31052015,몬스타 몬스타기어 닌자104PRO 유무선 공장풀윤활 기계식 블랙,"프라임, 폭스테일_165,850|페르시안, 후르츠피치_176,550","프라임, 폭스테일_165,850|페르시안, 후르츠피치_176,550","프라임, 폭스테일_165,850|페르시안, 후르츠피치_176,550"
31050491,몬스타 몬스타기어 닌자104PRO 유무선 공장풀윤활 기계식 화이트,"프라임, 폭스테일_165,850|삼색이, 후르츠피치_176,550","프라임, 폭스테일_165,850|삼색이, 후르츠피치_176,550","프라임, 폭스테일_165,850|삼색이, 후르츠피치_176,550"
28477019,몬스타 몬스타기어 닌자104PRO 유무선 커스텀 기계식 블랙,"황축_199,000|갈축_199,000|백축_199,000|적축_199,000","황축_199,000|갈축_199,000|백축_199,000|적축_199,000",0
28476977,몬스타 몬스타기어 닌자104PRO 유무선 커스텀 기계식 블랙,0,0,"황축_199,000|갈축_199,000|백축_199,000|적축_199,000"
28476782,몬스타 몬스타기어 닌자104PRO 유무선 커스텀 기계식 화이트,"황축_199,000|갈축_199,000|백축_199,000|적축_199,000","황축_199,000|갈축_199,000|백축_199,000|적축_199,000","황축_199,000|갈축_199,000|백축_199,000|적축_199,000"
20369636,몬스타 몬스타기어 닌자108 PRO 유무선 DIY KIT 커스텀 기계식,"화이트_86,670|아이보리_86,670","화이트_86,670|아이보리_86,670","화이트_86,670|아이보리_86,670"
19471625,몬스타 몬스타기어 닌자108PRO 기계식 커스텀 유무선 카일,"흑임자라떼, 적축_165,850|쑥인절미, 백축_170,000|쑥인절미, 적축_169,000|피치요거트, 갈축_170,000|피치요거트, 백축_170,000|","흑임자라떼, 적축_165,850|쑥인절미, 백축_170,000|쑥인절미, 적축_169,000|피치요거트, 갈축_170,000|피치요거트, 백축_170,000|","흑임자라떼, 적축_165,850|쑥인절미, 백축_170,000|쑥인절미, 적축_169,000|피치요거트, 갈축_170,000|피치요거트, 백축_170,000|"
28923599,몬스타 몬스타기어 닌자108PRO 유무선 공방풀윤활 기계식 아이보리,"클래식, 폭스테일_274,000|클래식, 바다소금 저소음_296,000|클래식, 후르츠피치_274,000","클래식, 폭스테일_274,000|클래식, 바다소금 저소음_296,000|클래식, 후르츠피치_274,000","클래식, 폭스테일_274,000|클래식, 바다소금 저소음_296,000|클래식, 후르츠피치_274,000"
28923611,몬스타 몬스타기어 닌자108PRO 유무선 공방풀윤활 기계식 화이트,"쑥인절미, 폭스테일_245,030|쑥인절미, 바다소금 저소음_245,030|쑥인절미, 후르츠피츠_274,000|피치요거트, 바다소금 저소음_269,000|피치요거트, 폭스테일_249,000||||","쑥인절미, 폭스테일_245,030|쑥인절미, 바다소금 저소음_245,030|쑥인절미, 후르츠피츠_274,000|피치요거트, 바다소금 저소음_269,000|피치요거트, 폭스테일_249,000||||","쑥인절미, 폭스테일_245,030|쑥인절미, 바다소금 저소음_245,030|쑥인절미, 후르츠피츠_274,000|피치요거트, 바다소금 저소음_269,000|피치요거트, 폭스테일_249,000||||"
28922012,몬스타 몬스타기어 닌자108PRO 유무선 공장풀윤활 기계식 아이보리,"클래식, 폭스테일_186,000|클래식, 바다소금 저소음_208,000|클래식, 후르츠피치_186,000","클래식, 폭스테일_186,000|클래식, 바다소금 저소음_208,000|클래식, 후르츠피치_186,000","클래식, 폭스테일_186,000|클래식, 바다소금 저소음_208,000|클래식, 후르츠피치_186,000"
28922186,몬스타 몬스타기어 닌자108PRO 유무선 공장풀윤활 기계식 화이트,"쑥인절미, 폭스테일_165,850|쑥인절미, 바다소금 저소음_165,850|쑥인절미, 후르츠피치_165,850|피치요거트, 바다소금 저소음_189,000|피치요거트, 폭스테일_169,000||||","쑥인절미, 폭스테일_165,850|쑥인절미, 바다소금 저소음_165,850|쑥인절미, 후르츠피치_165,850|피치요거트, 바다소금 저소음_189,000|피치요거트, 폭스테일_169,000||||","쑥인절미, 폭스테일_165,850|쑥인절미, 바다소금 저소음_165,850|쑥인절미, 후르츠피치_165,850|피치요거트, 바다소금 저소음_189,000|피치요거트, 폭스테일_169,000||||"
20538419,몬스타 몬스타기어 닌자108PRO 유무선 기계식,"흑임자라떼, 황축_160,000","흑임자라떼, 황축_160,000","흑임자라떼, 황축_160,000"
29081003,몬스타 몬스타기어 닌자84PRO 유무선 DIY KIT 기계식,"화이트_86,670|블랙_86,660","화이트_86,670|블랙_86,660","화이트_86,670|블랙_86,660"
30338312,몬스타 몬스타기어 닌자84PRO 유무선 공방풀윤활 기계식 블랙,"페르시안, 폭스테일_185,110|삼색이, 후르츠피치_195,810","페르시안, 폭스테일_185,110|삼색이, 후르츠피치_195,810","페르시안, 폭스테일_185,110|삼색이, 후르츠피치_195,810"
30338333,몬스타 몬스타기어 닌자84PRO 유무선 공방풀윤활 기계식 화이트,"페르시안, 폭스테일_185,110|삼색이, 후르츠피치_195,810","페르시안, 폭스테일_185,110|삼색이, 후르츠피치_195,810","페르시안, 폭스테일_185,110|삼색이, 후르츠피치_195,810"
30337193,몬스타 몬스타기어 닌자84PRO 유무선 공장풀윤활 기계식 블랙,"페르시안, 폭스테일_145,520|삼색이, 후르츠피치_156,220","페르시안, 폭스테일_145,520|삼색이, 후르츠피치_156,220","페르시안, 폭스테일_145,520|삼색이, 후르츠피치_156,220"
30338015,몬스타 몬스타기어 닌자84PRO 유무선 공장풀윤활 기계식 화이트,"페르시안, 폭스테일_145,520|삼색이, 후르츠피치_156,220","페르시안, 폭스테일_145,520|삼색이, 후르츠피치_156,220","페르시안, 폭스테일_145,520|삼색이, 후르츠피치_156,220"
28474946,몬스타 몬스타기어 닌자84PRO 유무선 커스텀 기계식 블랙,"황축_179,000|갈축_179,000|백축_179,000|적축_179,000","황축_179,000|갈축_179,000|백축_179,000|적축_179,000","황축_179,000|갈축_179,000|백축_179,000|적축_179,000"
28474877,몬스타 몬스타기어 닌자84PRO 유무선 커스텀 기계식 화이트,"황축_179,000|갈축_179,000|백축_179,000|적축_179,000","황축_179,000|갈축_179,000|백축_179,000|적축_179,000","황축_179,000|갈축_179,000|백축_179,000|적축_179,000"
13362941,몬스타 몬스타기어 닌자87 블루투스 키보드 게이트론,"갈축_98,990|황축_99,000","갈축_98,990|황축_99,000","갈축_98,990|황축_99,000"
13362995,몬스타 몬스타기어 닌자87 블루투스 키보드 체리,"흑축_99,000","흑축_99,000","흑축_99,000"
28921391,몬스타 몬스타기어 닌자87BT V2 유무선 공장풀윤활 기계식 블랙,"흑임자라떼, 폭스테일_139,000|흑임자라떼, 바다소금 저소음_172,000|흑임자라떼, 후르츠피치_150,000","흑임자라떼, 폭스테일_139,000|흑임자라떼, 바다소금 저소음_172,000|흑임자라떼, 후르츠피치_150,000","흑임자라떼, 폭스테일_139,000|흑임자라떼, 바다소금 저소음_172,000|흑임자라떼, 후르츠피치_150,000"
28921310,몬스타 몬스타기어 닌자87BT V2 유무선 공장풀윤활 기계식 화이트,"쑥인절미, 폭스테일_126,000|쑥인절미, 바다소금 저소음_172,000|쑥인절미, 후르츠피치_150,000","쑥인절미, 폭스테일_126,000|쑥인절미, 바다소금 저소음_172,000|쑥인절미, 후르츠피치_150,000","쑥인절미, 폭스테일_126,000|쑥인절미, 바다소금 저소음_172,000|쑥인절미, 후르츠피치_150,000"
15868499,몬스타 몬스타기어 닌자87BT WHITE 블루투스 기계식 키보드,"갈축_99,000|백축_99,000","갈축_99,000|백축_99,000","갈축_99,000|백축_99,000"
16151822,몬스타 몬스타기어 닌자87PRO G RGB 유무선 기계식 커스텀 키보드 블랙,"청축_99,500|갈축_99,500|황축_99,500|적축_99,500|백축_99,500|","청축_99,500|갈축_99,500|황축_99,500|적축_99,500|백축_99,500|","청축_99,500|갈축_99,500|황축_99,500|적축_99,500|백축_99,500|"
16151933,몬스타 몬스타기어 닌자87PRO G RGB 유무선 기계식 커스텀 키보드 화이트,"청축_99,500|갈축_99,500|황축_99,500|적축_99,500|백축_99,500|",0,0
16151852,몬스타 몬스타기어 닌자87PRO G RGB 유무선 기계식 커스텀 키보드 화이트,0,"청축_99,500|갈축_99,500|황축_99,500|적축_99,500|백축_99,500|","청축_99,500|갈축_99,500|황축_99,500|적축_99,500|백축_99,500|"
16150232,몬스타 몬스타기어 닌자87PRO K RGB 유무선 기계식 커스텀 키보드,"99,500","99,500","99,500"
16150424,몬스타 몬스타기어 닌자87PRO RGB DIY 커스텀 기계식 키보드,"69,000","69,000","69,000"
17241050,몬스타 몬스타기어 닌자87PRO S RGB 유무선 기계식 커스텀 키보드,"110,000","110,000","110,000"
28921754,몬스타 몬스타기어 닌자87PRO V2 유무선 공방풀윤활 기계식 블랙,"흑임자라떼, 폭스테일_165,850|흑임자라떼, 바다소금 저소음_176,550|흑임자라떼, 후르츠피치_176,550","흑임자라떼, 폭스테일_165,850|흑임자라떼, 바다소금 저소음_176,550|흑임자라떼, 후르츠피치_176,550","흑임자라떼, 폭스테일_165,850|흑임자라떼, 바다소금 저소음_176,550|흑임자라떼, 후르츠피치_176,550"
28921628,몬스타 몬스타기어 닌자87PRO V2 유무선 공방풀윤활 기계식 화이트,"쑥인절미, 폭스테일_165,850|쑥인절미, 바다소금 저소음_176,550|쑥인절미, 후르츠피치_176,550","쑥인절미, 폭스테일_165,850|쑥인절미, 바다소금 저소음_176,550|쑥인절미, 후르츠피치_176,550","쑥인절미, 폭스테일_165,850|쑥인절미, 바다소금 저소음_176,550|쑥인절미, 후르츠피치_176,550"
28477667,몬스타 몬스타기어 닌자87PRO v2 유무선 DIY KIT 커스텀 기계식,"화이트_67,410|블랙_67,410|퍼플_79,000","화이트_67,410|블랙_67,410|퍼플_79,000","화이트_67,410|블랙_67,410|퍼플_79,000"
28487360,몬스타 몬스타기어 닌자87PRO v2 유무선 커스텀 기계식 블랙,"황축_99,500|갈축_99,500|백축_99,500|적축_99,500","황축_99,500|갈축_99,500|백축_99,500|적축_99,500","황축_99,500|갈축_99,500|백축_99,500|적축_99,500"
28487432,몬스타 몬스타기어 닌자87PRO v2 유무선 커스텀 기계식 퍼플,"황축_99,500|갈축_99,500|백축_99,500|적축_99,500","황축_99,500|갈축_99,500|백축_99,500|적축_99,500","황축_99,500|갈축_99,500|백축_99,500|적축_99,500"
28487078,몬스타 몬스타기어 닌자87PRO v2 유무선 커스텀 기계식 화이트,"황축_99,500|갈축_99,500|백축_99,500|적축_99,500","황축_99,500|갈축_99,500|백축_99,500|적축_99,500","황축_99,500|갈축_99,500|백축_99,500|적축_99,500"
28924739,몬스타 몬스타기어 닌자87PRO 유무선 공방풀윤활 기계식 핑크,"딸기우유, 폭스테일_186,000|딸기우유, 바다소금 저소음_219,000|딸기우유, 후르츠피치_197,000","딸기우유, 폭스테일_186,000|딸기우유, 바다소금 저소음_219,000|딸기우유, 후르츠피치_197,000","딸기우유, 폭스테일_186,000|딸기우유, 바다소금 저소음_219,000|딸기우유, 후르츠피치_197,000"
30010262,몬스타 몬스타기어 닌자87PRO 유무선 공장풀윤활 기계식 핑크,"딸기우유, 후르츠피치_153,000|딸기우유, 바다소금 저소음_175,000|딸기우유, 폭스테일_142,000","딸기우유, 후르츠피치_153,000|딸기우유, 바다소금 저소음_175,000|딸기우유, 폭스테일_142,000",0
17432522,몬스타 몬스타기어 닌자87PRO 풀윤활 기계식 키보드,"갈축_159,000|적축_159,000","갈축_159,000|적축_159,000","갈축_159,000|적축_159,000"
29062319,몬스타 몬스타기어 닌자96PRO 유무선 DIY KIT 기계식,"화이트_94,150|블랙_94,160","화이트_94,150|블랙_94,160","화이트_94,150|블랙_94,160"
31049621,몬스타 몬스타기어 닌자96PRO 유무선 공방풀윤활 기계식 블랙,"그레이블랙96, 바다소금_207,580|도시락, 후르츠피치_217,210","그레이블랙96, 바다소금_207,580|도시락, 후르츠피치_217,210","그레이블랙96, 바다소금_207,580|도시락, 후르츠피치_217,210"
31048691,몬스타 몬스타기어 닌자96PRO 유무선 공방풀윤활 기계식 화이트,"삼색이, 폭스테일_207,580|도시락, 후르츠피치_217,210","삼색이, 폭스테일_207,580|도시락, 후르츠피치_217,210","삼색이, 폭스테일_169,000|도시락, 후르츠피치_217,210"
31015847,몬스타 몬스타기어 닌자96PRO 유무선 공장풀윤활 기계식 블랙,"그레이블랙96, 바다소금_165,850|삼색이, 후르츠피치_156,220","그레이블랙96, 바다소금_165,850|삼색이, 후르츠피치_156,220","그레이블랙96, 바다소금_165,850|삼색이, 후르츠피치_156,220"
30980930,몬스타 몬스타기어 닌자96PRO 유무선 공장풀윤활 기계식 화이트,"삼색이, 폭스테일_165,850|페르시안, 후르츠피치_179,000","삼색이, 폭스테일_165,850|페르시안, 후르츠피치_179,000","삼색이, 폭스테일_165,850|페르시안, 후르츠피치_179,000"
28476032,몬스타 몬스타기어 닌자96PRO 유무선 커스텀 기계식 블랙,"갈축_199,000|백축_199,000|적축_199,000","갈축_199,000|백축_199,000|적축_199,000","갈축_199,000|백축_199,000|적축_199,000"
28475915,몬스타 몬스타기어 닌자96PRO 유무선 커스텀 기계식 화이트,"황축_199,000|갈축_199,000|백축_199,000|적축_199,000","황축_199,000|갈축_199,000|백축_199,000|적축_199,000",0
28475816,몬스타 몬스타기어 닌자96PRO 유무선 커스텀 기계식 화이트,0,0,"황축_199,000|갈축_199,000|백축_199,000|적축_199,000"
20201111,몬스타 몬스타기어 딸기우유 PBT 한영정각 104키 키캡,"23,240","23,240","23,240"
30007379,몬스타 몬스타기어 레트로 블랙 키캡,"7,500",0,0
15167828,몬스타 몬스타기어 로지텍 k480 전용 키스킨,"훈민정음_1,800","훈민정음_1,800","훈민정음_1,800"
15048791,몬스타 몬스타기어 로지텍 k480 키스킨 한영,"1,800","1,800","1,800"
29859854,몬스타 몬스타기어 마카롱 쑥인절미 PBT 키캡,"37,270","37,270","37,270"
29859728,몬스타 몬스타기어 마카롱 피치요거트 PBT 키캡,"37,450","37,450","37,450"
29859944,몬스타 몬스타기어 마카롱 흑임자라떼 PBT 키캡,"37,450","37,450","37,450"
20321858,몬스타 몬스타기어 만능 미니 키보드 청소 브러쉬세트,"3,000","3,000","3,000"
16906700,몬스타 몬스타기어 미니키프로 RGB 유무선 슬림 기계식 키보드,"갈축_69,000|적축_69,000","갈축_69,000|적축_69,000","갈축_69,000|적축_69,000"
28649354,몬스타 몬스타기어 바캉스 8키 포인트 키캡,"12,310","12,310","12,310"
31655849,몬스타 몬스타기어 블루버니 PBT 키캡,가격비교예정,가격비교예정,가격비교예정
29859191,몬스타 몬스타기어 스완 PBT 키캡,"38,000","38,000","38,000"
20322455,몬스타 몬스타기어 스테빌라이저 스타터 키트,"16,000","16,000","16,000"
18845126,몬스타 몬스타기어 아쿠아67,"151,500","151,500","151,500"
20354591,몬스타 몬스타기어 오테뮤 톰 스위치 10pcs,"2,800","2,800","2,800"
20321303,몬스타 몬스타기어 윤활 스타터 키트,"25,000","25,000","25,000"
28031186,몬스타 몬스타기어 집사 PBT 키캡,"삼색이_37,990|페르시안_36,840","삼색이_37,990|페르시안_36,840","삼색이_37,990|페르시안_36,840"
20202137,몬스타 몬스타기어 카일 신형 박스 V2 커스텀 키보드 스위치 10pcs,"적축_4,000|갈축_4,000|백축_4,000","적축_4,000|갈축_4,000|백축_4,000","적축_4,000|갈축_4,000|백축_4,000"
29858393,몬스타 몬스타기어 클래식 PBT 키캡,"38,000","38,000","38,000"
19725593,몬스타 몬스타기어 클래식 TKL 아크릴 DIY KIT 커스텀 기계식,"139,000","139,000","139,000"
21626420,몬스타 몬스타기어 클래식 TKL 유무선 기계식,"화이트_550,000|그레이_550,000","화이트_550,000|그레이_550,000","화이트_550,000|그레이_550,000"
30007583,몬스타 몬스타기어 투나 PBT 키캡,"53,500",0,0
30028289,몬스타 몬스타기어 파스텔 37 PBT 키캡,"8,490","8,490",0
28052453,몬스타 몬스타기어 폭스테일 리니어 스위치 10pcs,"1,930","1,930","1,930"
30069602,몬스타 몬스타기어 한영정각 ABS 키캡 화이트,"10,000","10,000","10,000"
16192472,몬스타 몬스타기어 화이트 온 블랙 영문 PBT 키캡,"57,500","57,500","57,500"
29857952,몬스타 몬스타기어 후르츠 피치 저소음 리니어 스위치 10pcs,"3,000","3,000","3,000"
31311854,비프렌드 K10-USB,"29,900","29,900","29,900"
30310724,빠밤 키보드 높이 조절 피트 H2,"9,200","9,200","9,200"
30309278,사오파오 체리 프로그래머2 키캡,"49,900","49,900","49,900"
13620794,삼성전자 PK1100 전용 키스킨,"4,320","4,310",0
5703735,삼성전자 SKP-900B 키보드 마우스 세트,"키스킨 포함_25,900|키스킨 미포함_23,900","키스킨 포함_25,900|키스킨 미포함_23,900","키스킨 포함_25,900|키스킨 미포함_23,890"
5782793,삼성전자 SPA-JKA1BUB,"16,710","16,900","16,710"
14269259,삼성전자 스마트키보드 트리오 500,"블랙_33,100|화이트_33,108","블랙_33,100|화이트_33,108","블랙_33,100|화이트_33,108"
17685953,상도아이앤티 ANYZONE ANY-K2 키보드,0,0,"3,900"
30082505,상상이상 GMIN-0628-0703,"39,900","39,900","39,900"
2415346,스카이디지탈 NKEYBOARD NKEY-2,"33,000","33,000","33,000"
3850778,스카이디지탈 NKEYBOARD W570 무선 키보드 마우스,0,0,"블랙_28,890|화이트_28,900"
2009589,스카이디지탈 nkeyboard nkey-1 전용 실리콘 키스킨,"3,150","3,150",0
17874857,스틸시리즈 Apex 9 TKL US,"236,610","236,610","236,610"
9450495,스틸시리즈 Apex Pro,"정품_289,000","정품_289,000","정품_289,000"
17450069,스틸시리즈 Apex Pro Mini Wireless,"정품_395,010","정품_395,010","정품_395,010"
17977730,스틸시리즈 Apex Pro TKL,"정품_325,710|해외구매_227,000","정품_325,710|해외구매_227,000","정품_325,710|해외구매_227,000"
17977487,스틸시리즈 Apex Pro TKL Wireless,"정품_395,010","정품_395,010","정품_395,010"
12023663,아이리버 EQwear-MVS7000,"화이트_46,980|블랙_46,990","화이트_46,980|블랙_46,990","화이트_46,980|블랙_46,990"
10577571,알파스캔 AOC GK500 게이밍 RGB LED 기계식,"44,000","44,000","63,360"
15337181,앱코 ABKONCORE K660 ARC 오테뮤 기계식 게이밍 키보드,"청축_49,990","청축_49,990","청축_49,990"
13990238,앱코 ACK01 컴팩트 키보드,"블랙_11,500","블랙_11,500","블랙_11,500"
13132175,앱코 ADK05 아크릴 듀얼 RGB 게이밍 키보드,"적축_158,800|백축_158,800","적축_158,800|백축_158,800","적축_158,800|백축_158,800"
18716624,앱코 AG75 가스켓 마운트 기계식 로즈 핑크,"갈축_152,000|적축_152,000","갈축_152,000|적축_152,000","갈축_152,000|적축_152,000"
18717203,앱코 AG75 가스켓 마운트 기계식 퍼플 블루,"적축_152,000|갈축_152,000","적축_152,000|갈축_152,000","적축_152,000|갈축_152,000"
16350560,앱코 AKR01 TKL 아크릴 텐키리스 키보드 덮개,"9,900","9,900","9,900"
16361930,앱코 AKR01 아크릴 키보드 덮개,"10,900","10,900","10,900"
29806367,앱코 AKT95 아크 PBT키캡 카일광축 완전방수 컴팩트 게이밍 기계식,"청축_65,900|다크적축_65,900","청축_65,900|다크적축_65,900","청축_65,900|다크적축_65,900"
20759003,앱코 AN01T RGB BAR 기계식 다크그레이,"청축_35,500|갈축_35,500|적축_35,500","청축_35,500|갈축_35,500|적축_35,500","청축_35,500|갈축_35,500|적축_35,500"
20759315,앱코 AN01T RGB BAR 기계식 핑크,"청축_35,500|갈축_35,500|적축_35,500","청축_35,500|갈축_35,500|적축_35,500","청축_35,500|갈축_35,500|적축_35,500"
14650787,앱코 AN02 다크그레이 RGB BAR 축교환 기계식 키보드,"청축_39,900|갈축_39,900|적축_39,900","청축_39,900|갈축_39,900|적축_39,900","청축_39,900|갈축_39,900|적축_39,900"
14650697,앱코 AN02 블랙 RGB BAR 축교환 기계식 키보드,"청축_39,900|갈축_39,900|적축_39,900","청축_39,900|갈축_39,900|적축_37,800","청축_39,900|갈축_39,900|적축_39,900"
14650808,앱코 AN02 핑크 RGB BAR 축교환 기계식 키보드,"청축_39,900|갈축_39,900|적축_39,900","청축_39,900|갈축_39,900|적축_39,900",0
14650835,앱코 AN02 핑크 RGB BAR 축교환 기계식 키보드,0,0,"청축_39,900|갈축_39,900|적축_39,900"
18775013,앱코 AN03 옵티컬 게이밍,"48,400","48,400","48,400"
18091124,앱코 AN04F PBT 특주축 게이밍 기계식 키보드,"클릭_72,000|넌클릭_72,000|리니어_72,000","클릭_72,000|넌클릭_72,000|리니어_72,000","클릭_72,000|넌클릭_72,000|리니어_72,000"
19830005,앱코 AN05 아이스큐브 옵티컬 게이밍,"블랙_53,000|핑크_53,000","블랙_53,000|핑크_53,000","블랙_53,000|핑크_53,000"
19006127,앱코 AN06F TKL PBT 게이밍 기계식,"클릭_55,000|넌클릭_55,000|리니어_55,000","클릭_55,000|넌클릭_55,000|리니어_55,000","클릭_55,000|넌클릭_55,000|리니어_55,000"
29312675,앱코 AN08 가스켓 아이스큐브 광축 LED 게이밍,"블루, 클릭_67,000|블루, 리니어_67,000|핑크, 리니어_67,000|핑크, 클릭_67,000","블루, 클릭_67,000|블루, 리니어_67,000|핑크, 리니어_67,000|핑크, 클릭_67,000",0
29312777,앱코 AN08 가스켓 아이스큐브 광축 LED 게이밍,0,0,"블루, 클릭_67,000|블루, 리니어_67,000|핑크, 리니어_67,000|핑크, 클릭_67,000"
16847930,앱코 AN10 아이스큐브 무빙 LED 광축 게이밍 키보드,"76,500","76,500","72,480"
16848017,앱코 AN50 아이스큐브 무빙 LED 광축 게이밍 키보드,"89,900","89,900","89,900"
20596694,앱코 APK87 폴리카보네이트 사일런스 가스켓 기계식,"185,000","185,000","185,000"
10468689,앱코 AR21 CNC 풀 알루미늄 DIY KIT 넘버패드,"실버_117,400|그레이_117,400|네이비_117,400","실버_117,400|그레이_117,400|네이비_117,400","실버_117,400|그레이_117,400|네이비_117,400"
18474248,앱코 AR61D 풀 알루미늄 유무선 기계식,"99,000","99,000","99,000"
12982325,앱코 ARC1 TKL 텐키리스 아크릴 팜레스트 손목 받침대,"ICE Acrylic_13,800|Clear Acrylic_13,800","ICE Acrylic_13,800|Clear Acrylic_13,800","ICE Acrylic_13,800|Clear Acrylic_13,800"
12971420,앱코 ARC1 아크릴 팜레스트 손목 받침대,"Clear Acrylic_15,900|ICE Acrylic_13,800","Clear Acrylic_15,900|ICE Acrylic_13,800","Clear Acrylic_15,900|ICE Acrylic_13,800"
15796007,앱코 AWK10 멀티페어링 블루투스 키보드,"16,900","16,900","12,900"
13007576,앱코 BT220 멀티페어링 블루투스 키보드,"11,000","11,000","9,900"
12373433,앱코 BT250 멀티페어링 블루투스 키보드,"블랙_16,900","블랙_16,900","블랙_16,900"
19284713,앱코 GKM500 기계식 키보드 마우스 세트,"청축_39,500|적축_39,500","청축_39,500|적축_39,500","청축_39,500|적축_39,500"
8038174,앱코 HACKER 6key 컬러풀 포인트 키캡,"V1_2,900|V2_2,900|V3_2,900","V1_2,900|V2_2,900|V3_2,900","V1_2,900|V2_2,900|V3_2,900"
12130040,앱코 HACKER ADK01 BT 블루투스 5.0 카일박스축 게이밍 기계식 키보드,"레드그레이, 갈축_일시품절|레드그레이, 적축_일시품절","레드그레이, 적축_일시품절","레드그레이, 적축_일시품절"
12119666,앱코 HACKER ADK01 카일박스축 게이밍 기계식 키보드,"레드그레이, 갈축_74,490|레드그레이, 백축_74,490|레드그레이, 적축_74,490","레드그레이, 갈축_74,490|레드그레이, 백축_74,490|레드그레이, 적축_74,490","레드그레이, 갈축_74,490|레드그레이, 백축_74,490|레드그레이, 적축_74,490"
11909530,앱코 HACKER ADK87 PBT 이색사출 텐키리스 체리 기계식 키보드,"블랙, 청축_59,900|블랙, 갈축_99,000|블랙, 저소음 적축_103,500|블랙, 적축_99,000|화이트, 갈축_99,000||","블랙, 청축_59,900|블랙, 갈축_99,000|블랙, 저소음 적축_103,500|블랙, 적축_99,000|화이트, 갈축_99,000||","블랙, 청축_62,390|블랙, 갈축_99,000|블랙, 저소음 적축_103,500|블랙, 적축_99,000|화이트, 갈축_99,000||"
11167377,앱코 HACKER ARC 거치대,"5,500","5,500","5,500"
9940446,앱코 HACKER GKM570 키보드 마우스 LED 게이밍 콤보,"블랙_44,400|화이트_29,900","블랙_44,400|화이트_29,900","블랙_44,400|화이트_29,900"
5298971,앱코 HACKER K1000 축교환 게이밍 기계식,"블랙, 청축_68,000|화이트, 청축_127,430","블랙, 청축_68,000|화이트, 청축_127,430","블랙, 청축_68,000|화이트, 청축_127,430"
15108260,앱코 HACKER K150 텐키리스 레인보우 LED 게이밍 멤브레인,"블랙_13,000|화이트_13,500",0,0
11015091,앱코 HACKER K150 텐키리스 레인보우 LED 게이밍 멤브레인,0,"블랙_13,000|화이트_13,500","블랙_13,000|화이트_13,500"
3248321,앱코 HACKER K300 게이밍 키보드,"29,410","29,410","29,410"
10106664,앱코 HACKER K315 텐키리스 축교환 측면 RGB 라이팅 이중사출 게이밍 기계식 키보드 블랙,"청축_29,900","청축_29,900","청축_29,900"
8516163,앱코 HACKER K512 체리쉬 염료승화 PBT 텐키리스 체리 게이밍 키보드,"청축_79,000|갈축_106,000","청축_79,000|갈축_106,000","청축_79,000|갈축_106,000"
