Id,Name,2024-01-01 10:36:27,2024-01-02 10:30:42,2024-01-03 10:30:41
10890990,3M MK-250 무선 키보드 마우스 세트,"블랙_27,900|핑크_27,900|화이트_27,900","블랙_27,900|핑크_27,900|화이트_27,900",0
28392785,8bitdo Retro 유무선 기계식,"해외구매_60,900","해외구매_60,900","해외구매_79,480"
31428872,A4Tech Bloody S87 기계식,블랙_일시품절|화이트_일시품절,블랙_일시품절|화이트_일시품절,"블랙_148,700|화이트_148,700"
21592418,AJAZZ AK871 무선 기계식,"해외구매_22,830","해외구매_22,830",0
30082328,APPLE Magic Keyboard Touch ID 탑재형 중국어 (MK2C3KC/A),"192,280","192,280","192,280"
17950412,APPLE Magic Keyboard Touch ID 탑재형 한글 (MK293KH/A),"162,960","162,960",0
5363737,APPLE Magic Keyboard with Numeric Keypad (MQ052KH/A),"정품_132,050","정품_132,050","정품_132,050"
28557293,ASUS ROG AZOTH WHITE PBT 유무선 영문,"적축_399,000|SNOW_가격비교예정|STORM_가격비교예정","적축_399,000|SNOW_가격비교예정|STORM_가격비교예정","적축_399,000|SNOW_가격비교예정|STORM_가격비교예정"
18728846,ASUS ROG AZOTH 유무선 기계식 영문,"갈축_399,000|적축_387,000|청축_399,000","갈축_399,000|적축_387,000|청축_399,000",0
18728819,ASUS ROG AZOTH 유무선 기계식 영문,0,0,"갈축_399,000|적축_398,510|청축_399,000"
19827977,ASUS ROG AZOTH 유무선 기계식 한글,"갈축_399,000|적축_399,000|청축_399,000","갈축_399,000|적축_399,000|청축_399,000","갈축_399,000|적축_399,000|청축_399,000"
16559405,ASUS ROG CLAYMORE II RX PBT,"청축_391,400","청축_391,400","청축_391,400"
14408222,ASUS ROG CLAYMORE II RX 영문,"청축_329,000|적축_329,000","청축_329,000|적축_329,000",0
14408198,ASUS ROG CLAYMORE II RX 영문,0,0,"청축_329,000|적축_329,000"
18519221,ASUS ROG FALCHION ACE 기계식,"적축_199,000|갈축_199,000","적축_199,000|갈축_199,000","적축_199,000|갈축_199,000"
15369422,ASUS ROG FALCHION NX,"청축_229,000|적축_229,000|해외구매_258,540","청축_229,000|적축_229,000|해외구매_258,540",0
15370208,ASUS ROG FALCHION NX,0,0,"청축_229,000|적축_169,460|해외구매_258,540"
12768116,ASUS ROG FALCHION 영문,"청축_229,000|적축_229,000","청축_229,000|적축_229,000","청축_229,000|적축_229,000"
13417076,ASUS ROG PBT KEYCAP SET,"54,000","54,000","54,000"
17017928,ASUS ROG RX PBT 이중사출 키캡 세트,"54,000","54,000","54,000"
6081923,ASUS ROG STRIX FLARE,청축_일시품절,청축_일시품절,청축_일시품절
16988402,ASUS ROG STRIX FLARE II NX,"갈축_279,000|적축_279,000","갈축_279,000|적축_279,000","갈축_279,000|적축_279,000"
16930400,ASUS ROG STRIX FLARE II NX ANIMATE PBT 영문,"청축_329,000|갈축_329,000|적축_329,000",0,0
16930385,ASUS ROG STRIX FLARE II NX ANIMATE PBT 영문,0,"청축_329,000|갈축_329,000|적축_329,000","청축_329,000|갈축_329,000|적축_329,000"
17730146,ASUS ROG STRIX FLARE II NX ANIMATE PBT 한글,"청축_329,000|갈축_329,000|적축_329,000","청축_329,000|갈축_329,000|적축_329,000","청축_329,000|갈축_329,000|적축_329,000"
8216992,ASUS ROG STRIX FLARE PINK,"청축_224,000","청축_224,000","청축_224,000"
28121846,ASUS ROG STRIX SCOPE II 96 유무선 기계식,"SNOW_259,000","SNOW_259,000","SNOW_259,000"
28888703,ASUS ROG STRIX SCOPE II RX,"청축_209,000","청축_209,000","청축_209,000"
28888754,ASUS ROG STRIX SCOPE II RX 영문,"청축_209,000","청축_209,000","청축_209,000"
17832590,ASUS ROG STRIX SCOPE NX,"청축_189,000|적축_189,000","청축_189,000|적축_189,000","청축_189,000|적축_189,000"
15354248,ASUS ROG STRIX SCOPE NX TKL,"갈축_179,000|적축_179,000","갈축_179,000|적축_179,000","갈축_179,000|적축_179,000"
14962448,ASUS ROG STRIX SCOPE NX TKL Moonlight White,"청축_189,000|갈축_189,000|적축_189,000","청축_189,000|갈축_189,000|적축_189,000","청축_189,000|갈축_189,000|적축_189,000"
16749149,ASUS ROG STRIX SCOPE NX WIRELESS DELUXE,"청축_229,000|갈축_229,000|적축_229,000","청축_229,000|갈축_229,000|적축_229,000","청축_229,000|갈축_229,000|적축_229,000"
11078613,ASUS ROG STRIX SCOPE PBT 영문,"청축_164,000|갈축_164,000|적축_164,000","청축_164,000|갈축_164,000|적축_164,000","청축_164,000|갈축_164,000|적축_164,000"
14706350,ASUS ROG STRIX SCOPE RX,"적축_184,000|청축_178,000",0,0
13486184,ASUS ROG STRIX SCOPE RX,0,"적축_184,000|청축_178,000","적축_184,000|청축_178,000"
15901865,ASUS ROG STRIX SCOPE RX PBT 영문,"청축_189,000|적축_189,000","청축_189,000|적축_189,000","청축_189,000|적축_189,000"
16750865,ASUS ROG STRIX SCOPE RX TKL WIRELESS DELUXE,"청축_249,000|적축_249,000","청축_249,000|적축_249,000","청축_249,000|적축_249,000"
15004463,ASUS ROG STRIX SCOPE TKL 영문,"청축_164,000|적축_470,110","청축_164,000|적축_470,110","청축_164,000|적축_470,110"
8140465,ASUS ROG STRIX SCOPE 영문,"청축_171,910|적축_174,000","청축_171,910|적축_174,000","청축_171,910|적축_174,000"
2885992,ASUS STRIX Tactic Pro,"청축_114,670","청축_114,670","청축_114,670"
3567106,ASUS STRIX Tactic Pro STCOM,"청축_65,000","청축_65,000","청축_65,000"
30621089,AULA F87 PRO 유무선 기계식,"해외구매_39,668","해외구매_39,668","해외구매_39,668"
25638710,AULA F87 기계식,"해외구매_36,390","해외구매_36,390","해외구매_36,390"
25638749,AULA F87 유무선 기계식,"해외구매_35,934","해외구매_35,934","해외구매_35,934"
8203102,Actto BTK-03,0,0,"23,150"
6445016,CHERRY G80-3000,"화이트, 청축_128,640|블랙, 갈축_129,000|화이트, 갈축_129,000","화이트, 청축_128,640|블랙, 갈축_129,000|화이트, 갈축_129,000","화이트, 청축_128,640|블랙, 갈축_129,000|화이트, 갈축_129,000"
14420600,CHERRY G80-3000S RGB TKL,"블랙, 청축_101,250|블랙, 갈축_115,320|블랙, 적축_115,320|블랙, 흑축_124,000|블랙, 저소음 적축_124,620|||||","블랙, 청축_101,250|블랙, 갈축_115,320|블랙, 적축_115,320|블랙, 흑축_124,000|블랙, 저소음 적축_124,620|||||","블랙, 청축_101,250|블랙, 갈축_115,320|블랙, 적축_115,320|블랙, 흑축_124,000|블랙, 저소음 적축_124,620|||||"
12285686,CHERRY G80-3000S TKL,"블랙, 청축_99,000|블랙, 갈축_99,000|블랙, 적축_98,880|블랙, 저소음 적축_108,029|화이트, 청축_99,000|||","블랙, 청축_99,000|블랙, 갈축_99,000|블랙, 적축_98,880|블랙, 저소음 적축_108,029|화이트, 청축_99,000|||","블랙, 청축_99,000|블랙, 갈축_99,000|블랙, 적축_98,880|블랙, 저소음 적축_108,029|화이트, 청축_99,000|||"
6466903,CHERRY G80-3494,"블랙, 저소음 적축_129,000|화이트, 적축_128,640","블랙, 저소음 적축_129,000|화이트, 적축_128,640","블랙, 저소음 적축_129,000|화이트, 적축_128,640"
2868094,CHERRY G80-3800 + 키보드 받침대,"청축_87,450","청축_87,450","청축_87,450"
2120324,CHERRY G80-3800 기계식 키보드 전용 컬러 16종 키캡,"옐로우_8,500|오렌지_8,500|퍼플_8,500","옐로우_8,500|오렌지_8,500|퍼플_8,500","옐로우_8,500|오렌지_8,500|퍼플_8,500"
20773823,CHERRY KC6000 SLIM,"55,707","55,707","55,707"
20314643,CHERRY MX 1.1 TKL 기계식 블랙,"청축_69,000|갈축_69,000|적축_69,000|저소음 적축_69,000","청축_69,000|갈축_69,000|적축_69,000|저소음 적축_69,000","청축_69,000|갈축_69,000|적축_69,000|저소음 적축_69,000"
20314661,CHERRY MX 1.1 TKL 기계식 화이트,"청축_69,000|갈축_69,000|적축_69,000|저소음 적축_69,000","청축_69,000|갈축_69,000|적축_69,000|저소음 적축_69,000","청축_69,000|갈축_69,000|적축_69,000|저소음 적축_69,000"
11494881,CHERRY MX BOARD 1.0 TKL RGB,"청축_203,100|적축_203,100","청축_203,100|적축_203,100","청축_203,100|적축_203,100"
12181010,CHERRY MX BOARD 10.0 Low Profile RGB,"블랙_259,000|실버_259,000","블랙_259,000|실버_259,000","블랙_259,000|실버_259,000"
13014152,CHERRY MX BOARD 2.0S,"블랙, 청축_79,000|블랙, 갈축_79,000|블랙, 적축_73,470|블랙, 저소음 적축_82,770|화이트, 청축_79,000|||","블랙, 청축_79,000|블랙, 갈축_79,000|블랙, 적축_73,470|블랙, 저소음 적축_82,770|화이트, 청축_79,000|||","블랙, 청축_79,000|블랙, 갈축_79,000|블랙, 적축_73,470|블랙, 저소음 적축_82,770|화이트, 청축_79,000|||"
14811248,CHERRY MX BOARD 2.0S RGB,"블랙, 청축_108,990|블랙, 갈축_107,900|화이트, 청축_108,990|화이트, 갈축_108,990|화이트, 적축_106,810|","블랙, 청축_108,990|블랙, 갈축_107,900|화이트, 청축_108,990|화이트, 갈축_108,990|화이트, 적축_106,810|","블랙, 청축_108,990|블랙, 갈축_107,900|화이트, 청축_108,990|화이트, 갈축_108,990|화이트, 적축_105,720|"
18072689,CHERRY MX BOARD 2.0S WIRELESS,"화이트, 적축_149,000|화이트, 저소음 적축_159,000|블랙, 적축_149,000|블랙, 저소음 적축_159,000","화이트, 적축_149,000|화이트, 저소음 적축_159,000|블랙, 적축_149,000|블랙, 저소음 적축_159,000",0
12285776,CHERRY MX BOARD 3.0S,"블랙, 청축_116,100|블랙, 갈축_116,100|블랙, 적축_128,640|블랙, 흑축_129,000|블랙, 저소음 적축_125,100|||||","블랙, 청축_128,640|블랙, 갈축_115,990|블랙, 적축_128,640|블랙, 흑축_129,000|블랙, 저소음 적축_129,270|||||","블랙, 청축_122,670|블랙, 갈축_115,990|블랙, 적축_128,640|블랙, 흑축_129,000|블랙, 저소음 적축_128,060|||||"
13014194,CHERRY MX BOARD 3.0S RGB,"블랙, 청축_143,100|블랙, 갈축_143,100|블랙, 적축_143,100|블랙, 흑축_148,140|블랙, 저소음 적축_152,100||||||||||","블랙, 청축_148,140|블랙, 갈축_148,140|블랙, 적축_148,140|블랙, 흑축_148,140|블랙, 저소음 적축_159,000||||||||||","블랙, 청축_159,000|블랙, 갈축_159,000|블랙, 적축_159,000|블랙, 흑축_151,700|블랙, 저소음 적축_159,000||||||||||"
17400206,CHERRY MX BOARD 3.0S TKL,"블랙, 청축_122,314|블랙, 갈축_122,310|블랙, 적축_122,314|블랙, 저소음 적축_132,470|핑크, 청축_122,314|||||||","블랙, 청축_122,314|블랙, 갈축_122,310|블랙, 적축_122,314|블랙, 저소음 적축_132,470|핑크, 청축_122,314|||||||","블랙, 청축_122,314|블랙, 갈축_122,310|블랙, 적축_122,314|블랙, 저소음 적축_132,470|핑크, 청축_122,314|||||||"
17653121,CHERRY MX BOARD 3.0S TKL RGB,"블랙, 청축_149,000|블랙, 갈축_149,000|블랙, 적축_149,000|블랙, 저소음 적축_159,000|핑크, 청축_149,000|||||||","블랙, 청축_149,000|블랙, 갈축_149,000|블랙, 적축_149,000|블랙, 저소음 적축_159,000|핑크, 청축_149,000|||||||","블랙, 청축_149,000|블랙, 갈축_149,000|블랙, 적축_149,000|블랙, 저소음 적축_159,000|핑크, 청축_149,000|||||||"
19401896,CHERRY MX LP 2.1 유무선 기계식,"블랙_159,000|카키파우더_159,000|파스텔화이트_159,000","블랙_159,000|카키파우더_159,000|파스텔화이트_159,000","블랙_159,000|카키파우더_159,000|파스텔화이트_159,000"
29878442,CIDOO V21 유무선,"해외구매_54,720","해외구매_54,830","해외구매_54,720"
27737228,CIDOO V65 PRO VIA 유무선 기계식,"169,000","169,000","169,000"
6197601,CJ ENM ENTUS K330G GENESIS ED CJ광축 게이밍,"옐로우_35,000|블랙_33,900|오렌지_33,900|화이트_98,590","옐로우_35,000|블랙_33,900|오렌지_33,900|화이트_98,590","옐로우_35,000|블랙_33,900|오렌지_33,900|화이트_98,590"
3586784,CORSAIR GAMING K70,"갈축, 정품_175,000","갈축, 정품_175,000","갈축, 정품_175,000"
17932703,CORSAIR K100 AIR WIRELESS RGB Ultra Low Profile 게이밍 기계식 키보드,"387,580","387,560","387,540"
12402839,CORSAIR K100 RGB MX SPEED 영문,"은축_334,780","은축_334,760","은축_334,750"
12799214,CORSAIR K100 RGB MX SPEED 한글,"은축_341,990","은축_341,990","은축_341,990"
14035898,CORSAIR K100 RGB MX SPEED 한글+PBT Double-shot Keycaps Pro,"은축, 블루_363,650|은축, 그린_363,640|은축, 레드_363,520|은축, 블랙_363,600|은축, 핑크_363,650|","은축, 블루_363,650|은축, 그린_363,640|은축, 레드_363,520|은축, 블랙_363,600|은축, 핑크_363,650|","은축, 블루_363,650|은축, 그린_363,640|은축, 레드_363,520|은축, 블랙_363,600|은축, 핑크_363,650|"
12402851,CORSAIR K100 RGB OPTICAL 영문,"리니어_334,780","리니어_334,760","리니어_334,750"
12799259,CORSAIR K100 RGB OPTICAL 한글,"324,000","328,250","328,240"
12618380,CORSAIR K60 PRO,"111,840","111,820","111,810"
12618515,CORSAIR K60 RGB PRO,"137,840","137,820","137,810"
12669857,CORSAIR K60 RGB PRO LP,"은축_188,990","은축_188,990","은축_188,990"
12829025,CORSAIR K60 RGB PRO SE,"정품_122,490","정품_122,490","정품_122,490"
5065159,CORSAIR K63,"적축_149,000","적축_149,000","적축_149,000"
6040268,CORSAIR K63 WIRELESS,"적축_168,000","적축_168,000","적축_168,000"
21566336,CORSAIR K65 PRO MINI OPX 게이밍,"168,660","168,640","168,630"
13661003,CORSAIR K65 RGB MINI,"블랙, 적축_122,920|블랙, 저소음 적축_128,990|화이트, 적축_122,920|화이트, 저소음 적축_129,000","블랙, 적축_122,870|블랙, 저소음 적축_128,990|화이트, 적축_122,870|화이트, 저소음 적축_129,000","블랙, 적축_122,860|블랙, 저소음 적축_128,990|화이트, 적축_122,860|화이트, 저소음 적축_129,000"
28601858,CORSAIR K65 RGB PLUS 유무선 게이밍 기계식,"198,990","198,990","199,000"
5217261,CORSAIR K68 방수/방진,"청축_142,000|적축_117,500","청축_142,000|적축_117,500","청축_142,000|적축_117,500"
4138936,CORSAIR K70 LUX,"청축_176,000|적축_181,000","청축_176,000|적축_181,000","청축_176,000|적축_181,000"
4412109,CORSAIR K70 LUX RGB,"적축_288,000|갈축_288,000","적축_288,000|갈축_288,000","적축_288,000|갈축_288,000"
27546863,CORSAIR K70 MAX RGB MGX 게이밍 기계식,"마그네틱축_299,000","마그네틱축_299,000","마그네틱축_299,000"
4111501,CORSAIR K70 RAPIDFIRE,"은축_181,990","은축_181,990","은축_181,990"
28603439,CORSAIR K70 RGB CORE BLACK 게이밍 기계식,"135,000","138,980","138,980"
28605752,CORSAIR K70 RGB CORE WHITE SE 게이밍 기계식,"151,050","151,050","151,050"
6351641,CORSAIR K70 RGB MK.2,"청축_260,100|갈축_229,000|은축_일시품절|적축_260,010|저소음 적축_287,890","청축_260,100|갈축_229,000|은축_일시품절|적축_260,010|저소음 적축_287,890","청축_260,100|갈축_229,000|은축_일시품절|적축_260,010|저소음 적축_287,890"
6569690,CORSAIR K70 RGB MK.2 LOW PROFILE,적축_일시품절,적축_일시품절,적축_일시품절
6548195,CORSAIR K70 RGB MK.2 LOW PROFILE RAPIDFIRE,은축_일시품절,은축_일시품절,은축_일시품절
16388009,CORSAIR K70 RGB PRO,"청축_220,910|갈축_227,920|적축_193,000|저소음 적축_215,400|스피드 은축_224,000","청축_220,910|갈축_227,880|적축_193,000|저소음 적축_217,540|스피드 은축_223,910","청축_220,910|갈축_227,870|적축_193,000|저소음 적축_216,960|스피드 은축_223,860"
17822123,CORSAIR K70 RGB PRO OPX 게이밍 기계식 키보드,"블랙_231,590|화이트_233,000","블랙_231,550|화이트_233,000","블랙_231,540|화이트_233,000"
14897762,CORSAIR K70 RGB TKL CHAMPION 영문,"은축_197,990","은축_198,990",0
13855607,CORSAIR K70 RGB TKL CHAMPION 한글,"적축_197,990|은축_191,650|저소음 적축_197,990","적축_198,990|은축_191,620|저소음 적축_198,990","적축_195,990|은축_191,610|저소음 적축_198,990"
16795421,CORSAIR K70 RGB TKL OPX 광적축 게이밍 기계식 키보드,"정품_196,860|해외구매_166,470","정품_188,540|해외구매_166,470","정품_196,800|해외구매_166,470"
17467112,CORSAIR K70 프로 미니 핫스왑 무선 게이밍 기계식 키보드,"적축_189,000|저소음 적축_189,000","적축_189,000|저소음 적축_189,000","적축_189,000|저소음 적축_189,000"
7411843,CORSAIR K83 Wireless Entertainment Keyboard,"192,650","189,610","189,610"
5013599,CORSAIR K95 RGB PLATINUM,"은축_369,000","은축_369,000","은축_369,000"
5714453,CORSAIR PBT DOUBLE-SHOT KEYCAPS,"블랙_39,000|화이트_39,000","블랙_39,000|화이트_39,000","블랙_39,000|화이트_39,000"
6214631,CORSAIR STRAFE RGB MK.2 SILENT,"저소음 적축_365,910","저소음 적축_364,633","저소음 적축_364,633"
11815033,CORSAIR iCUE NEXUS,"141,130","141,130","142,000"
14438276,COUGAR VANTAR AX,"Black_64,840|Silver_64,990|Pink_73,000","Black_64,790|Silver_64,990|Pink_71,100","Black_64,700|Silver_64,990|Pink_71,100"
6454547,COX 145Key 염료승화 PBT 한글 포인트 컬러 키캡,"오렌지_66,700|블루_66,700","오렌지_66,700|블루_66,700","오렌지_66,700|블루_66,700"
11640566,COX CA106 CNC 알루미늄 어고노믹 게이트론 기계식 키보드,"황축_377,400|갈축_377,400","황축_377,400|갈축_377,400","황축_377,400|갈축_377,400"
10677879,COX CA108BT 블루투스 유무선 알루미늄 PBT 이색사출,"레드, 황축_144,310|레드, 갈축_138,000|로즈골드, 갈축_159,000|로즈골드, 황축_187,000","레드, 황축_144,310|레드, 갈축_138,000|로즈골드, 갈축_159,000|로즈골드, 황축_187,000","레드, 황축_144,310|레드, 갈축_138,000|로즈골드, 갈축_159,000|로즈골드, 황축_184,000"
8004508,COX CARAVEL 게이트론 교체축 RGB 염료승화 PBT 리빙코랄,"녹축_58,300","녹축_58,300","녹축_58,300"
8004616,COX CARAVEL108 게이트론 교체축 RGB 염료승화 PBT 리빙코랄,"녹축_66,990","녹축_66,990","녹축_66,990"
19401857,COX CBF300 무선 큰글씨,"15,590","15,590","15,590"
13224044,COX CK01 Navy 교체축 사이드 RGB 게이밍 기계식 키보드,"청축_39,900|갈축_39,850|적축_39,900","청축_39,900|갈축_39,860|적축_39,900","청축_39,900|갈축_39,860|적축_39,900"
15185441,COX CK01 PBT SL 기계식 키보드,"저소음 백축_66,000","저소음 백축_66,000","저소음 백축_66,000"
18625514,COX CK01 PBT 마이애미 나이트 에디션 게이밍 기계식,"청축_49,700|갈축_49,260|적축_49,180","청축_49,710|갈축_49,270|적축_49,190","청축_49,710|갈축_49,270|적축_49,190"
11696723,COX CK01 PBT 이색사출 사이드 RGB 기계식 키보드,"청축_45,500|갈축_47,260|적축_46,880",0,"청축_45,510|갈축_47,250|적축_46,880"
11696714,COX CK01 PBT 이색사출 사이드 RGB 기계식 키보드,0,"청축_45,510|갈축_47,260|적축_46,880",0
28862948,COX CK01 SAHARA HUANO 퀵스압 게이밍 기계식,"청축_41,990|갈축_42,000|적축_41,640","청축_42,000|갈축_42,000|적축_41,640","청축_42,000|갈축_42,000|적축_41,640"
14440445,COX CK01 TKL,"청축_33,960|갈축_33,900|적축_33,980","청축_33,960|갈축_33,910|적축_33,980","청축_33,960|갈축_33,910|적축_33,980"
15185348,COX CK01 TKL PBT SL 기계식 키보드,"저소음 백축_56,750","저소음 백축_56,750","저소음 백축_56,750"
14393789,COX CK01 TKL PBT 기계식 키보드,"청축_43,940|갈축_42,540|적축_43,940","청축_43,940|갈축_42,550|적축_43,940","청축_43,940|갈축_42,550|적축_43,940"
11234139,COX CK01 교체축 사이드 RGB 게이밍 기계식 키보드,"블랙, 청축_39,900|블랙, 적축_49,270|화이트, 갈축_43,700|화이트, 적축_43,690|화이트, 청축_44,240",0,0
11234124,COX CK01 교체축 사이드 RGB 게이밍 기계식 키보드,0,"블랙, 청축_39,900|블랙, 적축_49,270|화이트, 갈축_43,700|화이트, 적축_43,690|화이트, 청축_44,240","블랙, 청축_39,900|블랙, 적축_49,270|화이트, 갈축_43,700|화이트, 적축_43,690|화이트, 청축_44,240"
19456175,COX CK01SL PBT 45GF,"61,000","61,000","61,000"
20439878,COX CK01SL TKL PBT 45GF 기계식,"60,410","60,410","60,410"
16180022,COX CK01V V광축 완전방수 사이드 RGB 게이밍 키보드,"블랙&틸_51,470","블랙&틸_51,470","블랙&틸_51,470"
11433837,COX CK104 RGB BAR 투톤 이중사출 게이트론 기계식,"블랙그레이, 청축_47,900|레드그레이, 청축_47,900|레드그레이, 황축_47,900","블랙그레이, 청축_47,900|레드그레이, 청축_47,900|레드그레이, 황축_47,900","블랙그레이, 청축_47,900|레드그레이, 청축_47,900|레드그레이, 황축_47,900"
12095825,COX CK108 BT 게이트론 블루투스 5.0 기계식 게이밍 키보드,"블랙, 청축_68,820|화이트, 청축_69,900","블랙, 청축_68,830|화이트, 청축_69,900","블랙, 청축_68,830|화이트, 청축_69,900"
8048776,COX CK108 레드/다크그레이 게이트론 LED 게이밍 기계식,"S1, 녹축_66,500|S1, 갈축_91,000|S1, 황축_91,000|S2, 갈축_91,000|S2, 녹축_52,000|","S1, 녹축_66,500|S1, 갈축_91,000|S1, 황축_91,000|S2, 갈축_91,000|S2, 녹축_52,000|","S1, 녹축_66,500|S1, 갈축_91,000|S1, 황축_91,000|S2, 갈축_91,000|S2, 녹축_52,000|"
10332036,COX CK108 블랙/다크그레이 게이트론 LED 게이밍 기계식,"녹축_73,900|갈축_73,900|저소음 갈축_69,900|저소음 황축_69,900|황축_69,900","녹축_73,900|갈축_73,900|저소음 갈축_69,900|저소음 황축_69,900|황축_69,900","녹축_73,900|갈축_73,900|저소음 갈축_69,900|저소음 황축_69,900|황축_69,900"
8070895,COX CK2000 V광축 SA 투톤키캡 완전방수 교체축 사이드 RGB 게이밍,"34,490","34,500","34,500"
28191863,COX CK20th Century 멤브레인,"16,490","16,500","16,500"
6404207,COX CK250 교체축 LED 기계식 게이밍 텐키리스,"블랙, 청축_36,380|블랙, 갈축_63,760|블랙, 적축_95,950|화이트, 갈축_63,800|화이트, 적축_59,170|","블랙, 청축_36,380|블랙, 갈축_63,760|블랙, 적축_95,950|화이트, 갈축_63,800|화이트, 적축_59,170|","블랙, 청축_36,380|블랙, 갈축_63,760|블랙, 적축_95,950|화이트, 갈축_88,100|화이트, 적축_59,170|"
7480660,COX CK450 교체축 사이드 RGB 기계식 게이밍,"화이트, 적축_53,950","화이트, 적축_53,950","화이트, 적축_53,950"
16889645,COX CK510 교체축 LED 게이밍 기계식 키보드,"청축_27,060|갈축_27,060|적축_27,070","청축_27,060|갈축_27,060|적축_27,070","청축_27,060|갈축_27,060|적축_27,070"
8414463,COX CK8100 V광축 완전방수 크리스탈 키캡 교체축 사이드 RGB 게이밍,"S1, 클릭_37,390|S2, 클릭_28,410","S1, 클릭_37,390|S2, 클릭_28,410","S1, 클릭_37,390|S2, 클릭_29,900"
12086645,COX CK87 BT 게이트론 블루투스 5.0 텐키리스 기계식 게이밍 키보드,"블랙, 청축_59,900|블랙, 갈축_60,530|블랙, 황축_59,900|화이트, 청축_59,900|화이트, 갈축_108,400|","블랙, 청축_59,900|블랙, 갈축_60,530|블랙, 황축_59,900|화이트, 청축_59,900|화이트, 갈축_108,400|","블랙, 청축_59,900|블랙, 갈축_60,530|블랙, 황축_59,900|화이트, 청축_59,900|화이트, 갈축_108,400|"
20438657,COX CK87 PBT SUNSHINE GD 기계식,"황축_88,240|갈축_87,580","황축_88,240|갈축_87,580",0
20438609,COX CK87 PBT SUNSHINE GD 기계식,0,0,"황축_88,240|갈축_87,570"
15376265,COX CK87 PBT 게이트론 기계식 키보드,"청축_82,500|갈축_82,500|황축_82,500","청축_82,500|갈축_82,500|황축_82,500","청축_82,500|갈축_82,500|황축_82,500"
17466563,COX CK87 SLIM LP PBT,"블랙, 청축_78,980|블랙, 갈축_78,980|블랙, 적축_78,980|화이트, 청축_78,990|화이트, 갈축_78,990|","블랙, 청축_78,980|블랙, 갈축_79,000|블랙, 적축_79,000|화이트, 청축_79,000|화이트, 갈축_79,000|","블랙, 청축_78,980|블랙, 갈축_79,000|블랙, 적축_79,000|화이트, 청축_79,000|화이트, 갈축_79,000|"
7938631,COX CK87 네이비 게이트론 LED 게이밍 기계식,"갈축_62,900|녹축_62,900|황축_62,900","갈축_62,900|녹축_62,900|황축_62,900","갈축_62,900|녹축_62,900|황축_62,900"
7939003,COX CK87 레드/그레이 게이트론 LED 게이밍 기계식,"S1, 황축_73,900","S1, 황축_73,900","S1, 황축_73,900"
7938454,COX CK87 블랙 게이트론 LED 게이밍 기계식,"갈축_62,600|녹축_62,900|황축_59,900|저소음 갈축_59,900|저소음 황축_59,900","갈축_62,600|녹축_62,900|황축_59,900|저소음 갈축_59,900|저소음 황축_59,900","갈축_62,600|녹축_62,900|황축_59,900|저소음 갈축_59,900|저소음 황축_59,900"
11063505,COX CK87 크림블루 게이트론 LED 게이밍 기계식,"청축_62,710|갈축_62,900|황축_62,900","청축_62,720|갈축_62,900|황축_62,900","청축_62,720|갈축_62,900|황축_62,900"
10339101,COX CK87 화이트 게이트론 LED 게이밍 기계식,"갈축_62,900|황축_62,900",0,"갈축_62,900|황축_62,900"
10339050,COX CK87 화이트 게이트론 LED 게이밍 기계식,0,"갈축_62,900|황축_62,900",0
12419303,COX CKM01 멤브레인 키보드마우스 세트,"15,390","15,400","15,400"
10924074,COX CKM20 무선 키보드 마우스 콤보,"28,530","28,530","28,530"
12025010,COX CKM30W 저소음 무선 키보드 마우스 세트,"화이트_17,000","화이트_17,000","화이트_17,000"
5355168,COX CKM500 게이밍 키보드 마우스 콤보,"23,970","23,980","23,980"
11589167,COX CKM510 게이밍 키보드 마우스 세트,"22,900","22,900","22,900"
13252187,COX CKM600 게이밍 키보드 마우스 세트,"12,900","12,900","12,900"
17878583,COX CKM700 게이밍 키보드 마우스 세트,"25,760","25,760","25,760"
14804228,COX CKR01 TKL 아크릴 키보드 덮개,"7,730","7,730","7,730"
14802494,COX CKR01 아크릴 키보드 덮개,"7,900","7,900","7,900"
18455168,COX CKT87 RGB 반투광사출 기계식 텐키리스,"갈축_134,740|황축_134,650","갈축_134,740|황축_134,660","갈축_134,740|황축_134,660"
12757994,COX CNK103 콤팩트 무접점 키보드,"블랙, 50g_일시품절","블랙, 50g_일시품절","블랙, 50g_일시품절"
13994231,COX CNK87 BT,일시품절,일시품절,일시품절
14689772,COX COK100BT 블루투스 펜타그래프 키보드,"블랙_13,890","블랙_13,890","블랙_13,890"
15544967,COX COK105BT 멀티페어링 블루투스 키보드,"22,800","22,800","22,800"
