12149873,QSENN GP-KM4500 Plus,"PS/2_13,880|USB, 블랙_13,900|USB, 화이트_13,890","PS/2_13,880|USB, 블랙_13,900|USB, 화이트_13,890","PS/2_13,880|USB, 블랙_13,900|USB, 화이트_13,890"
15055466,QSENN K1000 무선키보드,"블랙, 키스킨 포함_9,650|화이트, 키스킨 포함_9,900|민트, 키스킨 포함_9,900|핑크, 키스킨 포함_9,900","블랙, 키스킨 포함_9,900|화이트, 키스킨 포함_9,900|민트, 키스킨 포함_9,900|핑크, 키스킨 포함_9,900",0
6691954,QSENN KM2500 Plus USB 키보드 마우스 세트,"8,600","8,600",0
15270260,QSENN MK210 무선 키보드 마우스 세트,"블랙, 키스킨 포함_14,800|화이트, 키스킨 포함_14,800|핑크, 키스킨 포함_14,800|민트, 키스킨 포함_14,800|블랙, 키스킨 미포함_14,800|||","블랙, 키스킨 포함_14,800|화이트, 키스킨 포함_14,800|핑크, 키스킨 포함_14,800|민트, 키스킨 포함_14,800|블랙, 키스킨 미포함_14,800|||","블랙, 키스킨 포함_14,800|화이트, 키스킨 포함_14,800|핑크, 키스킨 포함_14,800|민트, 키스킨 포함_14,800|블랙, 키스킨 미포함_14,800|||"
29857550,QSENN MK280 무선 키보드 마우스 세트,0,0,"블랙_17,040|민트_17,000|핑크_17,040|화이트_17,040"
20166155,QSENN MK350 무선 키보드 마우스 세트,"블랙_19,830|민트_19,830|핑크_19,830|화이트_19,830","블랙_19,830|민트_19,830|핑크_19,830|화이트_19,830",0
17459969,QSENN MK450 무선 키보드 마우스 세트,"블랙_18,400|민트_17,600|핑크_18,400|화이트_18,400","블랙_18,400|민트_17,600|핑크_18,400|화이트_18,400",0
3274953,QSENN SEM-DT35 NEW USB,"블랙_12,390|민트_11,880|핑크_11,790|화이트_12,400","블랙_12,390|민트_11,880|핑크_11,790|화이트_12,400",0
3274956,QSENN SEM-DT35 NEW USB,0,0,"블랙_12,390|민트_11,880|핑크_11,790|화이트_12,400"
19993385,QSENN SEM-DT35W 무선,"블랙_15,900|민트_15,100|핑크_15,490|화이트_15,490","블랙_15,900|민트_15,100|핑크_15,490|화이트_15,490","블랙_15,900|민트_15,900|핑크_15,490|화이트_15,490"
11996561,QSENN SEM-DT45 NEW Plus,0,0,"PS/2_10,590|USB, 블랙_10,600|USB, 화이트_10,600"
17459588,QSENN SEM-DT45 Plus 무선,0,0,"블랙_13,800|민트_13,800|핑크_13,800|화이트_13,670"
31473689,RAINY75 유무선,"해외구매_169,900","해외구매_164,220","해외구매_169,900"
4112515,Razer BlackWidow Chroma 오버워치 에디션,"녹축_126,070","녹축_126,040","녹축_125,950"
7957945,Razer BlackWidow Lite Stealth US,"블랙, 오렌지축_129,000","블랙, 오렌지축_129,000","블랙, 오렌지축_129,000"
14519831,Razer BlackWidow V3 KR,"녹축_149,000|황축_148,260","녹축_149,000|황축_148,260","녹축_149,000|황축_148,270"
14458676,Razer BlackWidow V3 Mini HyperSpeed KR,"녹축_219,000|황축_219,000","녹축_219,000|황축_219,000","녹축_219,000|황축_219,000"
13617902,Razer BlackWidow V3 Pro KR,"녹축_310,000|황축_310,000","녹축_310,000|황축_310,000","녹축_310,000|황축_310,000"
12495716,Razer BlackWidow V3 Pro US,"녹축_310,000","녹축_310,000","녹축_310,000"
14244248,Razer BlackWidow V3 TKL KR,"녹축_136,500|황축_138,470","녹축_136,500|황축_138,470","녹축_136,500|황축_138,470"
12495356,Razer BlackWidow V3 US,"녹축_190,990","녹축_198,940","녹축_198,940"
28124966,Razer BlackWidow V4 75% 기계식,"283,210","283,210","283,210"
28125020,Razer BlackWidow V4 75% 기계식 화이트,"265,880","269,060","268,770"
15169460,Razer Blackwidow V3 Mini HyperSpeed Phantom US,"녹축_289,000|황축_289,000","녹축_289,000|황축_289,000","녹축_289,000|황축_289,000"
28497494,Razer Blackwidow V3 Roblox Edition,"정품_211,620|해외구매_149,300","정품_211,590|해외구매_149,300","정품_211,480|해외구매_149,300"
27569933,Razer Blackwidow V4 KR,"239,040","239,040","236,550"
27569942,Razer Blackwidow V4 Linear KR,"239,040","239,040","238,800"
19109549,Razer Blackwidow V4 Pro KR,"346,750","339,770","339,770"
19109573,Razer Blackwidow V4 Pro Linear KR,"정품_324,570|병행수입_428,740","정품_324,570|병행수입_428,740","정품_328,060|병행수입_428,740"
19109597,Razer Blackwidow V4 Pro Linear US,"349,000","349,000","349,000"
19109588,Razer Blackwidow V4 Pro US,"349,000","349,000","349,000"
17685794,Razer DeathStalker V2 Pro Linear KR,"309,990","309,990","309,990"
17685806,Razer DeathStalker V2 Pro Linear US,"249,000","249,000","249,000"
17839187,Razer DeathStalker V2 Pro TKL Linear KR,"295,270","295,270","295,270"
17839301,Razer DeathStalker V2 Pro TKL Linear US,"298,990","298,990","298,990"
18497024,Razer DeathStalker V2 Pro TKL Linear White US,"299,000","299,000","299,000"
18802031,Razer DeathStalker V2 Pro White US 유무선,"319,000","319,000","319,000"
18739907,Razer DeathStalker V2 US,"리니어_199,000","리니어_199,000","리니어_199,000"
14731214,Razer Ergonomic Wrist Rest,"MINI_29,000|TKL_29,000","MINI_29,000|TKL_29,000","MINI_29,000|TKL_29,000"
10357521,Razer Ergonomic Wrist Rest Pro,"49,000","48,780","48,780"
10357491,Razer Ergonomic Wrist Rest Standard,"28,000","28,000","28,000"
6290416,Razer Huntsman Elite US,"클릭_299,000|리니어_299,000","클릭_299,000|리니어_299,000","클릭_299,000|리니어_299,000"
12235631,Razer Huntsman Mini US,"블랙, 클릭_159,000|머큐리, 리니어_180,000|머큐리, 클릭_169,000|블랙, 리니어_180,000","블랙, 클릭_159,000|머큐리, 리니어_180,000|머큐리, 클릭_169,000|블랙, 리니어_180,000","블랙, 클릭_159,000|머큐리, 리니어_180,000|머큐리, 클릭_169,000|블랙, 리니어_180,000"
9668085,Razer Huntsman Tournament US,"154,000","154,000","154,000"
13569632,Razer Huntsman V2 Analog US,"363,870","359,180","359,180"
21625853,Razer Huntsman V2 Battlegrounds Edition,"리니어_329,000","리니어_329,000","리니어_329,000"
16058669,Razer Huntsman V2 KR,"리니어_216,840|퍼플축_216,870","리니어_216,840|퍼플축_216,870","리니어_218,930|퍼플축_216,870"
15680276,Razer Huntsman V2 TKL KR,"리니어_181,440","리니어_181,440","리니어_181,440"
15284648,Razer Huntsman V2 TKL US,"리니어_219,000|퍼플축_199,000",0,0
15332048,Razer Huntsman V2 TKL US,0,"리니어_219,000|퍼플축_199,000","리니어_219,000|퍼플축_199,000"
15284444,Razer Huntsman V2 US,"리니어_259,000|퍼플축_219,000",0,0
15284531,Razer Huntsman V2 US,0,"리니어_259,000|퍼플축_219,000","리니어_259,000|퍼플축_219,000"
29367731,Razer Huntsman V3 Pro KR,"367,630","367,630",0
29367524,Razer Huntsman V3 Pro TKL KR,"329,000","326,070","324,660"
28773296,Razer Mechanical Switches Pack,"그린_34,470|옐로우_35,900|오렌지_34,470","그린_34,470|옐로우_35,900|오렌지_34,470","그린_35,900|옐로우_35,900|오렌지_35,900"
11538242,Razer ORNATA V2,"222,400","222,400","222,400"
17686100,Razer Ornata V3 KR,"109,000","106,980","106,980"
19970087,Razer Ornata V3 TKL KR,"104,900","104,900","104,900"
28324988,Razer PBT Keycap Coiled Cable Set,"화이트_79,000|그린_79,000|블랙_79,000|핑크_79,000","화이트_79,000|그린_79,000|블랙_79,000|핑크_79,000","화이트_79,000|그린_79,000|블랙_79,000|핑크_79,000"
10357257,Razer PBT Keycap Upgrade Set,"블랙_42,000|그린_42,000|핑크_42,000|화이트_42,000","블랙_41,990|그린_42,000|핑크_42,000|화이트_42,000","블랙_41,990|그린_42,000|핑크_42,000|화이트_42,000"
21625907,Razer PUBG Battlegrounds Edition 키보드 마우스 세트 + 헤드셋,"748,990","748,990","748,990"
12227084,Razer Pro Type,"199,000","199,000","199,000"
16716845,Razer Pro type Ultra KR,"218,990","218,990","216,740"
16316537,Razer Pro type Ultra US,"219,000","219,000","219,000"
10770483,Razer Tartarus Pro,"클래식 블랙_189,000|머큐리 화이트_187,470|해외구매_127,700","클래식 블랙_189,000|머큐리 화이트_184,580|해외구매_127,700","클래식 블랙_189,000|머큐리 화이트_184,580|해외구매_127,700"
31473038,SPM AL66A 풀 알루미늄 DIY KIT 기계식,"에보니_55,000|내추럴_55,000","에보니_55,000|내추럴_55,000","에보니_55,000|내추럴_55,000"
31473326,SPM AL82A 풀 알루미늄 DIY KIT 기계식,"에보니_69,000|내추럴_69,000","에보니_69,000|내추럴_69,000","에보니_69,000|내추럴_69,000"
31473575,SPM AL87A 풀 알루미늄 DIY KIT 기계식,"에보니_79,000|내추럴_79,000","에보니_79,000|내추럴_79,000","에보니_79,000|내추럴_79,000"
30217028,SPM OSHID 크리스마스 투명 레진 아티산 포인트 키캡,"쿠키_9,900|눈사람_9,900|산타모자_9,900","쿠키_9,900|눈사람_9,900|산타모자_9,900","쿠키_9,900|눈사람_9,900|산타모자_9,900"
29809940,SPM 아크릴 기계식 키보드 스위치 보관함,0,0,"3,000"
3389678,TGIC TGC-K1200U,0,0,"4,060"
12706109,TGIC TGC-K1500U 멤브레인 유선키보드,"3,840","3,820","3,820"
2866578,TGIC TGC-MK1200 세트,"6,090","6,090","6,090"
15102761,TGIC TGC-WMK275 무선 키보드 마우스 세트,0,0,"블랙_11,610"
16699949,Topre REALFORCE PZ-R2TLSA-US4,"해외구매_242,990","해외구매_242,990","해외구매_242,650"
28418198,Topre REALFORCE R3 BT 유무선 그레이 블루 한글,"465,000","465,000","465,000"
17428598,Topre REALFORCE R3 R3HH21,"해외구매_370,550","해외구매_370,520","해외구매_370,410"
30158459,U2 OK-100,"6,900","6,900","6,900"
30207344,U2 OK-100 OM-100 키보드 마우스 세트,"8,900","8,900","8,900"
20082929,VARMILO MA108 V2 WARRIOR SOAR 무접점,"아이리스축_249,000|로즈축_249,000|바이올렛축_249,000|자스민축_249,000|핑크축_249,000","아이리스축_249,000|로즈축_249,000|바이올렛축_249,000|자스민축_249,000|핑크축_249,000","아이리스축_249,000|로즈축_249,000|바이올렛축_249,000|자스민축_249,000|핑크축_249,000"
13728860,VARMILO MA108M KOI PBT 염료승화 영문,"데이지축_206,990|로즈축_일시품절|핑크축_209,000","데이지축_208,740|로즈축_일시품절|핑크축_209,000","데이지축_208,490|로즈축_일시품절|핑크축_209,000"
13350848,VARMILO MA108M Lovebirds I PBT 염료승화 영문,"핑크축_299,000","핑크축_299,000","핑크축_299,000"
13350923,VARMILO MA108M Lovebirds YOU PBT 염료승화 영문,"로즈축_198,000|핑크축_192,700","로즈축_198,000|핑크축_192,700","로즈축_198,000|핑크축_192,700"
13199999,VARMILO MA108M MOONLIGHT PBT 염료승화 영문,"핑크축_415,000","핑크축_415,000","핑크축_415,000"
15126398,VARMILO MA108M SUMMIT R2 PBT 염료승화 영문,"핑크축_219,000","핑크축_219,000","핑크축_219,000"
20082431,VARMILO MA87 V2 WARRIOR SOAR 무접점,"데이지축_229,000|로즈축_229,000|바이올렛축_229,000|아이리스축_229,000|자스민축_229,000|","데이지축_229,000|로즈축_229,000|바이올렛축_229,000|아이리스축_229,000|자스민축_229,000|","데이지축_229,000|로즈축_229,000|바이올렛축_229,000|아이리스축_229,000|자스민축_229,000|"
13729001,VARMILO MA87M KOI PBT 염료승화 영문,"데이지축_198,000|로즈축_197,990|핑크축_197,990","데이지축_198,000|로즈축_197,990|핑크축_197,990","데이지축_198,000|로즈축_197,990|핑크축_197,990"
13350356,VARMILO MA87M Lovebirds I PBT 염료승화 영문,"로즈축_389,000","로즈축_389,000","로즈축_389,000"
13350203,VARMILO MA87M Lovebirds You PBT 염료승화 영문,"로즈축_306,500","로즈축_306,500","로즈축_306,500"
15034571,VARMILO MA87M MOONLIGHT PBT 염료승화 영문,"아이비축_177,990","아이비축_177,990","아이비축_177,990"
15126377,VARMILO MA87M SUMMIT R2 PBT 염료승화 영문,"핑크축_208,000","핑크축_208,000","핑크축_208,000"
29821703,VARMILO MINILO 75 유무선 기계식 레트로 영문,"저소음축_207,990|라이트축_197,990|적축_197,990","저소음축_207,990|라이트축_197,990|적축_197,990","저소음축_207,990|라이트축_197,990|적축_197,990"
29821742,VARMILO MINILO 75 유무선 기계식 맨도사 영문,"저소음축_207,990|라이트축_197,990|적축_197,990","저소음축_207,990|라이트축_197,990|적축_197,990","저소음축_207,990|라이트축_197,990|적축_197,990"
29821802,VARMILO MINILO 75 유무선 기계식 블루벨 영문,"저소음축_207,990|라이트축_197,990|적축_197,990",0,"저소음축_207,990|라이트축_197,990|적축_197,990"
29821787,VARMILO MINILO 75 유무선 기계식 블루벨 영문,0,"저소음축_207,990|라이트축_197,990|적축_197,990",0
29821775,VARMILO MINILO 75 유무선 기계식 유칼리투스 영문,"저소음축_207,990|라이트축_197,990|적축_197,990","저소음축_207,990|라이트축_197,990|적축_197,990","저소음축_207,990|라이트축_197,990|적축_197,990"
28619048,VARMILO MINILO 75% RGB 유무선 기계식,"해외구매_262,790","해외구매_262,790","해외구매_262,790"
18978827,VARMILO MINILO EUCALYPTUS 유무선 영문,"로즈축_169,000|바이올렛축_169,000|아이리스축_169,000|자스민축_169,000|핑크축_169,000","로즈축_169,000|바이올렛축_169,000|아이리스축_169,000|자스민축_169,000|핑크축_169,000","로즈축_169,000|바이올렛축_169,000|아이리스축_169,000|자스민축_169,000|핑크축_169,000"
18991463,VARMILO MINILO MENDOZAE 유무선 영문,"데이지축_169,000|로즈축_169,000|바이올렛축_169,000|아이리스축_169,000|자스민축_169,000|","데이지축_169,000|로즈축_169,000|바이올렛축_169,000|아이리스축_169,000|자스민축_169,000|","데이지축_169,000|로즈축_169,000|바이올렛축_169,000|아이리스축_169,000|자스민축_169,000|"
12495089,VARMILO MIYA PRO KOI PBT 염료승화 영문,"갈축_179,000|적축_178,990","갈축_179,000|적축_178,990","갈축_179,000|적축_178,990"
5829362,VARMILO MIYA PRO PBT 매화 컬렉션 염료승화 영문,"갈축_138,000","갈축_138,000","갈축_138,000"
13734128,VARMILO VA108M Lovebirds I PBT 염료승화 영문,"저소음 적축_239,000","저소음 적축_239,000","저소음 적축_239,000"
13733990,VARMILO VA108M Lovebirds YOU PBT 염료승화 영문,"저소음 적축_208,050","저소음 적축_208,050","저소음 적축_208,050"
14039546,VARMILO VA108M SUMMIT R2 PBT 염료승화 영문,"갈축_209,000|적축_208,800","갈축_209,000|적축_208,790",0
14039525,VARMILO VA108M SUMMIT R2 PBT 염료승화 영문,0,0,"갈축_209,000|적축_208,770"
17572766,VARMILO VA108M V2 Dreams on Board PBT 염료승화 한글,"갈축_209,000|저소음 적축_219,000","갈축_일시품절|저소음 적축_219,000","갈축_일시품절|저소음 적축_299,000"
20260103,VARMILO VA108M V2 MOONLIGHT 한글,갈축_일시품절|저소음 적축_일시품절|적축_일시품절,갈축_일시품절|저소음 적축_일시품절|적축_일시품절,갈축_일시품절|저소음 적축_일시품절|적축_일시품절
17632310,VARMILO VA108M V2 PANDA R2 PBT 염료승화 영문,"적축_209,000|저소음 적축_279,800","적축_일시품절|저소음 적축_279,800","적축_일시품절|저소음 적축_279,800"
16841903,VARMILO VA108M V2 SEA MELODY PBT 염료승화 한글,"갈축_일시품절|적축_일시품절|저소음 적축_209,000","갈축_일시품절|적축_일시품절|저소음 적축_209,000","갈축_일시품절|적축_일시품절|저소음 적축_209,000"
16894562,VARMILO VA108M V2 SUMMIT R2 PBT 염료승화 영문,"적축_299,000","적축_299,000","적축_299,000"
28184024,VARMILO VA108M V2 SUMMIT 기계식,"저소음 적축_229,000","저소음 적축_229,000","저소음 적축_229,000"
16894238,VARMILO VA108M V2 다크 그레이 PBT 염료승화 한글,"갈축_199,000|적축_185,180|저소음 적축_일시품절",0,"갈축_199,000|적축_185,040|저소음 적축_일시품절"
16894223,VARMILO VA108M V2 다크 그레이 PBT 염료승화 한글,0,"갈축_199,000|적축_185,150|저소음 적축_일시품절",0
16893995,VARMILO VA108M V2 다크믹스 PBT 염료승화 한글,저소음 적축_일시품절,저소음 적축_일시품절,저소음 적축_일시품절
16855478,VARMILO VA108M V2 매화 컬렉션 PBT 염료승화 한글,저소음 적축_일시품절,저소음 적축_일시품절,저소음 적축_일시품절
16874471,VARMILO VA108Mac V2 밀키 화이트 PBT 염료승화 영문,"갈축_179,000|적축_179,000","갈축_179,000|적축_179,000","갈축_179,000|적축_179,000"
13882346,VARMILO VA87M Beijing Opera 염료승화 영문,"적축_198,000","적축_198,000","적축_198,000"
9639522,VARMILO VA87M KOI PBT 염료승화 영문,"갈축_189,000|적축_185,370","갈축_189,000|적축_185,120","갈축_189,000|적축_184,870"
15835511,VARMILO VA87M Lovebirds I PBT 염료승화 영문,"저소음 적축_219,000","저소음 적축_219,000","저소음 적축_219,000"
15835523,VARMILO VA87M Lovebirds YOU PBT 염료승화 영문,"저소음 적축_218,990","저소음 적축_218,990","저소음 적축_218,990"
12137576,VARMILO VA87M MONOGRAY PBT 염료승화 한글,"갈축_168,000|적축_167,990","갈축_168,000|적축_167,990","갈축_168,000|적축_167,990"
14963873,VARMILO VA87M MOONLIGHT PBT 염료승화 영문,"갈축_177,990","갈축_177,990","갈축_177,990"
14039420,VARMILO VA87M SUMMIT R2 PBT 염료승화 영문,"갈축_198,000|저소음 적축_206,100|적축_198,000","갈축_198,000|저소음 적축_206,100|적축_198,000","갈축_198,000|저소음 적축_206,100|적축_198,000"
17572631,VARMILO VA87M V2 Dreams on Board PBT 염료승화 한글,"갈축_226,000",갈축_일시품절,갈축_일시품절
20260487,VARMILO VA87M V2 MOONLIGHT 한글,"갈축_178,990|적축_178,990","갈축_178,990|적축_178,990","갈축_178,990|적축_178,990"
17632271,VARMILO VA87M V2 PANDA R2 PBT 염료승화 영문,"갈축_191,700|저소음 적축_289,000","갈축_191,700|저소음 적축_289,000","갈축_191,700|저소음 적축_289,000"
16841807,VARMILO VA87M V2 SEA MELODY PBT 염료승화 한글,"갈축_189,000|적축_189,000|저소음 적축_249,300","갈축_189,000|적축_189,000|저소음 적축_249,300","갈축_일시품절|적축_일시품절|저소음 적축_249,300"
16894469,VARMILO VA87M V2 SUMMIT R2 PBT 염료승화 영문,"적축_209,000","적축_209,000","적축_209,000"
16894133,VARMILO VA87M V2 다크 그레이 PBT 염료승화 한글,"갈축_239,900|적축_249,800|저소음 적축_169,000","갈축_239,900|적축_249,800|저소음 적축_169,000","갈축_239,900|적축_249,800|저소음 적축_169,000"
16893824,VARMILO VA87M V2 다크믹스 PBT 염료승화 한글,"갈축_159,000|적축_159,000",0,0
16893761,VARMILO VA87M V2 다크믹스 PBT 염료승화 한글,0,"갈축_159,000|적축_159,000","갈축_159,000|적축_159,000"
16855292,VARMILO VA87M V2 매화 컬렉션 PBT 염료승화 한글,"갈축_198,000|적축_198,000|저소음 적축_198,000","갈축_198,000|적축_198,000|저소음 적축_198,000","갈축_198,000|적축_198,000|저소음 적축_198,000"
18384794,VARMILO VA87M V2 매화 컬렉션 R2 PBT 염료승화 한글,"갈축_198,000|저소음 적축_209,000|적축_198,000","갈축_198,000|저소음 적축_209,000|적축_198,000","갈축_198,000|저소음 적축_209,000|적축_198,000"
7001122,VARMILO VA87M 다크그레이 RE PBT 염료승화 한글,갈축_일시품절|적축_일시품절,갈축_일시품절|적축_일시품절,갈축_일시품절|적축_일시품절
11823049,VARMILO VA87M 다크믹스 RE PBT 염료승화 한글,"저소음 적축_486,000","저소음 적축_486,000","저소음 적축_486,000"
11500380,VARMILO VA87M 매화 컬렉션 PBT 염료승화 한글,"갈축_157,990|저소음 적축_251,230","갈축_157,990|저소음 적축_251,230","갈축_273,100|저소음 적축_251,230"
16873304,VARMILO VA87Mac V2 밀키 화이트 PBT 염료승화 영문,"갈축_169,000|적축_169,000","갈축_169,000|적축_169,000","갈축_169,000|적축_169,000"
14012858,VARMILO X ZOMO 고양이 발바닥 ABS 키캡,"젖소냥_22,000|고등어냥_18,890|샴냥_18,900|치즈냥_22,000","젖소냥_22,000|고등어냥_18,890|샴냥_18,900|치즈냥_22,000","젖소냥_22,000|고등어냥_18,890|샴냥_18,900|치즈냥_22,000"
30097799,WANDU K68 무선 기계식,"해외구매_23,490","해외구매_23,490","해외구매_23,490"
20607614,Wooting 60HE,"해외구매_301,200","해외구매_301,200","해외구매_301,190"
13064840,archon K75 영문 블루투스 5.0 기계식 키보드,"화이트, 갈축_79,000|블랙, 갈축_79,000|블랙, 저소음 적축_99,000|블랙, 적축_79,000|화이트, 저소음 적축_99,000|","화이트, 갈축_79,000|블랙, 갈축_79,000|블랙, 저소음 적축_99,000|블랙, 적축_79,000|화이트, 저소음 적축_99,000|",0
13128875,archon K77 한글 블루투스 5.0 기계식 키보드,"화이트, 적축_99,000|블랙, 갈축_일시품절|블랙, 적축_168,000|화이트, 갈축_일시품절","화이트, 적축_99,000|블랙, 갈축_일시품절|블랙, 적축_168,000|화이트, 갈축_일시품절","화이트, 적축_99,000|블랙, 갈축_일시품절|블랙, 적축_168,000|화이트, 갈축_일시품절"
30158657,co2CREA 8Bitdo Retro 키보드 케이스,"해외구매_65,790","해외구매_65,790","해외구매_65,790"
20128619,darkFlash GD100 유무선 기계식 밀크 브라운,"황축_37,800","황축_37,800","황축_38,000"
28449845,darkFlash GD100 유무선 기계식 별빛 파랑,"황축_37,790","황축_37,790","황축_37,790"
20128646,darkFlash GD100 유무선 기계식 흑설탕,"황축_37,790","황축_37,790","황축_37,790"
21470327,darkFlash GD108 유무선 기계식 밀크 브라운,"황축_57,390","황축_57,390","황축_57,390"
21470333,darkFlash GD108 유무선 기계식 별빛 파랑,"황축_57,390","황축_57,390","황축_57,390"
21470318,darkFlash GD108 유무선 기계식 흑설탕,"황축_57,340","황축_57,340","황축_57,340"
28889486,darkFlash GD68 유무선 기계식 별빛 파랑,"42,790","42,790","42,790"
28889495,darkFlash GD68 유무선 기계식 흑설탕,"42,790","42,790","42,790"
28649996,darkFlash GD87 유무선 기계식 별빛 파랑,"황축_38,000","황축_38,000","황축_38,000"
28650263,darkFlash GD87 유무선 기계식 흑설탕,"황축_36,840","황축_36,840","황축_36,840"
4998158,i-rocks IRK01W / IRK01B 전용 키스킨,"2,590","2,590",0
1394973,i-rocks IRK01W X-Slim,"블랙_28,500|실버_29,270|화이트_28,500|핑크_29,280","블랙_28,500|실버_29,230|화이트_28,500|핑크_29,240","블랙_28,500|실버_29,470|화이트_28,500|핑크_29,470"
134184,i-rocks KR-6170 X-Slim,0,0,"블랙_32,500|화이트_32,500"
30066854,가드브이 로지텍 G PRO G PRO X 키스킨,"12,900","12,900","12,900"
6397616,갤럭시 XANOVA MAGNETAR RGB 기계식 키보드,"갈축_111,000","갈축_111,000","갈축_111,000"
11778145,갤럭시 XANOVA PULSAR 기계식 키보드,"적축_104,400",적축_일시품절,적축_일시품절
6423252,갤럭시 XANOVA 한영 ABS 104 키캡,"7,900","7,900","7,900"
16297799,갤럭시 갤라즈 GALAX EX-03 게이밍 기계식 키보드,"34,890","34,890","34,890"
5019857,건평정보통신 IPLEX RK-2000C 무선 키보드 마우스 세트,"11,620","11,620","11,620"
17345081,글로리어스 AURA KEYCAPS V2,"블랙_30,540|핑크_30,540|화이트_30,540","블랙_50,900|핑크_48,580|화이트_48,580","블랙_50,900|핑크_48,580|화이트_48,580"
18438824,글로리어스 FOX 사전 윤활 스위치 세트,"70,850","109,000","109,000"
19184264,글로리어스 GMMK NUMPAD 골드 뱃지,"10,740","17,900","17,900"
19184390,글로리어스 GMMK NUMPAD 상판 프레임,"E-WHITE_48,000|NAVY BLUE_48,000","E-WHITE_80,000|NAVY BLUE_72,730","E-WHITE_80,000|NAVY BLUE_80,000"
19184477,글로리어스 GMMK NUMPAD 스위치 보강판,"폴리카보네이트_12,000|황동_30,000","폴리카보네이트_20,000|황동_50,000","폴리카보네이트_20,000|황동_50,000"
19184561,글로리어스 GMMK NUMPAD 슬라이더,"BLACK SLATE_16,660|E-WHITE_17,900|NAVY BLUE_17,890|PRISM PINK_17,890","BLACK SLATE_16,660|E-WHITE_17,900|NAVY BLUE_17,890|PRISM PINK_17,890","BLACK SLATE_16,660|E-WHITE_17,900|NAVY BLUE_17,890|PRISM PINK_17,890"
18436580,글로리어스 GMMK NUMPAD 유무선,"화이트_184,000|블랙_119,600","화이트_184,000|블랙_184,000","화이트_184,000|블랙_184,000"
17532062,글로리어스 GMMK PRO PreBuilt,"366,750","489,000","489,000"
17840324,글로리어스 GMMK PRO 베어본 커스텀 키보드,"블랙_179,250|화이트_179,250","블랙_239,000|화이트_239,000","블랙_239,000|화이트_239,000"
17847629,글로리어스 GMMK PRO 볼륨 노브,"AQUA BLUE_14,900|E-WHITE_8,940|FOREST GREEN_14,900|GOLDEN YELLOW_14,900|NAVY BLUE_14,900|","AQUA BLUE_14,900|E-WHITE_14,900|FOREST GREEN_14,900|GOLDEN YELLOW_14,900|NAVY BLUE_14,900|","AQUA BLUE_14,900|E-WHITE_14,900|FOREST GREEN_14,900|GOLDEN YELLOW_14,900|NAVY BLUE_14,900|"
17820788,글로리어스 GMMK PRO 상판,"WHITE_84,000|AQUA BLUE_50,400|FOREST GREEN_50,400|GOLDEN YELLOW_50,400|NAVY BLUE_50,400|","WHITE_84,000|AQUA BLUE_64,000|FOREST GREEN_64,000|GOLDEN YELLOW_84,000|NAVY BLUE_64,000|","WHITE_84,000|AQUA BLUE_64,000|FOREST GREEN_64,000|GOLDEN YELLOW_84,000|NAVY BLUE_64,000|"
17847749,글로리어스 GMMK PRO 스위치 보강판,"황동_44,400|폴리카보네이트_17,940","황동_48,950|폴리카보네이트_19,580",0
17847794,글로리어스 GMMK PRO 스위치 보강판,0,0,"황동_52,620|폴리카보네이트_21,040"
17181068,글로리어스 GMMK2 65% Prebuilt 기계식 키보드,"블랙_109,850|화이트_109,850|핑크_109,850","블랙_168,810|화이트_169,000|핑크_169,000","블랙_168,810|화이트_169,000|핑크_169,000"
17180156,글로리어스 GMMK2 65% 베어본 커스텀 키보드,"블랙_74,100|화이트_74,100|핑크_74,100","블랙_114,000|화이트_114,000|핑크_114,000","블랙_114,000|화이트_114,000|핑크_114,000"
17181212,글로리어스 GMMK2 96% Prebuilt 기계식 키보드,"블랙_109,850|핑크_109,850|화이트_109,850","블랙_169,000|핑크_169,000|화이트_169,000","블랙_169,000|핑크_169,000|화이트_169,000"
