13050158,앱코 HACKER KM700 게이밍 키보드 마우스 장패드 세트,"블랙_23,900","블랙_23,900"
11833771,앱코 HACKER KN01 텐키리스 PBT RGB 무접점 키보드,"블랙, 45g_99,000|블랙, 55g_99,000|화이트, 45g_99,000|화이트, 55g_99,000","블랙, 45g_99,000|블랙, 55g_99,000|화이트, 45g_99,000|화이트, 55g_99,000"
12170507,앱코 HACKER KN10 PBT RGB 무접점 키보드,"블랙, 45g_102,700|블랙, 55g_109,000|화이트, 45g_일시품절|화이트, 55g_109,000","블랙, 45g_108,990|블랙, 55g_109,000|화이트, 45g_일시품절|화이트, 55g_109,000"
5228654,앱코 HACKER QUICK SWAP용 OUTEMU 스위치,"8개, 청축_2,200|8개, 갈축_2,200|8개, 적축_2,200|각2개, 청축/갈축/적축/흑축_2,200","8개, 청축_2,200|8개, 갈축_2,200|8개, 적축_2,200|각2개, 청축/갈축/적축/흑축_2,200"
5827135,앱코 HACKER 카일 정품 광축 스위치,"10개, 클릭_4,000|10개, 리니어_4,000|5+5개, 클릭/리니어_4,000","10개, 클릭_4,000|10개, 리니어_4,000|5+5개, 클릭/리니어_4,000"
2788274,앱코 K-A4U,"98,400","98,400"
28450646,앱코 K1924 RETRO GTMX NON-LED 가스켓 게이밍 기계식,청축_가격비교예정,청축_가격비교예정
28450715,앱코 K1924 RETRO GTMX NON-LED 게이밍 기계식,갈축_가격비교예정|적축_가격비교예정,갈축_가격비교예정|적축_가격비교예정
18878243,앱코 K517 레트로 기계식,"적축_39,900|갈축_39,900|청축_39,900","적축_39,900|갈축_39,900|청축_39,900"
12278276,앱코 K551 A광축 사이드 Edge RGB LED 게이밍 키보드,"클릭_38,900","클릭_38,900"
13363190,앱코 K560 축교환 레인보우 무빙 LED 기계식 키보드,"청축_27,900|갈축_27,900|적축_27,900","청축_27,900|갈축_27,900|적축_27,900"
14471087,앱코 K570 축교환 레인보우 무빙 LED 기계식 키보드,"청축_31,990|갈축_32,000|적축_32,000","청축_31,990|갈축_32,000|적축_32,000"
13363517,앱코 K640T SLIM 축교환 무빙LED 텐키리스 기계식 블랙,"청축_39,900|적축_39,900","청축_39,900|적축_39,900"
15282614,앱코 K640T SLIM 축교환 무빙LED 텐키리스 기계식 화이트,"청축_39,900|적축_39,900","청축_39,900|적축_39,900"
17057819,앱코 K641 SLIM PLUS RGB 게이밍 기계식 키보드,"청축_61,900|적축_61,900",0
17057765,앱코 K641 SLIM PLUS RGB 게이밍 기계식 키보드,0,"청축_61,900|적축_61,900"
19456031,앱코 K660 블루민트 에디션 카일 광축 게이밍,"62,000","62,000"
17345816,앱코 K660M-L68 무선 블루투스 기계식 미니 키보드,"블랙_112,000|화이트_112,000","블랙_112,000|화이트_112,000"
13208612,앱코 K660P 프리미엄 카일광축 무빙 LED 게이밍 기계식 키보드,"마젠타, 클릭_73,000|다크 그레이, 클릭_73,000","마젠타, 클릭_73,000|다크 그레이, 클릭_73,000"
19690820,앱코 K669 카일 광축 게이밍,"블랙 레드_65,000|핑크 화이트_65,000","블랙 레드_65,000|핑크 화이트_65,000"
27754094,앱코 K8200 PRO 스카이블루 아이스큐브 키캡 게이밍,"클릭_69,000","클릭_69,000"
15825842,앱코 K840 사각 레트로 축교환 기계식 블랙,"갈축_49,900|청축_49,900|적축_49,900",0
15825632,앱코 K840 사각 레트로 축교환 기계식 블랙,0,"갈축_49,900|청축_49,900|적축_49,900"
15825908,앱코 K840 사각 레트로 축교환 기계식 화이트,"청축_49,900|갈축_49,900|적축_49,890","청축_49,900|갈축_49,900|적축_49,900"
15150851,앱코 K841 조약돌 레트로 축교환 기계식 민트,"청축_32,000|갈축_32,000|적축_32,000","청축_32,000|갈축_32,000|적축_32,000"
15150836,앱코 K841 조약돌 레트로 축교환 기계식 핑크,"청축_32,000|갈축_32,000|적축_32,000","청축_32,000|갈축_32,000|적축_32,000"
27755567,앱코 K8900 PRO 블랙 아이스큐브 키캡 게이밍,"69,000","69,000"
9494319,앱코 KM110 RGB 멤브레인 키보드 마우스 합본,"블랙_13,620|화이트_13,620","블랙_13,620|화이트_13,620"
9494352,앱코 KM120 RGB 멤브레인 키보드 마우스 합본,"블랙_18,000|화이트_18,000","블랙_18,000|화이트_18,000"
12399617,앱코 KM150 키보드 마우스 오피스 세트,"16,500","16,500"
12471623,앱코 KM250 키보드 마우스 세트,"8,580","8,580"
5182267,앱코 KM400 게이밍 콤보,"블랙_25,000|화이트_27,500","블랙_25,000|화이트_27,500"
18650684,앱코 KM500 키보드 마우스 세트,"V1, 화이트_25,900|V1, 블랙_25,900|V2, 블랙_25,900|V2, 화이트_25,900","V1, 화이트_25,900|V1, 블랙_25,900|V2, 블랙_25,900|V2, 화이트_25,900"
19562489,앱코 KM800 키보드 마우스 세트,"블랙_33,000|화이트_33,000","블랙_33,000|화이트_33,000"
12376373,앱코 KN01 BT 블루투스 TKL 무접점 게이밍 키보드 블랙,"45g_99,000|55g_99,000","45g_99,000|55g_99,000"
12376391,앱코 KN01 BT 블루투스 TKL 무접점 게이밍 키보드 화이트,"45g_178,200","45g_178,200"
15230645,앱코 KN01C 텐키리스 PBT 무접점 키보드 블루,"30g_150,000","30g_150,000"
15230654,앱코 KN01C 텐키리스 PBT 무접점 키보드 핑크,"45g_150,000","45g_150,000"
19645700,앱코 KN02C 삼색사출 PBT 텐키리스 무접점,"149,000","149,000"
12376532,앱코 KN10 BT 블루투스 무접점 게이밍 키보드 블랙,"45g_129,000|55g_179,300","45g_129,000|55g_179,300"
12376574,앱코 KN10 BT 블루투스 무접점 게이밍 키보드 화이트,"45g_132,000|55g_215,500","45g_132,000|55g_215,500"
15229799,앱코 KN10C PBT 무접점 키보드,"그레이, 30g_169,000|핑크, 45g_169,000","그레이, 30g_169,000|핑크, 45g_169,000"
19645514,앱코 KN20C 삼색사출 PBT 무접점,"175,000","175,000"
24133613,앱코 KN30BT 블루투스 유무선 무접점,"159,000","159,000"
9925461,앱코 KP10 키패드,"6,930","6,930"
16994000,앱코 KP35BT 블루투스 와이드 키패드,"28,900","28,900"
2241246,앱코 MultiPack KM-A4P,"10,100","10,100"
2682415,앱코 MultiPack KM-A4U,"13,800","13,800"
2241240,앱코 MultiPack KM-A5PS,"키스킨 포함_11,800","키스킨 포함_11,800"
14216075,앱코 PUBG 배틀그라운드 하자드 에디션 카일 광축,"145,470","145,470"
14321915,앱코 TOS100 무선 키보드,"66,370","66,327"
16792100,앱코 TOS180 블루투스 펜타그래프 키보드,"18,750","19,900"
13655036,앱코 TOS200 LED 블루투스 키보드,"로즈골드_59,970|블랙_112,120","로즈골드_59,970|블랙_112,120"
14691737,앱코 TOS250 LED 블루투스 키보드,"블랙_39,900|화이트_19,900","블랙_39,900|화이트_19,900"
14567123,앱코 TPM1 TKL 어고노믹 월넛 팜레스트,"19,900","19,900"
14567039,앱코 TPM1 어고노믹 월넛 팜레스트,"22,500","22,500"
12423566,앱코 TW1867 레트로 블루투스 기계식 키보드,"청축_87,000|적축_87,000","청축_87,000|적축_87,000"
11123001,앱코 WKM01 무선 키보드 마우스 세트,"핑크_23,000|민트_23,000|블루_23,000","핑크_23,000|민트_23,000|블루_23,000"
11480607,앱코 WKM02 무선 키보드 마우스 세트,"블랙_29,810|화이트_29,880","블랙_29,810|화이트_29,880"
13912325,앱코 WKM03 무선 키보드마우스 세트,"블랙_18,900|핑크_18,900","블랙_18,900|핑크_18,900"
12098402,앱코 WKM160 펜타그래프 무선 키보드 마우스 오피스 세트,"28,100","28,100"
12129872,앱코 WKM360 무선 터치패드 키보드,"27,200","27,200"
13037375,앱코 WKM40 무선 키보드 마우스 세트,"베이지_21,900","베이지_21,900"
13037483,앱코 WKM50 펜홀더형 무선 키보드 마우스 세트,"핑크_21,900|네이비_21,900","핑크_21,900|네이비_21,900"
13037591,앱코 WKM60 무선 키보드 마우스 세트,"블랙_21,100","블랙_21,100"
12278561,앱코 WKM620 TKL 멀티 컬러 육각키캡 무선 미니 키보드 마우스 세트,"옐로우_28,000|피치_9,900|핑크_9,900","옐로우_28,000|피치_9,900|핑크_9,900"
12257378,앱코 WKM650 멀티 컬러 육각키캡 무선 키보드 마우스 세트,"핑크_10,900|스카이 블루_10,900|카키_33,500","핑크_10,900|스카이 블루_10,900|카키_33,500"
17990549,앱코 WKM800 무선 키보드 마우스 세트,"21,500","21,500"
13860356,앱코 WKM900 무소음 무선 키보드 마우스 세트,"블랙_21,900","블랙_21,900"
5682284,앱코 레트로 써클 컬러 키캡 104키,"화이트, 실버_31,570|핑크_31,000","화이트, 실버_31,570|핑크_31,000"
4291186,앱코 레트로 써클 키캡,"68키_43,900|87키_48,500|104키_53,000","68키_43,900|87키_48,500|104키_53,000"
13493210,앱코 앱코 ASM01 스위트몬스터 스페셜에디션 무선 터치패드 키보드,"9,900","9,900"
3768039,앱코 초콜릿 KM80 무선 Combo,"골드_32,400|블랙_32,400|핑크_18,000","골드_32,400|블랙_32,400|핑크_18,000"
28417634,언커먼 MX KEYS 전용 하드 케이스,"15,900","15,900"
6121808,에이데이타코리아 DDZONE DMK-900M,"14,310","14,310"
5780163,에이데이타코리아 DDZONE MK-3000 LED 키보드 마우스 세트,0,"13,500"
15120776,에이투 AG0301 게이밍 LED TKL 기계식 키보드,"블랙_54,840|화이트_54,840","블랙_54,840|화이트_54,840"
17820701,에이투 AG0302,"적축_54,900","적축_54,900"
28494455,엘레컴 TK-TCM011,"20,750","20,750"
13274054,엠비에프 실리콘 롤 키보드,"화이트_9,350|블랙_9,890|핑크_9,350",0
28440941,엠스톤글로벌 GV10 수제윤활 라이트MA,"코랄V2축, 38g_가격비교예정|갈축, 35g_가격비교예정|갈축, 45g_가격비교예정|밀키V2축, 38g_가격비교예정|밀키V2축, 45g_가격비교예정||||||||||||||","코랄V2축, 38g_가격비교예정|갈축, 35g_가격비교예정|갈축, 45g_가격비교예정|밀키V2축, 38g_가격비교예정|밀키V2축, 45g_가격비교예정||||||||||||||"
28415708,엠스톤글로벌 GV10 수제윤활 퍼플러MA,"코랄V2축, 38g_가격비교예정|코랄V2축, 45g_가격비교예정|코랄V2축, 55g_가격비교예정|저소음 코랄축, 38g_가격비교예정|저소음 코랄축, 45g_가격비교예정||||||||||||||","코랄V2축, 38g_가격비교예정|코랄V2축, 45g_가격비교예정|코랄V2축, 55g_가격비교예정|저소음 코랄축, 38g_가격비교예정|저소음 코랄축, 45g_가격비교예정||||||||||||||"
28451300,엠스톤글로벌 GV10 표준윤활 라이트 MA,재잘축_가격비교예정,재잘축_가격비교예정
28451294,엠스톤글로벌 GV10 표준윤활 클라리온 MA,재잘축_가격비교예정,재잘축_가격비교예정
28451261,엠스톤글로벌 GV10 표준윤활 클라리온P MA,재잘축_가격비교예정,재잘축_가격비교예정
28451156,엠스톤글로벌 GV10 표준윤활 퍼플러 MA,재잘축_가격비교예정,재잘축_가격비교예정
28440851,엠스톤글로벌 GV8 수제윤활 라이트MA,"코랄V2축, 38g_가격비교예정|갈축, 35g_가격비교예정|갈축, 45g_가격비교예정|밀키V2축, 38g_가격비교예정|밀키V2축, 45g_가격비교예정||||||||||||||","코랄V2축, 38g_가격비교예정|갈축, 35g_가격비교예정|갈축, 45g_가격비교예정|밀키V2축, 38g_가격비교예정|밀키V2축, 45g_가격비교예정||||||||||||||"
28402649,엠스톤글로벌 GV8 수제윤활 퍼플러MA,"코랄V2축, 38g_가격비교예정|코랄V2축, 45g_가격비교예정|코랄V2축, 55g_가격비교예정|저소음 코랄축, 38g_가격비교예정|저소음 코랄축, 45g_가격비교예정||||||||||||||","코랄V2축, 38g_가격비교예정|코랄V2축, 45g_가격비교예정|코랄V2축, 55g_가격비교예정|저소음 코랄축, 38g_가격비교예정|저소음 코랄축, 45g_가격비교예정||||||||||||||"
28460528,엠스톤글로벌 GV8 표준윤활 라이트 MA,재잘축_가격비교예정,재잘축_가격비교예정
28460516,엠스톤글로벌 GV8 표준윤활 클라리온 MA,재잘축_가격비교예정,재잘축_가격비교예정
28460507,엠스톤글로벌 GV8 표준윤활 클라리온P MA,재잘축_가격비교예정,재잘축_가격비교예정
28460465,엠스톤글로벌 GV8 표준윤활 퍼플러 MA,재잘축_가격비교예정,재잘축_가격비교예정
19616252,엠스톤글로벌 Groove T 풀윤활 다크 MA,0,"갈축, 35g_일시품절|갈축, 45g_149,000|밀키V2축, 45g_159,000|밀키V2축, 55g_일시품절|저소음 갈축_일시품절||||||||"
18698012,엠스톤글로벌 Groove T 풀윤활 라이트MA,0,"갈축, 35g_일시품절|갈축, 45g_149,000|밀키V2축, 38g_159,000|밀키V2축, 45g_159,000|저소음 밀키축, 38g_192,400|||||"
19517783,엠스톤글로벌 Groove T 풀윤활 퍼플러 MA,0,"밀키V2축, 38g_159,000|갈축, 35g_149,000|갈축, 45g_149,000|밀키V2축, 45g_159,000|저소음 갈축_일시품절||||||"
16099280,엠스톤글로벌 Rooky 68BT RGB,"적축_126,200","적축_126,200"
11464899,웨이코스 씽크웨이 CROAD BK620 턴 블루투스 유무선 기계식 키보드,"청축_69,500|갈축_69,500|적축_69,500","청축_69,500|갈축_69,500|적축_69,500"
5867148,웨이코스 씽크웨이 CROAD C704 체리미엄 PBT LED 기계식 키보드,"적축_115,000","적축_115,000"
6398866,웨이코스 씽크웨이 CROAD K10 LED 기계식 숫자 키패드,"청축_22,000|갈축_22,000|적축_21,990","청축_22,000|갈축_22,000|적축_21,990"
10002555,웨이코스 씽크웨이 CROAD K20 매크로 숫자 키패드,"청축_27,500|갈축_27,500|적축_27,500","청축_27,500|갈축_27,500|적축_27,500"
6414424,웨이코스 씽크웨이 CROAD P206 베이직 키보드 마우스 콤보,"11,540","11,540"
6953971,웨이코스 씽크웨이 CROAD X36 키보드 손목 보호 받침대 (텐키리스용),"29,800","29,800"
9568836,웨이코스 씽크웨이 토체티 D&T 콜라보 체리 키보드,"파스텔블루, 갈축_144,000|다크그레이, 저소음 흑축_154,000|베이지, 갈축_144,000|베이지, 은축_149,000|베이지, 저소음 적축_149,000||||||||||","파스텔블루, 갈축_144,000|다크그레이, 저소음 흑축_154,000|베이지, 갈축_144,000|베이지, 은축_149,000|베이지, 저소음 적축_149,000||||||||||"
9537417,웨이코스 씽크웨이 토체프 D&T 콜라보 체리 키보드,"파스텔블루, 갈축_152,600|파스텔블루, 적축_152,600|파스텔블루, 저소음 적축_161,330|파스텔블루, 은축_159,000|파스텔블루, 저소음 흑축_164,000||||||||||","파스텔블루, 갈축_152,600|파스텔블루, 적축_152,600|파스텔블루, 저소음 적축_161,330|파스텔블루, 은축_159,000|파스텔블루, 저소음 흑축_164,000||||||||||"
15553550,이음전산 스마텍 STBK-1000 무선 블루투스 키보드,"13,330","13,330"
4736164,제닉스 STORMX K5,"청축_69,900|갈축_69,900|적축_69,900","청축_69,900|갈축_69,900|적축_69,900"
16909373,제닉스 STORMX MK-3,"청축_45,000|갈축_39,900|적축_40,750",0
16909397,제닉스 STORMX MK-3,0,"청축_44,990|갈축_39,900|적축_40,750"
3698558,제닉스 STORMX TITAN SE,"골드_27,850|그레이_27,850|블랙_27,000|블루_27,850|화이트_27,000","골드_27,850|그레이_27,850|블랙_27,000|블루_27,850|화이트_27,000"
5061650,제닉스 STORMX ZERO,"청축_54,000|적축_56,100","청축_54,000|적축_56,100"
12438863,제닉스 WC2 키보드마우스 콤보,"블랙_22,990|화이트_18,400","블랙_22,980|화이트_18,400"
17261381,제닉스 X-PAM COOL GEL 손목받침대,"22,500","22,500"
18463994,제닉스 X-PAM 손목받침대,"13,880","13,880"
5454375,제닉스 XPAM 대나무 손목 받침대,"텐키리스용_11,900|풀배열용_11,900","텐키리스용_11,900|풀배열용_11,900"
15319547,제닉스 스톰엑스 아크릴 손목받침대 텐키리스,"스노우_11,900|크리스탈_11,900|블랙_13,900","스노우_11,900|크리스탈_11,900|블랙_13,900"
15319625,제닉스 스톰엑스 아크릴 손목받침대 풀키,"스노우_11,900|크리스탈_11,900|블랙_13,890","스노우_11,900|크리스탈_11,900|블랙_13,890"
12875090,제닉스 스톰체이서LT 게이밍 기계식 키보드,"청축_42,000|갈축_42,000|적축_42,000","청축_42,000|갈축_42,000|적축_42,000"
12875306,제닉스 스톰체이서LT 텐키리스 게이밍 기계식 키보드,"청축_28,410|갈축_28,410|적축_28,410","청축_29,900|갈축_29,900|적축_29,900"
14845634,제이컴정보통신 트렌잇 JTK-188 접이식 블루투스 키보드,"22,360","25,970"
17851214,주연테크 JK01 PBT,"적축_43,000|갈축_42,420","적축_43,000|갈축_42,990"
17967110,주연테크 JWK01BT,"29,340","29,890"
28391975,지클릭커 GK-K510X Special,청축_가격비교예정|갈축_가격비교예정|적축_가격비교예정|황축_가격비교예정,청축_가격비교예정|갈축_가격비교예정|적축_가격비교예정|황축_가격비교예정
14892368,청맥전자 FOR LG LGC-K1000B,"블랙_12,800","블랙_12,800"
20119253,청연MnS naVee NV142-KB15U,0,"7,900"
3176158,코시 KB1331G,0,"9,040"
4309672,코시 KB3059BT,"블랙_16,790|화이트_16,790",0
15856820,코시 KP4030WL 제티 레트로 무선 키패드,0,"그린_14,490|핑크_14,500"
4398221,쿨러마스터 Acryl Keyboard Cover,"벌크_12,500","벌크_12,500"
14748998,쿨러마스터 CK352 기계식 키보드,"갈축_75,900|적축_75,900|청축_75,890",0
14748935,쿨러마스터 CK352 기계식 키보드,0,"갈축_75,900|적축_75,900|청축_75,890"
28059362,쿨러마스터 CK570 Street Fighter 6 Chun-Li 기계식,일시품절,일시품절
2671457,쿨러마스터 CM STORM QUICK FIRE RAPID-i,"청축_90,650","청축_90,650"
2447169,쿨러마스터 CM STORM QUICK FIRE TK STEALTH,"청축_81,980","청축_81,980"
3633518,쿨러마스터 CM STORM QUICK FIRE XTi,"청축_101,480","청축_101,480"
3447828,쿨러마스터 CM STORM QUICK FIRE XTi PC방 Version,"청축_158,000","청축_158,000"
2621935,쿨러마스터 CM STORM TRIGGER Z,"청축_184,000","청축_184,000"
6032018,쿨러마스터 MASTERKEYS MECHANICAL KEYCAP,"31,500","31,500"
4385990,쿨러마스터 MASTERKEYS PRO M White LED,"청축_71,650","청축_71,650"
4028167,쿨러마스터 MasterKeys RGB PRO L,"적축_120,450","적축_120,450"
7158781,쿨러마스터 Soft wrist rest WR530 S 손목받침대,"9,090","9,090"
14208506,쿨러마스터 Wrist Rest WR531 TKL 손목받침대,"9,290","9,290"
14208638,쿨러마스터 Wrist Rest WR531 풀사이즈 손목받침대,"12,330","12,330"
27766424,크로셀 C-Flip Pocket 무선,"그린_37,400|핑크_37,400",0
28497344,클리커스 D-501 기계식,"59,000","59,000"
5706845,펠로우즈 플러쉬터치 손목받침대,"12,280","12,190"
18501188,퓨전에프앤씨 INOTE KM730R 무선 키보드 마우스 세트,"블랙_16,800|화이트_16,800","블랙_16,800|화이트_16,800"
20128175,퓨전에프앤씨 INOTE KN09B 블루투스,"29,800","29,800"
28081673,퓨전에프앤씨 INOTE KP100RB 무선,"블랙_48,940|블루_48,880|화이트_48,880",0
15358874,퓨전에프앤씨 INOTE NK908RB 충전식 무선 키보드,"64,800","64,800"
19262954,퓨전에프앤씨 INOTE X-FOLDING RGB LED 블루투스 접이식 키보드,"화이트_54,000|핑크_54,000",0
20401124,퓨전에프앤씨 INOTE X-Folding Touch Plus 무선,"48,400","47,980"
14244341,퓨전에프앤씨 INOTE X-KEY 38BTC,"블랙_22,900|파우더 핑크_3,000|화이트_22,900","블랙_22,900|파우더 핑크_3,000|화이트_22,900"
28470476,퓨전에프앤씨 카카오프렌즈 KFK100J 죠르디 무선 키보드,"44,800","44,800"
7283581,플레오맥스 PLEOMAX AVEC-101M 무선 미니 키보드 마우스 세트,"블랙_22,080|화이트_23,400","블랙_22,080|화이트_23,940"
28059587,플레오맥스 PMBK-X10 무선,"29,900","29,900"
2444833,한성컴퓨터 ABS 이색사출 키캡,"블루_17,000","블루_17,000"
2637558,한성컴퓨터 ABS 프리미엄 이색사출 키캡,"White-Black_24,500|White-Red_24,000|White-Red 한글_24,000|보와이 (English)_24,500","White-Black_24,500|White-Red_24,000|White-Red 한글_24,000|보와이 (English)_24,500"
11626016,한성컴퓨터 BK300 멀티페어링 블루투스 키보드,"블랙_19,900|민트_22,900|실버_19,900|핑크_19,900","블랙_22,900|민트_22,900|실버_19,900|핑크_19,900"
14413640,한성컴퓨터 BK330 멀티페어링 블루투스 키보드,"블랙_24,900|그린_24,900|핑크_24,900|화이트_24,900","블랙_24,900|그린_24,900|핑크_24,900|화이트_24,900"
13076267,한성컴퓨터 BK500 듀얼 무선 멀티페어링 키보드,"민트_31,900|블랙_26,300|퍼플_31,890|핑크_26,300|화이트_31,900","민트_31,900|블랙_26,300|퍼플_31,890|핑크_26,300|화이트_31,900"
13076459,한성컴퓨터 BKM500 듀얼 무선 키보드 마우스 세트,"민트_42,480|블랙_42,480|퍼플_42,900|핑크_42,480|화이트_42,480","민트_42,480|블랙_42,480|퍼플_42,900|핑크_42,480|화이트_42,480"
16358624,한성컴퓨터 GK200 RAINBOW 게이밍 기계식 키보드,"블랙, 청축_34,900|블랙, 갈축_34,900|블랙, 적축_34,900|화이트, 갈축_34,900|화이트, 적축_34,900|","블랙, 청축_34,900|블랙, 갈축_34,900|블랙, 적축_34,900|화이트, 갈축_34,900|화이트, 적축_34,900|"
18950525,한성컴퓨터 GK300 RAINBOW,"블랙, 청축_31,900|블랙, 갈축_31,300|블랙, 적축_31,900|화이트, 갈축_31,900|화이트, 적축_31,900|","블랙, 청축_31,900|블랙, 갈축_31,300|블랙, 적축_31,900|화이트, 갈축_31,900|화이트, 적축_31,900|"
14908106,한성컴퓨터 GK687 TKL 게이트론 RGB 기계식 키보드,"블랙, 청축_49,900|블랙, 갈축_49,900|블랙, 황축_49,900|블랙, 적축_49,900|화이트, 청축_49,900|||","블랙, 청축_49,900|블랙, 갈축_49,900|블랙, 황축_49,900|블랙, 적축_49,900|화이트, 청축_49,900|||"
19844303,한성컴퓨터 GK707S OfficeMaster 저소음 기계식,"블랙, 라임축_49,900|블랙, 피치축_49,900|화이트, 라임축_49,900|화이트, 피치축_49,900","블랙, 라임축_49,900|블랙, 피치축_49,900|화이트, 라임축_49,900|화이트, 피치축_49,900"
14755910,한성컴퓨터 GK787B OfficeMaster 블루투스 키보드,블랙_일시품절,블랙_일시품절
11731784,한성컴퓨터 GK787S OfficeMaster 체리 기계식 키보드,"블랙, 저소음 적축_79,000|화이트, 저소음 적축_79,900","블랙, 저소음 적축_79,000|화이트, 저소음 적축_79,900"
9590022,한성컴퓨터 GK868B TICO,"블랙, 35g_159,000|블랙, 50g_159,000|화이트, 35g_159,000|화이트, 50g_159,000","블랙, 35g_159,000|블랙, 50g_159,000|화이트, 35g_159,000|화이트, 50g_159,000"
21526553,한성컴퓨터 GK868B 염료승화 EDITION 유무선 무접점,"SURFYY_173,890","SURFYY_173,890"
7356157,한성컴퓨터 GK888B minicoup,"블랙, 50g_159,000|화이트, 35g_159,000|화이트, 50g_159,000","블랙, 50g_159,000|화이트, 35g_159,000|화이트, 50g_159,000"
17288447,한성컴퓨터 GK893B SPORTS 영문,"블랙, 50g_159,000|화이트, 50g_159,000|투톤 화이트, 50g_158,990","블랙, 50g_159,000|화이트, 50g_159,000|투톤 화이트, 50g_158,990"
17288426,한성컴퓨터 GK893B SPORTS 한글,"블랙, 50g_159,000|블랙핑크, 35g_159,000|투톤 블랙, 50g_159,000|투톤 화이트, 35g_159,000|화이트, 50g_159,000|","블랙, 50g_159,000|블랙핑크, 35g_159,000|투톤 블랙, 50g_159,000|투톤 화이트, 35g_159,000|화이트, 50g_159,000|"
18490880,한성컴퓨터 GK893B 염료승화 EDITION 유무선 무접점,"TOY BLOCK_175,000|CAMPING_175,000|Purple Heart_175,000|SURFYY_173,880",0
18490895,한성컴퓨터 GK893B 염료승화 EDITION 유무선 무접점,0,"TOY BLOCK_175,000|CAMPING_175,000|Purple Heart_175,000|SURFYY_173,880"
19572239,한성컴퓨터 GK896B OfficeMaster 염료승화 유무선 무접점,"CAMPING_179,000|Purple Heart_179,000","CAMPING_179,000|Purple Heart_179,000"
18989738,한성컴퓨터 GK898B Office-Duo 유무선 무접점 키보드 마우스 세트 영문,"블랙_179,000|화이트_179,000","블랙_179,000|화이트_179,000"
18989549,한성컴퓨터 GK898B Office-Duo 유무선 무접점 키보드 마우스 세트 한글,"화이트_179,000|블랙_179,000","화이트_179,000|블랙_179,000"
17071676,한성컴퓨터 GK898B OfficeMaster Gray Edition,"192,280","192,280"
8489031,한성컴퓨터 GK898B OfficeMaster 영문,"블랙, 50g_159,000|화이트, 50g_169,000","블랙, 50g_159,000|화이트, 50g_169,000"
8488995,한성컴퓨터 GK898B OfficeMaster 한글,"블랙, 50g_159,000|블랙핑크, 35g_169,000|화이트, 35g_169,000|화이트, 50g_169,000","블랙, 50g_159,000|블랙핑크, 35g_169,000|화이트, 35g_169,000|화이트, 50g_169,000"
17685977,한성컴퓨터 GK898B 염료승화 EDITION 무접점 키보드,"TOY BLOCK_185,000|CAMPING_185,000|Purple Heart_185,000|SURFYY_184,990","TOY BLOCK_185,000|CAMPING_184,990|Purple Heart_185,000|SURFYY_184,990"
28160375,한성컴퓨터 GK908B Deskterior 유무선 기계식,0,"화이트_129,000"
11046786,한성컴퓨터 GK993B SKY 블루투스 기계식 키보드 영문,"화이트, 갈축_89,000|블랙, 갈축_89,000|화이트, 적축_89,000","화이트, 갈축_89,000|블랙, 갈축_89,000|화이트, 적축_89,000"
11046696,한성컴퓨터 GK993B SKY 블루투스 기계식 키보드 한글,"블랙, 갈축_109,000|블랙, 적축_109,000|화이트, 갈축_107,920|화이트, 적축_119,000","블랙, 갈축_109,000|블랙, 적축_109,000|화이트, 갈축_107,920|화이트, 적축_119,000"
12246440,한성컴퓨터 GK998B SKY 블루투스 기계식 키보드 영문,"화이트, 갈축_일시품절","화이트, 갈축_일시품절"
12246560,한성컴퓨터 GK998B SKY 블루투스 기계식 키보드 한글,"화이트, 갈축_231,500","화이트, 갈축_231,500"
3000884,한성컴퓨터 GTune CHL5 RGB,"55g_169,860","55g_169,860"
8112178,한성컴퓨터 GTune GK600 게이밍 기계식,"그레이, 청축_39,900|그레이, 적축_39,900|그레이, 갈축_39,900|실버, 청축_39,900|실버, 적축_39,900|","그레이, 청축_39,900|그레이, 적축_39,900|그레이, 갈축_39,900|실버, 청축_39,900|실버, 적축_39,900|"
6523571,한성컴퓨터 GTune GK638 Optik RGB 축교환 광축 게이밍,"블랙, 클릭_30,780|블랙, 리니어_37,210|화이트, 클릭_32,980","블랙, 클릭_30,780|블랙, 리니어_37,210|화이트, 클릭_32,980"
