16841903,VARMILO VA108M V2 SEA MELODY PBT 염료승화 한글,"저소음 적축_209,000","저소음 적축_209,000"
16894562,VARMILO VA108M V2 SUMMIT R2 PBT 염료승화 영문,"적축_299,000","적축_299,000"
28183976,VARMILO VA108M V2 SUMMIT 기계식,"갈축_가격비교예정|저소음 적축_403,500|적축_가격비교예정","갈축_가격비교예정|저소음 적축_403,500|적축_가격비교예정"
16894238,VARMILO VA108M V2 다크 그레이 PBT 염료승화 한글,"갈축_205,560|적축_198,990|저소음 적축_179,000","갈축_205,560|적축_198,990|저소음 적축_179,000"
16893995,VARMILO VA108M V2 다크믹스 PBT 염료승화 한글,저소음 적축_일시품절,저소음 적축_일시품절
16855478,VARMILO VA108M V2 매화 컬렉션 PBT 염료승화 한글,"저소음 적축_219,000","저소음 적축_219,000"
16874480,VARMILO VA108Mac V2 밀키 화이트 PBT 염료승화 영문,"갈축_179,000|적축_179,000|저소음 적축_189,000","갈축_179,000|적축_179,000|저소음 적축_189,000"
13882346,VARMILO VA87M Beijing Opera 염료승화 영문,"적축_198,000","적축_198,000"
9639465,VARMILO VA87M KOI PBT 염료승화 영문,"갈축_188,990|적축_188,990","갈축_188,990|적축_188,990"
15835511,VARMILO VA87M Lovebirds I PBT 염료승화 영문,"저소음 적축_219,000","저소음 적축_219,000"
15835523,VARMILO VA87M Lovebirds YOU PBT 염료승화 영문,"저소음 적축_218,990","저소음 적축_218,990"
12137534,VARMILO VA87M MONOGRAY PBT 염료승화 한글,"갈축_161,250|적축_167,990","갈축_161,250|적축_167,990"
14963873,VARMILO VA87M MOONLIGHT PBT 염료승화 영문,"갈축_177,990","갈축_177,990"
14039351,VARMILO VA87M SUMMIT R2 PBT 염료승화 영문,"갈축_198,000|적축_198,000","갈축_198,000|적축_198,000"
17572676,VARMILO VA87M V2 Dreams on Board PBT 염료승화 한글,"갈축_189,000|적축_일시품절|저소음 적축_198,000","갈축_189,000|적축_일시품절|저소음 적축_198,000"
20260532,VARMILO VA87M V2 MOONLIGHT 한글,"갈축_179,000|저소음 적축_189,000|적축_179,000","갈축_179,000|저소음 적축_189,000|적축_179,000"
17632271,VARMILO VA87M V2 PANDA R2 PBT 염료승화 영문,"갈축_일시품절|저소음 적축_198,000|적축_189,000","갈축_일시품절|저소음 적축_198,000|적축_189,000"
16841807,VARMILO VA87M V2 SEA MELODY PBT 염료승화 한글,"저소음 적축_249,300","저소음 적축_249,300"
16894469,VARMILO VA87M V2 SUMMIT R2 PBT 염료승화 영문,"적축_209,000","적축_209,000"
16894109,VARMILO VA87M V2 다크 그레이 PBT 염료승화 한글,"갈축_229,900|적축_249,800","갈축_229,900|적축_249,800"
16893761,VARMILO VA87M V2 다크믹스 PBT 염료승화 한글,갈축_일시품절,갈축_일시품절
16855292,VARMILO VA87M V2 매화 컬렉션 PBT 염료승화 한글,"갈축_198,000|적축_198,000|저소음 적축_198,000","갈축_198,000|적축_198,000|저소음 적축_198,000"
18384794,VARMILO VA87M V2 매화 컬렉션 R2 PBT 염료승화 한글,"갈축_198,000|저소음 적축_209,000|적축_198,000","갈축_198,000|저소음 적축_209,000|적축_198,000"
7001119,VARMILO VA87M 다크그레이 RE PBT 염료승화 한글,"갈축_137,990|적축_189,000","갈축_137,990|적축_189,000"
11823049,VARMILO VA87M 다크믹스 RE PBT 염료승화 한글,"저소음 적축_486,000","저소음 적축_486,000"
11500461,VARMILO VA87M 매화 컬렉션 PBT 염료승화 한글,"갈축_157,990|저소음 적축_275,270","갈축_157,990|저소음 적축_275,270"
16873304,VARMILO VA87Mac V2 밀키 화이트 PBT 염료승화 영문,"갈축_169,000|적축_169,000","갈축_169,000|적축_169,000"
14012858,VARMILO X ZOMO 고양이 발바닥 ABS 키캡,"젖소냥_22,000|고등어냥_18,890|샴냥_18,900|치즈냥_22,000","젖소냥_22,000|고등어냥_18,890|샴냥_18,900|치즈냥_22,000"
13956101,WEZEL WZ-K2100,0,"3,500"
15791006,WEZEL WZ-MK3500,"5,290","5,290"
20607614,Wooting 60HE,"해외구매_287,000","해외구매_287,000"
27696722,XINMENG M71 유무선 기계식,"해외구매_43,500","해외구매_43,500"
13128875,archon K77 한글 블루투스 5.0 기계식 키보드,0,"화이트, 적축_98,450|블랙, 갈축_99,000|블랙, 적축_99,000|화이트, 갈축_99,000"
20128619,darkFlash GD100 유무선 기계식 밀크 브라운,"황축_37,800","황축_37,800"
28449845,darkFlash GD100 유무선 기계식 별빛 파랑,"황축_37,500","황축_37,500"
20128646,darkFlash GD100 유무선 기계식 흑설탕,"황축_37,800","황축_37,800"
21470327,darkFlash GD108 유무선 기계식 밀크 브라운,"황축_57,800","황축_57,800"
21470333,darkFlash GD108 유무선 기계식 별빛 파랑,"황축_57,800","황축_57,800"
21470318,darkFlash GD108 유무선 기계식 흑설탕,"황축_57,800","황축_57,800"
1394973,i-rocks IRK01W X-Slim,"블랙_28,500|실버_29,280|화이트_28,500|핑크_29,500","블랙_28,500|실버_29,280|화이트_28,500|핑크_29,500"
6465371,i-rocks IRK07RP 무선 저소음 키보드 마우스 세트,"블랙_44,000|화이트_44,000","블랙_44,000|화이트_41,420"
14862851,i-rocks IRK07W,"블랙_22,890|화이트_22,900","블랙_22,890|화이트_22,900"
5083253,i-rocks IRK25RP 2017,"블랙_48,990|화이트_49,000","블랙_48,990|화이트_49,000"
134184,i-rocks KR-6170 X-Slim,"블랙_32,500|화이트_32,500","블랙_32,500|화이트_32,500"
17371535,iKBC W210 무선 기계식 키보드 화이트,"청축_109,470|갈축_109,470|적축_116,490|저소음 적축_109,470","청축_116,480|갈축_110,080|적축_116,490|저소음 적축_110,090"
6397616,갤럭시 XANOVA MAGNETAR RGB 기계식 키보드,"갈축_111,000","갈축_111,000"
11306637,갤럭시 XANOVA PULSAR 기계식 키보드,"적축_96,050|청축_86,810","적축_96,050|청축_86,720"
6423252,갤럭시 XANOVA 한영 ABS 104 키캡,"7,900","7,900"
16297799,갤럭시 갤라즈 GALAX EX-03 게이밍 기계식 키보드,"34,900","34,900"
17345051,글로리어스 AURA KEYCAPS V2,"블랙_40,900|핑크_40,900|화이트_40,900","블랙_40,900|핑크_40,900|화이트_40,900"
18438824,글로리어스 FOX 사전 윤활 스위치 세트,"89,000","89,000"
19184264,글로리어스 GMMK NUMPAD 골드 뱃지,"17,900","17,900"
19184417,글로리어스 GMMK NUMPAD 상판 프레임,"E-WHITE_80,000|NAVY BLUE_70,000","E-WHITE_80,000|NAVY BLUE_70,000"
19184477,글로리어스 GMMK NUMPAD 스위치 보강판,"폴리카보네이트_20,000|황동_50,000","폴리카보네이트_20,000|황동_50,000"
19184561,글로리어스 GMMK NUMPAD 슬라이더,"BLACK SLATE_17,900|E-WHITE_17,900|NAVY BLUE_17,890|PRISM PINK_17,890","BLACK SLATE_17,900|E-WHITE_17,900|NAVY BLUE_17,890|PRISM PINK_17,890"
18436559,글로리어스 GMMK NUMPAD 유무선,"화이트_184,000|블랙_184,000","화이트_184,000|블랙_184,000"
17532062,글로리어스 GMMK PRO PreBuilt,"489,000","489,000"
17840324,글로리어스 GMMK PRO 베어본 커스텀 키보드,"블랙_189,000|화이트_189,000","블랙_189,000|화이트_189,000"
17847629,글로리어스 GMMK PRO 볼륨 노브,"AQUA BLUE_14,900|E-WHITE_14,900|FOREST GREEN_14,900|GOLDEN YELLOW_14,900|NAVY BLUE_14,900|","AQUA BLUE_14,900|E-WHITE_14,900|FOREST GREEN_14,900|GOLDEN YELLOW_14,900|NAVY BLUE_14,900|"
17820788,글로리어스 GMMK PRO 상판,"WHITE_64,000|AQUA BLUE_64,000|FOREST GREEN_64,000|GOLDEN YELLOW_64,000|NAVY BLUE_64,000|","WHITE_64,000|AQUA BLUE_64,000|FOREST GREEN_64,000|GOLDEN YELLOW_64,000|NAVY BLUE_64,000|"
17847749,글로리어스 GMMK PRO 스위치 보강판,"황동_52,620|폴리카보네이트_21,040","황동_52,620|폴리카보네이트_21,040"
17181056,글로리어스 GMMK2 65% Prebuilt 기계식 키보드,"블랙_169,000|화이트_169,000|핑크_169,000","블랙_169,000|화이트_169,000|핑크_169,000"
17180156,글로리어스 GMMK2 65% 베어본 커스텀 키보드,"블랙_114,000|화이트_114,000|핑크_114,000","블랙_114,000|화이트_114,000|핑크_114,000"
17181212,글로리어스 GMMK2 96% Prebuilt 기계식 키보드,"블랙_169,000|핑크_169,000|화이트_169,000","블랙_169,000|핑크_169,000|화이트_169,000"
17180462,글로리어스 GMMK2 96% 베어본 커스텀 키보드,"블랙_113,990|화이트_114,000|핑크_114,000","블랙_113,990|화이트_114,000|핑크_114,000"
17840849,글로리어스 GPBT CELESTIAL 키캡 세트,"ICE_109,000|Fire_109,000",0
17805494,글로리어스 GPBT CELESTIAL 키캡 세트,0,"ICE_109,000|Fire_109,000"
17532311,글로리어스 GPBT 키캡 세트,"NEBULA_52,900|OCEAN BLUE_52,900|OLIVE_52,900|PASTEL_52,900|RAIN FOREST_52,900|","NEBULA_52,900|OCEAN BLUE_52,900|OLIVE_52,900|PASTEL_52,900|RAIN FOREST_52,900|"
15400751,글로리어스 KEYBOARD CARRYING CASE,"34,900","34,900"
15169571,글로리어스 LYNX 스위치,"36개_27,900","36개_27,900"
15173192,글로리어스 LYNX 스위치 사전윤활,"36개_39,900","36개_39,900"
15067220,글로리어스 PANDA 스위치,"36개_27,900","36개_27,900"
17535434,글로리어스 PANDA 스위치 사전 윤활,"36개_39,900","36개_39,900"
27863762,글로리어스 POLYCHROMA RGB 키캡 세트,"59,900","59,900"
27689453,글로리어스 RAPTOR 스위치 사전 윤활 36pcs,"52,900","52,900"
17848106,글로리어스 스위치 윤활 키트,"109,000","109,000"
18439139,글로리어스 키보드 매트,"19,900","19,900"
17820932,글로리어스 키보드 클리닝 키트,"15,900","15,900"
17848028,글로리어스 키캡 리무버,"16,900","16,900"
20573486,내셔널지오그래픽 NGM-BWK 무선 블루투스,"블랙_49,000|화이트_49,000","블랙_49,000|화이트_49,000"
20565224,내셔널지오그래픽 NGM-BWKM 무선 키보드 마우스 세트,"블랙_69,000|화이트_69,000","블랙_69,000|화이트_69,000"
19724627,다얼유 A104 PRO 유무선 기계식,"아이스블루_148,990|레트로베이지_148,990|스모키블루_159,000|알루비얼골드_148,990","아이스블루_148,990|레트로베이지_148,990|스모키블루_159,000|알루비얼골드_148,990"
17532131,다얼유 A87 Pro 무선 가스켓,"레트로베이지_128,990|스모키블루_129,000|아이스블루_128,990|챠콜_129,000","레트로베이지_128,990|스모키블루_129,000|아이스블루_128,990|챠콜_129,000"
6713845,다얼유 DK750 광축 완전방수 축교환 게이밍 키보드 한글이중사출,"블랙_29,800|레드_29,800","블랙_29,800|레드_29,800"
12763124,다얼유 LK200 블루투스 키보드,"블랙_19,900|화이트_29,500","블랙_19,900|화이트_29,500"
3812779,대양케이스 LimitDK 3Color 플런져 게이밍 키보드,"20,380","20,380"
18020273,데이비드테크 엔보우 N패드 맥스,"화이트_39,900|블랙_39,900","화이트_39,900|블랙_39,900"
18580175,라이트컴 COMS BD211 무선 리모컨 키보드,0,"31,450"
5135289,라이트컴 COMS BW300 접이식 블루투스 키보드,0,"51,210"
18580109,라이트컴 COMS SK351 무선 키보드 마우스 세트,"29,000","29,000"
5605354,라이트컴 COMS 일본어 키보드 스티커,"IB711_1,190",0
17466854,레오폴드 FC750RBT PD 다크블루 한글,"청축_195,990|갈축_195,990|적축_196,000|저소음 적축_174,230","청축_195,990|갈축_195,990|적축_196,000|저소음 적축_174,230"
15889982,레오폴드 FC750RBT PD 블랙 한글,"청축_196,000|갈축_216,000|적축_195,990|저소음 적축_219,500","청축_196,000|갈축_216,000|적축_195,990|저소음 적축_219,500"
16573469,레오폴드 FC750RBT PD 스웨디시 화이트 한글,"청축_196,000|갈축_174,320|적축_174,990|저소음 적축_176,550","청축_196,000|갈축_174,240|적축_174,990|저소음 적축_176,460"
17565737,레오폴드 FC750RBT PD 코랄블루 한글,"청축_174,990|갈축_174,990|적축_174,990|저소음 적축_172,550",0
16093631,레오폴드 FC750RBT PD 화이트 투톤 한글,"청축_176,850|갈축_174,340|적축_174,700|저소음 적축_172,290","청축_176,760|갈축_174,250|적축_174,700|저소음 적축_172,200"
5497449,레오폴드 FC900R PD 이색사출 그레이 블루 한글,"청축_159,130|갈축_167,500|적축_152,000|저소음 적축_151,430","청축_159,130|갈축_167,500|적축_152,000|저소음 적축_149,200"
15448637,레오폴드 FC900RBT PD 그라파이트 화이트 한글,"청축_177,590|갈축_181,570|적축_177,190|저소음 적축_179,210","청축_177,500|갈축_181,490|적축_174,740|저소음 적축_179,120"
15414833,레오폴드 FC900RBT PD 그레이 블루 한글,"청축_176,910|갈축_177,870|적축_177,890|저소음 적축_173,720","청축_176,830|갈축_174,740|적축_177,800|저소음 적축_177,470"
16167866,레오폴드 FC900RBT PD 화이트 투톤 한글,"청축_174,740|갈축_182,990|적축_177,660|저소음 적축_180,200",0
17079680,레오폴드 FC900RBT PD 화이트민트 한글,"청축_171,570|갈축_177,660|적축_177,220|저소음적축_179,540","청축_171,570|갈축_177,570|적축_177,130|저소음적축_179,450"
13479911,로지텍 ERGO K860 (정품),0,"189,000"
17095721,로지텍 G PRO GX Blue (정품),"156,680","156,680"
28365206,로지텍 G PRO X TKL (정품),"279,000","279,000"
16396631,로지텍 G413 SE (정품),"82,000","82,000"
16396439,로지텍 G413 TKL SE (정품),"70,610","70,230"
15861926,로지텍 G512 GX Red 기계식 게이밍 키보드,0,"적축_130,390"
5541989,로지텍 G613 LIGHTSPEED,"병행수입_139,000|해외구매_86,480","병행수입_139,000|해외구매_86,480"
17640476,로지텍 G715 TKL 무선 오로라 컬렉션 (정품),"택타일_228,930|리니어_235,200","택타일_228,910|리니어_235,200"
9343947,로지텍 G913 (정품),"클릭_302,870|넌클릭_302,340|리니어_302,870","클릭_302,870|넌클릭_302,340|리니어_302,870"
11816080,로지텍 G913 TKL (정품),"블랙, 택타일_267,600|블랙, 리니어_242,870|블랙, 클릭키_242,870|화이트, 택타일_240,000","블랙, 택타일_267,600|블랙, 리니어_242,870|블랙, 클릭키_242,870|화이트, 택타일_240,000"
21201353,로지텍 K120 New,"병행수입_8,940|비공식유통_10,740|해외구매_45,200","병행수입_8,940|비공식유통_10,740|해외구매_45,200"
1581153,로지텍 K120 New (정품),"9,550","9,550"
5942386,로지텍 K120 New + M100R 블랙 (정품),"19,000","19,000"
1992976,로지텍 K120 New + M90 (정품),"14,470","14,470"
6396595,로지텍 K240 NANO 카카오 에디션 (정품),"19,900","19,900"
1433300,로지텍 K270 (정품),"28,470","28,540"
11381697,로지텍 K270 + M187 블루 (정품),"42,000",0
4719145,로지텍 K375s (정품),"29,440","29,440"
5418467,로지텍 K380,"병행수입_22,280|해외구매_22,280|비공식유통_35,620","병행수입_22,280|해외구매_22,280|비공식유통_35,530"
14133644,로지텍 K380 + M350 PEBBLE,"해외구매_46,410|정품_57,800","해외구매_46,410|정품_57,800"
13805981,로지텍 K380 키스킨미포함 (정품),"그레이_36,040|화이트_36,040|샌드_36,190|라벤더_36,190|블루_39,890|","그레이_36,010|화이트_36,010|샌드_36,500|라벤더_36,500|블루_39,900|"
5347701,로지텍 K380 키스킨포함 (정품),"그레이_38,850|핑크_38,850|화이트_38,850","그레이_38,760|핑크_38,770|화이트_38,760"
3428178,로지텍 K400 PLUS (정품),"49,890","49,890"
2800393,로지텍 K480 (정품),"블랙_41,270|화이트_44,800","블랙_45,990|화이트_44,800"
9246237,로지텍 K580 (정품),"63,100","63,100"
13350962,로지텍 KEYS-TO-GO (정품),"블랙_68,730|핑크_68,720","블랙_68,730|핑크_68,720"
1677001,로지텍 MK200 NEW (정품),"19,290","18,710"
5319001,로지텍 MK235,"해외구매_22,910|병행수입_19,990|비공식유통_23,350","해외구매_22,910|병행수입_19,990|비공식유통_23,350"
3798967,로지텍 MK235 (정품),"키스킨 미포함_23,130|키스킨 포함_25,890","키스킨 미포함_23,200|키스킨 포함_25,890"
4363933,로지텍 MK240 NANO (정품),"블랙_29,460|화이트_29,900","블랙_28,500|화이트_29,900"
2541329,로지텍 MK270r (정품),"키스킨 미포함_31,800|키스킨 포함_38,000","키스킨 미포함_31,800|키스킨 포함_38,000"
4340134,로지텍 MK275 (정품),"29,240","29,240"
12552761,로지텍 MK295 SILENT (정품),"블랙_33,900|화이트_33,900","블랙_33,900|화이트_33,900"
2904153,로지텍 MK345 (정품),"37,300","37,110"
8416011,로지텍 MK470 Slim (정품),"블랙_53,500|핑크_53,500|화이트_53,500","블랙_53,500|핑크_53,500|화이트_53,500"
5972582,로지텍 MK545 (정품),"68,260","68,170"
5967481,로지텍 MK850,"병행수입_56,880|비공식유통_115,730|해외구매_63,890","병행수입_57,180|비공식유통_115,730|해외구매_63,890"
5147612,로지텍 MK850 (정품),"123,490","123,490"
9904098,로지텍 MX KEYS,"해외구매_82,650|병행수입_109,990|비공식유통_174,990","해외구매_82,650|병행수입_106,540|비공식유통_174,990"
9523836,로지텍 MX KEYS (정품),"157,920","157,920"
12006083,로지텍 MX KEYS for Mac (정품),"141,550","146,110"
20769566,로지텍 MX KEYS light pack (정품),"119,000","119,000"
20437697,로지텍 MX Keys S (정품),"147,630","147,630"
20437769,로지텍 MX Keys S COMBO,"295,840","295,840"
17171387,로지텍 MX Mechanical (정품),"갈축_228,980","갈축_215,380"
17170784,로지텍 MX Mechanical Mini (정품),"갈축_199,000","갈축_199,000"
15611276,로지텍 mx keys mini,"해외 구매_87,980|병행 수입_84,620|비공식유통_142,740","해외 구매_87,980|병행 수입_84,620|비공식유통_138,510"
16151342,로지텍 mx keys mini (정품),"그래파이트_129,600|로즈핑크_129,600|페일그레이_142,390","그래파이트_129,600|로즈핑크_129,600|페일그레이_142,390"
17745347,로지텍 시그니처 K650 (정품),"그라파이트_59,590|오프화이트_59,590","그라파이트_59,590|오프화이트_59,590"
20691041,로지텍 시그니처 K855 무선 키보드,"해외구매_67,790|병행수입_98,000|비공식유통_93,810",0
17431472,로지텍 시그니처 K855 무선 키보드,0,"해외구매_67,790|병행수입_98,000|비공식유통_93,810"
17310608,로지텍 시그니처 K855 무선 키보드 (정품),"적축_96,990","적축_96,990"
17763857,로지텍 시그니처 MK650 (정품),"그래파이트_79,900|오프화이트_79,900","그래파이트_79,900|오프화이트_79,900"
11748392,마이크로닉스 CPK-1 큰글씨 한글키보드,"18,300","18,300"
6567821,마이크로닉스 GANSS ALT-71 CNC 풀알루미늄 분리형 키보드,"저소음 적축_279,000","저소음 적축_279,000"
15386765,마이크로닉스 MANIC EX580 광축 크리스탈 게이밍 키보드,"파스텔핑크, 화이트_일시품절",0
17188943,마이크로닉스 MANIC EX580L 게이밍 기계식 키보드,"블랙, 청축_30,370|블랙, 갈축_32,700|블랙, 적축_32,890|화이트, 청축_31,230|화이트, 갈축_32,890|","블랙, 청축_31,640|블랙, 갈축_32,700|블랙, 적축_32,890|화이트, 청축_32,620|화이트, 갈축_32,890|"
12866255,마이크로닉스 MANIC EX89 텐키리스PRO 게이밍기계식 RGB,"청축_43,390|갈축_46,600|적축_49,800","청축_43,390|갈축_46,600|적축_49,800"
14107556,마이크로닉스 MANIC GK170 키보드 마우스 세트,"17,000","17,000"
13101569,마이크로닉스 MANIC GS260 LED 게이밍 키보드 마우스 세트,"26,640","26,640"
13611080,마이크로닉스 MANIC K1400 유선 키보드,"9,620","9,790"
6150422,마이크로닉스 MANIC K160 키보드 마우스 무선 합본,"스카이 블루_16,500|블랙_16,450|인디 핑크_13,200","스카이 블루_16,500|블랙_16,450|인디 핑크_13,200"
16493366,마이크로닉스 MANIC K350 맥호환 알루미늄 저소음 펜타그래프 키보드,"블랙 그레이_35,900|화이트 실버_35,890","블랙 그레이_35,900|화이트 실버_35,890"
6308820,마이크로닉스 MANIC K61 RGB 미니 블루투스 카일박스축,"블랙, 적축_69,800|블랙, 백축_69,700|화이트, 적축_69,800|화이트, 백축_86,000","블랙, 적축_69,800|블랙, 백축_69,700|화이트, 적축_69,800|화이트, 백축_86,000"
6244499,마이크로닉스 MANIC K940 RGB 초슬림 기계식 카일 초콜릿축,"백축_90,090|적축_91,990","백축_90,000|적축_91,990"
6948109,마이크로닉스 MANIC KM110 유선 키보드 마우스 합본,"20,100","20,100"
13483409,마이크로닉스 MANIC KM150 유선 키보드 마우스 합본,"14,840","14,840"
7955509,마이크로닉스 MANIC KM220 유선 게이밍 키보드 마우스 합본,"50,860","50,860"
9615873,마이크로닉스 MANIC KM220PLUS 유선 게이밍 키보드 마우스 합본,"30,500","30,500"
9585567,마이크로닉스 MANIC KM330 무선 슬림 키보드 마우스 합본,"블랙_19,900|민트_19,000|코발트블루_20,260|핑크_19,000","블랙_19,900|민트_19,000|코발트블루_20,260|핑크_19,000"
12125087,마이크로닉스 MANIC KM530 무선 슬림 무소음 키보드 마우스 합본,"블랙_19,800|핑크_16,700|화이트_19,800","블랙_19,800|핑크_16,700|화이트_19,800"
17338148,마이크로닉스 MANIC KM630W 무선 키보드 마우스 세트,"블랙_24,370|화이트_24,570","블랙_24,370|화이트_24,570"
15452261,마이크로닉스 MANIC PAMPAM 우드 팜레스트,"104키_25,930|89키_19,240","104키_25,930|89키_19,240"
9473790,마이크로닉스 MANIC PAMPAM 팜레스트 키보드 손목받침대,"8,820","8,820"
13761752,마이크로닉스 MANIC X100 마닉축 기계식 게이밍 키보드,"청축_40,300|갈축_43,500|적축_일시품절","청축_40,300|갈축_43,500|적축_일시품절"
13263071,마이크로닉스 MANIC X240 LED 게이밍 기계식 키보드,"청축_28,900|갈축_28,900|적축_28,900","청축_28,900|갈축_28,900|적축_28,900"
12085406,마이크로닉스 MANIC X280 마닉축 엣지 LED 기계식 키보드,"청축_37,000|적축_34,040","청축_37,000|적축_34,040"
9267441,마이크로닉스 MANIC X30 마닉축 기계식 키보드,"청축_55,300|갈축_50,390|적축_63,280","청축_55,300|갈축_50,390|적축_62,620"
12085250,마이크로닉스 MANIC X300 마닉축 엣지 RGB 기계식 키보드,"청축_42,800|적축_42,900","청축_42,800|적축_42,900"
9893076,마이크로닉스 MANIC X38 4세대 광축 IPX8 완전방수 게이밍,"41,900","41,900"
7705261,마이크로닉스 MANIC X40 4세대 광축 완전방수 게이밍,"블랙_85,260|화이트_72,760","블랙_85,260|화이트_72,760"
18515912,마이크로닉스 MANIC X40P 4세대 광축 완전방수 PBT,"블랙_57,450","블랙_57,380"
9602910,마이크로닉스 MANIC X48 4세대 광축 완전방수 게이밍 크리스탈키캡,"민트 민트_46,700|민트 화이트_53,900|레드 핑크_46,700|레드 화이트_46,700|블랙 화이트_53,900|","민트 민트_46,700|민트 화이트_53,900|레드 핑크_46,700|레드 화이트_46,700|블랙 화이트_53,900|"
9892773,마이크로닉스 MANIC X50 4세대 광축 완전방수 PBT 게이밍 키보드,"블랙 레드_55,590|네이비 그레이_63,900|네이비 스카이블루_63,900|화이트 화이트_55,600","블랙 레드_55,590|네이비 그레이_63,900|네이비 스카이블루_63,900|화이트 화이트_55,600"
15394172,마이크로닉스 MANIC ZK7 엣지 레인보우 LED 축교환 기계식 키보드,"청축_59,000|갈축_71,370|적축_일시품절","청축_59,000|갈축_66,520|적축_일시품절"
15398030,마이크로닉스 MANIC ZK9 엣지 RGB 축교환 기계식 키보드,청축_일시품절|갈축_일시품절|적축_일시품절,청축_일시품절|갈축_일시품절|적축_일시품절
14761970,마이크로닉스 MECHA ZK-1 RGB 게이밍 기계식 키보드,"갈축_94,990|적축_72,360|백축_100,170","갈축_94,990|적축_72,360|백축_100,170"
14858900,마이크로닉스 MORPH MK-1 마닉축 RGB 게이밍 기계식 키보드,"청축_59,900|갈축_59,900|적축_59,900","청축_59,900|갈축_59,900|적축_59,900"
14761205,마이크로닉스 WARP WK-1 마닉축 RGB 게이밍 기계식 키보드 블랙,"청축_65,390|갈축_65,300|적축_65,400","청축_65,390|갈축_65,300|적축_65,400"
14761394,마이크로닉스 WARP WK-1 마닉축 RGB 게이밍 기계식 키보드 화이트,"청축_65,400|갈축_65,300|적축_65,300","청축_65,400|갈축_65,300|적축_65,300"
18460013,마이크로닉스 WIZMAX W101P 4세대 광축 완전방수 PBT,"스카이 블루_62,150|애쉬 핑크_60,000|피코크 그린_67,000","스카이 블루_62,060|애쉬 핑크_59,960|피코크 그린_67,000"
17580434,마이크로닉스 ZOMO 크리스탈 냥냥젤리 포인트 키캡,"19,500","19,500"
17307470,마이크로닉스 iWORKS 민트 에디션 기계식 키보드 마우스 키캡 세트,"적축_52,420","적축_52,420"
16301705,마이크로닉스 iWORKS 퍼플 에디션 기계식 키보드 마우스 키캡 세트,"적축_55,200","적축_55,200"
17958569,마이크로닉스 메카 ZK1 마닉축 RGB 기계식 키보드,"갈축_89,350","갈축_89,350"
16362128,마이크로닉스 메카 ZK2 마닉축 RGB 게이밍 기계식 키보드,"청축_83,790|갈축_79,480|적축_83,790",0
16361963,마이크로닉스 메카 ZK2 마닉축 RGB 게이밍 기계식 키보드,0,"청축_83,790|갈축_79,480|적축_83,790"
16331504,마이크로닉스 워프 WK2 마닉축 RGB 게이밍 기계식 키보드,"청축_79,800|갈축_79,800|적축_79,800","청축_79,800|갈축_79,800|적축_79,800"
16332077,마이크로닉스 워프 WK3 마닉축 블루투스 RGB 텐키리스 게이밍 기계식 키보드,"청축_93,670|갈축_93,670|적축_93,900","청축_93,670|갈축_93,670|적축_93,900"
16335209,마이크로닉스 워프 WK4 마닉축 RGB 텐키리스 게이밍 기계식 키보드,"청축_75,450|갈축_75,470|적축_75,450","청축_75,360|갈축_75,450|적축_75,360"
16523606,마이크로닉스 클라로 이중사출 크리스탈 클리어 104 키캡,"스카이블루_17,000|핑크_일시품절","스카이블루_17,000|핑크_일시품절"
28497581,모나코올리브 바니융 손목보호 패드,"14,900","14,900"
12332198,몬스타 MK16BT 체리 블루투스 5.0 기계식 키보드,"갈축_88,000|적축_76,440","갈축_88,000|적축_76,440"
13385852,몬스타 MK87 블랙 게이밍 기계식 키보드,"갈축_39,900|적축_39,900","갈축_39,900|적축_39,900"
