15023699,Keychron K6 OEM PBT 레트로 키캡 한글,"43,000"
11515166,Keychron K6 RGB 옵티컬,"청축_129,000|갈축_129,000|적축_139,000"
11516732,Keychron K6 알루미늄 RGB 핫스왑,"청축_131,250|갈축_131,250|적축_141,250"
3755095,LG전자 MKS-1000Plus 세트,"12,780"
4347157,LKG For LG K-3000,"10,360"
4623638,LKG For LG MKS-V100 SET,"12,900"
9957126,LKG For LG 무선 2.4GHz LGA-ST500 SET,"29,900"
10238394,LKG For LG 유선 키보드 LGA-K3200,"8,390"
6272970,MAXTILL TRON G610K V2 RGB 축교환 방진축,"청축_44,800|갈축_44,800|적축_43,650|흑축_44,800"
6325707,MAXTILL TRON G610K V2 축교환 방진축,"청축_39,900|갈축_38,880|적축_38,960|흑축_38,920"
5752754,MAXTILL 키보드 거치대,"2,900"
13846658,MSI GK20,"13,080"
9781407,MSI GK30,"24,000"
11140494,MSI GK30 COMBO,"33,980"
6640600,MSI GK40,"정품_97,800|해외구매_97,900"
6640690,MSI GK40 COMBO,"해외구매_106,130"
12073616,MSI GK50 ELITE,"102,460"
11887852,MSI GK50 LOW PROFILE,"43,600"
6569807,MSI GK80,"은축_97,950"
12073796,MSI WR01,"21,190"
11757986,Microsoft Bluetooth Desktop,"정품_68,900"
10503801,Microsoft Bluetooth Keyboard,"정품_66,000|해외구매_92,250"
13269491,Microsoft Designer Compact Keyboard,"매트 블랙_89,900|라이트 그레이_84,900"
2310940,Microsoft Sculpt Ergonomic Desktop,"정품_119,000|해외구매_137,400"
3657745,Microsoft Wireless Desktop 900,"정품_39,900|병행수입_일시품절|해외구매_79,980"
3388414,Microsoft 디자이너 블루투스 데스크탑,"정품_94,900"
13269398,Microsoft 무선 넘버패드 블루투스,"매트 블랙_37,900|라이트 그레이_37,900"
1445979,Microsoft 무선 데스크탑 2000,"정품_39,900"
3599997,Microsoft 무선 데스크탑 3050,"정품_42,000"
3623410,Microsoft 무선 데스크탑 5050,"정품_55,900"
3655377,Microsoft 무선 데스크탑 850,"정품_26,980"
3791113,Microsoft 무선 키보드 850,"정품_19,960"
2669904,Microsoft 올인원 Media 키보드,"정품_36,990|해외구매_38,620"
897387,Microsoft 유선 데스크탑 600,"블랙, 정품_116,290"
897400,Microsoft 유선 키보드 600,"블랙, 정품_13,440"
3692246,OA BTKBDA 접이식 키보드,"34,900"
15031856,OMT OW-VK 무선키보드,"6,440"
12914768,Obins ANNE PRO2,"해외구매_64,000"
13318679,PFU 해피해킹 Professional HYBRID Type-S PD-KB800BS 블랙 영문,"해외구매_370,580"
13320602,PFU 해피해킹 Professional HYBRID Type-S PD-KB800WS 화이트 영문,"해외구매_370,570"
6527106,QSENN ARES Q34 LED 게이밍 기계식 한손 키보드,"청축_21,800|갈축_21,800|적축_21,800"
12605768,QSENN AULA F2063 그린 LED 게이밍 기계식 키보드,"청축_25,900|갈축_25,900|적축_25,900|흑축_25,900"
12213530,QSENN GP-K1200,"USB_6,200|PS/2_6,200"
5133909,QSENN GP-K5000 LED USB,"11,900"
3331780,QSENN GP-K5000 NEW USB,"8,900"
3369149,QSENN GP-K5000 실리콘 키스킨,"1,210"
3331744,QSENN GP-K7000,"블랙_11,700|화이트_30,790"
12256646,QSENN GP-KM2200 Plus,"USB_7,900|PS/2_7,900"
6498951,QSENN GP-KM4500U,"USB_10,380"
7100656,QSENN K6000 미니 키보드 블랙,"5,400"
15055394,QSENN MK110 무선키보드 마우스 세트 (키스킨포함),가격비교예정
6555974,QSENN PTS-GK1000 게이밍 한손 키보드,"13,840"
4033519,QSENN PTS-K8100UT,"28,890"
15055466,QSENN QSENN K1000 무선키보드 (키스킨 포함),"9,300"
3274953,QSENN SEM-DT35 NEW,"블랙_11,200|화이트_12,100"
3274936,QSENN SEM-DT35 NEW PS2,"블랙_11,200|화이트_11,200"
5339279,QSENN SEM-DT35S LED Stella,"17,500"
11996561,QSENN SEM-DT45 NEW Plus,"PS/2_8,290|USB_8,250"
3331725,QSENN SNK-3000,"10,600"
5971438,RIZUM M10 무선 키보드 무소음 마우스 세트,"블랙_20,150|블루_21,900|실버_21,900|퍼플_21,900"
10369644,RIZUM RK202 기계식 게이밍 키보드,"블랙, 청축_31,400|레드, 적축_33,650|레드, 청축_31,400|블랙, 적축_29,800|화이트, 적축_31,400|화이트, 청축_31,400"
10281822,RIZUM RWS-101 무선 키보드 마우스 세트,"블랙_19,800|레드_19,800|민트_19,800|실버_19,800"
8181970,ROCCAT VULCAN 100 AIMO 영문,"갈축_169,000"
6511987,ROCCAT VULCAN 120 AIMO 영문,"갈축_149,000"
8103517,ROCCAT VULCAN 121 AIMO 영문,"갈축_189,000|적축_189,000"
9490335,ROCCAT VULCAN 121 AIMO 한글,"적축_189,000"
9640725,ROCCAT VULCAN 122 AIMO 영문,"갈축_189,000"
11295579,ROCCAT VULCAN 122 AIMO 한글,"적축_196,880"
12636680,ROCCAT VULCAN PRO 영문,"적축_259,000"
12636704,ROCCAT VULCAN PRO 한글,"적축_259,000"
12636422,ROCCAT VULCAN TKL PRO 영문,"적축_179,000"
12636446,ROCCAT VULCAN TKL PRO 한글,"적축_179,000"
12566594,ROCCAT VULCAN TKL 영문,"적축_139,000"
12566561,ROCCAT VULCAN TKL 한글,"적축_139,000"
14856902,ROYCHE RMK-4600 무선 키보드 마우스 세트,"핑크_24,650|그레이_24,650"
4743580,ROYCHE RX-3100,"블랙_14,000|화이트_14,000"
4743644,ROYCHE RX-3300,"블랙_14,000|화이트_13,980"
4112515,Razer BlackWidow Chroma 오버워치 에디션,"녹축_127,500"
11147655,Razer BlackWidow KR,"녹축_108,970|황축_108,990"
8603834,Razer BlackWidow Lite Stealth US,"블랙, 오렌지축_129,000|머큐리, 오렌지축_122,150"
9413253,Razer BlackWidow Ultimate V2 US,"녹축_109,000"
14519933,Razer BlackWidow V3 KR,"녹축_138,570|황축_138,570"
14458676,Razer BlackWidow V3 Mini HyperSpeed KR,"녹축_219,000|황축_219,000"
13617902,Razer BlackWidow V3 Pro KR,"녹축_310,000|황축_301,250"
12495716,Razer BlackWidow V3 Pro US,"녹축_310,000|황축_310,000"
14244248,Razer BlackWidow V3 TKL KR,"녹축_125,100|황축_139,000"
12495464,Razer BlackWidow V3 US,"녹축_139,000|황축_149,000"
4037075,Razer BlackWidow X Tournament Chroma US,녹축_일시품절
10357521,Razer Ergonomic Wrist Rest Pro,"49,000"
10357491,Razer Ergonomic Wrist Rest Standard,"28,000"
10357065,Razer Huntsman Elite KR,"리니어_299,000"
9772839,Razer Huntsman Elite US,"클릭_299,000|리니어_289,000"
12066629,Razer Huntsman Mini US,"블랙, 클릭_169,000|머큐리, 리니어_180,000|머큐리, 클릭_169,000|블랙, 리니어_180,000"
9668085,Razer Huntsman Tournament US,"162,240"
13569632,Razer Huntsman V2 Analog US,"349,950"
11538242,Razer ORNATA V2,"139,000"
10357266,Razer PBT Keycap Upgrade Set,"블랙_42,000|그린_42,000|핑크_42,000|화이트_42,000"
12227084,Razer Pro Type,"199,000"
3758654,Razer Tartarus Chroma,"117,760"
10770483,Razer Tartarus Pro,"클래식 블랙_189,000|머큐리 화이트_189,000|해외구매_100,700"
5701063,Razer Tartarus V2,"109,000"
11483694,Redragon Broadsword K588,"청축_67,000|갈축_66,980|적축_67,000"
11482383,Redragon KALI K577R,"청축_55,000|갈축_55,000|적축_55,000"
11481660,Redragon Shrapnel K589,"청축_58,000|갈축_58,000|적축_57,200"
3389678,TGIC TGC-K1200U,"3,700"
14826035,TGIC TGC-MK2000 키보드 마우스 세트,"5,430"
3059821,TGIC컴퓨터 TGC-MK3000,"6,090"
9444384,TG삼보 TG-KM400GS Lovely,"블랙_19,280|민트_19,500|핑크_19,500|화이트_19,500"
8491545,Topre REALFORCE R2TL-US3-BK,"해외구매_273,410"
14777549,TourboxTech TourBox NEO,"200,330"
13883111,VARMILO MA108M Beijing Opera 염료승화 영문,"로즈축_203,200|데이지축_209,950|핑크축_209,950"
13728860,VARMILO MA108M KOI PBT 염료승화 영문,"데이지축_201,200|로즈축_202,250|핑크축_201,240"
13350863,VARMILO MA108M Lovebirds I PBT 염료승화 영문,"로즈축_191,580|데이지축_191,580|핑크축_191,580"
13350941,VARMILO MA108M Lovebirds YOU PBT 염료승화 영문,"로즈축_191,580|데이지축_191,580|핑크축_191,580"
13200005,VARMILO MA108M MOONLIGHT PBT 염료승화 영문,"로즈축_182,830|데이지축_182,840|핑크축_181,950|아이비축_가격비교예정"
14159804,VARMILO MA108M SEA MELODY PBT 염료승화 한글,"로즈축_일시품절|데이지축_187,990|핑크축_187,150"
13905791,VARMILO MA108M SUMMIT PBT 염료승화 영문,"핑크축_182,830|데이지축_192,450|로즈축_182,830"
14852339,VARMILO MA108M 다크 그레이 BOLD PBT 염료승화 한글,"로즈축_169,000|핑크축_169,000|데이지축_169,000"
14161049,VARMILO MA108M 매화 컬렉션 PBT 염료승화 한글,"로즈축_181,950|데이지축_181,980|핑크축_181,950|아이비축_가격비교예정"
13882589,VARMILO MA87M Beijing Opera 염료승화 영문,"로즈축_197,040|데이지축_201,200|핑크축_194,740"
13728989,VARMILO MA87M KOI PBT 염료승화 영문,"데이지축_191,580|로즈축_191,580|핑크축_191,580"
13350404,VARMILO MA87M Lovebirds I PBT 염료승화 영문,"핑크축_181,950"
13199318,VARMILO MA87M MOONLIGHT PBT 염료승화 영문,"로즈축_173,200|데이지축_173,200|핑크축_173,200|아이비축_가격비교예정"
14159660,VARMILO MA87M SEA MELODY PBT 염료승화 한글,"로즈축_173,200|데이지축_173,200|핑크축_173,200"
13733699,VARMILO MA87M SUMMIT PBT 염료승화 영문,"데이지축_일시품절|로즈축_일시품절|핑크축_187,930"
14160737,VARMILO MA87M 매화 컬렉션 PBT 염료승화 한글,"로즈축_177,020|데이지축_177,020|핑크축_177,020|아이비축_가격비교예정"
6240222,VARMILO MIYA PRO PANDA PBT 염료승화 영문,"갈축_178,950"
5829362,VARMILO MIYA PRO PBT 염료승화 영문,"갈축_146,280|저소음적축_가격비교예정"
8481867,VARMILO VA104M 다크 그레이 BOLD PBT 염료승화 한글,"갈축_137,700|적축_137,650"
13883219,VARMILO VA108M Beijing Opera 염료승화 영문,"적축_197,520"
6421332,VARMILO VA108M FOREST FAIRY PBT 염료승화 영문,"갈축_162,720|적축_172,930"
13734128,VARMILO VA108M Lovebirds I PBT 염료승화 영문,저소음 적축_일시품절
13733990,VARMILO VA108M Lovebirds YOU PBT 염료승화 영문,"저소음 적축_191,580"
14964239,VARMILO VA108M MOONLIGHT PBT 염료승화 영문,"저소음적축_가격비교예정|갈축_187,160|적축_181,170"
6306955,VARMILO VA108M PANDA PBT 염료승화 영문,적축_일시품절
7877596,VARMILO VA108M SEA MELODY PBT 염료승화 영문,"저소음 적축_187,950"
11500857,VARMILO VA108M SEA MELODY PBT 염료승화 한글,"갈축_177,950|저소음 적축_188,000|적축_177,950"
9631584,VARMILO VA108M STAY PANGAH PBT 염료승화 한글,"갈축_187,880"
14850605,VARMILO VA108M 다크 그레이 BOLD PBT 염료승화,"저소음적축_가격비교예정|갈축_157,380|적축_157,380"
14850599,VARMILO VA108M 다크 그레이 BOLD PBT 염료승화,"갈축_157,380|저소음적축_가격비교예정|적축_157,380"
11823499,VARMILO VA108M 다크믹스 RE PBT 염료승화 한글,"갈축_153,120|저소음 적축_167,350|적축_153,120"
5793897,VARMILO VA108M 매화 컬렉션 PBT 염료승화 한글,"갈축_163,330|적축_162,730|저소음 적축_173,200"
5709836,VARMILO VA108Mac 밀키 화이트 PBT 염료승화 영문,"저소음 적축_157,450"
13882346,VARMILO VA87M Beijing Opera 염료승화 영문,"적축_190,800"
6421434,VARMILO VA87M FOREST FAIRY PBT 염료승화 영문,"갈축_153,080|적축_153,080"
9639522,VARMILO VA87M KOI PBT 염료승화 영문,"갈축_183,700|적축_183,700"
14963927,VARMILO VA87M MOONLIGHT PBT 염료승화 영문,"갈축_177,160|저소음적축_가격비교예정|적축_177,160"
6123574,VARMILO VA87M PANDA PBT 염료승화 영문,"갈축_183,720|적축_183,720"
7877704,VARMILO VA87M SEA MELODY PBT 염료승화 영문,"갈축_168,000"
11499990,VARMILO VA87M SEA MELODY PBT 염료승화 한글,"갈축_167,390|저소음 적축_177,950|적축_164,750"
14039435,VARMILO VA87M SUMMIT R2 PBT 염료승화 영문,저소음 적축_일시품절
12138281,VARMILO VA87M 다크그레이 RE PBT 염료승화 영문,"갈축_일시품절|저소음 적축_151,150"
7001122,VARMILO VA87M 다크그레이 RE PBT 염료승화 한글,"적축_133,830"
5444619,VARMILO VA87M 다크믹스 RE PBT 염료승화 영문,"갈축_145,670|적축_일시품절"
11823034,VARMILO VA87M 다크믹스 RE PBT 염료승화 한글,"적축_148,000"
5758679,VARMILO VA87M 매화 컬렉션 PBT 염료승화 영문,"갈축_142,580|저소음 적축_167,350"
11500461,VARMILO VA87M 매화 컬렉션 PBT 염료승화 한글,"갈축_153,080|저소음 적축_162,730"
14012858,VARMILO X ZOMO 고양이 발바닥 ABS 키캡,"젖소냥_18,360|고등어냥_18,360|샴냥_18,360|치즈냥_18,360"
8698322,Wooting one,"클릭_189,360|리니어_197,100"
14990237,XTRA gni-601 접이식 무선 블루투스 키보드,"화이트_36,200|블랙_36,200"
13065107,archon K77 영문 블루투스 5.0 기계식 키보드,"화이트, 적축_107,370|블랙, 갈축_107,370|블랙, 저소음 적축_117,180|블랙, 적축_107,370|화이트, 갈축_107,370|화이트, 저소음 적축_114,000"
13128902,archon K77 한글 블루투스 5.0 기계식 키보드,"화이트, 적축_109,000|블랙, 갈축_107,370|블랙, 저소음 적축_109,000|블랙, 적축_107,370|화이트, 갈축_107,370|화이트, 저소음 적축_117,180"
13065329,archon K79 영문 블루투스 5.0 기계식 키보드,"화이트, 적축_117,180|블랙, 갈축_117,180|블랙, 저소음 적축_129,000|블랙, 적축_117,180|화이트, 갈축_117,180|화이트, 저소음 적축_126,990"
13128959,archon K79 한글 블루투스 5.0 기계식 키보드,"화이트, 적축_117,180|블랙, 갈축_119,000|블랙, 저소음 적축_119,000|블랙, 적축_117,180|화이트, 갈축_117,180|화이트, 저소음 적축_126,990"
12997043,archon RE:AL FX2,"블랙, 갈축_219,000|블랙, 적축_238,000|블랙, 저소음 적축_247,600|화이트, 갈축_257,100|화이트, 적축_259,480|화이트, 저소음 적축_269,110"
14260406,archon RE:AL GX CNC 풀 알루미늄,"블랙, 갈축_266,600|블랙, 적축_266,600|블랙, 저소음 적축_278,740|화이트, 갈축_285,700|화이트, 적축_285,700|화이트, 저소음 적축_295,300"
1394973,i-rocks IRK01W X-Slim,"블랙_27,900|실버_26,200|화이트_27,530|핑크_28,770"
6465371,i-rocks IRK07RP 무선 저소음 키보드 마우스 세트,"블랙_44,000|화이트_44,000"
14863451,i-rocks IRK07W,"화이트_31,000|블랙_31,000"
5083270,i-rocks IRK25RP 2017,"블랙_48,110|화이트_48,110"
4998170,i-rocks KR-6170 / IRK25RP 전용 키스킨,"2,190"
134184,i-rocks KR-6170 X-Slim,"블랙_29,910|화이트_29,910"
11706185,iKBC W210 Wireless,"청축_107,580|갈축_107,580|저소음 적축_116,790"
7026682,강원전자 NETmate NM-GK35 USB 한손 게이밍 키보드,"14,640"
4767025,강원전자 NETmate NM-OM05,"4,120"
6031115,갤럭시 GALAX 한영 ABS 104 키캡,"11,900"
6397616,갤럭시 XANOVA MAGNETAR RGB 기계식 키보드,"청축_111,000|갈축_110,950|적축_110,300"
11306637,갤럭시 XANOVA PULSAR 기계식 키보드,"갈축_90,000|적축_90,000|청축_61,000"
6423252,갤럭시 XANOVA 한영 ABS 104 키캡,"11,090"
13569245,건평정보통신 IPLEX KP-7223U,"3,440"
5019857,건평정보통신 IPLEX RK-2000C 무선 키보드 마우스 세트,"11,150"
15067088,글로리어스 WOOD WRIST RESTS 다크,풀배열_가격비교예정|텐키리스_가격비교예정|컴팩트_가격비교예정
15067106,글로리어스 WOOD WRIST RESTS 브라운,풀배열_가격비교예정|텐키리스_가격비교예정|컴팩트_가격비교예정
15067220,글로리어스 글로리어스 판다 스위치 PANDA Switch 36개,가격비교예정
14882825,넥스원 K180 LED 한손 게이밍 키보드,"15,580"
14884175,넥스원 T520 LED 립스틱 팔레트 키보드,가격비교예정
5243292,다얼유 EK820 블루투스 겸용 슬림 LED 기계식 키보드,"블랙, 청축_79,000|블랙, 적축_79,000"
12711191,다얼유 LK186G 무선 키보드 마우스 세트,"17,210"
3812779,대양케이스 LimitDK 3Color 플런져 게이밍 키보드,"19,820"
14879540,더코너스톤 MANLAB BK200 무선 블루투스 키보드,블랙_가격비교예정|화이트_가격비교예정
5135289,라이트컴 COMS BW300 접이식 블루투스 키보드,"48,050"
14872178,라이트컴 COMS DT441 레트로 무선 키보드 마우스 세트,"20,460"
14874008,라이트컴 COMS JD168 유선 키보드,"3,800"
14826716,라이트컴 COMS RT328 무선 터치패드 키보드,"25,740"
14874434,라이트컴 COMS 키보드 마우스 손목받침대,"블루_8,310|블랙_7,690"
3384793,라이트컴 COMS 한글 키보드 스티커,"화이트, IB710_980|블랙, ITA629_1,040"
13069682,레노버 4Y40Z48977,"134,560"
2692878,레오폴드 FC210TP,"갈축_51,980|적축_51,980|청축_51,980"
5434268,레오폴드 FC660M PD 이색사출 블랙 한글,"저소음 적축_129,950|갈축_128,000|적축_128,000|청축_128,000"
12664712,레오폴드 FC660M PD 화이트 블루 스타 한글,"청축_127,950|갈축_109,330|저소음 적축_115,890|적축_115,700"
14643884,레오폴드 FC660MBT PD 그레이 블루 한글,"갈축_135,000"
6954625,레오폴드 FC750R PD 다크블루 한글,"청축_152,000|적축_211,820"
11697908,레오폴드 FC750R PD 라이트 핑크 한글,"청축_137,550|갈축_137,450|저소음 적축_일시품절|적축_152,000"
9450876,레오폴드 FC750R PD 애쉬 옐로우 한글,"청축_152,000"
5318124,레오폴드 FC750R PD 이색사출 블랙 한글,"청축_132,870|갈축_132,870|적축_132,900|저소음 적축_135,490"
13702868,레오폴드 FC750R PD 화이트 민트 한글,청축_일시품절|갈축_일시품절
12761069,레오폴드 FC750R PD 화이트 블루 스타 영문,"청축_152,000|갈축_141,500|저소음 적축_135,490|적축_141,500"
12706964,레오폴드 FC750R PD 화이트 블루 스타 한글,"청축_일시품절|갈축_152,000|적축_152,000|저소음 적축_155,000"
5677183,레오폴드 FC900R PD 그라파이트 화이트 한글,"저소음 적축_일시품절|갈축_135,400|적축_일시품절|청축_135,490"
12398588,레오폴드 FC900R PD 그레이 퍼플 한글,"청축_134,950|갈축_134,950|저소음 적축_143,860|적축_134,950"
9451077,레오폴드 FC900R PD 애쉬 옐로우 한글,청축_일시품절
5318227,레오폴드 FC900R PD 이색사출 블랙 한글,"청축_일시품절|갈축_139,170|적축_149,500"
10092873,레오폴드 FC900R PD 전용 키스킨,"4,630"
10550661,레오폴드 FC900R PD 화이트 그레이 한글,"청축_139,360|갈축_139,500|저소음 적축_152,380|적축_139,360"
5617043,레오폴드 FC900R PD 화이트 한글,"저소음 적축_일시품절|갈축_145,610|적축_155,000|청축_155,000"
12011171,레오폴드 LEO-WR-ABK,"S_36,760|L_47,400|M_40,650"
5558028,로지텍 CRAFT (정품),"199,000"
13479911,로지텍 ERGO K860 WIRELESS (정품),"159,000"
13718012,로지텍 ERGO K860 WIRELESS + M575 ERGO,"그래파이트_181,000|오프화이트_178,820"
13717385,로지텍 ERGO K860 WIRELESS + MX VERTICAL,"278,000"
13792880,로지텍 G PRO K/DA Mechanical Gaming Keyboard (정품),"128,140"
9648243,로지텍 G PRO X Mechanical Gaming Keyboard (정품),"99,000"
5161551,로지텍 G413 (정품),"카본_59,900|실버_63,860"
6086876,로지텍 G512 CARBON RGB (정품),"청축_179,000|갈축_129,000|적축_131,370|넌클릭_124,990|리니어_126,580"
4199468,로지텍 G610 ORION BLUE (정품),"97,980"
5541989,로지텍 G613 LIGHTSPEED,"해외구매_84,960"
5541978,로지텍 G613 LIGHTSPEED (정품),"86,900"
9343749,로지텍 G813 (정품),"클릭_219,000|넌클릭_219,000|리니어_219,000"
9343947,로지텍 G913 WIRELESS (정품),"클릭_299,000|넌클릭_239,000|리니어_299,000"
11662541,로지텍 G913 Wireless TKL (정품),"블랙, 택타일_278,990|블랙, 리니어_277,890|블랙, 클릭키_219,000|화이트, 택타일_277,900"
1725597,로지텍 K120 + B100 (정품),"15,060"
1581153,로지텍 K120 New (정품),"8,220"
5942386,로지텍 K120 New + M100R 블랙 (정품),"16,720"
1992976,로지텍 K120 New + M90 (정품),"13,790"
13730018,로지텍 K120 New 키스킨,"2,620"
1433300,로지텍 K270 (정품),"20,510"
13443491,로지텍 K270 + ERGO M575,"그래파이트_60,900|화이트_62,080"
5723099,로지텍 K270 + M185 (정품),"34,790"
3354146,로지텍 K270 / MK270R / MK260R 전용 키스킨,"1,410"
4719145,로지텍 K375s (정품),"30,580"
4350489,로지텍 K380,"리퍼비시_24,890|해외구매_19,000|벌크_27,020|병행수입_17,000"
14133644,로지텍 K380 + M350 PEBBLE,"해외구매_26,000|정품_57,800"
3427959,로지텍 K380 키스킨미포함 (정품),"그레이_34,500|블루_33,440|핑크_33,440|화이트_34,880"
5347701,로지텍 K380 키스킨포함 (정품),"그레이_35,980"
3428178,로지텍 K400 PLUS (정품),"45,900"
2800393,로지텍 K480 (정품),"블랙_34,390|화이트_35,880"
10283862,로지텍 K580,"병행수입_36,410|벌크_41,570|해외구매_35,420"
9246237,로지텍 K580 (정품),"41,900"
13069385,로지텍 K600 TV,"해외구매_50,000|병행수입_51,500"
1982271,로지텍 K750r (정품),"76,940"
5253093,로지텍 K780,"리퍼비시_47,890|벌크_55,810|병행수입_60,150|해외구매_49,980"
4259119,로지텍 K780 (정품),"59,000"
7628860,로지텍 K800,"해외구매_172,740|벌크_78,640"
12746630,로지텍 K835 TKL (정품),"그래파이트_59,490|오프화이트_59,490"
13069376,로지텍 KEYS-TO-GO,"해외구매_66,650"
13350962,로지텍 KEYS-TO-GO (정품),"블랙_69,000|핑크_69,000"
1581154,로지텍 MK120 New (정품),"16,660"
1677001,로지텍 MK200 NEW (정품),"17,830"
2096226,로지텍 MK220,"병행수입_22,190|해외구매_16,520|_27,600"
1512676,로지텍 MK220 (정품),"16,900"
3798967,로지텍 MK235 (정품),"키스킨 미포함_20,080|키스킨 포함_21,600"
4363933,로지텍 MK240 NANO (정품),"블랙_22,000|화이트_23,350"
5319431,로지텍 MK270r,"병행수입_18,900|해외구매_19,230"
2541329,로지텍 MK270r (정품),"키스킨 미포함_29,700|키스킨 포함_30,080"
4340134,로지텍 MK275 (정품),"27,900"
14199998,로지텍 MK295 SILENT WIRELESS COMBO,"병행_52,640|해외구매_41,280"
12552761,로지텍 MK295 SILENT WIRELESS COMBO (정품),"블랙_39,040|화이트_39,350"
7704109,로지텍 MK315 QUIET (정품),"37,330"
6527643,로지텍 MK330R (정품),"39,880"
5417360,로지텍 MK345,"벌크_41,300|병행수입_30,440|비공식유통_38,920|해외구매_10,990"
2904153,로지텍 MK345 (정품),"37,830"
8416011,로지텍 MK470 Slim Wireless Combo (정품),"61,930"
13677830,로지텍 MK545,"해외구매_58,210|벌크_64,300|병행수입_57,740"
5972582,로지텍 MK545 (정품),"62,890"
5967481,로지텍 MK850,"리퍼비시_68,900|병행수입_72,270|해외구매_49,750"
5147612,로지텍 MK850 (정품),"98,950"
13576226,로지텍 MX KEYS,"해외구매_95,380|리퍼비시_일시품절|벌크_120,000|병행수입_119,500|비공식유통_137,610"
9523836,로지텍 MX KEYS (정품),"139,000"
12006083,로지텍 MX KEYS for Mac (정품),"139,000"
11026725,로지텍 MX KEYS 손목받침대,"24,800"
13667051,로지텍 MX KEYS 전용 키스킨,"2,360"
11748392,마이크로닉스 CPK-1 큰글씨 한글키보드,"19,890"
6579922,마이크로닉스 GANSS 87PRO RGB 이중사출 PBT,"저소음 적축_243,100|은축_205,660|적축_161,710"
6567821,마이크로닉스 GANSS ALT-71 CNC 풀알루미늄 분리형 키보드,"저소음 적축_199,000"
12866330,마이크로닉스 MANIC EX89 텐키리스PRO 게이밍기계식 RGB,"청축_49,800|갈축_49,780|적축_49,800"
14107556,마이크로닉스 MANIC GK170 키보드 마우스 세트,"16,900"
13101569,마이크로닉스 MANIC GS260 LED 게이밍 키보드 마우스 세트,"19,450"
13611080,마이크로닉스 MANIC K1400 유선 키보드,"9,870"
6150422,마이크로닉스 MANIC K160 키보드 마우스 무선 합본,"스카이 블루_16,480|블랙_16,480|인디 핑크_16,480"
5997878,마이크로닉스 MANIC K520 텐키리스 카일박스축,"갈축_일시품절|적축_85,120"
5623350,마이크로닉스 MANIC K532 카일박스축,"백축_57,500"
6308820,마이크로닉스 MANIC K61 RGB 미니 블루투스 카일박스축,"블랙, 적축_69,780|블랙, 백축_62,110|화이트, 적축_69,800|화이트, 백축_69,800"
5897010,마이크로닉스 MANIC K735 엣지 RGB 카일박스축,"블랙, 갈축_79,800|블랙, 적축_79,800|블랙, 백축_79,800|레드, 백축_63,000|블루, 백축_63,000"
6244499,마이크로닉스 MANIC K940 RGB 초슬림 기계식 카일 초콜릿축,"백축_99,000|적축_99,000"
6948109,마이크로닉스 MANIC KM110 유선 키보드 마우스 합본,"8,180"
13483409,마이크로닉스 MANIC KM150 유선 키보드 마우스 합본,"15,110"
7955509,마이크로닉스 MANIC KM220 유선 게이밍 키보드 마우스 합본,"19,900"
9615873,마이크로닉스 MANIC KM220PLUS 유선 게이밍 키보드 마우스 합본,"19,850"
9585567,마이크로닉스 MANIC KM330 무선 슬림 키보드 마우스 합본,"블랙_22,610|민트_24,780|코발트블루_22,620|핑크_22,500"
12125084,마이크로닉스 MANIC KM530 무선 슬림 무소음 키보드 마우스 합본,"블랙_19,800|핑크_19,800|화이트_19,780"
12354434,마이크로닉스 MANIC NX420 무선 키보드 마우스 합본,"그레이_22,080|블랙_21,690|핑크_22,080|화이트_22,170"
9473790,마이크로닉스 MANIC PAMPAM 팜레스트 키보드 손목받침대,"9,680"
13761776,마이크로닉스 MANIC X100 마닉축 기계식 게이밍 키보드,"청축_21,900|갈축_23,880|적축_23,900"
13263071,마이크로닉스 MANIC X240 LED 게이밍 기계식 키보드,"청축_27,900|갈축_28,900|적축_28,810"
12085406,마이크로닉스 MANIC X280 마닉축 엣지 LED 기계식키보드,"청축_29,800|갈축_29,800|적축_22,150"
9595161,마이크로닉스 MANIC X30 마닉축 기계식 키보드,"청축_31,180|갈축_31,180|적축_31,180"
12085250,마이크로닉스 MANIC X300 마닉축 엣지 RGB 기계식키보드,"청축_42,900|적축_42,900"
9893076,마이크로닉스 MANIC X38 4세대 광축 IPX8 완전방수 게이밍,"51,860"
6434920,마이크로닉스 MANIC X40 4세대 광축 완전방수 게이밍,"블랙_48,390|화이트_48,390"
12480122,마이크로닉스 MANIC X40 크리스탈 4세대 광축,"34,230"
7710334,마이크로닉스 MANIC X48 4세대 광축 완전방수 게이밍 크리스탈키캡,"민트 그레이_53,900|민트 민트_50,300|민트 화이트_53,900|레드 핑크_53,480|레드 화이트_53,900|블랙 화이트_53,900|화이트 화이트_53,900"
