Id,Name,2021-08-25 10:08:33
11179761,3M K50 + M70 유선 키보드 마우스 세트,"블랙_23,320|화이트_23,900"
6640480,ADATA XPG INFAREX K20,"47,180"
10160544,ADATA XPG SUMMONER,"적축_121,900|은축_159,000"
4698428,ANYZEN K100U 유선키보드,"5,030"
5645544,ANYZEN MK-100 USB 유선 세트,"6,850"
15020876,APPLE MK293KH/A 매직 키보드 한글,"168,470"
15020783,APPLE MK2C3KH/A 매직 키보드 한글,"192,380"
5363737,APPLE Magic Keyboard with Numeric Keypad (MQ052KH/A),"정품_135,480"
14408222,ASUS ROG CLAYMORE II US,"청축_299,000|적축_299,000"
12768086,ASUS ROG FALCHION 영문,"청축_229,000|적축_229,000"
7281979,ASUS ROG Gaming Keycap Set,"29,900"
6081955,ASUS ROG STRIX FLARE,"청축_277,000|갈축_277,000|적축_209,000|은축_406,990"
8217067,ASUS ROG STRIX FLARE PINK,"청축_219,000|적축_219,000"
14963858,ASUS ROG STRIX SCOPE NX TKL Moonlight White,갈축_가격비교예정|청축_가격비교예정|적축_가격비교예정
11078613,ASUS ROG STRIX SCOPE PBT 영문,"청축_159,000|갈축_159,000"
13486184,ASUS ROG STRIX SCOPE RX,"적축_149,000|청축_149,000"
14716769,ASUS ROG STRIX SCOPE TKL Electro Punk,"169,000"
10577751,ASUS ROG STRIX SCOPE TKL 영문,"청축_159,000|적축_159,000"
10577739,ASUS ROG STRIX SCOPE TKL 한글,"적축_159,000|갈축_175,580"
8140477,ASUS ROG STRIX SCOPE 영문,"청축_169,000|갈축_169,000|은축_169,000|적축_168,950"
7953388,ASUS ROG STRIX SCOPE 한글,"적축_1,169,000|갈축_1,169,000"
2885992,ASUS STRIX Tactic Pro,"청축_111,630"
3567106,ASUS STRIX Tactic Pro STCOM,"청축_111,090"
7215610,ASUS TUF Gaming K5,"109,000"
5853828,Actto BTK-02,"11,870"
8203102,Actto BTK-03,"24,520"
14654054,Actto BTK-05 하프 블루투스 키보드,"21,900"
13498547,Actto BTK-06,"26,900"
5697582,Actto KBD-47 레트로 유선,"14,330"
5697549,Actto KBD-48 레트로 무선,"18,800"
5772703,Actto KBD-50 레트로 미니 무선,"19,550"
6638212,Actto KMC-03 무선 키보드 마우스 세트,"27,490"
14543747,Actto KMC-07 듀오 무선 키보드마우스 콤보,"블랙_21,500|화이트_21,500"
14902349,Actto NBK-23 퍼펙트 무선 키패드,"14,860"
14800856,Actto WRS-06 푸딩 손목 받침대,"9,980"
4918400,Bless ZIO G-LIGHT CHOCOLATE 키보드,"9,760"
6302057,Bless ZIO KMW4030 무선 키보드 무선 무소음 마우스 세트,"블랙_15,750|그레이_14,900|핑크_14,880|화이트_14,880"
8010823,Bless ZIO MK8700 미니 키보드,"10,000"
13989092,Britz 브리츠인터내셔널 BA-BK9 Plus 접이식 블루투스 키보드,"46,080"
11342667,Britz 브리츠인터내셔널 BA-MDK35,"38,900"
10493331,Britz 브리츠인터내셔널 GK80,"블랙_19,900|그레이_19,900"
6445053,CHERRY G80-3000,"블랙, 갈축_88,950|블랙, 청축_88,950|블랙, 흑축_89,000"
13672439,CHERRY G80-3000S RGB TKL,"블랙, 청축_99,000|블랙, 갈축_99,000|블랙, 적축_99,000|블랙, 흑축_99,000|블랙, 저소음 적축_109,000|화이트, 청축_99,000|화이트, 갈축_99,000|화이트, 적축_99,000|화이트, 흑축_99,000|화이트, 저소음 적축_109,000"
14469221,CHERRY G80-3000S TKL,"블랙, 청축_79,000|블랙, 갈축_74,970|블랙, 적축_79,000|블랙, 흑축_79,000|블랙, 저소음 적축_89,000|화이트, 청축_79,000|화이트, 갈축_79,000|화이트, 적축_79,000|화이트, 흑축_79,000|화이트, 저소음 적축_89,000"
6466882,CHERRY G80-3494,"블랙, 적축_87,570|블랙, 저소음 적축_98,250|블랙, 저소음 흑축_286,990|화이트, 적축_276,990|화이트, 저소음 적축_299,000"
1793775,CHERRY G80-3497,"적축_88,950"
2868094,CHERRY G80-3800 + 키보드 받침대,"청축_87,450"
2120324,CHERRY G80-3800 기계식 키보드 전용 컬러 16종 키캡,"옐로우_8,500|오렌지_8,500|퍼플_8,500"
14038877,CHERRY MV3.0 RGB BLACK,"비올라축_107,980"
14854280,CHERRY MV3.0 RGB SILVER,"비올라축_109,000"
11494881,CHERRY MX BOARD 1.0 TKL RGB,"청축_99,000|적축_99,000"
12181010,CHERRY MX BOARD 10.0 Low Profile RGB,"블랙_239,000|실버_239,000"
14808047,CHERRY MX BOARD 2.0S,"블랙, 청축_79,000|블랙, 갈축_79,000|블랙, 적축_79,000|블랙, 저소음 적축_89,000|화이트, 청축_79,000|화이트, 갈축_79,000|화이트, 적축_79,000|화이트, 저소음 적축_89,000"
14811248,CHERRY MX BOARD 2.0S RGB,"블랙, 청축_109,000|블랙, 갈축_109,000|블랙, 적축_109,000|화이트, 청축_109,000|화이트, 갈축_109,000|화이트, 적축_109,000|화이트, 저소음 적축_119,000"
12285776,CHERRY MX BOARD 3.0S,"블랙, 청축_89,000|블랙, 갈축_89,000|블랙, 적축_89,000|블랙, 흑축_89,000|블랙, 저소음 적축_99,000|화이트, 청축_89,000|화이트, 갈축_89,000|화이트, 적축_89,000|화이트, 흑축_89,000|화이트, 저소음 적축_99,000"
11356188,CHERRY MX BOARD 3.0S RGB,"블랙, 청축_129,000|블랙, 갈축_129,000|블랙, 적축_129,000|블랙, 흑축_129,000|블랙, 저소음 적축_139,000|핑크, 청축_129,000|핑크, 갈축_129,000|핑크, 적축_129,000|핑크, 흑축_129,000|핑크, 저소음 적축_139,000|화이트, 청축_129,000|화이트, 갈축_129,000|화이트, 적축_129,000|화이트, 흑축_129,000|화이트, 저소음 적축_139,000"
13955216,CHERRY MX Switch Tester Sampler 12종,"13,900"
9733638,CJ ENM ENTUS K200G BATTLE CJ 광축 게이밍 키보드,"클릭_32,900|넌클릭_32,900|리니어_32,900"
7824661,CJ ENM ENTUS K750G BATTLE 광축 방진방수 충전허브,"블랙_47,920|화이트_35,250"
13262570,CJ ENM N ENTUS EWKM-02 무선 키보드 마우스 세트,"블랙_17,800|화이트_17,800"
13155449,CJ ENM N ENTUS EWKM-04 무선 키보드 마우스 세트,"블랙그레이_16,430|화이트핑크V1_16,970"
14826242,COMS SPACE WARSHIPS F6 한손 키보드,"12,630"
3201110,CORSAIR GAMING K65 RGB,"적축_222,130"
2934972,CORSAIR GAMING K70,"청축, 정품_175,220|적축, 정품_196,850|갈축, 정품_175,000"
2856936,CORSAIR GAMING K70 RGB,"갈축, 정품_257,600|적축, 정품_243,440|청축, 정품_266,300"
2879254,CORSAIR GAMING K95 RGB,"적축, 정품_272,950"
12402839,CORSAIR K100 RGB MX SPEED 영문,"은축_298,900"
12799214,CORSAIR K100 RGB MX SPEED 한글,"은축_299,000"
14955515,CORSAIR K100 RGB MX SPEED 한글 + iCUE NEXUS,"은축_401,700"
12402851,CORSAIR K100 RGB OPTICAL 영문,"리니어_299,000"
14955425,CORSAIR K100 RGB OPTICAL 영문 + iCUE NEXUS,"은축_401,700|리니어_401,800"
12799259,CORSAIR K100 RGB OPTICAL 한글,"리니어_299,000"
14955542,CORSAIR K100 RGB OPTICAL 한글 + iCUE NEXUS,"리니어_401,700"
15050258,CORSAIR K57 + Harpoon 무선 게이밍 키보드 마우스 콤보,가격비교예정
10189578,CORSAIR K57 RGB WIRELESS,"정품_129,000"
12618380,CORSAIR K60 PRO,"98,500"
12618515,CORSAIR K60 RGB PRO,"129,000"
12669857,CORSAIR K60 RGB PRO LP,"은축_189,000"
12829025,CORSAIR K60 RGB PRO SE,"143,490"
5065159,CORSAIR K63,"적축_119,000"
6040268,CORSAIR K63 WIRELESS,"적축_129,500|해외구매_211,000"
6051064,CORSAIR K63 WIRELESS GAMING LAPBOARD,"89,000"
5385735,CORSAIR K65 LUX RGB,"적축_189,000"
4412040,CORSAIR K65 RAPIDFIRE RGB,"은축_219,770"
13661003,CORSAIR K65 RGB MINI,"적축_145,900|저소음 적축_145,900"
14034689,CORSAIR K65 RGB MINI + PBT Double-shot Keycaps Pro,"적축, 블랙_165,400|적축, 그린_165,400|적축, 레드_165,400|적축, 블루_165,400|적축, 핑크_165,400|적축, 화이트_165,400|저소음 적축. 블랙_165,400|저소음 적축. 그린_165,360|저소음 적축. 레드_165,400|저소음 적축. 블루_165,400|저소음 적축. 핑크_165,400|저소음 적축. 화이트_165,400"
5850268,CORSAIR K68 RGB 방수/방진,"적축_449,690"
5217261,CORSAIR K68 방수/방진,"청축_129,000|적축_129,000"
4138936,CORSAIR K70 LUX,"청축_175,000|갈축_175,000|적축_175,000"
4417510,CORSAIR K70 LUX BLUE LED,"적축_175,000"
4412109,CORSAIR K70 LUX RGB,"적축_225,000|청축_225,000|갈축_224,990"
10093344,CORSAIR K70 LUX 전용 키스킨,"4,500"
4111501,CORSAIR K70 RAPIDFIRE,"은축_175,000"
4085363,CORSAIR K70 RAPIDFIRE RGB,"은축_225,000"
6351641,CORSAIR K70 RGB MK.2,"청축_219,000|갈축_219,000|은축_225,000|적축_218,900|저소음 적축_225,000"
14956880,CORSAIR K70 RGB MK.2 + iCUE NEXUS,"적축_309,500|청축_309,500|은축_314,900|저소음 적축_314,900|갈축_309,600"
6569690,CORSAIR K70 RGB MK.2 LOW PROFILE,"적축_229,000"
6548195,CORSAIR K70 RGB MK.2 LOW PROFILE RAPIDFIRE,"은축_229,000"
14956364,CORSAIR K70 RGB MK.2 LOW PROFILE RAPIDFIRE + iCUE NEXUS,"은축_319,100"
6214607,CORSAIR K70 RGB MK.2 SE,"은축_229,000"
14956415,CORSAIR K70 RGB MK.2 SE + iCUE NEXUS,"은축_319,100"
14897762,CORSAIR K70 RGB TKL CHAMPION 영문,"은축_179,000"
14899472,CORSAIR K70 RGB TKL CHAMPION 영문 (해외구매),"209,000"
13855607,CORSAIR K70 RGB TKL CHAMPION 한글,"적축_179,000|저소음 적축_179,000"
7411843,CORSAIR K83 Wireless Entertainment Keyboard,"149,000"
5013573,CORSAIR K95 RGB PLATINUM,"갈축_259,000|은축_259,000|해외구매_219,700"
14955920,CORSAIR K95 RGB PLATINUM + iCUE NEXUS,"은축_352,000|갈축_352,000"
10483833,CORSAIR K95 RGB PLATINUM XT,"청축_869,000|갈축_261,000|은축_269,000"
14955809,CORSAIR K95 RGB PLATINUM XT + iCUE NEXUS,"갈축_368,800"
5714458,CORSAIR PBT DOUBLE-SHOT KEYCAPS,"블랙_91,080|화이트_91,080"
13913588,CORSAIR PBT DOUBLE-SHOT PRO KEYCAP MOD KIT,"화이트_39,900|그린_39,900|레드_39,900|블랙_39,900|블루_39,900|핑크_39,900"
6214631,CORSAIR STRAFE RGB MK.2 SILENT,"저소음 적축_199,000"
3911088,CORSAIR STRAFE SILENT RGB,"저소음 적축, 정품_239,000"
11815033,CORSAIR iCUE NEXUS,"129,000"
3135290,COUGAR 600K,청축_일시품절
3144388,COUGAR 700K 영문,"청축_168,950"
4680287,COUGAR ATTACK X3 RGB,"청축_169,000"
6474983,COUGAR ATTACK X3 RGB SPEEDY,"186,000"
8222014,COUGAR AURORA S,"45,560"
9242568,COUGAR FORT,"24,050"
9242619,COUGAR FORT X,"25,750"
4419200,COUGAR Metal Keycaps,"9,880"
5963168,COUGAR PURI,"적축_170,610"
13639778,COUGAR PURI RGB,"적축_109,000"
5962727,COUGAR PURI TKL,"청축_99,230"
13639985,COUGAR PURI TKL RGB,"적축_105,930"
5047429,COUGAR VANTAR,"38,980"
12901703,COUGAR VANTAR AX,"Black_58,300|Silver_58,480|Pink_65,000"
6454535,COX 145Key 염료승화 PBT 한글 포인트 컬러 키캡,"오렌지_65,650|블루_65,650"
11640566,COX CA106 CNC 알루미늄 어고노믹 게이트론 기계식 키보드,"황축_377,400|갈축_377,400"
10677831,COX CA108BT 블루투스 유무선 알루미늄 PBT 이색사출,"레드, 황축_229,000|레드, 갈축_229,000|로즈골드, 갈축_229,000|로즈골드, 황축_229,000"
8004508,COX CARAVEL 게이트론 교체축 RGB 염료승화 PBT 리빙코랄,"녹축_61,500|갈축_일시품절"
8004616,COX CARAVEL108 게이트론 교체축 RGB 염료승화 PBT 리빙코랄,"녹축_67,000|갈축_147,650"
8007130,COX CARAVEL108 체리 교체축 염료승화 PBT 리빙코랄,"청축_73,000|갈축_73,000"
13224059,COX CK01 Navy 교체축 사이드 RGB 게이밍 기계식 키보드,"청축_34,900|갈축_34,900|적축_34,900"
11696723,COX CK01 PBT 이색사출 사이드 RGB 기계식 키보드,"청축_39,900|갈축_39,900|적축_39,900"
14440445,COX CK01 TKL,"청축_28,950|갈축_29,000|적축_29,000"
14393789,COX CK01 TKL PBT 기계식 키보드,"청축_38,000|갈축_38,000|적축_38,000"
11234112,COX CK01 교체축 사이드 RGB 게이밍 기계식 키보드,"블랙, 청축_30,900|블랙, 갈축_30,900|블랙, 적축_30,900|화이트, 갈축_30,900|화이트, 적축_30,900|화이트, 청축_30,900"
12345143,COX CK01V 투톤 완전방수 사이드 RGB V광축 게이밍 키보드,"V광축, 클릭_41,300"
11433840,COX CK104 RGB BAR 투톤 이중사출 게이트론 기계식,"블랙그레이, 청축_52,900|레드그레이, 갈축_53,900|레드그레이, 청축_52,900|레드그레이, 황축_52,900|블랙그레이, 갈축_53,900|블랙그레이, 황축_52,900"
12095909,COX CK108 BT 게이트론 블루투스 5.0 기계식 게이밍 키보드,"블랙, 청축_89,900|블랙, 갈축_89,900|블랙, 황축_89,900|화이트, 갈축_89,900|화이트, 청축_89,900|화이트, 황축_89,900"
8050579,COX CK108 SA CREAM 게이트론 LED 게이밍 기계식,"블랙, 녹축_81,500|블랙, 황축_59,900"
8048905,COX CK108 레드/다크그레이 게이트론 LED 게이밍 기계식,"S1, 녹축_59,900|S1, 갈축_59,900|S1, 황축_59,900|S2, 갈축_59,900|S2, 녹축_59,900|S2, 황축_59,900"
8048431,COX CK108 블랙/다크그레이 게이트론 LED 게이밍 기계식,"녹축_59,900|갈축_59,900|저소음 갈축_110,800|저소음 황축_110,800|황축_59,900"
6284361,COX CK20 멤브레인 키보드,"블랙_14,700"
8070895,COX CK2000 V광축 SA 투톤키캡 완전방수 교체축 사이드 RGB 게이밍,"56,680"
5495935,COX CK25 레인보우 LED 게이밍 키보드,"94,000"
6404198,COX CK250 교체축 LED 기계식 게이밍 텐키리스,"블랙, 청축_29,900|블랙, 갈축_29,900|블랙, 적축_29,900|화이트, 갈축_29,900|화이트, 적축_29,900|화이트, 청축_29,900"
5832748,COX CK30 청축형 멤브레인 게이밍,"29,870"
6278417,COX CK420 교체축 레인보우 LED 게이밍 기계식 키보드,"블랙, 청축_32,600|블랙, 갈축_32,600|블랙, 적축_32,600|화이트, 갈축_32,600|화이트, 적축_32,600|화이트, 청축_32,600"
7480522,COX CK450 교체축 사이드 RGB 기계식 게이밍,"블랙, 청축_32,600|블랙, 갈축_32,600|블랙, 적축_32,600|화이트, 갈축_32,600|화이트, 적축_32,600|화이트, 청축_32,600"
6403276,COX CK710 LK 광축 완전방수 교체축 LED 게이밍,"블랙, 클릭_49,000"
6555421,COX CK770 LK 광축 4EDGE RGB 완전방수 교체축 게이밍,"블랙, 클릭_64,900|블랙, 리니어_일시품절"
8083036,COX CK771 V광축 투톤 초코믹스 완전방수 교체축 사이드 RGB 게이밍,"S1, 클릭_36,900|S2, 클릭_36,900"
7635781,COX CK777 V광축 완전방수 교체축 사이드 RGB 게이밍,"블랙, 클릭_42,500|블랙, 넌클릭_245,890|블랙, 리니어_123,510|화이트, 클릭_42,500|화이트, 넌클릭_245,890|화이트, 리니어_245,890"
8868848,COX CK777 WOOD V광축 완전방수 교체축 사이드 RGB 게이밍,"29,900"
7973581,COX CK8000 V광축 완전방수 크리스탈 키캡 교체축 사이드 RGB 게이밍,"클릭_49,000|리니어_일시품절"
8414463,COX CK8100 V광축 완전방수 크리스탈 키캡 교체축 사이드 RGB 게이밍,"S1, 클릭_79,180|S2, 클릭_79,200"
9775686,COX CK8200 V광축 완전방수 크리스탈 키캡 교체축 사이드 RGB 게이밍,"S1, 클릭_56,500|S2, 클릭_56,500"
12086699,COX CK87 BT 게이트론 블루투스 5.0 텐키리스 기계식 게이밍 키보드,"블랙, 청축_69,900|블랙, 갈축_69,900|블랙, 황축_69,900|화이트, 청축_69,900|화이트, 갈축_69,900|화이트, 황축_69,900"
7938631,COX CK87 네이비 게이트론 LED 게이밍 기계식,"갈축_49,900|녹축_49,900|황축_49,900"
7938979,COX CK87 레드/그레이 게이트론 LED 게이밍 기계식,"S1, 갈축_49,900|S1, 녹축_49,900|S1, 황축_49,900|S2, 갈축_49,900|S2, 녹축_49,900|S2, 황축_49,900"
7938520,COX CK87 블랙 게이트론 LED 게이밍 기계식,"갈축_49,900|녹축_49,900|황축_49,900|저소음 갈축_94,700|저소음 황축_94,700"
11063505,COX CK87 크림블루 게이트론 LED 게이밍 기계식,"청축_49,900|갈축_49,900|황축_49,900"
10339050,COX CK87 화이트 게이트론 LED 게이밍 기계식,"갈축_49,900|녹축_49,900|황축_49,900"
12025967,COX CK89 PBT 게이트론 기계식 누메릭 게이밍 키보드,"갈축_59,900|황축_59,900"
12419303,COX CKM01 멤브레인 키보드마우스 세트,"15,400"
5536571,COX CKM10U 키보드 마우스 USB 콤보,"화이트 실버_198,900"
10924074,COX CKM20 무선 키보드 마우스 콤보,"14,900"
12025010,COX CKM30W 저소음 무선 키보드 마우스 세트,"화이트_15,480|블랙_17,000"
5355168,COX CKM500 게이밍 키보드 마우스 콤보,"21,700"
11589167,COX CKM510 게이밍 키보드 마우스 세트,"21,100"
14804228,COX CKR01 TKL 아크릴 키보드 덮개,"7,740"
14802494,COX CKR01 아크릴 키보드 덮개,"8,400"
12757994,COX CNK103 콤팩트 무접점 키보드,"블랙, 50g_99,000"
13994231,COX CNK87 BT,"177,500"
14689772,COX COK100BT 블루투스 펜타그래프 키보드,"블랙_41,420"
14596919,COX COK200BT 블루투스 펜타그래프 키보드,"43,500"
12706379,COX COS1 TKL 텐키리스 어고노믹 월넛 팜레스트,"17,900"
12706313,COX COS1 어고노믹 월넛 팜레스트,"19,150"
11979683,COX COS10 유선 키보드 마우스 세트,"블랙_7,300"
12359927,COX COS100 무선 멤브레인 키보드 마우스 세트,"블랙_19,800|화이트_19,800"
14244110,COX COS2 어고노믹 월넛 팜레스트 For CA106,"23,870"
12614195,COX COS200 저소음 무선 키보드 마우스 세트,"블랙_21,100|화이트_21,100"
13385651,COX COS300 무선 키보드 마우스 세트,"16,900"
14718635,COX COS400 펜타그래프 무선 저소음 키보드 마우스 세트,"블랙_34,990|화이트_36,410"
9788562,COX CV108 BLACK V광축 완전방수 교체축 단일 LED 게이밍,"클릭_34,900|넌클릭_34,880|리니어_34,900"
9735471,COX CV108 WOOD V광축 완전방수 교체축 단일 LED 게이밍,"다크 브라운, 클릭_69,600|레드 브라운, 클릭_24,400|베이지, 클릭_74,400"
14530181,COX CX157 PBT 이색사출 키캡 트레이 세트,"Blue Betta_53,080|Blue Tang_54,070"
14530379,COX CX158 PBT 이색사출 키캡 트레이 세트,"Ocellaris_54,900"
15004838,COX CX87 기계식 TKL 게이밍 키보드,"한글, H1리니어_일시품절|한글, T1넌클릭_일시품절|영문, H1리니어_일시품절|영문, T1넌클릭_일시품절"
15003881,COX CX87 기계식 TKL 게이밍 키보드,"한글, H1리니어_일시품절|한글, T1넌클릭_일시품절|영문, H1리니어_일시품절|영문, T1넌클릭_일시품절"
14828237,COX CY104 게이트론 기계식 키보드 그린,"갈축_64,900|황축_64,900"
14828417,COX CY104 게이트론 기계식 키보드 블루,"황축_64,900|갈축_64,900"
14828387,COX CY104 게이트론 기계식 키보드 블루,"갈축_64,900|황축_64,900"
14828333,COX CY104 게이트론 기계식 키보드 핑크,"갈축_64,900|황축_64,900"
14828321,COX CY104 게이트론 기계식 키보드 핑크,"갈축_64,900|황축_64,900"
11353056,COX 갤리온 CNC 풀 알루미늄 RGB 108키 DIY KIT,"실버_199,000|다크 그레이_199,000|블루_199,000|샴페인 골드_199,000"
7814353,COX 교체축 오테뮤 스위치,"8개, 청축_1,970|8개, 갈축_1,970|8개, 적축_2,000"
6510120,COX 돈틀리스 교체축 염료승화 PBT 체리 키보드,"청축_121,000|갈축_89,900|저소음 적축_일시품절|적축_121,000"
6510071,COX 모나크 교체축 RGB 한영 이중사출 PBT 체리 키보드,"청축_89,900|갈축_89,900|저소음 적축_일시품절|적축_89,900"
8036461,COX 모나크108 교체축 RGB 한영 이중사출 PBT 체리 키보드,"청축_138,000|적축_135,280|갈축_137,180|저소음 적축_163,000"
8201143,COX 블랙펄 CNC 알루미늄 DIY KIT,"블랙_189,000|블루_189,000|샴페인 골드_189,000"
6770245,COX 블랙펄 CNC 풀 알루미늄 텐키리스 체리 키보드,"청축_199,000|갈축_199,000|저소음 적축_199,000|적축_199,000|흑축_199,000"
11615042,COX 엔데버 네이비 에디션 RGB TKL 무접점,"50g_131,020|35g_132,500"
8345919,COX 엔데버 텐키리스 RGB PBT 완전방수 무접점,"블랙, 50g_132,500|화이트, 50g_132,500|블랙, 35g_132,500|화이트, 35g_132,500"
7127530,COX 엠프리스 RGB PBT 완전방수 무접점,"블랙, 50g_163,800|화이트, 50g_163,800|블랙, 35g_163,800|화이트, 35g_163,800"
11615357,COX 엠프리스 네이비 에디션 RGB 무접점,"35g_163,800|50g_150,390"
5828052,COX 카일 정품 광축 스위치,"10개, 클릭_3,500|10개, 리니어_3,500|5+5개, 클릭/리니어_3,200"
10420293,COX 피네스 66키 아크릴 RGB 게이트론 퀵스왑 키보드,"황축_79,000|갈축_79,900"
6082470,DELL KM636,"43,990"
8480829,DURGOD K310 Corona,"화이트, 갈축_149,000"
13387181,DURGOD TAURUS K320 LED 텐키리스 투톤 한영 키보드 블랙/그레이,"갈축_144,000|저소음 적축_155,000|적축_143,950"
13232666,DURGOD 퓨전 블루투스 유무선 기계식 키보드,"STEAM, 청축_186,000|NAVIGATOR, 갈축_186,000|NAVIGATOR, 저소음 적축_199,000|NAVIGATOR, 적축_186,000|NAVIGATOR, 청축_186,000|ORIGINAL, 갈축_186,000|ORIGINAL, 저소음 적축_199,000|ORIGINAL, 적축_186,000|ORIGINAL, 청축_186,000|STEAM, 갈축_186,000|STEAM, 저소음 적축_199,000|STEAM, 적축_186,000"
12235832,Deck CBL-108N Deck Hassium Lite,"청축_122,000|갈축_119,830|저소음 적축_127,000|적축_122,000|흑축_122,000"
12235757,Deck CBL-108P Deck Hassium Pro,"저소음 적축_188,270|청축_187,550|갈축_187,550|적축_187,550"
10675491,Deck CBL-108XN Hassium Geobukseon 블랙에디션,"갈축_154,000|은축_159,000|저소음 적축_154,000|저소음 흑축_159,000|적축_154,000|청축_161,200|흑축_154,000"
2428637,Deck CBL-87P Deck Francium Pro,"저소음 적축_187,990|청축_182,990|갈축_183,000|적축_182,950"
11220657,Deck CBL-87XN Francium Geobukseon 블랙에디션,"청축_150,000|갈축_150,000|은축_162,200|저소음 적축_155,000|저소음 흑축_155,000|적축_152,700|흑축_150,000"
7453453,Diatec FILCO 마제스터치 컨버터블2 크림치즈 한글,"갈축_192,950|저소음 적축_191,010"
6194396,Diatec FILCO 마제스터치2 닌자 한글,"갈축_161,020"
7052692,Ducky ONE 2 MINI RGB PBT 이중사출 한글,"청축_일시품절|갈축_119,000|적축_119,000|저소음 적축_139,000|은축_139,000"
14913209,Ducky ONE 2 MINI RGB PURE WHITE PBT 이중사출 영문,"갈축_129,000|청축_119,000|적축_129,000|저소음 적축_138,950|은축_139,000"
9723786,Ducky ONE 2 SEAMLESS BON VOYAGE PBT 이중사출 영문,"청축_128,000|저소음 적축_137,950"
14998211,Ducky ONE 2 SEAMLESS BON VOYAGE PBT 이중사출 한글,적축_가격비교예정|은축_가격비교예정|갈축_가격비교예정|저소음적축_가격비교예정
12586238,Ducky ONE 2 SEAMLESS TUXEDO PBT 이중사출 한글,"갈축_137,950|적축_137,950|저소음 적축_147,950|은축_147,950"
12549590,Ducky ONE 2 SF RGB PURE WHITE PBT 이중사출 영문,"갈축_139,000|적축_139,000|저소음 적축_149,000|은축_149,000"
9723897,Ducky ONE 2 TKL SEAMLESS BON VOYAGE PBT 이중사출 영문,"청축_130,250|갈축_142,000|저소음 적축_137,950"
14998166,Ducky ONE 2 TKL SEAMLESS BON VOYAGE PBT 이중사출 한글,은축_가격비교예정|갈축_가격비교예정|적축_가격비교예정|저소음적축_가격비교예정
8109733,Ducky ONE 2 TKL SEAMLESS MIDNIGHT PBT 이중사출 영문,"갈축_127,990|저소음 적축_137,990"
6255359,Ducky ONE 2 TKL SEAMLESS SKYLINE PBT 이중사출 한글,"저소음 적축_142,290"
7291267,Ducky ONE 2 WHITE LED SEAMLESS PBT 이중사출 한글,"갈축_142,600|은축_157,950|저소음 적축_158,000|적축_148,950"
14979101,Ducky One 2 SEAMLESS ROSA PBT 이중사출 한글,은축_가격비교예정|갈축_가격비교예정|저소음적축_가격비교예정|적축_가격비교예정
5881376,Ducky PBT 이중 사출 영문 ULTRA VIOLET,"88,080"
7099462,Ducky SHINE7 RGB SEAMLESS PBT 이중사출 한글,"적축_204,600"
4258098,EPIC GEAR 디파이언트 LED 키보드,"GREY_136,360|ORANGE_132,250|PURPLE_207,450"
14516426,EVGA Z15 RGB 게이밍 키보드 한글,"동축_158,950|은축_158,950"
14811578,EVGA Z20 RGB 광축 게이밍 키보드 한글,"리니어_215,950|클릭_215,950"
3689711,G.SKILL GAMING RIPJAWS KM780 RGB,"정품, 갈축_658,000"
11605613,GIGABYTE AORUS K1,"117,700"
5770994,GIGABYTE AORUS K7 게이밍 기계식 키보드,"적축_124,000"
7161334,GIGABYTE AORUS K9 RGB Fusion 광축 게이밍 키보드,"클릭_99,000|리니어_148,950"
10014078,GameSir VX AimSwitch Combo,"129,000"
8636366,HEXGEARS GK705,"백축_68,320|갈축_59,000|적축_68,320"
8635598,HEXGEARS GK755,"백축_88,300|갈축_88,280|적축_89,000"
8635760,HEXGEARS GK757,"백축_77,300|갈축_79,000|적축_78,980"
8913236,HEXGEARS GK760,"119,000"
8634812,HEXGEARS K950,"블랙, 백축_111,860|블랙, 적축_100,000|실버, 적축_119,000"
8634854,HEXGEARS K950 영문,"실버, 백축_113,900"
10443588,HP GK400F LED,"청축_25,380|갈축_25,380|적축_25,900|흑축_25,380"
6230188,HP KM100 Combo,"키스킨 포함_10,300|키스킨 미포함_10,110"
11785609,HP KM300F Combo,"18,900"
11484000,INOTE X-KEY 38BT + 로지텍 M557,"블랙, 블랙_51,780|블랙, 화이트_56,100|핑크, 블랙_51,780|핑크, 화이트_60,030|화이트, 블랙_51,780|화이트, 화이트_60,030"
9956190,Keychron K2 RGB,"라이트그레이, 청축_144,000|다크그레이, 갈축_292,400|다크그레이, 적축_292,400"
13375043,Keychron K2 V2 LED 라이트그레이 핫스왑,"청축_129,000|갈축_129,000|적축_163,000"
13376327,Keychron K2 V2 RGB 다크그레이 알루미늄 핫스왑,"청축_149,000|갈축_149,000|적축_일시품절"
15022013,Keychron K2 XDA PBT 레트로 키캡 영문,"46,870"
15021974,Keychron K2 XDA PBT 레트로 키캡 한글,"49,000"
13740008,Keychron K3 LED,"청축_124,000"
14594963,Keychron K3 V2 LED 라이트그레이 옵티컬 핫스왑,"청축_124,000|갈축_124,000|적축_124,000"
14596235,Keychron K3 V2 RGB 다크그레이,"청축_134,000|갈축_134,000|적축_134,000"
14596568,Keychron K3 V2 RGB 다크그레이 옵티컬 핫스왑,"청축_134,000|갈축_134,000|적축_134,000|백축_일시품절"
14995913,Keychron K3 V2용 키캡 영문,"라이트그레이_29,000|다크그레이_29,000"
14995985,Keychron K3 V2용 키캡 한글,"라이트그레이_29,000|다크그레이_29,000"
14525984,Keychron K4 V2 LED 라이트그레이 핫스왑,"청축_129,000|갈축_129,000|적축_129,000"
14526902,Keychron K4 V2 RGB 다크그레이 알루미늄,"청축_139,000|갈축_139,000|적축_139,000"
14526680,Keychron K4 V2 RGB 라이트그레이,"청축_129,000|갈축_129,000|적축_129,000"
11511707,Keychron K6 LED 옵티컬,"청축_124,000|갈축_124,000|적축_129,000"
15022223,Keychron K6 OEM PBT 레트로 키캡 영문,"43,000"
