9892740,마이크로닉스 MANIC X50 4세대 광축 완전방수 PBT 게이밍 키보드,"블랙 레드_63,880|네이비 그레이_59,100|네이비 스카이블루_59,500|화이트 화이트_62,940"
6322439,마이크로닉스 MANIC X60 RGB 마닉축 축교환 with 푸딩키캡,"청축_104,680|적축_일시품절"
8088784,마이크로닉스 MANIC X70 RGB 엣지디자인 마닉축 기계식 키보드,"적축_104,800"
14075924,마이크로닉스 MANIC ZERO PLUS 게이밍 기계식 키보드,"청축_20,900|갈축_20,900|적축_20,900"
12354605,마이크로닉스 MANIC ZERO 기계식키보드,"청축_19,900|갈축_18,040|적축_18,040"
14761985,마이크로닉스 MECHA ZK-1 RGB 게이밍 기계식 키보드,"갈축_128,600|적축_128,600|백축_128,600"
14858900,마이크로닉스 MORPH MK-1 마닉축 RGB 게이밍 기계식 키보드,"갈축_88,800|적축_88,800|청축_88,800"
14761205,마이크로닉스 WARP WK-1 마닉축 RGB 게이밍 기계식 키보드 블랙,"청축_83,800|갈축_77,400|적축_84,000"
14761394,마이크로닉스 WARP WK-1 마닉축 RGB 게이밍 기계식 키보드 화이트,"청축_84,000|갈축_83,800|적축_84,000"
14906615,모가비 MOG-093 접이식 블루투스 키보드,"실버_26,900|블랙_26,900"
14905307,모가비 MOG-109 키보드 손목받침대,"9,900"
14905679,모가비 MOG-110 키보드 손목받침대,"블랙_11,500|그레이_11,500"
14905913,모가비 MOG-118 블루투스 키보드,"블랙_25,900|핑크_25,900|화이트_25,900"
13385825,몬스타 MK87 화이트 게이밍 기계식키보드 유선키보드,"갈축_39,900|적축_39,900"
14656028,몬스타 MP87 팜레스트,"7,900"
13362941,몬스타 닌자87 블루투스 키보드 게이트론,"갈축_99,000|황축_99,000"
13362995,몬스타 닌자87 블루투스 키보드 체리,"흑축_114,000"
6708283,몬스타 데빌스킬 MK108V2 축교환 기계식 키보드,"레인보우, 갈축_39,900|레인보우, 적축_39,900"
12762659,몬스타 우드팜레스트 키보드손목받침대,"에보니_일시품절|월넛_16,900|웬지_29,900"
15079157,몬스타기어 PBT 영문측각 108키 키캡,블랙_가격비교예정
15048791,몬스타기어 로지텍 k480 키스킨 한영,"1,800"
11226774,비프렌드 RF800K 무선 키보드,"블랙_34,790|실버 블랙_36,300|실버 화이트_35,470|화이트 핑크_일시품절"
5269223,삼성전자 AA-KW1AUWB,"청축_73,770"
1056924,삼성전자 SKG-2000PB PS2,"12,600"
1056910,삼성전자 SKG-3000UB,"키스킨 포함_14,250|키스킨 미포함_12,830"
1795212,삼성전자 SKN-6100UB,"17,900"
5703735,삼성전자 SKP-900B 키보드 마우스 세트,"키스킨 포함_18,600|키스킨 미포함_17,490"
1249177,삼성전자 SKS-9000UB,"키스킨 미포함_16,600|키스킨 포함_15,150"
5782793,삼성전자 SPA-JKA1BUB,"12,700"
15059675,삼성전자 SPA-KKA1BUW + JMA1PUW 유선 키보드 마우스 세트,"34,580"
6436163,삼성전자 SPA-KKA1BUW 유선 키보드,"14,410"
13071926,삼성전자 SPA-KKA2GBB,"31,690"
9249348,삼성전자 SPA-KKG1CU 기계식 키보드,"청축_59,800|갈축_59,800|적축_59,800"
5775961,삼성전자 SRP-9400B,"35,860"
7477474,삼성전자 SRP-9500B,"41,700"
14269259,삼성전자 스마트키보드 트리오 500,"블랙_33,490|화이트_33,490"
7791040,상도아이앤티 ANYZONE WMK-300 무선 키보드 마우스 세트,"블랙_16,400|화이트_16,550"
13543949,샤이닝몰 컴썸 키보드 손목받침대,"9,800"
6499318,세컨드찬스 GEEKSTAR GK801-2 프리미엄 카일 광축 크리스탈 키캡 완전방수,"클릭_67,400|리니어_67,400"
11503011,세컨드찬스 GEEKSTAR GK87 게이트론 텐키리스 기계식 키보드,"청축_59,000|갈축_59,000|황축_59,000"
6440331,스카이디지탈 K2-SE LED 축교환 매크로 기계식 키보드,"청축_59,900"
10179900,스카이디지탈 NKEY BT61 LED 2.0 블루투스 유무선 기계식,"청축_56,200|갈축_56,200|적축_56,200"
8610956,스카이디지탈 NKEY K2-SE 화이트 LED 축교환 매크로 기계식,"청축_48,900|갈축_61,660|적축_48,210"
10430940,스카이디지탈 NKEY RM3 2.0 LED 매크로 기계식,"청축_69,000|갈축_69,000|적축_69,000"
5726218,스카이디지탈 NKEY RM3 LED 매크로 기계식 키보드,"청축_69,000|갈축_69,000|적축_69,000"
5841566,스카이디지탈 NKEY Z1 LED 축교환 듀얼레이어 기계식 키보드,"블랙, 청축_36,700|블랙, 갈축_55,350|블랙, 적축_56,430|화이트, 청축_일시품절"
3781004,스카이디지탈 NKEYBOARD 9키 PBT 더블샷 컬러 키캡,"베이비핑크_4,200|샤이닝레몬_6,290|캐롯오렌지_2,900"
3635318,스카이디지탈 NKEYBOARD BAG 키보드 전용 가방,"25,420"
5756825,스카이디지탈 NKEYBOARD NKEY R1s 레인보우 LED 방진 기계식 게이밍 키보드,"블랙, 청축_124,740"
4977695,스카이디지탈 NKEYBOARD NKEY Ta 레인보우 LED 텐키리스,"블랙, 적축_67,220"
3587506,스카이디지탈 NKEYBOARD NKEY 키캡 리무버,"2,120"
863027,스카이디지탈 NKEYBOARD NKEY-1,"키스킨+손목받침대 포함_31,000"
2415346,스카이디지탈 NKEYBOARD NKEY-2,"31,020"
4629755,스카이디지탈 NKEYBOARD NKEY-A1 RGB 기계식 게이밍 키보드,"블랙, 청축_103,410"
3410712,스카이디지탈 NKEYBOARD NKEY-R3 RGB,"블랙, 청축_89,000|블랙, 갈축_89,000|블랙, 적축_89,000|화이트, 청축_162,660"
4785900,스카이디지탈 NKEYBOARD NKEY-R3 RGB PBT,"블루, 청축_일시품절|블루, 갈축_289,810"
2040560,스카이디지탈 NKEYBOARD NKEY-매크로,"33,000"
2798010,스카이디지탈 NKEYBOARD W303 무선 키보드 마우스,"35,680"
3365466,스카이디지탈 NKEYBOARD W570 무선 키보드 마우스,"블랙_27,900|화이트_27,900"
10555398,스카이디지탈 SKY W270 저소음 무선 키보드 마우스,"블랙, 키스킨 미포함_17,900|그레이, 키스킨 미포함_20,680|블랙, 키스킨 포함_17,900|화이트, 키스킨 미포함_17,900|화이트, 키스킨 포함_17,900"
6227003,스카이디지탈 SKY4600 레인보우 LED 게이밍 키보드,"12,200"
9318975,스카이디지탈 WL320 무선 키보드 마우스 콤보,"23,410"
9763566,스카이디지탈 WS310 무선 키보드 마우스 콤보,"27,150"
2009589,스카이디지탈 nkeyboard nkey-1 전용 실리콘 키스킨,"2,800"
10556034,스틸시리즈 Apex 3,"정품_74,400|해외구매_79,300"
9450495,스틸시리즈 Apex Pro,"정품_258,950|해외구매_281,060"
14075690,써멀테이크 ARGENT K5 RGB 게이밍 키보드,"청축_188,300|은축_198,300"
9557046,써멀테이크 Level 20 RGB 티타늄 게이밍 키보드,"청축_126,450"
3455529,써멀테이크 Tt eSPORTS 포세이돈Z RGB,"청축_52,870"
14075930,써멀테이크 WR1 키보드 손목받침대,"27,800"
6252661,써멀테이크 X1 RGB 체리 MX 실버 게이밍 키보드,"은축_119,000"
6254095,써멀테이크 X1 RGB 체리 MX 청축 게이밍 키보드,"청축_126,440"
12023663,아이리버 EQwear-MVS7000,"화이트_45,000|블랙_45,000"
4820122,아이리버 IR-K2000,"블랙_13,720|화이트_13,720|로즈골드_13,720|코발트블루_13,720"
4810266,아이리버 IR-WMK5000,"블랙_26,900|화이트_26,900|로즈골드_26,620|코발트블루_26,900"
5875945,아이온코리아 PLANTIUM M-G100,"10,800"
5532035,아이온코리아 블랙스톤 G-150,"10,200"
10577571,알파스캔 AOC GK500 게이밍 RGB LED 기계식,"48,600"
13990238,앱코 ACK01 컴팩트 키보드,"블랙_9,700"
13132268,앱코 ADK05 아크릴 듀얼 RGB 게이밍 키보드,"적축_147,300|백축_147,300"
14650787,앱코 AN02 다크그레이 RGB BAR 축교환 기계식 키보드,"청축_34,500|갈축_34,500|적축_34,500"
14650688,앱코 AN02 블랙 RGB BAR 축교환 기계식 키보드,"청축_34,500|갈축_34,500|적축_34,500"
14650835,앱코 AN02 핑크 RGB BAR 축교환 기계식 키보드,"청축_34,500|갈축_34,500|적축_34,500"
10468689,앱코 AR21 CNC 풀 알루미늄 DIY KIT 넘버패드,"실버_117,400|그레이_117,400|네이비_117,400"
9940026,앱코 AR87 CNC 풀 알루미늄 체리키보드,"다크그레이, 청축_446,610|네이비, 갈축_219,000|네이비, 저소음 적축_229,000|네이비, 적축_219,000|네이비, 청축_219,000|네이비, 흑축_219,000|다크그레이, 갈축_445,250|다크그레이, 적축_513,240|다크그레이, 저소음 적축_388,910|실버, 청축_447,237|실버, 갈축_219,000|실버, 적축_512,310|실버, 흑축_440,081|실버, 저소음 적축_465,182"
6452982,앱코 AR96 축교환 CNC 풀 알루미늄 키보드,"다크그레이, 청축_277,500|다크그레이, 갈축_277,500|다크그레이, 적축_277,500|다크그레이, 흑축_277,500|실버, 청축_277,500|실버, 갈축_277,500|실버, 적축_277,500|실버, 흑축_277,500"
12982337,앱코 ARC1 TKL 텐키리스 아크릴 팜레스트 손목 받침대,"ICE Acrylic_13,800|Clear Acrylic_13,800"
12977087,앱코 ARC1 아크릴 팜레스트 손목 받침대,"Clear Acrylic_15,900|ICE Acrylic_15,900"
5894353,앱코 BRAIN WK310 무선 미니 키보드,"31,350"
6152022,앱코 BRAIN WKM200 무선콤보,"19,790"
13007576,앱코 BT220 멀티페어링 블루투스 키보드,"21,100"
12373433,앱코 BT250 멀티페어링 블루투스 키보드,"블랙_25,400"
8038162,앱코 HACKER 6key 컬러풀 포인트 키캡,"V1_2,900|V2_2,900|V3_2,900"
12130040,앱코 HACKER ADK01 BT 블루투스 5.0 카일박스축 게이밍 기계식 키보드,"레드그레이, 백축_419,000|레드그레이, 갈축_120,250|레드그레이, 적축_176,730"
12119666,앱코 HACKER ADK01 카일박스축 게이밍 기계식 키보드,"레드그레이, 갈축_59,900|레드그레이, 백축_59,900|레드그레이, 적축_59,900"
11909560,앱코 HACKER ADK87 PBT 이색사출 텐키리스 체리 기계식 키보드,"블랙, 청축_69,900|블랙, 갈축_69,900|블랙, 저소음 적축_79,900|블랙, 적축_69,900|화이트, 갈축_69,900|화이트, 저소음 적축_79,900|화이트, 적축_69,900|화이트, 청축_69,900"
11167377,앱코 HACKER ARC 거치대,"5,500"
9939768,앱코 HACKER GKM570 키보드 마우스 LED 게이밍 콤보,"블랙_44,400|화이트_44,400"
6127234,앱코 HACKER K1000 LED 에디션 축교환 게이밍,"레드, 청축_41,500|옐로우, 갈축_78,700|옐로우, 청축_39,500"
5299013,앱코 HACKER K1000 축교환 게이밍 기계식,"블랙, 청축_26,900|화이트, 청축_26,900"
11015091,앱코 HACKER K150 텐키리스 레인보우 LED 게이밍 멤브레인,"10,500"
5618641,앱코 HACKER K180 레인보우 LED 멤브레인,"블랙_22,200"
3248321,앱코 HACKER K300 게이밍 키보드,"22,200"
10106718,앱코 HACKER K315 텐키리스 축교환 측면 RGB 라이팅 이중사출 게이밍 기계식 키보드,"블랙, 청축_19,900|블랙, 갈축_19,900|블랙, 적축_19,900"
6385574,앱코 HACKER K511 카일 광축 완전방수 축교환 게이밍 키보드 어반그레이,"V1, 클릭_41,500|V2, 클릭_58,900|V1, 리니어_58,900|V2, 리니어_58,900"
8516247,앱코 HACKER K512 체리쉬 염료승화 PBT 텐키리스 체리 게이밍 키보드,"청축_106,000|갈축_106,000|적축_106,000"
9321180,앱코 HACKER K515 축교환 측면 RGB 라이팅 이중사출 게이밍 기계식 키보드,"블랙, 청축_29,900|블랙, 갈축_29,900|블랙, 적축_29,900|화이트, 갈축_29,900|화이트, 적축_29,900|화이트, 청축_29,900"
9326619,앱코 HACKER K516 축교환 측면 RGB 라이팅 이중사출 게이밍 기계식 키보드,"레드, 청축_30,900|레드, 갈축_30,900|레드, 적축_30,900|옐로우, 갈축_30,900|옐로우, 적축_30,900|옐로우, 청축_30,900"
9647322,앱코 HACKER K523 기계식 축교환 LED 키패드,"14,300"
12224390,앱코 HACKER K525 GTMX 축교환 게이밍 기계식 키보드,"청축_37,600|갈축_37,600|적축_37,600"
10272321,앱코 HACKER K550 A광축 축교환 측면 RGB 라이팅 완전방수 이중사출 게이밍 키보드,"블랙, 클릭_39,800"
10272501,앱코 HACKER K5500 A광축 축교환 측면 RGB 라이팅 완전방수 크리스탈 게이밍 키보드,"블랙, 클릭_58,600"
6281637,앱코 HACKER K590 축교환 LED 게이밍 기계식 키보드,"블랙, 청축_29,900|블랙, 갈축_29,900|블랙, 적축_29,900|화이트, 청축_29,900"
8323581,앱코 HACKER K595 LED 축교환 게이밍 기계식,"블랙, 청축_32,500|블랙, 갈축_32,300|블랙, 적축_31,370|화이트, 청축_32,600"
9844782,앱코 HACKER K611 텐키리스 카일광축 완전방수 축교환 게이밍 키보드,"네이비 V1, 클릭_39,900|네이비 V1, 리니어_39,900|네이비 V2, 리니어_39,900|네이비 V2, 클릭_39,900|핑크 V1, 리니어_39,900|핑크 V1, 클릭_39,900|핑크 V2, 리니어_39,900|핑크 V2, 클릭_39,900"
4709084,앱코 HACKER K640 축교환 게이밍 기계식,"블랙, 청축_29,900|블랙, 갈축_29,480|블랙, 적축_29,900|화이트, 청축_29,900"
6392214,앱코 HACKER K640 플러스 축교환 측면 LED 게이밍 키보드,"블랙, 청축_34,890|블랙, 갈축_34,890|블랙, 적축_34,900|화이트, 청축_34,890"
5139143,앱코 HACKER K640T 축교환 게이밍 기계식 텐키리스,"블랙, 청축_28,900|블랙, 갈축_28,900|블랙, 적축_28,900"
5359118,앱코 HACKER K6500 PBT 스페셜 블루 에디션,"청축_62,000"
9883827,앱코 HACKER K660 ARC SA 초콜릿 믹스 카일광축 완전방수 오렌지 LED 키보드,"클릭_39,900"
7812220,앱코 HACKER K660 ARC 프리미엄 카일 광축 완전방수 RGB LED,"블랙, 클릭_67,300|레드, 클릭_67,300|옐로우, 클릭_67,300|블랙, 리니어_67,300|레드, 리니어_67,300|옐로우, 리니어_67,300"
7637752,앱코 HACKER K660 ARC 프리미엄 카일 광축 완전방수 레인보우 LED,"블랙, 클릭_67,300|레드, 클릭_67,300|옐로우, 클릭_67,300|블랙, 리니어_65,620|레드, 리니어_67,300|옐로우, 리니어_67,300"
4588702,앱코 HACKER K660 게이밍 기계식 카일 방진축,"옐로우, 청축_47,900"
6571880,앱코 HACKER K660 단일 LED 에디션 카일 광축 축교환 완전방수 게이밍,"블랙, 클릭_47,900"
5221479,앱코 HACKER K660 축교환 완전방수 게이밍 카일 광축,"블랙, 클릭_47,880|레드, 클릭_47,900|옐로우, 클릭_47,900|화이트, 클릭_47,900|블랙, 리니어_47,900|레드, 리니어_47,900|옐로우, 리니어_47,900|화이트, 리니어_47,900"
11137779,앱코 HACKER K660M 이색사출 PBT 체리 키보드,"블랙, 청축_75,000|미드나잇그린, 갈축_75,000|미드나잇그린, 저소음 적축_118,900|미드나잇그린, 적축_75,000|미드나잇그린, 청축_75,000|블랙, 갈축_75,000|블랙, 저소음 적축_85,000|블랙, 적축_75,000"
7818658,앱코 HACKER K661 카일 광축 완전방수 축교환 어썸블루,"블랙 V1, 클릭_62,400|블랙 V2, 클릭_62,400"
6044153,앱코 HACKER K662 카일 광축 완전방수 축교환 어반그레이,"V1, 클릭_63,600|V2, 클릭_64,600|V1, 리니어_64,600|V2, 리니어_64,600"
6377726,앱코 HACKER K663 카일 광축 완전방수 축교환 LED 알루미늄 게이밍 키보드,"레드, 클릭_58,900"
8015860,앱코 HACKER K664 ARC 프리미엄 카일 광축 완전방수 LED 데빌,"V1, 클릭_42,900|V1, 리니어_42,900|V2, 클릭_42,900|V2, 리니어_42,900"
4602335,앱코 HACKER K670 레인보우 볼륨다이얼 게이밍 기계식,"청축_78,000"
12004670,앱코 HACKER K6700 카일광축 메탈릭 무빙 LED 게이밍 기계식 키보드,"클릭_66,500"
6605095,앱코 HACKER K701 카일 광축 완전방수 4면 RGB LED,"블랙, 클릭_55,000"
6604519,앱코 HACKER K702 카일 광축 완전방수 4면 RGB 그레이믹스,"V2, 클릭_59,950"
11157819,앱코 HACKER K711 ARC 카일광축 완전방수 사이드 RGB 화이트 LED,"V1, 클릭_49,900|V2, 클릭_49,900"
5750796,앱코 HACKER K770 카일 광축 축교환 완전방수 게이밍,"블랙, 클릭_52,260"
11874703,앱코 HACKER K7900 카일광축 완전방수 레인보우 PBT Moving LED,"클릭_95,300"
11409333,앱코 HACKER K8200 카일광축 완전방수 크리스탈 투톤 레인보우 Moving LED,"V1, 클릭_70,000|V2, 클릭_70,000"
5326943,앱코 HACKER K820T 축교환 조약돌 레트로 87키,"블랙, 적축_93,290"
11519342,앱코 HACKER K8300 카일광축 완전방수 사이드 RGB 크리스탈 투톤 게이밍 키보드,"V1 클릭_72,100|V2 클릭_72,100"
5546958,앱코 HACKER K840 조약돌 레트로 축교환 기계식,"블랙, 청축_36,600|블랙, 갈축_36,600|블랙, 적축_36,580|화이트, 청축_36,600|화이트, 갈축_36,600|화이트, 적축_36,600|화이트LED, 핑크, 청축_36,310"
4549610,앱코 HACKER K850 알루미늄 레트로 기계식,"백축_164,800"
5734329,앱코 HACKER K850 알루미늄 레트로 엣지,"핑크, 백축_160,880"
6771466,앱코 HACKER K8700 RED LED 에디션 카일 광축 축교환 완전방수 게이밍,"블랙, 클릭_45,000"
5430107,앱코 HACKER K8700 카일 광축 완전방수 크리스탈 키캡,"블랙, 클릭_69,900|옐로우, 클릭_69,900|레드/핑크, 클릭_69,900|레드/화이트, 클릭_69,900"
8936366,앱코 HACKER K8800 카일 광축 완전방수 축교환 크리스탈 키캡,"레드, 클릭_69,900|화이트 V1, 클릭_69,900|화이트 V2, 클릭_69,900"
6450798,앱코 HACKER K8900 카일 광축 완전방수 어반그레이,"V1, 클릭_74,100|V2, 클릭_74,100|V1, 리니어_74,100|V2, 리니어_74,100"
6915427,앱코 HACKER K9000 아틀란티스 카일 광축 완전방수 크리스탈 키캡 레인보우,"클릭_130,260"
8515131,앱코 HACKER K9100 ARC 프리미엄 카일 광축 크리스탈 키캡 완전방수 LED,"레드, 클릭_76,200|옐로우, 클릭_76,200|블랙, 클릭_76,200"
9297786,앱코 HACKER K9300 ARC 핑크펄 카일 광축 완전방수 크리스탈 키캡,"클릭_78,300"
4864124,앱코 HACKER K945P V2 RGB PBT 무접점,"45g_97,260"
9309579,앱코 HACKER K9500 ARC 프리미엄 카일 광축 완전방수 투광 키캡,"77,000"
9242871,앱코 HACKER K990 V3 스카이문 LED 완전방수 무접점,"45g_176,400"
6413846,앱코 HACKER K995P V3 RGB PBT 무접점,"화이트, 45g_161,050|블랙, 45g_163,800"
12067004,앱코 HACKER K997P PBT 투톤 RGB 완전방수 무접점 키보드,"블랙, 45g_163,800|화이트, 45g_163,800"
6843574,앱코 HACKER KM350 키보드 마우스 콤보 레인보우 LED 게이밍,"21,700"
5182267,앱코 HACKER KM400 게이밍 콤보,"21,700"
13050158,앱코 HACKER KM700 게이밍 키보드 마우스 장패드 세트,"블랙_21,100"
11834479,앱코 HACKER KN01 텐키리스 PBT RGB 무접점 키보드,"블랙, 45g_99,000|블랙, 55g_99,000|화이트, 45g_99,000|화이트, 55g_99,000"
12170540,앱코 HACKER KN10 PBT RGB 무접점 키보드,"블랙, 45g_109,000|블랙, 55g_109,000|화이트, 45g_109,000|화이트, 55g_109,000"
5228638,앱코 HACKER QUICK SWAP용 OUTEMU 스위치,"8개, 청축_2,200|8개, 갈축_2,200|8개, 적축_2,200|각2개, 청축/갈축/적축/흑축_2,200"
5908168,앱코 HACKER 배틀 가이드 PBT 염료승화 108키,"29,900"
5247997,앱코 HACKER 조약돌 레트로 한영이중사출 104,"블루_7,890|핑크_7,900|연보라_7,550"
5827146,앱코 HACKER 카일 정품 광축 스위치,"10개, 클릭_3,500|10개, 리니어_4,300|5+5개, 클릭/리니어_3,500"
2788274,앱코 K-A4U,"6,300"
3357054,앱코 K100U 동시 16키,"17,000"
12278276,앱코 K551 A광축 사이드 Edge RGB LED 게이밍 키보드,"클릭_46,600"
13363175,앱코 K560 축교환 레인보우 무빙 LED 기계식 키보드,"청축_20,150|갈축_21,500|적축_21,500"
14471114,앱코 K570 축교환 레인보우 무빙 LED 기계식 키보드,"청축_21,500|갈축_21,500|적축_21,500"
13363517,앱코 K640T SLIM 축교환 무빙LED 텐키리스 기계식,"청축_38,100|적축_38,100"
13208633,앱코 K660P 프리미엄 카일광축 무빙 LED 게이밍 기계식 키보드,"마젠타, 클릭_65,700|다크 그레이, 클릭_65,700"
9494331,앱코 KM110 RGB 멤브레인 키보드 마우스 합본,"블랙_16,400|화이트_16,270"
9494352,앱코 KM120 RGB 멤브레인 키보드 마우스 합본,"블랙_16,400|화이트_16,400"
11859295,앱코 KM140 유선 키보드 마우스 오피스 세트,"화이트_12,700"
12399617,앱코 KM150 키보드 마우스 오피스 세트,"15,400"
12471623,앱코 KM250 키보드 마우스 세트,"8,400"
3831414,앱코 KM60 무선 Combo,"14,300"
10282032,앱코 KM70 키보드 마우스 무선 콤보,"115,600"
12376391,앱코 KN01 BT 블루투스 TKL 무접점 게이밍 키보드,"블랙, 45g_119,000|블랙, 55g_119,000|화이트, 45g_119,000|화이트, 55g_119,000"
12376532,앱코 KN10 BT 블루투스 무접점 게이밍 키보드,"블랙, 45g_129,000|블랙, 55g_129,000|화이트, 45g_129,000|화이트, 55g_129,000"
9925461,앱코 KP10 키패드,"5,800"
9925545,앱코 KP20 키패드,"6,500"
9925596,앱코 KP30 키패드,"8,100"
2241246,앱코 MultiPack KM-A4P,"6,900"
2682415,앱코 MultiPack KM-A4U,"6,900"
2241240,앱코 MultiPack KM-A5PS,"키스킨 포함_7,900"
14216075,앱코 PUBG 배틀그라운드 하자드 에디션 카일 광축,"62,000"
14321915,앱코 TOS100 무선 키보드,"29,900"
13655036,앱코 TOS200 LED 블루투스 키보드,"로즈골드_47,500|블랙_47,500"
13653470,앱코 TOS250 LED 블루투스 키보드,"블랙_39,900|화이트_39,900"
14567123,앱코 TPM1 TKL 어고노믹 월넛 팜레스트,"17,900"
14567039,앱코 TPM1 어고노믹 월넛 팜레스트,"21,100"
12423566,앱코 TW1867 레트로 블루투스 기계식 키보드,"청축_111,500|적축_111,500"
11123001,앱코 WKM01 무선 키보드 마우스 세트,"핑크_21,080|민트_21,080|블루_21,080"
11480676,앱코 WKM02 무선 키보드 마우스 세트,"블랙_19,000|화이트_19,000"
13912325,앱코 WKM03 무선 키보드마우스 세트,"블랙_18,900|핑크_18,900"
12098402,앱코 WKM160 펜타그래프 무선 키보드 마우스 오피스 세트,"19,900"
12129872,앱코 WKM360 무선 터치패드 키보드,"25,400"
13037375,앱코 WKM40 무선 키보드 마우스 세트,"베이지_21,100"
13037483,앱코 WKM50 펜홀더형 무선 키보드 마우스 세트,"핑크_21,100|네이비_21,100"
13037591,앱코 WKM60 무선 키보드 마우스 세트,"블랙_21,100"
12278561,앱코 WKM620 TKL 멀티 컬러 육각키캡 무선 미니 키보드 마우스 세트,"옐로우_28,000|피치_28,000|핑크_28,000"
12257405,앱코 WKM650 멀티 컬러 육각키캡 무선 키보드 마우스 세트,"핑크_33,500|스카이 블루_33,200|카키_33,500"
9267093,앱코 WKM810 키보드 마우스 무선콤보,"브라운_16,500|블랙_16,500"
13860356,앱코 WKM900 무소음 무선 키보드 마우스 세트,"블랙_19,900"
5682280,앱코 레트로 써클 컬러 키캡 104키,"화이트, 골드_일시품절|화이트, 실버_31,000|핑크_31,000"
4291175,앱코 레트로 써클 키캡,"68키_43,900|87키_48,500|104키_53,000"
3768021,앱코 초콜릿 KM80 무선 Combo,"골드_32,400|블랙_32,400|핑크_18,000"
5211477,에이데이타코리아 DDZONE AKplus AK-K450 LED 플런저 키보드,"11,310"
3558495,에이데이타코리아 DDZONE DK-BT9000,"12,220"
3666473,에이데이타코리아 DDZONE DMK-W5000,"11,010"
5780208,에이데이타코리아 DDZONE K-350 LED 게이밍 키보드,"10,310"
11785303,에이데이타코리아 GOON GK-1700USB,"5,900"
12105098,에이데이타코리아 GOON GK-2300 LED,"11,270"
14892053,에이데이타코리아 Standard DK-201,"5,240"
12763688,엠스톤글로벌 mStone Groove F 실리콘 다크그레이,"저소음 갈축_144,000"
12726920,엠스톤글로벌 mStone Groove F 풀윤활 실리콘 다크그레이,"갈축, 35g_146,000|갈축, 45g_146,000|은축_154,000|저소음 적축, 35g_154,000|저소음 적축, 45g_154,000|적축_146,000"
14904278,엠스톤글로벌 mStone Groove F 풀윤활 실리콘 클라리온2,"저소음적축, 35g_159,000|저소음적축, 45g_159,000|갈축, 45g_149,000|적축, 45g_149,000"
11186187,엠스톤글로벌 mStone Groove T 87A SF 라이트그레이,"저소음 갈축_129,000"
10341426,엠스톤글로벌 mStone Groove T SF 실리콘 페인팅플레이 핑크,"갈축_129,000|은축_139,000|저소음 적축_139,000"
12192710,엠스톤글로벌 mStone Groove T 풀윤활 실리콘 다크 그레이,"오레오축_199,420|갈축, 45g_156,640|은축_149,000|저소음 적축, 35g_149,000|저소음 적축, 45g_149,000|적축_일시품절|코랄축, 38g_일시품절|크림축, 55g_189,000|흑축_191,900"
13485248,엠스톤글로벌 mStone Groove T 풀윤활 실리콘 클라리온 + 키캡,"갈축, 35g_144,000"
13991360,엠스톤글로벌 mStone Groove T 풀윤활 실리콘 클라리온2,"갈축, 45g_144,000|저소음 적축, 35g_166,940|저소음 적축, 45g_154,000|적축_144,000"
14519390,엠스톤글로벌 mStone 아이스버그 87Key 한영 키캡,일시품절
12169160,엠스톤글로벌 mStone 크리스탈 팜레스트 360 블랙,"BASIC_29,000|위국헌신_29,000|훈민정음_29,000|흑룡_29,000"
12692273,엠스톤글로벌 mStone 크리스탈 팜레스트 440 블랙,"BASIC_33,000|위국헌신_33,000|훈민정음_33,000|흑룡_33,000"
15066272,엠스톤글로벌 다크그레이 87키 키캡,8비트_가격비교예정|훈민정음_가격비교예정|영문좌상_가격비교예정|무각_가격비교예정
15064265,엠스톤글로벌 사군자 스페이스바,"난_가격비교예정|국_7,900|죽_7,900|매_7,900"
15061325,엠스톤글로벌 스페이스바,"인디핑크_4,900|세이지그린_4,900|옐로우_4,900|레드_4,900|퍼플_4,900"
15064658,엠스톤글로벌 흑룡 승화 스페이스바,"다크시티_7,900|다크그레이_가격비교예정"
14893382,오젬 블루투스 키보드,"실버_12,340|블랙_12,340"
7888963,웨이코스 씽크웨이 CROAD BK620 턴 블루투스 유무선 기계식 키보드,"청축_69,500|갈축_69,500|적축_69,500"
6186896,웨이코스 씽크웨이 CROAD C604 체리미엄 PBT 측각 한영 게이밍 키보드,"청축_77,860|갈축_79,000|적축_78,980|흑축_78,980|은축_83,000|저소음 적축_81,250"
5867148,웨이코스 씽크웨이 CROAD C704 체리미엄 PBT LED 기계식 키보드,"청축_일시품절|적축_115,000"
6398867,웨이코스 씽크웨이 CROAD K10 LED 기계식 숫자 키패드,"청축_15,890|갈축_15,890|적축_15,290"
