14761970,마이크로닉스 MECHA ZK-1 RGB 게이밍 기계식 키보드,"갈축_64,900|적축_60,800|백축_59,900","갈축_64,900|적축_60,800|백축_60,800","갈축_64,900|적축_60,800|백축_60,800"
14858900,마이크로닉스 MORPH MK-1 마닉축 RGB 게이밍 기계식 키보드,"청축_79,310|갈축_61,900|적축_73,900","청축_68,790|갈축_60,000|적축_61,900","청축_68,790|갈축_60,000|적축_61,900"
14761205,마이크로닉스 WARP WK-1 마닉축 RGB 게이밍 기계식 키보드 블랙,"청축_65,190|갈축_65,200|적축_65,200","청축_64,990|갈축_64,350|적축_64,990","청축_64,990|갈축_64,350|적축_64,990"
14761394,마이크로닉스 WARP WK-1 마닉축 RGB 게이밍 기계식 키보드 화이트,"청축_64,990|갈축_65,200|적축_65,300","청축_64,990|갈축_64,990|적축_64,990","청축_64,990|갈축_64,990|적축_64,990"
18460013,마이크로닉스 WIZMAX W101P 4세대 광축 완전방수 PBT,"스카이 블루_63,790|애쉬 핑크_63,690|피코크 그린_67,000","스카이 블루_63,690|애쉬 핑크_60,280|피코크 그린_66,300","스카이 블루_63,590|애쉬 핑크_60,200|피코크 그린_66,300"
17580434,마이크로닉스 ZOMO 크리스탈 냥냥젤리 포인트 키캡,"19,500","19,500","19,500"
17307470,마이크로닉스 iWORKS 민트 에디션 기계식 키보드 마우스 키캡 세트,"적축_52,420","적축_52,420","적축_52,420"
16301705,마이크로닉스 iWORKS 퍼플 에디션 기계식 키보드 마우스 키캡 세트,"적축_55,200","적축_55,200","적축_55,200"
17958569,마이크로닉스 메카 ZK1 마닉축 RGB 기계식 키보드,"갈축_89,350","갈축_89,350","갈축_89,350"
16361963,마이크로닉스 메카 ZK2 마닉축 RGB 게이밍 기계식 키보드,"청축_87,990|갈축_84,310|적축_86,140","청축_83,790|갈축_84,310|적축_83,790","청축_83,790|갈축_83,790|적축_83,790"
16331504,마이크로닉스 워프 WK2 마닉축 RGB 게이밍 기계식 키보드,"청축_70,900|갈축_70,900|적축_70,900","청축_70,900|갈축_70,900|적축_70,900","청축_70,900|갈축_70,900|적축_70,900"
16332077,마이크로닉스 워프 WK3 마닉축 블루투스 RGB 텐키리스 게이밍 기계식 키보드,"청축_85,900|갈축_85,900|적축_86,000","청축_85,900|갈축_85,900|적축_86,000","청축_85,900|갈축_85,900|적축_86,000"
16335209,마이크로닉스 워프 WK4 마닉축 RGB 텐키리스 게이밍 기계식 키보드,"청축_65,900|갈축_65,900|적축_65,900","청축_65,900|갈축_65,900|적축_65,900","청축_65,900|갈축_65,900|적축_65,900"
16523606,마이크로닉스 클라로 이중사출 크리스탈 클리어 104 키캡,"스카이블루_17,000","스카이블루_17,000","스카이블루_17,000"
20522678,메타블 메텐프로 기계식,"청축_27,500|갈축_27,500|적축_27,500",0,0
18975341,모키보 MKB420 블루투스,"113,000",0,0
12332198,몬스타 MK16BT 체리 블루투스 5.0 기계식 키보드,"갈축_89,800|적축_69,000","갈축_89,800|적축_69,000","갈축_89,800|적축_69,000"
13385852,몬스타 MK87 블랙 게이밍 기계식 키보드,"갈축_39,900|적축_39,900","갈축_39,900|적축_39,900","갈축_39,900|적축_39,900"
15698054,몬스타 닌자87BT 화이트 블루투스 키보드 게이트론,"갈축_99,000|백축_125,000","갈축_99,000|백축_125,000","갈축_99,000|백축_125,000"
15698084,몬스타 닌자87BT 화이트 블루투스 키보드 체리,"흑축_99,000","흑축_99,000","흑축_99,000"
5818348,몬스타 데빌스킬 GK104DJ 리듬게임 RGB 게이밍,"20,000","20,000","20,000"
6102417,몬스타 데빌스킬 GUTS 프로게이밍 카일박스축 사이드 풀RGB PBT 방수방진,"백축_99,000","백축_99,000","백축_99,000"
5872811,몬스타 데빌스킬 MK108GOD 퀵스왑 축교체 커스텀 키보드,"청축_35,000","청축_35,000","청축_35,000"
19299425,몬스타 몬스타기어 GK104 클래식,"15,000","15,000","15,000"
28883816,몬스타 몬스타기어 GrainGold 발해블루 스위치 10pcs,"2,500","2,500","2,500"
20352815,몬스타 몬스타기어 Haimu 바다소금 스위치 10pcs,"2,800",일시품절,일시품절
20353943,몬스타 몬스타기어 Haimu 발해블루 스위치 10pcs,일시품절,일시품절,일시품절
20355374,몬스타 몬스타기어 KTT 강백축V3 스위치 10pcs,"2,500","2,500","2,500"
14140583,몬스타 몬스타기어 MGT SOS 키보드 스위치 오프너,"블랙_8,900|실버_8,900","블랙_8,900|실버_8,900","블랙_8,900|실버_8,900"
18369887,몬스타 몬스타기어 MK308 풀윤활 광축 커스텀 키보드,"다크그레이, 갈축_117,000|다크그레이, 황축_117,000|블랙푸딩, 갈축_117,000|블랙푸딩, 황축_155,500|빅히트블랙, 갈축_105,000||","다크그레이, 갈축_117,000|다크그레이, 황축_117,000|블랙푸딩, 갈축_117,000|블랙푸딩, 황축_155,500|빅히트블랙, 갈축_105,000||","다크그레이, 갈축_117,000|다크그레이, 황축_117,000|블랙푸딩, 갈축_117,000|블랙푸딩, 황축_155,500|빅히트블랙, 갈축_105,000||"
17161487,몬스타 몬스타기어 Melgeek Mojo68 Retro 유무선 키보드,"262,000","262,000","262,000"
15528293,몬스타 몬스타기어 PBT 영문정각 108키 키캡,"베이지 화이트_39,900","베이지 화이트_39,900","베이지 화이트_39,900"
15137306,몬스타 몬스타기어 PBT 영문정각 포인트 키캡,"다크그레이_5,000","다크그레이_5,000","다크그레이_5,000"
15079157,몬스타 몬스타기어 PBT 영문측각 108키 키캡,"블랙_29,900","블랙_29,900","블랙_29,900"
20190641,몬스타 몬스타기어 PBT 한영정각 104키 키캡,"그레이옐로우_18,000","그레이옐로우_18,000","그레이옐로우_18,000"
16141688,몬스타 몬스타기어 PBT 한영정각 108 키캡,"화이트_18,990","화이트_18,990","화이트_18,990"
15407504,몬스타 몬스타기어 PBT염료승화 영문 정각 37키 키캡,"8,500","8,500","8,500"
28649270,몬스타 몬스타기어 고양이 8키 포인트 키캡,"12,990","12,990","12,990"
28477022,몬스타 몬스타기어 닌자104PRO 유무선 커스텀 기계식 블랙,"황축_199,000|갈축_199,000|백축_199,000|적축_199,000","황축_199,000|갈축_199,000|백축_199,000|적축_199,000","황축_199,000|갈축_199,000|백축_199,000|적축_199,000"
28476782,몬스타 몬스타기어 닌자104PRO 유무선 커스텀 기계식 화이트,"황축_199,000|갈축_199,000|백축_199,000|적축_199,000","황축_199,000|갈축_199,000|백축_199,000|적축_199,000","황축_199,000|갈축_199,000|백축_199,000|적축_199,000"
20369636,몬스타 몬스타기어 닌자108 PRO 유무선 DIY KIT 커스텀 기계식,"89,000","89,000","89,000"
19471640,몬스타 몬스타기어 닌자108PRO 기계식 커스텀 유무선 카일,"쑥인절미, 백축_170,000|쑥인절미, 적축_170,000|피치요거트, 갈축_170,000|피치요거트, 백축_170,000|피치요거트, 적축_170,000","쑥인절미, 백축_170,000|쑥인절미, 적축_170,000|피치요거트, 갈축_170,000|피치요거트, 백축_170,000|피치요거트, 적축_170,000",0
19471628,몬스타 몬스타기어 닌자108PRO 기계식 커스텀 유무선 카일,0,0,"쑥인절미, 백축_170,000|쑥인절미, 적축_170,000|피치요거트, 갈축_170,000|피치요거트, 백축_170,000|피치요거트, 적축_170,000"
20538419,몬스타 몬스타기어 닌자108PRO 유무선 기계식,"흑임자라떼, 황축_160,000","흑임자라떼, 황축_160,000","흑임자라떼, 황축_160,000"
28474946,몬스타 몬스타기어 닌자84PRO 유무선 커스텀 기계식 블랙,"황축_179,000|갈축_179,000|백축_179,000|적축_179,000","황축_179,000|갈축_179,000|백축_179,000|적축_179,000","황축_179,000|갈축_179,000|백축_179,000|적축_179,000"
28474877,몬스타 몬스타기어 닌자84PRO 유무선 커스텀 기계식 화이트,"황축_179,000|갈축_179,000|백축_179,000|적축_179,000","황축_179,000|갈축_179,000|백축_179,000|적축_179,000","황축_179,000|갈축_179,000|백축_179,000|적축_179,000"
13362989,몬스타 몬스타기어 닌자87 블루투스 키보드 게이트론,"갈축_99,000|황축_99,000","갈축_99,000|황축_99,000","갈축_99,000|황축_99,000"
13362995,몬스타 몬스타기어 닌자87 블루투스 키보드 체리,"흑축_99,000","흑축_99,000","흑축_99,000"
15868649,몬스타 몬스타기어 닌자87BT WHITE 블루투스 기계식 키보드,"갈축_99,000|백축_99,000","갈축_99,000|백축_99,000","갈축_99,000|백축_99,000"
16151633,몬스타 몬스타기어 닌자87PRO G RGB 유무선 기계식 커스텀 키보드 블랙,"청축_99,500|갈축_99,500|황축_99,500|적축_99,500|백축_99,500|","청축_99,500|갈축_99,500|황축_99,500|적축_99,500|백축_99,500|","청축_99,500|갈축_99,500|황축_99,500|적축_99,500|백축_99,500|"
16151918,몬스타 몬스타기어 닌자87PRO G RGB 유무선 기계식 커스텀 키보드 화이트,"청축_99,500|갈축_99,500|황축_99,500|적축_99,500|백축_99,500|","청축_99,500|갈축_99,500|황축_99,500|적축_99,500|백축_99,500|","청축_99,500|갈축_99,500|황축_99,500|적축_99,500|백축_99,500|"
16150232,몬스타 몬스타기어 닌자87PRO K RGB 유무선 기계식 커스텀 키보드,"99,500","99,500","99,500"
17238836,몬스타 몬스타기어 닌자87PRO P RGB 유무선 기계식 키보드 퍼플레빗,청축_일시품절|갈축_일시품절|적축_일시품절,청축_일시품절|갈축_일시품절|적축_일시품절,청축_일시품절|갈축_일시품절|적축_일시품절
16150424,몬스타 몬스타기어 닌자87PRO RGB DIY 커스텀 기계식 키보드,"69,000","69,000","69,000"
17241050,몬스타 몬스타기어 닌자87PRO S RGB 유무선 기계식 커스텀 키보드,"110,000","110,000","110,000"
28477667,몬스타 몬스타기어 닌자87PRO v2 유무선 DIY KIT 커스텀 기계식,"화이트_79,000|블랙_79,000|퍼플_79,000","화이트_79,000|블랙_79,000|퍼플_79,000","화이트_79,000|블랙_79,000|퍼플_79,000"
28487348,몬스타 몬스타기어 닌자87PRO v2 유무선 커스텀 기계식 블랙,"황축_99,500|갈축_99,500|백축_99,500|적축_99,500","황축_99,500|갈축_99,500|백축_99,500|적축_99,500","황축_99,500|갈축_99,500|백축_99,500|적축_99,500"
28487411,몬스타 몬스타기어 닌자87PRO v2 유무선 커스텀 기계식 퍼플,"황축_99,500|갈축_99,500|백축_99,500|적축_99,500","황축_99,500|갈축_99,500|백축_99,500|적축_99,500","황축_99,500|갈축_99,500|백축_99,500|적축_99,500"
28487078,몬스타 몬스타기어 닌자87PRO v2 유무선 커스텀 기계식 화이트,"황축_99,500|갈축_99,500|백축_99,500|적축_99,500","황축_99,500|갈축_99,500|백축_99,500|적축_99,500","황축_99,500|갈축_99,500|백축_99,500|적축_99,500"
17432522,몬스타 몬스타기어 닌자87PRO 풀윤활 기계식 키보드,"갈축_159,000|적축_159,000",0,"갈축_159,000|적축_159,000"
17432774,몬스타 몬스타기어 닌자87PRO 풀윤활 기계식 키보드,0,"갈축_159,000|적축_159,000",0
18162797,몬스타 몬스타기어 닌자87PRO 풀윤활 커스텀 키보드 블랙,"쑥인절미, 저소음 황축_185,970|흑임자라떼, 저소음 황축_185,970","쑥인절미, 저소음 황축_185,970|흑임자라떼, 저소음 황축_185,970","쑥인절미, 저소음 황축_185,970|흑임자라떼, 저소음 황축_185,970"
28475987,몬스타 몬스타기어 닌자96PRO 유무선 커스텀 기계식 블랙,"황축_일시품절|갈축_199,000|백축_199,000|적축_199,000","황축_일시품절|갈축_199,000|백축_199,000|적축_199,000","황축_일시품절|갈축_199,000|백축_199,000|적축_199,000"
28475816,몬스타 몬스타기어 닌자96PRO 유무선 커스텀 기계식 화이트,"황축_199,000|갈축_199,000|백축_199,000|적축_199,000","황축_199,000|갈축_199,000|백축_199,000|적축_199,000","황축_199,000|갈축_199,000|백축_199,000|적축_199,000"
20201111,몬스타 몬스타기어 딸기우유 PBT 한영정각 104키 키캡,"22,990","22,990","22,990"
15167828,몬스타 몬스타기어 로지텍 k480 전용 키스킨,"훈민정음_1,800","훈민정음_1,800","훈민정음_1,800"
15048791,몬스타 몬스타기어 로지텍 k480 키스킨 한영,"1,800","1,800","1,800"
20321858,몬스타 몬스타기어 만능 미니 키보드 청소 브러쉬세트,"3,000","3,000","3,000"
16906700,몬스타 몬스타기어 미니키프로 RGB 유무선 슬림 기계식 키보드,"갈축_69,000|적축_69,000","갈축_69,000|적축_69,000","갈축_69,000|적축_69,000"
28649354,몬스타 몬스타기어 바캉스 8키 포인트 키캡,"12,990","12,990","12,990"
20322455,몬스타 몬스타기어 스테빌라이저 스타터 키트,"16,000","16,000","16,000"
18845126,몬스타 몬스타기어 아쿠아67,"195,990","195,990","195,990"
20370056,몬스타 몬스타기어 오테뮤 라임 스위치 10pcs,0,"2,300","2,300"
20354591,몬스타 몬스타기어 오테뮤 톰 스위치 10pcs,"2,800","2,800","2,800"
20321303,몬스타 몬스타기어 윤활 스타터 키트,"25,000","25,000","25,000"
28031132,몬스타 몬스타기어 집사 PBT 키캡,"삼색이_39,000|페르시안_39,000","삼색이_39,000|페르시안_39,000","삼색이_39,000|페르시안_39,000"
20202602,몬스타 몬스타기어 카일 신형 박스 V2 커스텀 키보드 스위치 10pcs,"적축_4,100|갈축_4,100|백축_4,100","적축_4,100|갈축_4,100|백축_4,100",0
20202137,몬스타 몬스타기어 카일 신형 박스 V2 커스텀 키보드 스위치 10pcs,0,0,"적축_4,100|갈축_4,100|백축_4,100"
19725593,몬스타 몬스타기어 클래식 TKL 아크릴 DIY KIT 커스텀 기계식,"139,000","139,000","139,000"
21626420,몬스타 몬스타기어 클래식 TKL 유무선 기계식,"화이트_350,000|그레이_350,000","화이트_350,000|그레이_350,000","화이트_350,000|그레이_350,000"
28052453,몬스타 몬스타기어 하이무 폭스테일 바다소금v2 리니어 스위치 10pcs,"2,000","2,000","2,000"
16192472,몬스타 몬스타기어 화이트 온 블랙 영문 PBT 키캡,"57,500","57,500","57,500"
28960799,몬스타기어 닌자104PRO 유무선 DIY KIT 기계식,"화이트_99,000|블랙_99,000","화이트_99,000|블랙_99,000","화이트_99,000|블랙_99,000"
28921955,몬스타기어 닌자108PRO 유무선 공장풀윤활 기계식 아이보리,"클래식, 폭스테일_169,000|클래식, 바다소금 저소음_169,000","클래식, 폭스테일_169,000|클래식, 바다소금 저소음_189,000","클래식, 폭스테일_169,000|클래식, 바다소금 저소음_189,000"
28922186,몬스타기어 닌자108PRO 유무선 공장풀윤활 기계식 화이트,"쑥인절미, 폭스테일_169,000|쑥인절미, 바다소금 저소음_가격비교예정|피치요거트, 바다소금 저소음_169,000|피치요거트, 폭스테일_169,000|흑임자라떼, 바다소금 저소음_169,000|","쑥인절미, 폭스테일_169,000|쑥인절미, 바다소금 저소음_가격비교예정|피치요거트, 바다소금 저소음_189,000|피치요거트, 폭스테일_169,000|흑임자라떼, 바다소금 저소음_189,000|","쑥인절미, 폭스테일_169,000|쑥인절미, 바다소금 저소음_가격비교예정|피치요거트, 바다소금 저소음_189,000|피치요거트, 폭스테일_169,000|흑임자라떼, 바다소금 저소음_189,000|"
28923557,몬스타기어 닌자108PRO 유무선 본사풀윤활 기계식 아이보리,"클래식, 폭스테일_249,000|클래식, 바다소금 저소음_249,000","클래식, 폭스테일_249,000|클래식, 바다소금 저소음_269,000","클래식, 폭스테일_249,000|클래식, 바다소금 저소음_269,000"
28923611,몬스타기어 닌자108PRO 유무선 본사풀윤활 기계식 화이트,"쑥인절미, 폭스테일_249,000|쑥인절미, 바다소금 저소음_249,000|피치요거트, 바다소금 저소음_249,000|피치요거트, 폭스테일_249,000|흑임자라떼, 바다소금 저소음_249,000|","쑥인절미, 폭스테일_249,000|쑥인절미, 바다소금 저소음_269,000|피치요거트, 바다소금 저소음_269,000|피치요거트, 폭스테일_249,000|흑임자라떼, 바다소금 저소음_269,000|","쑥인절미, 폭스테일_249,000|쑥인절미, 바다소금 저소음_269,000|피치요거트, 바다소금 저소음_269,000|피치요거트, 폭스테일_249,000|흑임자라떼, 바다소금 저소음_269,000|"
29081003,몬스타기어 닌자84PRO 유무선 DIY KIT 기계식,"화이트_89,000|블랙_89,000","화이트_89,000|블랙_89,000","화이트_89,000|블랙_89,000"
28921391,몬스타기어 닌자87BT V2 유무선 공장풀윤활 기계식 블랙,"흑임자라떼, 폭스테일_126,000|흑임자라떼, 바다소금 저소음_136,000","흑임자라떼, 폭스테일_126,000|흑임자라떼, 바다소금 저소음_156,000","흑임자라떼, 폭스테일_126,000|흑임자라떼, 바다소금 저소음_156,000"
28920776,몬스타기어 닌자87BT V2 유무선 공장풀윤활 기계식 화이트,"쑥인절미, 폭스테일_126,000|쑥인절미, 바다소금 저소음_136,000","쑥인절미, 폭스테일_126,000|쑥인절미, 바다소금 저소음_156,000","쑥인절미, 폭스테일_126,000|쑥인절미, 바다소금 저소음_156,000"
28921712,몬스타기어 닌자87PRO V2 유무선 본사풀윤활 기계식 블랙,"흑임자라떼, 폭스테일_169,000|흑임자라떼, 바다소금 저소음_179,000","흑임자라떼, 폭스테일_169,000|흑임자라떼, 바다소금 저소음_199,000","흑임자라떼, 폭스테일_169,000|흑임자라떼, 바다소금 저소음_199,000"
28921586,몬스타기어 닌자87PRO V2 유무선 본사풀윤활 기계식 화이트,"쑥인절미, 폭스테일_169,000|쑥인절미, 바다소금 저소음_179,000","쑥인절미, 폭스테일_169,000|쑥인절미, 바다소금 저소음_199,000","쑥인절미, 폭스테일_169,000|쑥인절미, 바다소금 저소음_199,000"
28924739,몬스타기어 닌자87PRO 유무선 본사풀윤활 기계식 핑크,"딸기우유, 폭스테일_169,000|딸기우유, 바다소금 저소음_179,000","딸기우유, 폭스테일_169,000|딸기우유, 바다소금 저소음_199,000","딸기우유, 폭스테일_169,000|딸기우유, 바다소금 저소음_199,000"
29062319,몬스타기어 닌자96PRO 유무선 DIY KIT 기계식,"화이트_96,000|블랙_96,000","화이트_96,000|블랙_96,000","화이트_96,000|블랙_96,000"
16781726,삼성전자 SK-M1100B,"18,700",0,0
1103703,삼성전자 SKG-3000UB,"키스킨 포함_18,600|키스킨 미포함_16,900",0,0
1056910,삼성전자 SKG-3000UB,0,"키스킨 포함_18,600|키스킨 미포함_16,900","키스킨 포함_18,600|키스킨 미포함_16,900"
5618873,삼성전자 SKP-1000B,"키스킨 포함_24,300|키스킨 미포함_22,400","키스킨 포함_24,300|키스킨 미포함_22,400","키스킨 포함_24,300|키스킨 미포함_22,400"
5782793,삼성전자 SPA-JKA1BUB,"16,900","16,900","16,900"
9249393,삼성전자 SPA-KKG1CU 기계식 키보드,"청축_49,900|갈축_49,900|적축_49,900","청축_49,900|갈축_49,900|적축_49,900",0
13848482,삼성전자 SPA-NKG2CUW 텐키리스 기계식 키보드,"청축_29,900|갈축_29,900|적축_29,900",0,"청축_29,900|갈축_29,900|적축_29,900"
14269259,삼성전자 스마트키보드 트리오 500,"블랙_31,540|화이트_33,108","블랙_31,700|화이트_33,108","블랙_31,700|화이트_33,108"
28646162,샤이닝몰 컴썸 키보드 팜레스트 미니,"10,630","10,630",0
34162,세진전자 미니 키보드 SPR-8695U 블랙 USB,0,"32,680","34,000"
28583885,스마토이 6KEY 미니 기계식,"33,790",0,0
863027,스카이디지탈 NKEYBOARD NKEY-1,"브라운_33,000|키스킨+손목받침대 포함_31,800",0,0
2415346,스카이디지탈 NKEYBOARD NKEY-2,"33,000","33,000","33,000"
2040560,스카이디지탈 NKEYBOARD NKEY-매크로,"37,000","37,000",0
3365466,스카이디지탈 NKEYBOARD W570 무선 키보드 마우스,"블랙_32,900|화이트_30,100","블랙_32,900|화이트_30,100","블랙_32,900|화이트_32,900"
9318975,스카이디지탈 WL320 무선 키보드 마우스 콤보,"24,900",0,0
28577327,스카이디지탈 WL320 전용,"3,000",0,0
17874857,스틸시리즈 Apex 9 TKL US,"238,500","238,500","236,510"
9450495,스틸시리즈 Apex Pro,"정품_289,000","정품_289,000","정품_289,000"
17446844,스틸시리즈 Apex Pro Mini,"정품_299,000|해외구매_338,200",0,"정품_299,000|해외구매_338,200"
17977730,스틸시리즈 Apex Pro TKL,"정품_329,000|해외구매_191,800","정품_329,000|해외구매_191,800","정품_329,000|해외구매_191,800"
17977487,스틸시리즈 Apex Pro TKL Wireless,"정품_399,000","정품_399,000","정품_399,000"
29491295,아이노비아 YUNZII YZ75 유무선 기계식,"화이트, 백축_159,000|화이트, 적축_159,000|화이트, 갈축_159,000|화이트, 황축_159,000|블랙, 백축_159,000|||||||","화이트, 백축_159,000|화이트, 적축_159,000|화이트, 갈축_159,000|화이트, 황축_159,000|블랙, 백축_159,000|||||||","화이트, 백축_158,990|화이트, 적축_158,990|화이트, 갈축_158,990|화이트, 황축_158,990|블랙, 백축_158,990|||||||"
15222827,아이존아이앤디 EZ BTK-50 블루투스 키보드,"블랙_9,760|실버_9,770","블랙_9,650|실버_9,770","블랙_9,650|실버_9,770"
29398226,아이퀸 고급형 메모리폼 손목 받침대 세트,"12,750","12,750","12,750"
28826780,아이퀸 키보드 마우스 손목 쿠션 세트,"9,700","9,700","9,700"
15620105,알텍랜싱 ALGK8614 기계식 키보드 실버,0,"청축+갈축_29,700|갈축_29,900|적축_29,700",0
10577571,알파스캔 AOC GK500 게이밍 RGB LED 기계식,"59,900","59,900","59,900"
13990238,앱코 ACK01 컴팩트 키보드,"블랙_11,500","블랙_11,500","블랙_11,500"
13132175,앱코 ADK05 아크릴 듀얼 RGB 게이밍 키보드,"적축_158,000|백축_158,800","적축_158,000|백축_158,800","적축_158,000|백축_158,800"
18716624,앱코 AG75 가스켓 마운트 기계식 로즈 핑크,"갈축_152,000|적축_152,000","갈축_152,000|적축_152,000","갈축_152,000|적축_152,000"
18717203,앱코 AG75 가스켓 마운트 기계식 퍼플 블루,"적축_150,750|갈축_152,000","적축_150,750|갈축_152,000","적축_150,750|갈축_152,000"
16350560,앱코 AKR01 TKL 아크릴 텐키리스 키보드 덮개,"9,900","9,900","9,900"
16361930,앱코 AKR01 아크릴 키보드 덮개,"10,900","10,900","10,900"
20759003,앱코 AN01T RGB BAR 기계식 다크그레이,"청축_35,500|갈축_35,500|적축_35,500","청축_35,500|갈축_35,500|적축_35,500","청축_35,500|갈축_35,500|적축_35,500"
20759345,앱코 AN01T RGB BAR 기계식 핑크,"청축_35,500|갈축_35,500|적축_35,500","청축_35,500|갈축_35,500|적축_35,500",0
20759315,앱코 AN01T RGB BAR 기계식 핑크,0,0,"청축_35,500|갈축_35,500|적축_35,500"
14650787,앱코 AN02 다크그레이 RGB BAR 축교환 기계식 키보드,"청축_39,900|갈축_39,900|적축_39,900",0,0
14650769,앱코 AN02 다크그레이 RGB BAR 축교환 기계식 키보드,0,"청축_39,900|갈축_39,900|적축_39,900","청축_39,900|갈축_39,900|적축_39,900"
14650697,앱코 AN02 블랙 RGB BAR 축교환 기계식 키보드,"청축_39,900|갈축_39,900|적축_39,900","청축_39,900|갈축_39,900|적축_39,900",0
14650640,앱코 AN02 블랙 RGB BAR 축교환 기계식 키보드,0,0,"청축_39,900|갈축_39,900|적축_39,900"
14650835,앱코 AN02 핑크 RGB BAR 축교환 기계식 키보드,"청축_39,900|갈축_39,900|적축_39,900","청축_39,900|갈축_39,900|적축_39,900","청축_39,900|갈축_39,900|적축_39,900"
18775013,앱코 AN03 옵티컬 게이밍,"49,000","49,000","49,000"
18091124,앱코 AN04F PBT 특주축 게이밍 기계식 키보드,"클릭_72,000|넌클릭_72,000|리니어_72,000","클릭_72,000|넌클릭_72,000|리니어_72,000","클릭_72,000|넌클릭_72,000|리니어_72,000"
19830029,앱코 AN05 아이스큐브 옵티컬 게이밍,"블랙_53,000|핑크_53,000","블랙_53,000|핑크_53,000","블랙_53,000|핑크_53,000"
19006127,앱코 AN06F TKL PBT 게이밍 기계식,"클릭_55,000|넌클릭_55,000|리니어_55,000","클릭_55,000|넌클릭_55,000|리니어_55,000","클릭_55,000|넌클릭_55,000|리니어_55,000"
29312675,앱코 AN08 가스켓 아이스큐브 광축 LED 게이밍,"블루, 클릭_64,200|블루, 리니어_64,200|핑크, 리니어_64,200|핑크, 클릭_64,200","블루, 클릭_64,200|블루, 리니어_64,200|핑크, 리니어_64,200|핑크, 클릭_64,200","블루, 클릭_64,200|블루, 리니어_64,200|핑크, 리니어_64,200|핑크, 클릭_64,200"
16847930,앱코 AN10 아이스큐브 무빙 LED 광축 게이밍 키보드,"76,500","76,500","76,500"
16848017,앱코 AN50 아이스큐브 무빙 LED 광축 게이밍 키보드,"89,900","89,900","89,900"
20596694,앱코 APK87 폴리카보네이트 사일런스 가스켓 기계식,"185,000","185,000","185,000"
10468689,앱코 AR21 CNC 풀 알루미늄 DIY KIT 넘버패드,"실버_90,830|그레이_117,400|네이비_88,900","실버_90,830|그레이_117,400|네이비_88,900","실버_90,830|그레이_117,400|네이비_88,900"
18474248,앱코 AR61D 풀 알루미늄 유무선 기계식,"179,000","179,000","179,000"
12982325,앱코 ARC1 TKL 텐키리스 아크릴 팜레스트 손목 받침대,"ICE Acrylic_13,800|Clear Acrylic_13,800","ICE Acrylic_13,800|Clear Acrylic_13,800","ICE Acrylic_13,800|Clear Acrylic_13,800"
12977087,앱코 ARC1 아크릴 팜레스트 손목 받침대,"Clear Acrylic_15,900|ICE Acrylic_15,900","Clear Acrylic_15,900|ICE Acrylic_15,900","Clear Acrylic_15,900|ICE Acrylic_15,900"
15796007,앱코 AWK10 멀티페어링 블루투스 키보드,"16,900","16,900","16,900"
13007576,앱코 BT220 멀티페어링 블루투스 키보드,"11,000","11,000","11,000"
12373433,앱코 BT250 멀티페어링 블루투스 키보드,"블랙_16,900","블랙_16,900","블랙_16,900"
19280333,앱코 GKM500 기계식 키보드 마우스 세트,"청축_39,500|적축_39,500",0,0
