10002534,웨이코스 씽크웨이 CROAD K20 매크로 숫자 키패드,"청축_24,500|갈축_24,900|적축_24,500"
5897750,웨이코스 씽크웨이 CROAD K49 IR 광축 IPX8 마린 완전방수 축교환 클래식 키보드,"클릭_49,320"
6414424,웨이코스 씽크웨이 CROAD P206 베이직 키보드 마우스 콤보,"6,300"
9230352,웨이코스 씽크웨이 CROAD P214 스탠다드 키보드 마우스 콤보,"17,900"
6468650,웨이코스 씽크웨이 CROAD P304X 매크로 시저 게이밍 키보드,"31,280"
6953971,웨이코스 씽크웨이 CROAD X36 키보드 손목 보호 받침대 (텐키리스용),"7,850"
5996963,웨이코스 씽크웨이 CROAD X46 키보드 손목 보호 받침대,"7,240"
14028026,웨이코스 씽크웨이 토체티 BW D&T 콜라보 유무선 체리 키보드,"다크그레이, 갈축_170,000|베이지, 갈축_170,000"
9568836,웨이코스 씽크웨이 토체티 D&T 콜라보 체리 키보드,"파스텔블루, 갈축_134,000|다크그레이, 저소음 흑축_143,950|베이지, 갈축_134,000|베이지, 은축_139,000|베이지, 저소음 적축_144,000|베이지, 저소음 흑축_134,000|베이지, 적축_134,000|파스텔블루, 저소음 흑축_143,950|파스텔블루, 적축_133,950|파스텔블루, 저소음 적축_134,000|파스텔블루, 은축_139,000|다크그레이, 갈축_134,000|다크그레이, 적축_133,950|다크그레이, 저소음 적축_144,000|다크그레이, 은축_139,000"
14027447,웨이코스 씽크웨이 토체프 BW D&T 콜라보 유무선 체리 키보드,"다크그레이, 갈축_180,000|베이지, 갈축_180,000"
9537354,웨이코스 씽크웨이 토체프 D&T 콜라보 체리 키보드,"파스텔블루, 갈축_145,000|다크그레이, 저소음 흑축_154,000|베이지, 갈축_145,000|베이지, 은축_149,000|베이지, 저소음 적축_154,000|베이지, 저소음 흑축_145,000|베이지, 적축_145,000|파스텔블루, 저소음 흑축_154,000|파스텔블루, 적축_145,000|파스텔블루, 저소음 적축_154,000|파스텔블루, 은축_149,000|다크그레이, 갈축_145,000|다크그레이, 적축_145,000|다크그레이, 저소음 적축_154,000|다크그레이, 은축_149,000"
13272101,이그닉 리트 68A,"청축_39,900|갈축_39,900"
6455272,정현씨앤씨 디콤 DOK-BT4,"블랙_34,900|핑크_34,480|화이트_34,900"
3756254,제닉스 SCORPIUS M10TSFL,"화이트, 청축_105,000|화이트, 갈축_105,000"
4566446,제닉스 STORMCHASER,"청축_98,000|적축_129,000"
4285254,제닉스 STORMX TITAN MARK V 기계식키보드,"청축_75,800"
3698484,제닉스 STORMX TITAN SE,"골드_24,600|그레이_24,600|블랙_24,600|블루_24,600|화이트_24,600"
5061644,제닉스 STORMX ZERO,"청축_54,000|갈축_54,000|적축_54,000"
2796818,제닉스 TESORO LOBERA SUPREME,"청축_135,000|갈축_135,000|적축_135,000"
3757221,제닉스 TESORO M9 SPECTRUM,"청축_132,000"
7108609,제닉스 TITAN OPTICAL V2,"53,300"
12438848,제닉스 WC2 키보드마우스 콤보,"블랙_12,900|화이트_19,890"
5454370,제닉스 XPAM 대나무 손목 받침대,"텐키리스용_8,860|풀배열용_8,860"
12875030,제닉스 스톰체이서LT 게이밍 기계식키보드,"청축_38,980|갈축_38,980|적축_38,980"
12875270,제닉스 스톰체이서LT 텐키리스 게이밍 기계식키보드,"청축_39,000|갈축_39,000|적축_39,000"
14916362,제이컴정보통신 HB099 뉴플러스 접이식 블루투스 키보드,"71,850"
6563830,주연테크 리오나인 LK1 게이밍 기계식 키보드,"50,840"
3479725,지클릭커 Clicker K2 LED,"8,760"
9383583,지클릭커 GMK-100 키보드 마우스 세트,"키스킨 미포함_5,300|키스킨 포함_6,440"
7514758,지클릭커 GMK-510X Special with PAD 장패드 세트,"블랙, 청축_32,900|메탈그레이, 갈축_59,200|메탈그레이, 청축_67,620|블랙, 갈축_32,310|실버, 청축_59,200"
7570486,지클릭커 GMK-510X Special 키보드 마우스 세트,"블랙, 청축_30,800|메탈그레이, 갈축_35,000|메탈그레이, 청축_32,500|블랙, 갈축_29,230|실버, 청축_34,900"
14892368,청맥전자 FOR LG LGC-K1000B,"블랙_12,800"
5166754,청맥전자 For LG MKS-5000,"23,900"
3755212,청맥전자 For LG 무선 Nano 2.4GHz MKS-2000 SET,"23,790"
1362006,코시 KB1037,"3,960"
3308578,코시 KB1352BT,"13,250"
14870891,코시 KB2048BT 접이식 블루투스 키보드,"47,510"
14820725,코시 KB2062WL 토니 무선 키보드,"21,170"
5217481,코시 KB3139BT,"27,280"
5323647,코시 KB3152,"10,200"
14825576,코시 KB3295WL 코코 레트로 무선 키보드,"민트_17,120|화이트_17,120|핑크_17,120"
14825936,코시 KB3309 데일리 키보드,"화이트_7,520"
13901021,코시 KB3362WL 네오 무선 키보드,"10,910"
14836886,코시 KB3486BT 플로 접이식 블루투스 키보드,"34,980"
14820614,코시 KB4014 루시,"8,490"
14821193,코시 KBM3302WL 노마 무선 키보드 마우스 합본,"17,950"
14861852,코시 KBM3344WL 무선 키보드 마우스 세트,"16,260"
14823899,코시 KBM3409WL 파스텔 무선 키보드 마우스 세트,"민트_17,830|핑크_17,830"
11695916,코시 KBM3474WL 버티컬 무선 세트,"29,260"
4330334,코시 KP1364WL,"9,500"
14826149,코시 KP2087 모리 키패드,"15,680"
7188745,코시 KP3269BT 보노 블루투스 키패드,"14,010"
14998616,코시 KP4025 아미 레트로 키패드,"10,230"
15068918,코시 ST1413 클래식 책상 키보드 트레이 S,가격비교예정
15059651,코시 ST2122 발트 책상 키보드 트레이,"65,600"
15069200,코시 ST3498 오피스 책상 키보드 트레이,가격비교예정
15059552,코시 ST4035 하임 책상 키보드 트레이,"49,920"
5892571,코시 WP3094 비즈 키보드 손목받침대,"8,490"
4398221,쿨러마스터 Acryl Keyboard Cover,"벌크_10,000"
14748998,쿨러마스터 CK352 기계식 키보드,"갈축_77,580|적축_77,580|청축_77,580"
6945547,쿨러마스터 CK550 RGB 게이밍 기계식 키보드,"청축_119,000|적축_일시품절"
2671457,쿨러마스터 CM STORM QUICK FIRE RAPID-i,"청축_87,480"
2447169,쿨러마스터 CM STORM QUICK FIRE TK STEALTH,"청축_77,300"
3633518,쿨러마스터 CM STORM QUICK FIRE XTi,"청축_95,550"
3447828,쿨러마스터 CM STORM QUICK FIRE XTi PC방 Version,"청축_107,410"
2621935,쿨러마스터 CM STORM TRIGGER Z,"청축_103,050"
6032018,쿨러마스터 MASTERKEYS MECHANICAL KEYCAP,"31,500"
4385990,쿨러마스터 MASTERKEYS PRO M White LED,"청축_68,220"
5778814,쿨러마스터 MasterKeys MK750 RGB 영문,"적축_218,090|갈축_222,590"
4028167,쿨러마스터 MasterKeys RGB PRO L,"적축_114,010|갈축_126,000|청축_115,330"
4120538,쿨러마스터 MasterKeys RGB PRO S,"적축_198,000|청축_95,600"
7599937,쿨러마스터 SK630 MX RGB LOW PROFILE Switch,"적축_147,290"
7600177,쿨러마스터 SK650 MX RGB LOW PROFILE Switch,"적축_169,000"
7158844,쿨러마스터 Soft wrist rest WR530 L 손목받침대,"12,600"
7158781,쿨러마스터 Soft wrist rest WR530 S 손목받침대,"9,500"
14208506,쿨러마스터 Wrist Rest WR531 TKL 손목받침대,"9,500"
14208638,쿨러마스터 Wrist Rest WR531 풀사이즈 손목받침대,"12,600"
10409004,킹스톤 HyperX Alloy Origins Core,"적축_129,000"
3059003,타무즈 루마카 Full LED 기계식 키보드,청축_일시품절
14847401,트렌잇 JTK-099 접이식 블루투스 듀얼 키보드,"69,000"
14845634,트렌잇 JTK-188 접이식 블루투스 키보드,"26,500"
14845283,트렌잇 JTK-206 무선 블루투스 키보드,"화이트_33,200|블랙_33,200"
2756911,펠로우즈 I-Spire Rocking 손목받침대,"12,500"
14822504,펠로우즈 레더렛 메모리폼 손목받침대,"15,730"
927687,펠로우즈 젤 손목받침대,"16,310"
444315,펠로우즈 크리스탈 젤 손목받침대,"9,430"
5706845,펠로우즈 플러쉬터치 손목받침대,"10,310"
4354624,퓨전FNC INOTE X-Folding Laser,"35,800"
14830892,퓨전FNC INOTE X-Folding Raptor 접이식 블루투스 키보드,가격비교예정
10931028,퓨전FNC INOTE X-Folding Slim Touch,"44,000"
14121902,퓨전FNC INOTE X-Folding Touch Big,"44,000"
4565742,퓨전FNC INOTE X-Folding Touch Pro,"32,800"
1840897,퓨전FNC INOTE X-KEY 28BT,"10,890"
7040395,퓨전FNC INOTE X-KEY 38BT,"블랙_19,900|핑크_19,900|화이트_19,900"
14535365,퓨전FNC INOTE X-Key 96RB,"올리브그린_27,500|크림_27,500"
14623733,퓨전FNC 카카오프렌즈 KFKM-001 무선 키보드 마우스 세트,"어피치_54,110|라이언_54,110"
7283581,플레오맥스 PLEOMAX AVEC-101M 무선 미니 키보드 마우스 세트,"블랙_22,460|화이트_22,460"
9753588,플레오맥스 PLEOMAX COC-E500,"17,480"
6288436,플레오맥스 PLEOMAX PEK-N1000 인체공학 키보드,"42,770"
9235104,플레오맥스 PLEOMAX PKB-K1 USB 유선 키보드,"5,680"
2078659,플레오맥스 PLEOMAX PKC-650U,"8,790"
7842172,플레오맥스 PLEOMAX PTK-200,"34,300"
8182243,필립스 G614,"다크 실버, 청축_31,240|그레이 화이트, 갈축_32,780|그레이 화이트, 적축_33,900|그레이 화이트, 청축_32,780|다크 실버, 갈축_31,240|다크 실버, 적축_31,240|다크 실버, 흑축_31,240|블랙, 갈축_31,900|블랙, 적축_34,650|블랙, 청축_31,240|핑크 화이트, 갈축_31,900|핑크 화이트, 적축_33,900|핑크 화이트, 청축_32,780|화이트 그레이, 갈축_32,780|화이트 그레이, 적축_33,880|화이트 그레이, 청축_32,780|화이트 핑크, 갈축_31,900|화이트 핑크, 적축_33,880|화이트 핑크, 청축_33,880"
11803987,필립스 K314,"화이트, 키스킨포함_11,400|블랙, 키스킨포함_11,400"
11506292,필립스 SPK8605,"적축_29,900|청축_29,900"
11920927,필립스 SPT6254,"9,800"
2444786,한성컴퓨터 ABS 이색사출 키캡,"그린_15,520|블루_14,700"
2637562,한성컴퓨터 ABS 프리미엄 이색사출 키캡,"White-Black_24,500|보와이 (English)_24,500|White-Red_24,000|White-Red 한글_24,000"
11626016,한성컴퓨터 BK300 멀티페어링 블루투스 키보드,"블랙_19,900|민트_19,900|실버_19,900|핑크_19,900"
14413640,한성컴퓨터 BK330 멀티페어링 블루투스 키보드,"블랙_29,900|그린_29,900|핑크_29,900|화이트_29,900"
13076324,한성컴퓨터 BK500 듀얼 무선 멀티페어링 키보드,"민트_29,900|블랙_29,900|핑크_29,900|화이트_29,900"
13076483,한성컴퓨터 BKM500 듀얼 무선 키보드마우스 세트,"민트_39,900|블랙_39,900|핑크_39,900|화이트_39,900"
14908196,한성컴퓨터 GK687 TKL 게이트론 RGB 기계식 키보드,"화이트, 황축_54,900|블랙, 갈축_54,900|블랙, 청축_54,900|화이트, 적축_54,900|블랙, 적축_54,900|화이트, 갈축_54,900|화이트, 청축_54,900|블랙, 황축_54,900"
14908142,한성컴퓨터 GK687 TKL 게이트론 RGB 기계식 키보드,"블랙, 청축_54,900|블랙, 갈축_54,900|블랙, 적축_54,900|블랙, 황축_54,900|화이트, 갈축_54,900|화이트, 적축_54,900|화이트, 청축_54,900|화이트, 황축_54,900"
14755910,한성컴퓨터 GK787B OfficeMaster 블루투스 키보드,"블랙_109,000|화이트_109,000"
11731784,한성컴퓨터 GK787S OfficeMaster 체리 기계식키보드,"블랙, 저소음 적축_79,900|화이트, 저소음 적축_79,900"
9590022,한성컴퓨터 GK868B TICO,"블랙, 35g_149,000|블랙, 50g_139,000|화이트, 35g_149,000|화이트, 50g_149,000"
7356157,한성컴퓨터 GK888B minicoup,"블랙, 50g_139,000|화이트, 50g_149,000"
9369000,한성컴퓨터 GK893B SPORTS 영문,"블랙, 50g_145,000|화이트, 50g_145,000"
9369138,한성컴퓨터 GK893B SPORTS 한글,"블랙, 50g_145,000|화이트, 50g_145,000"
8489031,한성컴퓨터 GK898B OfficeMaster 영문,"블랙, 50g_159,000|화이트, 50g_159,000"
8488995,한성컴퓨터 GK898B OfficeMaster 한글,"블랙, 50g_159,000|화이트, 50g_159,000"
11046837,한성컴퓨터 GK993B SKY 블루투스 기계식 키보드 영문,"화이트, 갈축_99,000|블랙, 갈축_99,000|블랙, 저소음 적축_109,000|블랙, 적축_99,000|화이트, 저소음 적축_109,000|화이트, 적축_99,000"
11046735,한성컴퓨터 GK993B SKY 블루투스 기계식 키보드 한글,"블랙, 갈축_129,000|블랙, 적축_129,000|블랙, 저소음 적축_139,000|화이트, 갈축_129,000|화이트, 적축_129,000|화이트, 저소음 적축_139,000"
12246461,한성컴퓨터 GK998B SKY 블루투스 기계식 키보드 영문,"블랙, 갈축_139,000|블랙, 적축_139,000|블랙, 저소음 적축_149,000|화이트, 갈축_139,000|화이트, 적축_139,000|화이트, 저소음 적축_149,000"
12246542,한성컴퓨터 GK998B SKY 블루투스 기계식 키보드 한글,"블랙, 갈축_139,000|블랙, 적축_139,000|블랙, 저소음 적축_139,000|화이트, 갈축_139,000|화이트, 적축_139,000|화이트, 저소음 적축_149,000"
3000884,한성컴퓨터 GTune CHL5 RGB,"55g_169,860"
8112019,한성컴퓨터 GTune GK600 게이밍 기계식,"그레이, 청축_39,900|그레이, 적축_39,900|그레이, 갈축_39,900|실버, 청축_39,900|실버, 적축_39,900|실버, 갈축_39,310"
6523541,한성컴퓨터 GTune GK638 Optik RGB 축교환 광축 게이밍,"블랙, 클릭_39,900|블랙, 리니어_39,900|화이트, 클릭_39,900"
10979370,한성컴퓨터 GTune GK700 게이트론 RGB 게이밍 광축키보드,"실버, 청축_49,900|그레이, 갈축_49,900|그레이, 백축_49,900|그레이, 적축_49,900|그레이, 청축_49,900|실버, 갈축_49,900|실버, 백축_49,900|실버, 적축_49,900"
5934553,한성컴퓨터 GTune GK787 OfficeMaster PBT 체리 게이밍 기계식,"블랙, 갈축_186,000|블랙, 저소음 적축_186,000|화이트, 갈축_186,000|화이트, 저소음 적축_186,000"
5455259,한성컴퓨터 GTune MBF77 Fusion 게이밍 콤보,"블랙_19,900|화이트_19,900"
5011034,한성컴퓨터 GTune MBF77 Vision,"블랙_15,900|화이트_15,900"
4125029,한성컴퓨터 GTune MKF14S XRGB Color Edition,"블루, 청축_59,900|핑크, 청축_64,900"
5291224,한성컴퓨터 GTune MKF30S RAINBOW,"블랙, 갈축_35,900|블랙, 적축_29,900|블랙, 청축_29,900|화이트, 갈축_29,900|화이트, 적축_29,900|화이트, 청축_29,900"
5942806,한성컴퓨터 HBK50 터치패드 블루투스 키보드,"26,500"
4677213,한성컴퓨터 HKM1000K 키보드마우스 세트,"16,900"
4692054,한성컴퓨터 HKM600WL,"블랙_70,000|화이트_19,900"
5092064,한성컴퓨터 HKM660WL,"블랙_15,900|화이트_15,900"
9221601,한성컴퓨터 HKM770WL,"19,900"
10996881,한성컴퓨터 OfficeMaster S3 무선 키보드 마우스 세트,"블랙_16,900|화이트_16,900"
11889394,한성컴퓨터 TFG ARF 게이트론 RGB 게이밍 LP 광축키보드,"블랙, 청축_54,900|블랙, 갈축_54,900|블랙, 백축_54,900|블랙, 적축_54,900|화이트, 갈축_54,900|화이트, 백축_54,900|화이트, 적축_54,900|화이트, 청축_54,900"
11889967,한성컴퓨터 TFG ARF 게이트론 RGB 게이밍 크리스탈 광축키보드,"블랙, 청축_54,900|블랙, 갈축_54,900|블랙, 백축_54,900|블랙, 적축_54,900|화이트, 갈축_54,900|화이트, 백축_54,900|화이트, 적축_54,900|화이트, 청축_54,900"
10348473,한성컴퓨터 TFG ARF 아트박스 게이밍 기계식 영문,"블랙, 갈축_69,000|블랙, 백축_69,000|블랙, 적축_69,000|블랙, 흑축_69,000|실버, 갈축_69,000|실버, 백축_69,000|실버, 적축_69,000|실버, 흑축_69,000"
10348383,한성컴퓨터 TFG ARF 아트박스 게이밍 기계식 한글,"블랙, 갈축_69,000|블랙, 백축_69,000|블랙, 적축_69,000|블랙, 흑축_69,000|실버, 갈축_69,000|실버, 백축_69,000|실버, 적축_69,000|실버, 흑축_69,000"
10348698,한성컴퓨터 TFG ARF 체리 게이밍 기계식 영문,"블랙, 갈축_89,000|블랙, 저소음 적축_91,250|블랙, 적축_89,000|실버, 갈축_89,000|실버, 저소음 적축_99,000|실버, 적축_89,000"
10348662,한성컴퓨터 TFG ARF 체리 게이밍 기계식 한글,"블랙, 갈축_89,000|블랙, 저소음 적축_99,000|블랙, 적축_89,000|실버, 갈축_89,000|실버, 저소음 적축_99,000|실버, 적축_89,000"
7193845,한성컴퓨터 TFG ART,"그레이, 갈축_119,470"
13736417,한성컴퓨터 TFG ART Wireless 영문,"블랙, 갈축_179,000|블랙, 적축_179,000|블랙, 저소음 적축_181,500|화이트, 갈축_179,000|화이트, 적축_179,000|화이트, 저소음 적축_181,500"
13736477,한성컴퓨터 TFG ART Wireless 한글,"블랙, 갈축_179,000|블랙, 적축_179,000|블랙, 저소음 적축_189,000|화이트, 갈축_179,000|화이트, 적축_179,000|화이트, 저소음 적축_188,950"
10263897,후다바 트랙볼 미니키보드 FM-8600TU,"25,400"
