19284713,앱코 GKM500 기계식 키보드 마우스 세트,0,"청축_39,500|적축_39,500","청축_39,500|적축_39,500"
8038159,앱코 HACKER 6key 컬러풀 포인트 키캡,"V1_2,900|V2_2,900|V3_2,900","V1_2,900|V2_2,900|V3_2,900","V1_2,900|V2_2,900|V3_2,900"
12130025,앱코 HACKER ADK01 BT 블루투스 5.0 카일박스축 게이밍 기계식 키보드,"레드그레이, 갈축_123,500|레드그레이, 적축_192,370","레드그레이, 갈축_123,500|레드그레이, 적축_192,370","레드그레이, 갈축_123,500|레드그레이, 적축_192,370"
12119666,앱코 HACKER ADK01 카일박스축 게이밍 기계식 키보드,"레드그레이, 갈축_74,500|레드그레이, 백축_74,500|레드그레이, 적축_74,500","레드그레이, 갈축_74,500|레드그레이, 백축_74,500|레드그레이, 적축_74,500","레드그레이, 갈축_74,500|레드그레이, 백축_74,500|레드그레이, 적축_74,500"
11909575,앱코 HACKER ADK87 PBT 이색사출 텐키리스 체리 기계식 키보드,"블랙, 청축_59,900|블랙, 갈축_59,900|블랙, 저소음 적축_103,440|블랙, 적축_59,900|화이트, 갈축_59,900|||","블랙, 청축_59,900|블랙, 갈축_59,900|블랙, 저소음 적축_103,440|블랙, 적축_59,900|화이트, 갈축_59,900|||","블랙, 청축_88,800|블랙, 갈축_93,060|블랙, 저소음 적축_103,440|블랙, 적축_99,000|화이트, 갈축_93,060|||"
11167377,앱코 HACKER ARC 거치대,"5,500","5,500","5,500"
9940446,앱코 HACKER GKM570 키보드 마우스 LED 게이밍 콤보,"블랙_44,400|화이트_29,900","블랙_44,400|화이트_29,900","블랙_44,400|화이트_29,900"
5299013,앱코 HACKER K1000 축교환 게이밍 기계식,"블랙, 청축_68,000|화이트, 청축_66,367","블랙, 청축_68,000|화이트, 청축_66,367","블랙, 청축_68,000|화이트, 청축_66,367"
11015091,앱코 HACKER K150 텐키리스 레인보우 LED 게이밍 멤브레인,"블랙_13,000|화이트_13,500","블랙_13,000|화이트_13,500","블랙_13,000|화이트_13,500"
3248321,앱코 HACKER K300 게이밍 키보드,"29,410","29,410","29,410"
10106664,앱코 HACKER K315 텐키리스 축교환 측면 RGB 라이팅 이중사출 게이밍 기계식 키보드 블랙,"청축_29,900","청축_29,900","청축_29,900"
8516265,앱코 HACKER K512 체리쉬 염료승화 PBT 텐키리스 체리 게이밍 키보드,"청축_79,000|갈축_106,000|적축_일시품절",0,"청축_79,000|갈축_106,000|적축_일시품절"
8516163,앱코 HACKER K512 체리쉬 염료승화 PBT 텐키리스 체리 게이밍 키보드,0,"청축_79,000|갈축_106,000|적축_일시품절",0
9321162,앱코 HACKER K515 축교환 측면 RGB 라이팅 이중사출 게이밍 기계식 키보드,"블랙, 청축_37,900|블랙, 갈축_37,900|블랙, 적축_37,900|화이트, 갈축_37,900|화이트, 적축_37,900|","블랙, 청축_37,900|블랙, 갈축_37,900|블랙, 적축_37,900|화이트, 갈축_37,900|화이트, 적축_37,900|","블랙, 청축_37,900|블랙, 갈축_37,900|블랙, 적축_37,900|화이트, 갈축_37,900|화이트, 적축_37,900|"
9326580,앱코 HACKER K516 축교환 측면 RGB 라이팅 이중사출 게이밍 기계식 키보드,"레드, 청축_33,000|레드, 갈축_33,650|레드, 적축_33,000|옐로우, 갈축_42,950|옐로우, 적축_45,440|","레드, 청축_33,000|레드, 갈축_33,610|레드, 적축_33,000|옐로우, 갈축_42,950|옐로우, 적축_40,450|","레드, 청축_33,000|레드, 갈축_33,530|레드, 적축_33,000|옐로우, 갈축_48,590|옐로우, 적축_45,440|"
9647322,앱코 HACKER K523 기계식 축교환 LED 키패드,"청축_14,300|적축_14,300","청축_14,300|적축_14,300","청축_14,300|적축_14,300"
12224369,앱코 HACKER K525 GTMX 축교환 게이밍 기계식 키보드,"갈축_73,060","갈축_73,060","갈축_73,060"
10272321,앱코 HACKER K550 A광축 축교환 측면 RGB 라이팅 완전방수 이중사출 게이밍 키보드,"블랙, 클릭_34,370","블랙, 클릭_32,070","블랙, 클릭_32,070"
10272501,앱코 HACKER K5500 A광축 축교환 측면 RGB 라이팅 완전방수 크리스탈 게이밍 키보드,"블랙, 클릭_298,990","블랙, 클릭_254,150","블랙, 클릭_254,150"
6281637,앱코 HACKER K590 축교환 LED 게이밍 기계식 키보드 블랙,"청축_73,320|갈축_일시품절|적축_47,120","청축_73,320|갈축_일시품절|적축_48,110","청축_73,320|갈축_일시품절|적축_47,470"
6281650,앱코 HACKER K590 축교환 LED 게이밍 기계식 키보드 화이트,"청축_38,880","청축_38,880","청축_38,880"
8323581,앱코 HACKER K595 LED 축교환 게이밍 기계식,"화이트, 청축_32,600","화이트, 청축_32,600","화이트, 청축_32,600"
5339011,앱코 HACKER K6000 엘리트 리얼 RGB 에디션,"그린, 청축_44,000","그린, 청축_44,000","그린, 청축_44,000"
9844809,앱코 HACKER K611 텐키리스 카일광축 완전방수 축교환 게이밍 키보드 핑크 V1,"리니어_39,900|클릭_39,900","리니어_39,900|클릭_39,900","리니어_39,900|클릭_39,900"
9844815,앱코 HACKER K611 텐키리스 카일광축 완전방수 축교환 게이밍 키보드 핑크 V2,"클릭_39,900|리니어_39,900","클릭_39,900|리니어_39,900","클릭_39,900|리니어_39,900"
5040324,앱코 HACKER K640 축교환 게이밍 기계식 블랙,"청축_39,000|갈축_39,000|적축_39,000","청축_39,000|갈축_39,000|적축_39,000","청축_39,000|갈축_39,000|적축_39,000"
5128947,앱코 HACKER K640 축교환 게이밍 기계식 화이트,"청축_39,000","청축_39,000","청축_39,000"
6392210,앱코 HACKER K640 플러스 축교환 측면 LED 게이밍 키보드,"블랙, 적축_45,000|화이트, 청축_90,620","블랙, 적축_45,000|화이트, 청축_90,620","블랙, 적축_45,000|화이트, 청축_90,620"
5139191,앱코 HACKER K640T 축교환 게이밍 기계식 텐키리스,"블랙, 적축_42,900","블랙, 적축_42,900","블랙, 적축_42,900"
5359118,앱코 HACKER K6500 PBT 스페셜 블루 에디션,"청축_62,000","청축_62,000","청축_62,000"
9883827,앱코 HACKER K660 ARC SA 초콜릿 믹스 카일광축 완전방수 오렌지 LED 키보드,"클릭_141,090","클릭_141,090","클릭_141,090"
7812226,앱코 HACKER K660 ARC 프리미엄 카일 광축 완전방수 RGB LED,"블랙, 클릭_66,930|옐로우, 클릭_109,600|블랙, 리니어_85,500|레드, 리니어_66,900","블랙, 클릭_66,930|옐로우, 클릭_109,600|블랙, 리니어_85,500|레드, 리니어_66,900","블랙, 클릭_66,930|옐로우, 클릭_109,600|블랙, 리니어_85,500|레드, 리니어_66,900"
6982558,앱코 HACKER K660 ARC 프리미엄 카일 광축 완전방수 레인보우 LED,"블랙, 클릭_55,620|레드, 클릭_58,590|옐로우, 클릭_59,000|블랙, 리니어_59,000|레드, 리니어_59,000|","블랙, 클릭_55,620|레드, 클릭_58,590|옐로우, 클릭_59,000|블랙, 리니어_59,000|레드, 리니어_59,000|",0
7637752,앱코 HACKER K660 ARC 프리미엄 카일 광축 완전방수 레인보우 LED,0,0,"블랙, 클릭_55,620|레드, 클릭_58,590|옐로우, 클릭_59,000|블랙, 리니어_59,000|레드, 리니어_59,000|"
6571880,앱코 HACKER K660 단일 LED 에디션 카일 광축 축교환 완전방수 게이밍,"블랙, 클릭_59,500","블랙, 클릭_59,500","블랙, 클릭_59,500"
5633045,앱코 HACKER K660 축교환 완전방수 게이밍 카일 광축 레드,"클릭_59,500|리니어_59,500","클릭_59,500|리니어_59,500","클릭_59,500|리니어_59,500"
5221479,앱코 HACKER K660 축교환 완전방수 게이밍 카일 광축 블랙,"클릭_59,500|리니어_59,500","클릭_59,500|리니어_59,500","클릭_59,500|리니어_59,500"
5633048,앱코 HACKER K660 축교환 완전방수 게이밍 카일 광축 옐로우,"클릭_44,500|리니어_59,500","클릭_44,500|리니어_59,500","클릭_44,500|리니어_59,500"
5762059,앱코 HACKER K660 축교환 완전방수 게이밍 카일 광축 화이트,"클릭_59,500|리니어_59,500","클릭_59,500|리니어_59,500","클릭_59,400|리니어_59,500"
15446855,앱코 HACKER K660M TKL 이색사출 PBT 체리 키보드 딥로얄,"갈축_79,000|저소음적축_89,000","갈축_79,000|저소음적축_89,000",0
15446894,앱코 HACKER K660M TKL 이색사출 PBT 체리 키보드 딥로얄,0,0,"갈축_79,000|저소음적축_89,000"
15446945,앱코 HACKER K660M TKL 이색사출 PBT 체리 키보드 딥샌드,"갈축_79,000|저소음 적축_89,000","갈축_79,000|저소음 적축_89,000","갈축_79,000|저소음 적축_89,000"
11137791,앱코 HACKER K660M 이색사출 PBT 체리 키보드 미드나잇그린,"갈축_86,700|저소음 적축_105,900|적축_59,900|청축_133,000","갈축_86,700|저소음 적축_105,900|적축_59,900|청축_133,000","갈축_86,700|저소음 적축_105,900|적축_59,900|청축_133,000"
11137776,앱코 HACKER K660M 이색사출 PBT 체리 키보드 블랙,"청축_105,900|갈축_105,900|저소음 적축_119,000|적축_59,900","청축_105,900|갈축_105,900|저소음 적축_119,000|적축_59,900","청축_105,900|갈축_105,900|저소음 적축_119,000|적축_59,900"
6167983,앱코 HACKER K662 카일 광축 완전방수 축교환 어반그레이,"V1, 클릭_68,000|V2, 클릭_68,000|V1, 리니어_68,000|V2, 리니어_115,810","V1, 클릭_68,000|V2, 클릭_68,000|V1, 리니어_68,000|V2, 리니어_115,810","V1, 클릭_68,000|V2, 클릭_68,000|V1, 리니어_68,000|V2, 리니어_115,810"
5742922,앱코 HACKER K720 ET광축 축교환 완전방수 게이밍,"블랙, 클릭_55,220|화이트, 클릭_55,220","블랙, 클릭_55,220|화이트, 클릭_55,220","블랙, 클릭_55,220|화이트, 클릭_55,220"
11874703,앱코 HACKER K7900 카일광축 완전방수 레인보우 PBT Moving LED,"클릭_59,900","클릭_59,900","클릭_59,900"
6369156,앱코 HACKER K815 코리아 어디션 카일 광축 완전방수 축교환 LED 게이밍 키보드,"클릭_55,220","클릭_55,220","클릭_55,220"
5546958,앱코 HACKER K840 조약돌 레트로 축교환 기계식,"블랙, 청축_29,500|블랙, 갈축_29,500|블랙, 적축_29,500|화이트, 청축_29,500|화이트, 갈축_29,500||","블랙, 청축_29,500|블랙, 갈축_29,500|블랙, 적축_29,500|화이트, 청축_29,500|화이트, 갈축_29,500||","블랙, 청축_29,500|블랙, 갈축_29,500|블랙, 적축_29,500|화이트, 청축_29,500|화이트, 갈축_29,500||"
6085211,앱코 HACKER K8800 카일 광축 완전방수 축교환 크리스탈 키캡,"레드, 클릭_59,340|화이트 V1, 클릭_58,460|화이트 V2, 클릭_57,700","레드, 클릭_59,250|화이트 V1, 클릭_58,460|화이트 V2, 클릭_57,600","레드, 클릭_59,230|화이트 V1, 클릭_58,460|화이트 V2, 클릭_57,500"
6450798,앱코 HACKER K8900 카일 광축 완전방수 어반그레이,"V1, 클릭_일시품절|V2, 클릭_162,840","V1, 클릭_일시품절|V2, 클릭_162,840","V1, 클릭_일시품절|V2, 클릭_162,840"
7969963,앱코 HACKER K9100 ARC 프리미엄 카일 광축 크리스탈 키캡 완전방수 LED,"레드, 클릭_76,200|옐로우, 클릭_76,200","레드, 클릭_76,200|옐로우, 클릭_76,200",0
7970005,앱코 HACKER K9100 ARC 프리미엄 카일 광축 크리스탈 키캡 완전방수 LED,0,0,"레드, 클릭_76,200|옐로우, 클릭_76,200"
9309579,앱코 HACKER K9500 ARC 프리미엄 카일 광축 완전방수 투광 키캡,일시품절,일시품절,0
9242871,앱코 HACKER K990 V3 스카이문 LED 완전방수 무접점,"45g_175,000","45g_175,000","45g_175,000"
6413854,앱코 HACKER K995P V3 RGB PBT 무접점,"화이트, 45g_159,000|블랙, 45g_159,000",0,0
6413846,앱코 HACKER K995P V3 RGB PBT 무접점,0,"화이트, 45g_159,000|블랙, 45g_159,000","화이트, 45g_159,000|블랙, 45g_159,000"
12066962,앱코 HACKER K997P PBT 투톤 RGB 완전방수 무접점 키보드,"블랙, 45g_149,500|화이트, 45g_149,500","블랙, 45g_149,500|화이트, 45g_149,500","블랙, 45g_149,500|화이트, 45g_149,500"
6843574,앱코 HACKER KM350 키보드 마우스 콤보 레인보우 LED 게이밍,"24,500","24,500","24,500"
13050158,앱코 HACKER KM700 게이밍 키보드 마우스 장패드 세트,"블랙_23,900","블랙_23,900","블랙_23,900"
11833771,앱코 HACKER KN01 텐키리스 PBT RGB 무접점 키보드,"블랙, 45g_99,000|블랙, 55g_99,000|화이트, 45g_99,000|화이트, 55g_99,000","블랙, 45g_99,000|블랙, 55g_99,000|화이트, 45g_99,000|화이트, 55g_99,000","블랙, 45g_99,000|블랙, 55g_99,000|화이트, 45g_99,000|화이트, 55g_99,000"
12170507,앱코 HACKER KN10 PBT RGB 무접점 키보드,"블랙, 45g_109,000|블랙, 55g_109,000|화이트, 55g_109,000","블랙, 45g_109,000|블랙, 55g_109,000|화이트, 55g_109,000","블랙, 45g_109,000|블랙, 55g_109,000|화이트, 55g_109,000"
5790735,앱코 HACKER PBT 이중사출 컬러 키캡 LP 104키,블루_일시품절,블루_일시품절,블루_일시품절
5228654,앱코 HACKER QUICK SWAP용 OUTEMU 스위치,"8개, 청축_2,200|8개, 갈축_2,200|8개, 적축_2,200|8개, 흑축_2,250|각2개, 청축/갈축/적축/흑축_2,200","8개, 청축_2,200|8개, 갈축_2,200|8개, 적축_2,200|8개, 흑축_2,250|각2개, 청축/갈축/적축/흑축_2,200",0
5228638,앱코 HACKER QUICK SWAP용 OUTEMU 스위치,0,0,"8개, 청축_2,200|8개, 갈축_2,200|8개, 적축_2,200|8개, 흑축_2,250|각2개, 청축/갈축/적축/흑축_2,200"
5827146,앱코 HACKER 카일 정품 광축 스위치,"10개, 클릭_4,000|10개, 리니어_4,000|5+5개, 클릭/리니어_4,000",0,0
5827139,앱코 HACKER 카일 정품 광축 스위치,0,"10개, 클릭_4,000|10개, 리니어_4,000|5+5개, 클릭/리니어_4,000","10개, 클릭_4,000|10개, 리니어_4,000|5+5개, 클릭/리니어_4,000"
2788274,앱코 K-A4U,"98,400","98,400","98,400"
28450715,앱코 K1924 RETRO GTMX NON-LED 게이밍 기계식,"갈축_49,000|적축_49,000|청축_49,000","갈축_49,000|적축_49,000|청축_49,000","갈축_49,000|적축_49,000|청축_49,000"
18878243,앱코 K517 레트로 기계식,"적축_39,900|갈축_39,900|청축_39,900","적축_39,900|갈축_39,900|청축_39,900","적축_39,900|갈축_39,900|청축_39,900"
12278276,앱코 K551 A광축 사이드 Edge RGB LED 게이밍 키보드,"클릭_38,760","클릭_37,450","클릭_37,450"
13363187,앱코 K560 축교환 레인보우 무빙 LED 기계식 키보드,"블랙, 청축_27,900|블랙, 갈축_27,900|블랙, 적축_27,900|화이트, 청축_27,890|화이트, 갈축_27,890|","블랙, 청축_27,900|블랙, 갈축_27,900|블랙, 적축_27,900|화이트, 청축_27,890|화이트, 갈축_27,890|","블랙, 청축_27,900|블랙, 갈축_27,900|블랙, 적축_27,900|화이트, 청축_27,890|화이트, 갈축_27,890|"
14471114,앱코 K570 축교환 레인보우 무빙 LED 기계식 키보드,"청축_31,990|갈축_32,000|적축_32,000",0,"청축_31,990|갈축_32,000|적축_32,000"
14471015,앱코 K570 축교환 레인보우 무빙 LED 기계식 키보드,0,"청축_31,990|갈축_32,000|적축_32,000",0
13363517,앱코 K640T SLIM 축교환 무빙LED 텐키리스 기계식 블랙,"청축_39,900|적축_39,900","청축_39,900|적축_39,900","청축_39,900|적축_39,900"
15282614,앱코 K640T SLIM 축교환 무빙LED 텐키리스 기계식 화이트,"청축_39,900|적축_39,900","청축_39,900|적축_39,900","청축_39,900|적축_39,900"
17057819,앱코 K641 SLIM PLUS RGB 게이밍 기계식 키보드,"청축_48,850|적축_49,900","청축_46,790|적축_49,900","청축_48,850|적축_49,900"
19456031,앱코 K660 블루민트 에디션 카일 광축 게이밍,"62,000","62,000","62,000"
17345816,앱코 K660M-L68 무선 블루투스 기계식 미니 키보드,"블랙_99,000|화이트_99,000","블랙_99,000|화이트_99,000","블랙_99,000|화이트_99,000"
13208633,앱코 K660P 프리미엄 카일광축 무빙 LED 게이밍 기계식 키보드,"마젠타, 클릭_73,000|다크 그레이, 클릭_73,000","마젠타, 클릭_73,000|다크 그레이, 클릭_73,000","마젠타, 클릭_73,000|다크 그레이, 클릭_73,000"
19690820,앱코 K669 카일 광축 게이밍,"블랙 레드_65,000|핑크 화이트_65,000","블랙 레드_65,000|핑크 화이트_65,000","블랙 레드_65,000|핑크 화이트_65,000"
27754094,앱코 K8200 PRO 스카이블루 아이스큐브 키캡 게이밍,"클릭_69,000","클릭_69,000","클릭_69,000"
15825842,앱코 K840 사각 레트로 축교환 기계식 블랙,"갈축_49,900|청축_46,760|적축_49,900","갈축_49,900|청축_49,900|적축_49,900","갈축_49,900|청축_49,900|적축_49,900"
15825908,앱코 K840 사각 레트로 축교환 기계식 화이트,"청축_49,500|갈축_49,900|적축_49,900","청축_49,500|갈축_49,900|적축_49,900","청축_49,500|갈축_49,900|적축_49,900"
15150857,앱코 K841 조약돌 레트로 축교환 기계식 민트,"청축_32,000|갈축_32,000|적축_32,000","청축_32,000|갈축_32,000|적축_32,000","청축_32,000|갈축_32,000|적축_32,000"
15150836,앱코 K841 조약돌 레트로 축교환 기계식 핑크,"청축_32,000|갈축_32,000|적축_32,000","청축_32,000|갈축_32,000|적축_32,000","청축_32,000|갈축_32,000|적축_32,000"
27755567,앱코 K8900 PRO 블랙 아이스큐브 키캡 게이밍,"69,000","69,000","69,000"
9494319,앱코 KM110 RGB 멤브레인 키보드 마우스 합본,"블랙_13,900|화이트_13,900","블랙_13,900|화이트_13,900","블랙_13,800|화이트_13,800"
9494352,앱코 KM120 RGB 멤브레인 키보드 마우스 합본,"블랙_18,000|화이트_18,000","블랙_18,000|화이트_18,000","블랙_18,000|화이트_18,000"
12399617,앱코 KM150 키보드 마우스 오피스 세트,"16,500","16,500","16,500"
12471623,앱코 KM250 키보드 마우스 세트,"8,520","8,250","8,520"
5182267,앱코 KM400 게이밍 콤보,"블랙_25,000|화이트_27,500","블랙_25,000|화이트_27,500","블랙_25,000|화이트_27,500"
18650699,앱코 KM500 키보드 마우스 세트,"V1, 화이트_25,070|V1, 블랙_25,900|V2, 블랙_25,070|V2, 화이트_25,070","V1, 화이트_25,070|V1, 블랙_25,900|V2, 블랙_25,070|V2, 화이트_25,070","V1, 화이트_25,070|V1, 블랙_25,900|V2, 블랙_25,070|V2, 화이트_25,070"
19562501,앱코 KM800 키보드 마우스 세트,"블랙_33,000|화이트_33,000","블랙_33,000|화이트_33,000","블랙_33,000|화이트_33,000"
12376373,앱코 KN01 BT 블루투스 TKL 무접점 게이밍 키보드 블랙,"45g_99,000|55g_124,000","45g_99,000|55g_124,000","45g_99,000|55g_124,000"
12376391,앱코 KN01 BT 블루투스 TKL 무접점 게이밍 키보드 화이트,"45g_181,200","45g_181,200","45g_181,200"
15230645,앱코 KN01C 텐키리스 PBT 무접점 키보드 블루,"30g_150,000","30g_150,000","30g_150,000"
15230654,앱코 KN01C 텐키리스 PBT 무접점 키보드 핑크,"45g_150,000","45g_150,000","45g_150,000"
19645700,앱코 KN02C 삼색사출 PBT 텐키리스 무접점,"149,000","149,000","149,000"
12376532,앱코 KN10 BT 블루투스 무접점 게이밍 키보드 블랙,"45g_162,980|55g_214,900","45g_162,980|55g_214,900","45g_162,980|55g_214,900"
12376574,앱코 KN10 BT 블루투스 무접점 게이밍 키보드 화이트,"45g_200,000|55g_215,500","45g_200,000|55g_215,500","45g_200,000|55g_215,500"
15229799,앱코 KN10C PBT 무접점 키보드,"그레이, 30g_169,000|핑크, 45g_169,000","그레이, 30g_169,000|핑크, 45g_169,000","그레이, 30g_169,000|핑크, 45g_169,000"
19645514,앱코 KN20C 삼색사출 PBT 무접점,"175,000","175,000","175,000"
24133613,앱코 KN30BT 블루투스 유무선 무접점,"159,000","159,000","159,000"
9925461,앱코 KP10 키패드,"7,000","7,000","7,000"
16994000,앱코 KP35BT 블루투스 와이드 키패드,"28,900","28,900","28,900"
2241246,앱코 MultiPack KM-A4P,"10,100","10,100","10,100"
2682415,앱코 MultiPack KM-A4U,"13,800","13,800","13,800"
2241240,앱코 MultiPack KM-A5PS,"키스킨 포함_11,800","키스킨 포함_11,800","키스킨 포함_11,800"
14216075,앱코 PUBG 배틀그라운드 하자드 에디션 카일 광축,"145,470","145,470","145,470"
14321915,앱코 TOS100 무선 키보드,"72,100","72,100","72,100"
16792100,앱코 TOS180 블루투스 펜타그래프 키보드,"19,900","19,900","19,900"
13655036,앱코 TOS200 LED 블루투스 키보드,"로즈골드_178,500|블랙_112,120","로즈골드_178,300|블랙_112,120","로즈골드_177,910|블랙_112,120"
14691737,앱코 TOS250 LED 블루투스 키보드,"블랙_44,640|화이트_39,890","블랙_44,640|화이트_39,890","블랙_44,640|화이트_39,890"
14567123,앱코 TPM1 TKL 어고노믹 월넛 팜레스트,"19,900","19,900","19,900"
14567039,앱코 TPM1 어고노믹 월넛 팜레스트,"22,500","22,500","22,500"
12423566,앱코 TW1867 레트로 블루투스 기계식 키보드,"청축_87,000|적축_87,000","청축_87,000|적축_87,000","청축_87,000|적축_87,000"
11123001,앱코 WKM01 무선 키보드 마우스 세트,"핑크_23,000|민트_23,000|블루_23,000","핑크_23,000|민트_23,000|블루_23,000","핑크_23,000|민트_23,000|블루_23,000"
11480607,앱코 WKM02 무선 키보드 마우스 세트,"블랙_29,810|화이트_29,880","블랙_29,810|화이트_29,880","블랙_29,810|화이트_29,880"
13912325,앱코 WKM03 무선 키보드마우스 세트,"블랙_18,900|핑크_11,000","블랙_18,900|핑크_11,000","블랙_18,900|핑크_11,000"
12098402,앱코 WKM160 펜타그래프 무선 키보드 마우스 오피스 세트,"28,100","28,100","28,100"
12129872,앱코 WKM360 무선 터치패드 키보드,"27,200","27,200","27,200"
13037375,앱코 WKM40 무선 키보드 마우스 세트,"베이지_21,900","베이지_21,900","베이지_21,900"
13037507,앱코 WKM50 펜홀더형 무선 키보드 마우스 세트,"핑크_21,900|네이비_21,900","핑크_21,900|네이비_21,900","핑크_21,900|네이비_21,900"
13037591,앱코 WKM60 무선 키보드 마우스 세트,"블랙_21,100","블랙_21,100","블랙_21,100"
12278561,앱코 WKM620 TKL 멀티 컬러 육각키캡 무선 미니 키보드 마우스 세트,"옐로우_28,000|피치_9,900|핑크_9,900","옐로우_28,000|피치_9,900|핑크_9,900","옐로우_28,000|피치_9,900|핑크_9,900"
12257396,앱코 WKM650 멀티 컬러 육각키캡 무선 키보드 마우스 세트,"핑크_10,900|스카이 블루_10,900|카키_14,100","핑크_10,900|스카이 블루_10,900|카키_14,100","핑크_10,900|스카이 블루_10,900|카키_14,100"
17990549,앱코 WKM800 무선 키보드 마우스 세트,"21,500","21,500","21,500"
13860356,앱코 WKM900 무소음 무선 키보드 마우스 세트,"블랙_27,970","블랙_27,970","블랙_27,970"
5682284,앱코 레트로 써클 컬러 키캡 104키,"블랙_43,000|화이트, 실버_31,570|핑크_31,000","블랙_43,000|화이트, 실버_31,570|핑크_31,000","블랙_43,000|화이트, 실버_31,570|핑크_31,000"
4291186,앱코 레트로 써클 키캡,"68키_33,000|87키_38,000|104키_43,000","68키_33,000|87키_38,000|104키_43,000","68키_33,000|87키_38,000|104키_50,000"
13493210,앱코 앱코 ASM01 스위트몬스터 스페셜에디션 무선 터치패드 키보드,"9,900","9,900","9,900"
3768039,앱코 초콜릿 KM80 무선 Combo,"골드_32,400|블랙_32,400|핑크_18,000","골드_32,400|블랙_32,400|핑크_18,000","골드_32,400|블랙_32,400|핑크_18,000"
6121808,에이데이타코리아 DDZONE DMK-900M,"14,410","14,410","14,410"
15120776,에이투 AG0301 게이밍 LED TKL 기계식 키보드,"블랙_54,840|화이트_54,840","블랙_54,840|화이트_54,840",0
16376123,에이투 AG0301 게이밍 LED TKL 기계식 키보드,0,0,"블랙_54,840|화이트_54,840"
28833113,엘디네트웍스 APL-KT65,"40,580","40,590","40,730"
28441016,엠스톤글로벌 GV10 수제윤활 라이트MA,"코랄V2축, 38g_164,000|밀키V2축, 38g_164,000|밀키V2축, 45g_164,000|저소음 갈축_159,000|저소음 밀키축, 38g_164,000|||||","코랄V2축, 38g_164,000|밀키V2축, 38g_164,000|밀키V2축, 45g_164,000|저소음 갈축_159,000|저소음 밀키축, 38g_164,000|||||",0
28883351,엠스톤글로벌 GV10 수제윤활 클라리온 MA,"코랄V2축, 38g_가격비교예정|갈축, 35g_가격비교예정|갈축, 45g_가격비교예정|밀키V2축, 38g_가격비교예정|밀키V2축, 45g_가격비교예정||||||||||||||","코랄V2축, 38g_164,000|갈축, 35g_가격비교예정|갈축, 45g_151,000|밀키V2축, 38g_164,000|밀키V2축, 45g_164,000||||||||||||||","코랄V2축, 38g_164,000|갈축, 35g_가격비교예정|갈축, 45g_151,000|밀키V2축, 38g_164,000|밀키V2축, 45g_164,000||||||||||||||"
28882994,엠스톤글로벌 GV10 수제윤활 클라리온P MA,"밀키V2축, 38g_가격비교예정|갈축, 35g_가격비교예정|갈축, 45g_가격비교예정|밀키V2축, 45g_가격비교예정|밀키V2축, 55g_가격비교예정||||||||||||||","밀키V2축, 38g_164,000|갈축, 35g_가격비교예정|갈축, 45g_151,000|밀키V2축, 45g_164,000|밀키V2축, 55g_가격비교예정||||||||||||||","밀키V2축, 38g_164,000|갈축, 35g_가격비교예정|갈축, 45g_151,000|밀키V2축, 45g_164,000|밀키V2축, 55g_가격비교예정||||||||||||||"
28416083,엠스톤글로벌 GV10 수제윤활 퍼플러MA,"코랄V2축, 38g_164,000|코랄V2축, 45g_164,000|저소음 코랄축, 45g_164,000|밀키V2축, 38g_164,000|밀키V2축, 45g_164,000||||||","코랄V2축, 38g_164,000|코랄V2축, 45g_165,320|저소음 코랄축, 45g_164,000|밀키V2축, 38g_164,000|밀키V2축, 45g_164,000||||||","코랄V2축, 38g_164,000|코랄V2축, 45g_165,320|저소음 코랄축, 45g_164,000|밀키V2축, 38g_164,000|밀키V2축, 45g_164,000||||||"
29342330,엠스톤글로벌 GV8 수제윤활 라이트Y MA,"코랄V2축, 38g_가격비교예정|갈축, 35g_가격비교예정|갈축, 45g_가격비교예정|밀키V2축, 38g_가격비교예정|밀키V2축, 45g_가격비교예정||||||||||||||","코랄V2축, 38g_가격비교예정|갈축, 35g_가격비교예정|갈축, 45g_가격비교예정|밀키V2축, 38g_가격비교예정|밀키V2축, 45g_가격비교예정||||||||||||||","코랄V2축, 38g_가격비교예정|갈축, 35g_가격비교예정|갈축, 45g_가격비교예정|밀키V2축, 38g_가격비교예정|밀키V2축, 45g_가격비교예정||||||||||||||"
