17399789,MOUNTAIN EVEREST 60,"텍타일_214,200|리니어_218,160|리니어 스피드_214,200","텍타일_214,200|리니어_218,160|리니어 스피드_214,200","텍타일_214,200|리니어_218,160|리니어 스피드_214,200"
13144194,MOUNTAIN EVEREST 60 넘버패드,"텍타일_75,300|리니어_75,300|리니어 스피드_75,300","텍타일_75,300|리니어_75,300|리니어 스피드_75,300","텍타일_75,300|리니어_75,300|리니어 스피드_75,300"
17420348,MOUNTAIN EVEREST CORE,"블랙, 청축_249,090|블랙, 갈축_238,990|블랙, 적축_244,000|블랙, 저소음 적축_253,790","블랙, 청축_249,090|블랙, 갈축_238,990|블랙, 적축_244,000|블랙, 저소음 적축_253,790","블랙, 청축_249,090|블랙, 갈축_238,990|블랙, 적축_244,000|블랙, 저소음 적축_253,790"
17808431,MOUNTAIN EVEREST MAX,"블랙, 청축_494,990|블랙, 갈축_494,990|블랙, 적축_465,630|블랙, 저소음 적축_494,990|그레이, 청축_492,470|||",0,"블랙, 청축_494,990|블랙, 갈축_494,990|블랙, 적축_435,210|블랙, 저소음 적축_494,990|그레이, 청축_492,470|||"
17808434,MOUNTAIN EVEREST MAX,0,"블랙, 청축_494,990|블랙, 갈축_494,990|블랙, 적축_465,530|블랙, 저소음 적축_494,990|그레이, 청축_492,470|||",0
17961824,MOUNTAIN PBT 이중사출 키캡 세트,"Aquamarine_A_57,290|Aquamarine_B_57,290|Black_50,890|Dolomite_A_57,290|Dolomite_B_57,300||||||","Aquamarine_A_57,290|Aquamarine_B_57,290|Black_50,890|Dolomite_A_57,290|Dolomite_B_57,300||||||","Aquamarine_A_57,290|Aquamarine_B_57,290|Black_50,890|Dolomite_A_57,290|Dolomite_B_57,300||||||"
13164513,MOUNTAIN 스위치,"리니어 스피드_73,200|리니어_73,200|텍타일_73,200","리니어 스피드_73,200|리니어_73,200|텍타일_73,200","리니어 스피드_73,200|리니어_73,200|텍타일_73,200"
9781407,MSI GK30,"41,900","42,790","42,790"
16349240,MSI GK71 소닉 게이밍 키보드,"적축_172,300|청축_138,590","적축_172,300|청축_138,590","적축_172,300|청축_138,590"
12073796,MSI WR01,"15,000","15,000","15,000"
16955183,MadCatz S.T.R.I.K.E 6,"78,930","78,930","78,930"
28859534,Melgeek Modern97 유무선 기계식 분수,"해외구매_230,720","해외구매_230,720","해외구매_230,720"
28859471,Melgeek Modern97 유무선 기계식 오션,"해외구매_280,790","해외구매_280,790","해외구매_280,790"
28857533,Melgeek Mojo84 유무선 기계식 베이퍼웨이브,"해외구매_258,890","해외구매_258,590","해외구매_258,280"
28857458,Melgeek Mojo84 유무선 기계식 플라스틱 어드밴스 투명,"해외구매_258,990","해외구매_258,990","해외구매_258,990"
28857425,Melgeek Mojo84 유무선 기계식 플라스틱 투명,"해외구매_258,890","해외구매_258,580","해외구매_258,280"
28860080,Melgeek Pixel 유무선 기계식 캔버스,"해외구매_318,990","해외구매_318,990","해외구매_318,990"
28860104,Melgeek Pixel 유무선 기계식 크리스찬,"해외구매_319,000","해외구매_319,000","해외구매_319,000"
28860068,Melgeek Pixel 유무선 기계식 팔레트,"해외구매_318,750","해외구매_318,750","해외구매_318,750"
11757986,Microsoft Bluetooth Desktop,"정품_68,900","정품_68,900",0
13269479,Microsoft Designer Compact Keyboard,"매트 블랙_71,920|라이트 그레이_일시품절",0,0
2298401,Microsoft Sculpt Comfort 데스크탑,"정품_72,900","정품_72,900","정품_72,900"
2310940,Microsoft Sculpt Ergonomic Desktop,"정품_119,000","정품_119,000","정품_119,000"
3657745,Microsoft Wireless Desktop 900,"정품_35,900|해외구매_71,600","정품_35,900|해외구매_71,600","정품_35,900|해외구매_71,600"
3599997,Microsoft 무선 데스크탑 3050,"정품_38,900",0,0
2669904,Microsoft 올인원 Media 키보드,"정품_33,387","정품_33,387","정품_33,387"
16601570,NZXT FUNCTION,"Matte Black_136,250|Matte White_136,250","Matte Black_105,020|Matte White_105,020","Matte Black_105,020|Matte White_105,020"
16614191,NZXT FUNCTION MINITKL,"Matte Black_89,000|Matte White_일시품절","Matte Black_89,000|Matte White_일시품절","Matte Black_89,000|Matte White_일시품절"
16614065,NZXT FUNCTION TENKEYLESS,"Matte Black_179,000","Matte Black_179,000","Matte Black_179,000"
18622754,NuPhy Air60,0,"청축_228,500|갈축_228,490|적축_280,000","청축_228,500|갈축_241,800|적축_280,000"
28575494,NuPhy Air75 스위치 100Pcs,"적축_45,570|갈축_45,570|청축_45,570",0,0
20629943,NuPhy Halo96 유무선 기계식,0,"로즈 글래이셔_229,000|나이트 브리즈_229,000|베이비 라쿤_249,000|베이비 캥거루_249,000","로즈 글래이셔_229,000|나이트 브리즈_229,000|베이비 라쿤_249,000|베이비 캥거루_249,000"
3692246,OA BTKBDA 접이식 키보드,"34,020","34,900","34,900"
5550198,PowerFul KM701UU 키보드 마우스 콤보,"6,810","6,810","6,810"
12256646,QSENN GP-KM2200 Plus,0,0,"USB_9,460|PS/2_9,600"
12149873,QSENN GP-KM4500 Plus,"PS/2_13,880|USB, 블랙_13,900|USB, 화이트_13,900","PS/2_13,880|USB, 블랙_13,900|USB, 화이트_13,900","PS/2_13,880|USB, 블랙_13,900|USB, 화이트_13,900"
15270242,QSENN MK210 무선 키보드 마우스 세트,"블랙, 키스킨 포함_14,800|화이트, 키스킨 포함_14,800|핑크, 키스킨 포함_14,800|민트, 키스킨 포함_14,800|블랙, 키스킨 미포함_14,800|||","블랙, 키스킨 포함_14,800|화이트, 키스킨 포함_14,800|핑크, 키스킨 포함_14,800|민트, 키스킨 포함_14,800|블랙, 키스킨 미포함_14,800|||","블랙, 키스킨 포함_14,800|화이트, 키스킨 포함_14,800|핑크, 키스킨 포함_14,800|민트, 키스킨 포함_14,800|블랙, 키스킨 미포함_14,800|||"
20166155,QSENN MK350 무선 키보드 마우스 세트,0,0,"블랙_19,830|민트_19,830|핑크_19,830|화이트_19,830"
4033514,QSENN PTS-K8000UT,0,"30,900",0
11996414,QSENN SEM-DT25TS LED 텐키리스,"19,900",0,0
3274953,QSENN SEM-DT35 NEW USB,"블랙_12,400|민트_11,880|핑크_11,790|화이트_12,400","블랙_12,400|민트_11,880|핑크_11,790|화이트_12,400","블랙_12,400|민트_11,880|핑크_11,790|화이트_12,400"
19993331,QSENN SEM-DT35W 무선,"블랙_15,900|민트_15,900|핑크_15,490|화이트_15,490","블랙_15,900|민트_15,900|핑크_15,490|화이트_15,490","블랙_15,900|민트_15,900|핑크_15,490|화이트_15,490"
17459588,QSENN SEM-DT45 Plus 무선,"블랙_13,800|민트_13,160|핑크_13,800|화이트_13,670",0,0
17459609,QSENN SEM-DT45 Plus 무선,0,"블랙_13,800|민트_13,160|핑크_13,800|화이트_13,670","블랙_13,800|민트_13,160|핑크_13,800|화이트_13,670"
19301000,ROCCAT MAGMA Mini,"59,890","59,890","59,890"
15845864,ROCCAT VULCAN TKL PRO 한글 화이트,"149,000","149,000","199,000"
29664173,ROYCHE RMK-G1100 키보드 마우스 세트,0,"16,900","16,900"
4112515,Razer BlackWidow Chroma 오버워치 에디션,"녹축_142,157","녹축_142,150","녹축_142,150"
7957945,Razer BlackWidow Lite Stealth US,"블랙, 오렌지축_129,000|머큐리, 오렌지축_일시품절","블랙, 오렌지축_129,000|머큐리, 오렌지축_일시품절","블랙, 오렌지축_129,000|머큐리, 오렌지축_일시품절"
14519933,Razer BlackWidow V3 KR,"녹축_149,000|황축_99,270","녹축_149,000|황축_146,020","녹축_149,000|황축_148,270"
14458727,Razer BlackWidow V3 Mini HyperSpeed KR,"녹축_219,000|황축_219,000","녹축_219,000|황축_219,000","녹축_219,000|황축_219,000"
13617902,Razer BlackWidow V3 Pro KR,"녹축_306,050|황축_310,000","녹축_306,050|황축_310,000","녹축_306,050|황축_310,000"
12495716,Razer BlackWidow V3 Pro US,"녹축_310,000","녹축_310,000","녹축_310,000"
17669585,Razer BlackWidow V3 TKL (해외구매),"133,690",0,0
14244248,Razer BlackWidow V3 TKL KR,"녹축_139,000|황축_129,450","녹축_139,000|황축_129,450","녹축_139,000|황축_129,450"
12495356,Razer BlackWidow V3 US,"녹축_190,990","녹축_190,990","녹축_190,990"
28124966,Razer BlackWidow V4 75% 기계식,"283,210","283,210","288,990"
28125020,Razer BlackWidow V4 75% 기계식 화이트,"283,210","283,210","288,990"
15169460,Razer Blackwidow V3 Mini HyperSpeed Phantom US,"녹축_289,000|황축_289,000","녹축_289,000|황축_289,000","녹축_289,000|황축_289,000"
28497494,Razer Blackwidow V3 Roblox Edition,"정품_216,700|해외구매_149,300","정품_216,610|해외구매_149,300","정품_216,590|해외구매_149,300"
27569933,Razer Blackwidow V4 KR,"216,630","216,630","216,630"
27569942,Razer Blackwidow V4 Linear KR,"216,630","216,630","219,120"
19109549,Razer Blackwidow V4 Pro KR,"328,590","328,490","328,390"
19109573,Razer Blackwidow V4 Pro Linear KR,"정품_312,850|병행수입_428,740","정품_312,850|병행수입_428,740","정품_312,860|병행수입_428,740"
19109597,Razer Blackwidow V4 Pro Linear US,"349,000","349,000","349,000"
19109588,Razer Blackwidow V4 Pro US,"349,000","349,000","349,000"
17685794,Razer DeathStalker V2 Pro Linear KR,"309,990","309,990","309,990"
17685806,Razer DeathStalker V2 Pro Linear US,"249,000","249,000","249,000"
17839187,Razer DeathStalker V2 Pro TKL Linear KR,"293,020","293,020","293,020"
17839301,Razer DeathStalker V2 Pro TKL Linear US,"249,000","251,500","251,500"
18497024,Razer DeathStalker V2 Pro TKL Linear White US,"299,000","299,000","299,000"
18802031,Razer DeathStalker V2 Pro White US 유무선,"309,990","309,990","309,990"
18739907,Razer DeathStalker V2 US,"리니어_199,000","리니어_199,000","리니어_199,000"
14731214,Razer Ergonomic Wrist Rest,TKL_일시품절,TKL_일시품절,TKL_일시품절
10357521,Razer Ergonomic Wrist Rest Pro,"49,000","49,000","49,000"
10357491,Razer Ergonomic Wrist Rest Standard,"28,000","28,000","28,000"
9772839,Razer Huntsman Elite US,"클릭_299,000|리니어_299,000","클릭_299,000|리니어_299,000","클릭_299,000|리니어_299,000"
12066629,Razer Huntsman Mini US,"블랙, 클릭_159,000|머큐리, 리니어_180,000|머큐리, 클릭_169,000|블랙, 리니어_146,500","블랙, 클릭_159,000|머큐리, 리니어_180,000|머큐리, 클릭_169,000|블랙, 리니어_146,500","블랙, 클릭_159,000|머큐리, 리니어_180,000|머큐리, 클릭_169,000|블랙, 리니어_146,500"
9668085,Razer Huntsman Tournament US,"154,000","154,000","154,000"
13569632,Razer Huntsman V2 Analog US,"362,870","362,870","362,870"
21625853,Razer Huntsman V2 Battlegrounds Edition,"리니어_329,000","리니어_329,000","리니어_329,000"
16058669,Razer Huntsman V2 KR,"리니어_219,000|퍼플축_259,000","리니어_219,000|퍼플축_219,060","리니어_219,000|퍼플축_219,060"
15680276,Razer Huntsman V2 TKL KR,"리니어_189,000","리니어_189,000","리니어_188,990"
15332048,Razer Huntsman V2 TKL US,"리니어_일시품절|퍼플축_199,000","리니어_일시품절|퍼플축_199,000","리니어_일시품절|퍼플축_199,000"
15284531,Razer Huntsman V2 US,"리니어_269,000|퍼플축_259,000","리니어_269,000|퍼플축_219,000","리니어_269,000|퍼플축_219,000"
29367731,Razer Huntsman V3 Pro KR,"379,000","379,000","379,000"
29367416,Razer Huntsman V3 Pro Mini US,"268,990","268,990","268,990"
29367524,Razer Huntsman V3 Pro TKL KR,"328,990","328,990","328,990"
29367581,Razer Huntsman V3 Pro TKL US,"329,000","329,000","329,000"
29367683,Razer Huntsman V3 Pro US,"379,000","379,000","379,000"
28773296,Razer Mechanical Switches Pack,"그린_33,020|옐로우_33,020|오렌지_33,020","그린_33,020|옐로우_33,020|오렌지_33,020","그린_33,020|옐로우_33,020|오렌지_33,020"
11538242,Razer ORNATA V2,"222,400","222,400","222,400"
17686100,Razer Ornata V3 KR,"106,820","106,820","106,820"
19970087,Razer Ornata V3 TKL KR,"102,790","102,790","102,790"
28325009,Razer PBT Keycap Coiled Cable Set,"화이트_79,000|그린_79,000|블랙_79,000|핑크_79,000","화이트_79,000|그린_79,000|블랙_79,000|핑크_79,000","화이트_79,000|그린_79,000|블랙_79,000|핑크_79,000"
10357257,Razer PBT Keycap Upgrade Set,"블랙_42,000|그린_42,000|핑크_42,000|화이트_42,000","블랙_42,000|그린_42,000|핑크_42,000|화이트_42,000","블랙_31,850|그린_42,000|핑크_42,000|화이트_42,000"
21625907,Razer PUBG Battlegrounds Edition 키보드 마우스 세트 + 헤드셋,"748,990","748,990","748,990"
15329453,Razer Phantom Keycap Set,"화이트_55,000","화이트_55,000","화이트_55,000"
12227084,Razer Pro Type,"199,000","199,000","199,000"
16716845,Razer Pro type Ultra KR,"214,610","214,610","218,990"
16316537,Razer Pro type Ultra US,"219,000","219,000","219,000"
10770513,Razer Tartarus Pro,"클래식 블랙_189,000|머큐리 화이트_186,470|해외구매_127,700","클래식 블랙_189,000|머큐리 화이트_186,470|해외구매_141,100",0
10770483,Razer Tartarus Pro,0,0,"클래식 블랙_189,000|머큐리 화이트_186,470|해외구매_141,100"
5701063,Razer Tartarus V2,일시품절,일시품절,일시품절
11482773,Redragon BRAHMA K586RGB,"청축_90,000|갈축_107,500|적축_107,490",0,0
17851829,Redragon K617 Fizz,"해외구매_19,760","해외구매_19,760","해외구매_21,330"
29654600,Redragon K629-RGB Phantom 기계식,"해외구매_55,700","해외구매_55,700","해외구매_55,700"
29685893,SPM 3색조합 PBT 이중사출 영문 키캡 147키 오션블루,0,0,"16,900"
29685863,SPM 3색조합 PBT 이중사출 영문 키캡 147키 파스텔퍼플,0,0,"16,900"
29686163,SPM 3색조합 PBT 이중사출 영문 키캡 168키 몬스테라 그린,0,0,"18,900"
29686214,SPM 3색조합 PBT 이중사출 영문 키캡 168키 포터리 블루,0,0,"18,900"
29685173,SPM PC 투명 실크인쇄 한영 키캡 165키 블랙스모그,0,0,"24,900"
29685290,SPM PC 투명 실크인쇄 한영 키캡 165키 클리어,0,0,"24,900"
28798001,TGIC TGC-BK150 + BT102 키보드 마우스 세트,"블루, 골드_26,000|그레이, 골드_26,000|그레이, 레드_26,000|블루, 레드_26,000","블루, 골드_26,000|그레이, 골드_26,000|그레이, 레드_26,000|블루, 레드_26,000","블루, 골드_26,000|그레이, 골드_26,000|그레이, 레드_26,000|블루, 레드_26,000"
28779539,TGIC TGC-BK150 블루투스,"블루_16,280|그레이_16,280","블루_16,280|그레이_16,280","블루_16,280|그레이_16,280"
15318299,TGIC TGC-K7000M 유선 미니 키보드,0,"블랙_5,470","블랙_5,480"
28531145,Topre REALFORCE GX1 무접점,"해외구매_374,730","해외구매_374,730","해외구매_374,730"
16699949,Topre REALFORCE PZ-R2TLSA-US4,"해외구매_248,330","해외구매_247,590","해외구매_245,060"
28418198,Topre REALFORCE R3 BT 유무선 그레이 블루 한글,"474,990","465,000","465,000"
17060957,Topre REALFORCE R3 R3HD11,"해외구매_350,340",0,0
17428598,Topre REALFORCE R3 R3HH21,0,"해외구매_363,810","해외구매_363,710"
13899131,Topre REALFORCE SA PFU Limited Edition R2SA-US4M-WH,"해외구매_346,690",0,0
20082929,VARMILO MA108 V2 WARRIOR SOAR 무접점,"아이리스축_248,990|로즈축_248,990|바이올렛축_248,990|자스민축_248,990|핑크축_248,990","아이리스축_248,990|로즈축_248,990|바이올렛축_248,990|자스민축_248,990|핑크축_248,990","아이리스축_248,990|로즈축_248,990|바이올렛축_248,990|자스민축_248,990|핑크축_248,990"
13728860,VARMILO MA108M KOI PBT 염료승화 영문,"데이지축_208,990|로즈축_220,400|핑크축_209,000","데이지축_208,990|로즈축_220,400|핑크축_209,000","데이지축_208,990|로즈축_220,400|핑크축_209,000"
13350818,VARMILO MA108M Lovebirds I PBT 염료승화 영문,"로즈축_일시품절|핑크축_198,000","로즈축_일시품절|핑크축_198,000",0
13350848,VARMILO MA108M Lovebirds I PBT 염료승화 영문,0,0,"핑크축_198,000"
13350923,VARMILO MA108M Lovebirds YOU PBT 염료승화 영문,"로즈축_197,990|핑크축_197,990","로즈축_197,990|핑크축_197,990","로즈축_197,990|핑크축_197,990"
13199999,VARMILO MA108M MOONLIGHT PBT 염료승화 영문,"핑크축_187,990","핑크축_187,990","핑크축_188,000"
15126398,VARMILO MA108M SUMMIT R2 PBT 염료승화 영문,"핑크축_219,000","핑크축_219,000","핑크축_219,000"
20082431,VARMILO MA87 V2 WARRIOR SOAR 무접점,"데이지축_228,990|로즈축_228,990|바이올렛축_228,990|아이리스축_228,990|자스민축_228,990|","데이지축_228,990|로즈축_228,990|바이올렛축_228,990|아이리스축_228,990|자스민축_228,990|","데이지축_228,990|로즈축_228,990|바이올렛축_228,990|아이리스축_228,990|자스민축_228,990|"
13728956,VARMILO MA87M KOI PBT 염료승화 영문,"데이지축_197,160|로즈축_197,990|핑크축_197,990","데이지축_197,160|로즈축_197,990|핑크축_197,990","데이지축_197,160|로즈축_197,990|핑크축_197,990"
13350356,VARMILO MA87M Lovebirds I PBT 염료승화 영문,"로즈축_389,000","로즈축_389,000","로즈축_389,000"
13350203,VARMILO MA87M Lovebirds You PBT 염료승화 영문,"로즈축_306,500","로즈축_306,500","로즈축_306,500"
15034571,VARMILO MA87M MOONLIGHT PBT 염료승화 영문,"핑크축_일시품절|아이비축_177,990","핑크축_일시품절|아이비축_177,990","핑크축_일시품절|아이비축_177,990"
15126377,VARMILO MA87M SUMMIT R2 PBT 염료승화 영문,"핑크축_208,000","핑크축_208,000","핑크축_208,000"
14160737,VARMILO MA87M 매화 컬렉션 PBT 염료승화 한글,"로즈축_178,000","로즈축_178,000","로즈축_178,000"
28619048,VARMILO MINILO 75% RGB 유무선 기계식,"해외구매_272,500","해외구매_272,500",0
18978827,VARMILO MINILO EUCALYPTUS 유무선 영문,"로즈축_168,990|바이올렛축_168,990|아이리스축_168,990|자스민축_168,990|핑크축_168,990","로즈축_168,990|바이올렛축_168,990|아이리스축_168,990|자스민축_168,990|핑크축_168,990","로즈축_168,990|바이올렛축_168,990|아이리스축_168,990|자스민축_168,990|핑크축_168,990"
18991463,VARMILO MINILO MENDOZAE 유무선 영문,"데이지축_168,990|로즈축_168,990|바이올렛축_168,990|아이리스축_168,990|자스민축_168,990|","데이지축_168,990|로즈축_168,990|바이올렛축_168,990|아이리스축_168,990|자스민축_168,990|","데이지축_168,990|로즈축_168,990|바이올렛축_168,990|아이리스축_168,990|자스민축_168,990|"
12495089,VARMILO MIYA PRO KOI PBT 염료승화 영문,"갈축_179,000|적축_178,990","갈축_179,000|적축_178,990","갈축_179,000|적축_178,990"
5829362,VARMILO MIYA PRO PBT 매화 컬렉션 염료승화 영문,"갈축_138,000","갈축_138,000","갈축_138,000"
13734128,VARMILO VA108M Lovebirds I PBT 염료승화 영문,"저소음 적축_239,000","저소음 적축_239,000","저소음 적축_239,000"
13733990,VARMILO VA108M Lovebirds YOU PBT 염료승화 영문,"저소음 적축_219,000","저소음 적축_219,000","저소음 적축_219,000"
14039525,VARMILO VA108M SUMMIT R2 PBT 염료승화 영문,"갈축_209,000|적축_208,980","갈축_209,000|적축_208,960","갈축_209,000|적축_208,940"
17572766,VARMILO VA108M V2 Dreams on Board PBT 염료승화 한글,"갈축_일시품절|저소음 적축_219,000","갈축_일시품절|저소음 적축_219,000","갈축_일시품절|저소음 적축_219,000"
20260103,VARMILO VA108M V2 MOONLIGHT 한글,"갈축_197,990|저소음 적축_209,000|적축_198,000","갈축_197,990|저소음 적축_209,000|적축_198,000","갈축_197,990|저소음 적축_209,000|적축_198,000"
17632310,VARMILO VA108M V2 PANDA R2 PBT 염료승화 영문,"갈축_일시품절|적축_209,000|저소음 적축_208,730","갈축_일시품절|적축_209,000|저소음 적축_208,730","갈축_일시품절|적축_209,000|저소음 적축_208,730"
16841903,VARMILO VA108M V2 SEA MELODY PBT 염료승화 한글,"갈축_202,260|적축_202,260|저소음 적축_209,000","갈축_202,260|적축_202,260|저소음 적축_209,000","갈축_202,260|적축_202,260|저소음 적축_209,000"
16894562,VARMILO VA108M V2 SUMMIT R2 PBT 염료승화 영문,"적축_299,000","적축_299,000","적축_299,000"
28184024,VARMILO VA108M V2 SUMMIT 기계식,"저소음 적축_259,180","저소음 적축_259,070","저소음 적축_258,970"
16894238,VARMILO VA108M V2 다크 그레이 PBT 염료승화 한글,"갈축_199,000|적축_189,420|저소음 적축_179,000","갈축_199,000|적축_189,330|저소음 적축_179,000","갈축_199,000|적축_189,310|저소음 적축_179,000"
16893995,VARMILO VA108M V2 다크믹스 PBT 염료승화 한글,"적축_172,640|저소음 적축_179,000","적축_172,640|저소음 적축_171,250","적축_172,640|저소음 적축_179,000"
16855478,VARMILO VA108M V2 매화 컬렉션 PBT 염료승화 한글,"저소음 적축_219,000","저소음 적축_219,000","저소음 적축_219,000"
16874480,VARMILO VA108Mac V2 밀키 화이트 PBT 염료승화 영문,"갈축_179,000|적축_179,000|저소음 적축_189,000","갈축_179,000|적축_179,000|저소음 적축_189,000","갈축_179,000|적축_179,000|저소음 적축_189,000"
13882346,VARMILO VA87M Beijing Opera 염료승화 영문,"적축_198,000","적축_198,000","적축_198,000"
9639522,VARMILO VA87M KOI PBT 염료승화 영문,"갈축_188,990|적축_188,990","갈축_188,990|적축_188,990","갈축_188,990|적축_188,990"
15835511,VARMILO VA87M Lovebirds I PBT 염료승화 영문,"저소음 적축_219,000","저소음 적축_219,000","저소음 적축_219,000"
15835523,VARMILO VA87M Lovebirds YOU PBT 염료승화 영문,"저소음 적축_218,990","저소음 적축_218,990","저소음 적축_218,990"
12137576,VARMILO VA87M MONOGRAY PBT 염료승화 한글,"갈축_161,250|적축_167,790",0,0
12137534,VARMILO VA87M MONOGRAY PBT 염료승화 한글,0,"갈축_161,250|적축_167,780","갈축_161,250|적축_167,780"
14963873,VARMILO VA87M MOONLIGHT PBT 염료승화 영문,"갈축_177,990","갈축_177,990","갈축_177,990"
14039435,VARMILO VA87M SUMMIT R2 PBT 염료승화 영문,"갈축_198,000|저소음 적축_203,810|적축_198,000","갈축_198,000|저소음 적축_203,810|적축_198,000","갈축_198,000|저소음 적축_203,810|적축_198,000"
17572676,VARMILO VA87M V2 Dreams on Board PBT 염료승화 한글,"갈축_189,000|저소음 적축_일시품절","갈축_189,000|저소음 적축_198,000","갈축_189,000|저소음 적축_일시품절"
20260532,VARMILO VA87M V2 MOONLIGHT 한글,"갈축_178,990|저소음 적축_일시품절|적축_178,990","갈축_178,990|저소음 적축_일시품절|적축_178,990","갈축_178,990|저소음 적축_일시품절|적축_178,990"
17632271,VARMILO VA87M V2 PANDA R2 PBT 염료승화 영문,"갈축_일시품절|저소음 적축_375,000|적축_일시품절","갈축_일시품절|저소음 적축_375,000|적축_일시품절","갈축_일시품절|저소음 적축_375,000|적축_일시품절"
16841807,VARMILO VA87M V2 SEA MELODY PBT 염료승화 한글,"갈축_193,060|적축_193,060|저소음 적축_198,000","갈축_193,060|적축_193,060|저소음 적축_198,000","갈축_193,060|적축_193,060|저소음 적축_198,000"
16894469,VARMILO VA87M V2 SUMMIT R2 PBT 염료승화 영문,"적축_209,000","적축_209,000","적축_209,000"
16894097,VARMILO VA87M V2 다크 그레이 PBT 염료승화 한글,"갈축_161,250|적축_249,800","갈축_161,250|적축_249,800","갈축_161,250|적축_249,800"
16893824,VARMILO VA87M V2 다크믹스 PBT 염료승화 한글,"갈축_159,000|적축_159,000|저소음 적축_일시품절","갈축_159,000|적축_159,000|저소음 적축_일시품절",0
16893761,VARMILO VA87M V2 다크믹스 PBT 염료승화 한글,0,0,"갈축_159,000|적축_159,000|저소음 적축_일시품절"
16855292,VARMILO VA87M V2 매화 컬렉션 PBT 염료승화 한글,"갈축_198,000|적축_198,000|저소음 적축_198,000","갈축_198,000|적축_198,000|저소음 적축_198,000","갈축_198,000|적축_198,000|저소음 적축_198,000"
18384794,VARMILO VA87M V2 매화 컬렉션 R2 PBT 염료승화 한글,"갈축_198,000|저소음 적축_209,000|적축_198,000","갈축_198,000|저소음 적축_209,000|적축_198,000","갈축_198,000|저소음 적축_209,000|적축_198,000"
7001119,VARMILO VA87M 다크그레이 RE PBT 염료승화 한글,"갈축_152,760|적축_189,000","갈축_152,760|적축_189,000","갈축_152,760|적축_189,000"
11823049,VARMILO VA87M 다크믹스 RE PBT 염료승화 한글,"저소음 적축_486,000","저소음 적축_486,000","저소음 적축_486,000"
11500380,VARMILO VA87M 매화 컬렉션 PBT 염료승화 한글,"갈축_157,990|저소음 적축_262,000","갈축_157,990|저소음 적축_262,000","갈축_158,000|저소음 적축_259,100"
16873304,VARMILO VA87Mac V2 밀키 화이트 PBT 염료승화 영문,"갈축_169,000|적축_169,000|저소음 적축_179,000","갈축_169,000|적축_169,000|저소음 적축_179,000",0
16874330,VARMILO VA87Mac V2 밀키 화이트 PBT 염료승화 영문,0,0,"갈축_169,000|적축_169,000|저소음 적축_179,000"
14012846,VARMILO X ZOMO 고양이 발바닥 ABS 키캡,"젖소냥_22,000|고등어냥_18,890|샴냥_18,900|치즈냥_22,000","젖소냥_22,000|고등어냥_18,890|샴냥_18,900|치즈냥_22,000","젖소냥_22,000|고등어냥_18,890|샴냥_18,900|치즈냥_22,000"
13956101,WEZEL WZ-K2100,"3,410","3,410","3,410"
15791006,WEZEL WZ-MK3500,0,0,"5,300"
20607614,Wooting 60HE,"해외구매_269,000","해외구매_269,000","해외구매_269,000"
29396498,Workey 체리 PBT 던 포레스트 키캡,"33,740","33,740","33,740"
27696722,XINMENG M71 유무선 기계식,"해외구매_43,500","해외구매_43,500","해외구매_43,500"
28577645,ZECTUS OEM 프로파일 PBT 푸딩키캡,"10,750",0,0
13064861,archon K75 영문 블루투스 5.0 기계식 키보드,"화이트, 갈축_78,650|블랙, 갈축_78,650|블랙, 저소음 적축_98,450|블랙, 적축_78,650|화이트, 저소음 적축_98,450|","화이트, 갈축_78,650|블랙, 갈축_78,650|블랙, 저소음 적축_98,450|블랙, 적축_78,650|화이트, 저소음 적축_98,450|","화이트, 갈축_78,650|블랙, 갈축_78,650|블랙, 저소음 적축_98,450|블랙, 적축_78,650|화이트, 저소음 적축_98,450|"
