9321162,앱코 HACKER K515 축교환 측면 RGB 라이팅 이중사출 게이밍 기계식 키보드,"블랙, 청축_37,900|블랙, 갈축_37,900|블랙, 적축_37,900|화이트, 갈축_37,900|화이트, 적축_37,900|","블랙, 청축_37,900|블랙, 갈축_37,900|블랙, 적축_37,900|화이트, 갈축_35,910|화이트, 적축_37,900|","블랙, 청축_37,900|블랙, 갈축_37,900|블랙, 적축_37,900|화이트, 갈축_37,400|화이트, 적축_37,900|"
9326580,앱코 HACKER K516 축교환 측면 RGB 라이팅 이중사출 게이밍 기계식 키보드,"레드, 청축_33,900|레드, 갈축_33,900|레드, 적축_33,000|옐로우, 갈축_50,350|옐로우, 적축_45,440|","레드, 청축_33,900|레드, 갈축_33,900|레드, 적축_33,000|옐로우, 갈축_50,350|옐로우, 적축_45,440|","레드, 청축_33,900|레드, 갈축_33,900|레드, 적축_33,000|옐로우, 갈축_50,350|옐로우, 적축_45,440|"
9647322,앱코 HACKER K523 기계식 축교환 LED 키패드,"청축_14,300|적축_14,300","청축_14,300|적축_14,300","청축_14,300|적축_14,300"
10272321,앱코 HACKER K550 A광축 축교환 측면 RGB 라이팅 완전방수 이중사출 게이밍 키보드,"블랙, 클릭_34,010","블랙, 클릭_33,880","블랙, 클릭_33,730"
10272501,앱코 HACKER K5500 A광축 축교환 측면 RGB 라이팅 완전방수 크리스탈 게이밍 키보드,"블랙, 클릭_298,970","블랙, 클릭_269,100","블랙, 클릭_298,990"
6281637,앱코 HACKER K590 축교환 LED 게이밍 기계식 키보드 블랙,"청축_73,730|적축_61,320","청축_73,730|적축_61,320","청축_73,730|적축_61,320"
6281650,앱코 HACKER K590 축교환 LED 게이밍 기계식 키보드 화이트,"청축_75,200","청축_75,200","청축_75,200"
8323581,앱코 HACKER K595 LED 축교환 게이밍 기계식,"화이트, 청축_32,600","화이트, 청축_32,600","화이트, 청축_32,600"
5339011,앱코 HACKER K6000 엘리트 리얼 RGB 에디션,"그린, 청축_44,000","그린, 청축_44,000","그린, 청축_44,000"
9844809,앱코 HACKER K611 텐키리스 카일광축 완전방수 축교환 게이밍 키보드 핑크 V1,"리니어_45,900|클릭_45,900","리니어_45,900|클릭_45,900","리니어_45,890|클릭_45,900"
9844815,앱코 HACKER K611 텐키리스 카일광축 완전방수 축교환 게이밍 키보드 핑크 V2,"클릭_45,890|리니어_45,900","클릭_45,890|리니어_45,900","클릭_45,890|리니어_45,900"
5040324,앱코 HACKER K640 축교환 게이밍 기계식 블랙,"청축_39,000|갈축_39,000|적축_39,000","청축_39,000|갈축_39,000|적축_39,000","청축_39,000|갈축_39,000|적축_39,000"
5128947,앱코 HACKER K640 축교환 게이밍 기계식 화이트,"청축_39,000","청축_39,000","청축_39,000"
6392210,앱코 HACKER K640 플러스 축교환 측면 LED 게이밍 키보드,"블랙, 적축_45,000|화이트, 청축_일시품절","블랙, 적축_45,000|화이트, 청축_일시품절","블랙, 적축_45,000|화이트, 청축_일시품절"
5139191,앱코 HACKER K640T 축교환 게이밍 기계식 텐키리스,"블랙, 적축_42,900","블랙, 적축_42,900","블랙, 적축_42,900"
5359118,앱코 HACKER K6500 PBT 스페셜 블루 에디션,"청축_62,000","청축_62,000","청축_62,000"
7812214,앱코 HACKER K660 ARC 프리미엄 카일 광축 완전방수 RGB LED,"블랙, 클릭_일시품절|옐로우, 클릭_109,600",0,0
7812202,앱코 HACKER K660 ARC 프리미엄 카일 광축 완전방수 RGB LED,0,"블랙, 클릭_일시품절|옐로우, 클릭_109,600","블랙, 클릭_일시품절|옐로우, 클릭_109,600"
6982558,앱코 HACKER K660 ARC 프리미엄 카일 광축 완전방수 레인보우 LED,"블랙, 클릭_55,030|레드, 클릭_55,800|옐로우, 클릭_59,000|블랙, 리니어_59,000|옐로우, 리니어_59,000","블랙, 클릭_55,030|레드, 클릭_58,040|옐로우, 클릭_59,000|블랙, 리니어_59,000|옐로우, 리니어_59,000","블랙, 클릭_55,030|레드, 클릭_58,040|옐로우, 클릭_59,000|블랙, 리니어_59,000|옐로우, 리니어_59,000"
6571880,앱코 HACKER K660 단일 LED 에디션 카일 광축 축교환 완전방수 게이밍,"블랙, 클릭_59,000","블랙, 클릭_59,000","블랙, 클릭_59,000"
5633045,앱코 HACKER K660 축교환 완전방수 게이밍 카일 광축 레드,"클릭_59,500|리니어_59,500","클릭_59,500|리니어_59,500","클릭_59,500|리니어_59,500"
5221479,앱코 HACKER K660 축교환 완전방수 게이밍 카일 광축 블랙,"클릭_59,500|리니어_59,500","클릭_59,500|리니어_59,500","클릭_59,500|리니어_59,490"
5633048,앱코 HACKER K660 축교환 완전방수 게이밍 카일 광축 옐로우,"클릭_59,490|리니어_59,500","클릭_59,490|리니어_59,500","클릭_59,490|리니어_59,500"
5762059,앱코 HACKER K660 축교환 완전방수 게이밍 카일 광축 화이트,"클릭_59,400|리니어_59,500","클릭_59,400|리니어_59,500","클릭_59,400|리니어_59,500"
15446894,앱코 HACKER K660M TKL 이색사출 PBT 체리 키보드 딥로얄,"갈축_79,000|저소음적축_89,000","갈축_79,000|저소음적축_89,000","갈축_79,000|저소음적축_89,000"
15446945,앱코 HACKER K660M TKL 이색사출 PBT 체리 키보드 딥샌드,"갈축_79,000|저소음 적축_89,000","갈축_79,000|저소음 적축_89,000","갈축_79,000|저소음 적축_89,000"
11137797,앱코 HACKER K660M 이색사출 PBT 체리 키보드 미드나잇그린,"갈축_209,690|저소음 적축_일시품절|적축_105,900|청축_133,000","갈축_209,690|저소음 적축_일시품절|적축_105,900|청축_133,000",0
11137791,앱코 HACKER K660M 이색사출 PBT 체리 키보드 미드나잇그린,0,0,"갈축_209,690|저소음 적축_일시품절|적축_105,900|청축_133,000"
11137779,앱코 HACKER K660M 이색사출 PBT 체리 키보드 블랙,"청축_105,900|갈축_105,900|저소음 적축_일시품절|적축_105,900","청축_105,900|갈축_105,900|저소음 적축_일시품절|적축_105,900","청축_105,900|갈축_105,900|저소음 적축_일시품절|적축_105,900"
6167983,앱코 HACKER K662 카일 광축 완전방수 축교환 어반그레이,"V1, 클릭_67,990|V2, 클릭_123,890|V1, 리니어_97,900","V1, 클릭_67,990|V2, 클릭_117,770|V1, 리니어_97,900","V1, 클릭_67,990|V2, 클릭_117,770|V1, 리니어_97,900"
5742906,앱코 HACKER K720 ET광축 축교환 완전방수 게이밍,"블랙, 클릭_55,210|화이트, 클릭_55,210","블랙, 클릭_55,210|화이트, 클릭_55,210","블랙, 클릭_54,900|화이트, 클릭_54,900"
11874703,앱코 HACKER K7900 카일광축 완전방수 레인보우 PBT Moving LED,"클릭_95,300","클릭_95,300","클릭_149,900"
6369156,앱코 HACKER K815 코리아 어디션 카일 광축 완전방수 축교환 LED 게이밍 키보드,"클릭_55,210","클릭_54,900","클릭_54,900"
5122935,앱코 HACKER K840 조약돌 레트로 축교환 기계식,"블랙, 청축_29,500|블랙, 갈축_29,500|블랙, 적축_29,500|화이트, 청축_29,500|화이트, 갈축_29,500||","블랙, 청축_29,500|블랙, 갈축_29,500|블랙, 적축_29,500|화이트, 청축_29,500|화이트, 갈축_29,500||","블랙, 청축_29,500|블랙, 갈축_29,500|블랙, 적축_29,500|화이트, 청축_29,500|화이트, 갈축_29,500||"
8936366,앱코 HACKER K8800 카일 광축 완전방수 축교환 크리스탈 키캡,"레드, 클릭_59,220|화이트 V1, 클릭_58,460|화이트 V2, 클릭_56,380","레드, 클릭_59,140|화이트 V1, 클릭_58,460|화이트 V2, 클릭_56,980","레드, 클릭_59,040|화이트 V1, 클릭_58,460|화이트 V2, 클릭_56,870"
6450798,앱코 HACKER K8900 카일 광축 완전방수 어반그레이,"V2, 클릭_162,840","V2, 클릭_162,840","V2, 클릭_162,840"
7970005,앱코 HACKER K9100 ARC 프리미엄 카일 광축 크리스탈 키캡 완전방수 LED,"레드, 클릭_일시품절|옐로우, 클릭_110,480","레드, 클릭_일시품절|옐로우, 클릭_110,480","레드, 클릭_일시품절|옐로우, 클릭_110,480"
5110995,앱코 HACKER K970 V2 무접점,"블랙 실버_일시품절|화이트 실버_99,110","블랙 실버_일시품절|화이트 실버_99,110","블랙 실버_일시품절|화이트 실버_99,000"
4799472,앱코 HACKER K985P V2 RGB PBT 무접점,"55g_128,400","55g_127,900","55g_127,900"
9242871,앱코 HACKER K990 V3 스카이문 LED 완전방수 무접점,"45g_175,000","45g_175,000","45g_175,000"
6413854,앱코 HACKER K995P V3 RGB PBT 무접점,"화이트, 45g_159,000|블랙, 45g_159,000","화이트, 45g_159,000|블랙, 45g_159,000","화이트, 45g_159,000|블랙, 45g_159,000"
12066962,앱코 HACKER K997P PBT 투톤 RGB 완전방수 무접점 키보드,"블랙, 45g_129,000|화이트, 45g_129,000","블랙, 45g_129,000|화이트, 45g_129,000","블랙, 45g_129,000|화이트, 45g_129,000"
6843574,앱코 HACKER KM350 키보드 마우스 콤보 레인보우 LED 게이밍,"24,500","24,500","24,500"
13050158,앱코 HACKER KM700 게이밍 키보드 마우스 장패드 세트,"블랙_23,900","블랙_23,900","블랙_23,900"
11833771,앱코 HACKER KN01 텐키리스 PBT RGB 무접점 키보드,"블랙, 45g_99,000|블랙, 55g_99,000|화이트, 45g_99,000|화이트, 55g_99,000","블랙, 45g_99,000|블랙, 55g_99,000|화이트, 45g_99,000|화이트, 55g_99,000","블랙, 45g_99,000|블랙, 55g_99,000|화이트, 45g_99,000|화이트, 55g_99,000"
12170537,앱코 HACKER KN10 PBT RGB 무접점 키보드,"블랙, 45g_109,000|블랙, 55g_109,000|화이트, 55g_109,000","블랙, 45g_109,000|블랙, 55g_109,000|화이트, 55g_109,000","블랙, 45g_109,000|블랙, 55g_109,000|화이트, 55g_109,000"
5228654,앱코 HACKER QUICK SWAP용 OUTEMU 스위치,"8개, 청축_2,200|8개, 갈축_2,200|8개, 적축_2,200|8개, 흑축_2,250|각2개, 청축/갈축/적축/흑축_2,200","8개, 청축_2,200|8개, 갈축_2,200|8개, 적축_2,200|8개, 흑축_2,250|각2개, 청축/갈축/적축/흑축_2,200","8개, 청축_2,200|8개, 갈축_2,200|8개, 적축_2,200|8개, 흑축_2,200|각2개, 청축/갈축/적축/흑축_2,200"
5827139,앱코 HACKER 카일 정품 광축 스위치,"10개, 클릭_4,000|10개, 리니어_4,000|5+5개, 클릭/리니어_4,000","10개, 클릭_4,000|10개, 리니어_4,000|5+5개, 클릭/리니어_4,000","10개, 클릭_4,000|10개, 리니어_4,000|5+5개, 클릭/리니어_4,000"
2788274,앱코 K-A4U,"98,400","98,400","98,400"
28450742,앱코 K1924 RETRO GTMX NON-LED 게이밍 기계식,"갈축_49,000|적축_49,000|청축_49,000","갈축_49,000|적축_49,000|청축_49,000","갈축_49,000|적축_49,000|청축_49,000"
18878243,앱코 K517 레트로 기계식,"적축_39,900|갈축_39,900|청축_39,900","적축_39,900|갈축_39,900|청축_39,900","적축_39,900|갈축_39,900|청축_39,900"
12278276,앱코 K551 A광축 사이드 Edge RGB LED 게이밍 키보드,"클릭_38,890","클릭_38,890","클릭_38,840"
13363187,앱코 K560 축교환 레인보우 무빙 LED 기계식 키보드,"블랙, 청축_27,550|블랙, 갈축_27,900|블랙, 적축_27,550|화이트, 청축_27,900|화이트, 갈축_27,900|","블랙, 청축_27,550|블랙, 갈축_27,900|블랙, 적축_27,550|화이트, 청축_27,900|화이트, 갈축_27,900|","블랙, 청축_27,550|블랙, 갈축_27,890|블랙, 적축_27,550|화이트, 청축_27,900|화이트, 갈축_27,900|"
14471087,앱코 K570 축교환 레인보우 무빙 LED 기계식 키보드,"청축_32,000|갈축_32,000|적축_32,000","청축_32,000|갈축_32,000|적축_32,000","청축_32,000|갈축_32,000|적축_32,000"
13363517,앱코 K640T SLIM 축교환 무빙LED 텐키리스 기계식 블랙,"청축_39,900|적축_37,800","청축_39,900|적축_39,900","청축_39,900|적축_39,900"
15282614,앱코 K640T SLIM 축교환 무빙LED 텐키리스 기계식 화이트,"청축_39,900|적축_39,900","청축_39,900|적축_39,900",0
15282632,앱코 K640T SLIM 축교환 무빙LED 텐키리스 기계식 화이트,0,0,"청축_39,900|적축_39,900"
17057765,앱코 K641 SLIM PLUS RGB 게이밍 기계식 키보드,"청축_48,860|적축_60,000","청축_48,860|적축_60,000","청축_48,860|적축_60,000"
17106275,앱코 K641 TKL SLIM PLUS 게이밍 텐키리스 기계식 키보드,"청축_39,900|적축_39,900","청축_39,900|적축_39,900","청축_39,900|적축_39,900"
19456031,앱코 K660 블루민트 에디션 카일 광축 게이밍,"62,000","62,000","62,000"
17345816,앱코 K660M-L68 무선 블루투스 기계식 미니 키보드,"블랙_99,000|화이트_99,000","블랙_99,000|화이트_99,000","블랙_99,000|화이트_99,000"
13208633,앱코 K660P 프리미엄 카일광축 무빙 LED 게이밍 기계식 키보드,"마젠타, 클릭_73,000|다크 그레이, 클릭_73,000","마젠타, 클릭_73,000|다크 그레이, 클릭_73,000","마젠타, 클릭_73,000|다크 그레이, 클릭_73,000"
19690826,앱코 K669 카일 광축 게이밍,"블랙 레드_65,000|핑크 화이트_65,000","블랙 레드_65,000|핑크 화이트_65,000","블랙 레드_65,000|핑크 화이트_65,000"
27754094,앱코 K8200 PRO 스카이블루 아이스큐브 키캡 게이밍,"클릭_69,000","클릭_69,000","클릭_69,000"
15825842,앱코 K840 사각 레트로 축교환 기계식 블랙,"갈축_49,900|청축_49,900|적축_49,900","갈축_49,900|청축_49,900|적축_49,900","갈축_49,900|청축_49,900|적축_49,900"
15825908,앱코 K840 사각 레트로 축교환 기계식 화이트,"청축_49,500|갈축_49,900|적축_49,900","청축_49,500|갈축_49,900|적축_49,900",0
15825881,앱코 K840 사각 레트로 축교환 기계식 화이트,0,0,"청축_49,500|갈축_49,900|적축_49,900"
15150860,앱코 K841 조약돌 레트로 축교환 기계식 민트,"청축_32,000|갈축_32,000|적축_32,000","청축_32,000|갈축_32,000|적축_32,000","청축_32,000|갈축_32,000|적축_32,000"
15150830,앱코 K841 조약돌 레트로 축교환 기계식 핑크,"청축_32,000|갈축_32,000|적축_32,000","청축_32,000|갈축_32,000|적축_32,000","청축_32,000|갈축_32,000|적축_32,000"
27755567,앱코 K8900 PRO 블랙 아이스큐브 키캡 게이밍,"69,000","69,000","69,000"
9494319,앱코 KM110 RGB 멤브레인 키보드 마우스 합본,"블랙_13,800|화이트_13,800","블랙_13,800|화이트_13,800","블랙_13,800|화이트_13,800"
9494352,앱코 KM120 RGB 멤브레인 키보드 마우스 합본,"블랙_18,000|화이트_18,000","블랙_18,000|화이트_18,000","블랙_18,000|화이트_18,000"
12399617,앱코 KM150 키보드 마우스 오피스 세트,"16,500","16,500","16,500"
12471623,앱코 KM250 키보드 마우스 세트,"73,700","73,700","73,700"
5182267,앱코 KM400 게이밍 콤보,"블랙_25,000|화이트_26,060","블랙_25,000|화이트_27,500","블랙_23,690|화이트_27,500"
18650684,앱코 KM500 키보드 마우스 세트,"V1, 화이트_25,070|V1, 블랙_25,200|V2, 블랙_25,070|V2, 화이트_25,900","V1, 화이트_25,070|V1, 블랙_25,200|V2, 블랙_25,070|V2, 화이트_25,900","V1, 화이트_25,070|V1, 블랙_25,200|V2, 블랙_25,070|V2, 화이트_25,900"
19562489,앱코 KM800 키보드 마우스 세트,"블랙_33,000|화이트_33,000","블랙_33,000|화이트_33,000","블랙_33,000|화이트_33,000"
12376373,앱코 KN01 BT 블루투스 TKL 무접점 게이밍 키보드 블랙,"45g_178,200|55g_148,600","45g_178,200|55g_148,600","45g_178,200|55g_148,600"
12376391,앱코 KN01 BT 블루투스 TKL 무접점 게이밍 키보드 화이트,"45g_194,960","45g_194,960","45g_194,960"
15230645,앱코 KN01C 텐키리스 PBT 무접점 키보드 블루,"30g_149,990","30g_150,000","30g_149,990"
15230654,앱코 KN01C 텐키리스 PBT 무접점 키보드 핑크,"45g_150,000","45g_150,000","45g_150,000"
19645700,앱코 KN02C 삼색사출 PBT 텐키리스 무접점,"149,000","149,000","149,000"
12376532,앱코 KN10 BT 블루투스 무접점 게이밍 키보드 블랙,"45g_191,900|55g_214,900","45g_191,900|55g_214,900","45g_191,900|55g_214,900"
12376574,앱코 KN10 BT 블루투스 무접점 게이밍 키보드 화이트,"45g_216,000|55g_일시품절","45g_216,000|55g_일시품절","45g_216,000|55g_일시품절"
15229799,앱코 KN10C PBT 무접점 키보드,"그레이, 30g_169,000|핑크, 45g_169,000","그레이, 30g_169,000|핑크, 45g_169,000",0
15229802,앱코 KN10C PBT 무접점 키보드,0,0,"그레이, 30g_169,000|핑크, 45g_169,000"
19645514,앱코 KN20C 삼색사출 PBT 무접점,"175,000","175,000","175,000"
24133613,앱코 KN30BT 블루투스 유무선 무접점,"159,000","150,640","150,640"
9925461,앱코 KP10 키패드,"7,000","7,000","7,000"
16994000,앱코 KP35BT 블루투스 와이드 키패드,"28,900","28,900","28,900"
2241246,앱코 MultiPack KM-A4P,"14,800","14,800","14,800"
2682415,앱코 MultiPack KM-A4U,"14,900","14,900","14,900"
2241240,앱코 MultiPack KM-A5PS,"키스킨 포함_16,790","키스킨 포함_16,790","키스킨 포함_16,790"
14321915,앱코 TOS100 무선 키보드,"72,100","72,100","72,100"
16792100,앱코 TOS180 블루투스 펜타그래프 키보드,"19,900","19,900","19,900"
13655036,앱코 TOS200 LED 블루투스 키보드,"로즈골드_174,740|블랙_189,310","로즈골드_174,550|블랙_189,120","로즈골드_174,160|블랙_188,720"
13653470,앱코 TOS250 LED 블루투스 키보드,"블랙_47,620|화이트_일시품절","블랙_47,620|화이트_일시품절","블랙_47,620|화이트_일시품절"
14567123,앱코 TPM1 TKL 어고노믹 월넛 팜레스트,"19,900","19,900","19,900"
14567039,앱코 TPM1 어고노믹 월넛 팜레스트,"22,500","22,500","22,500"
12423533,앱코 TW1867 레트로 블루투스 기계식 키보드,"청축_87,000|적축_87,000","청축_87,000|적축_87,000","청축_87,000|적축_87,000"
11123001,앱코 WKM01 무선 키보드 마우스 세트,"핑크_23,000|민트_21,800|블루_23,000","핑크_23,000|민트_22,990|블루_23,000","핑크_23,000|민트_22,990|블루_23,000"
11480607,앱코 WKM02 무선 키보드 마우스 세트,"블랙_29,810|화이트_29,880","블랙_29,810|화이트_29,880","블랙_29,810|화이트_29,880"
13912325,앱코 WKM03 무선 키보드마우스 세트,"블랙_18,900|핑크_11,000","블랙_18,900|핑크_11,000","블랙_18,900|핑크_11,000"
12098402,앱코 WKM160 펜타그래프 무선 키보드 마우스 오피스 세트,"28,100","28,100","28,100"
12129872,앱코 WKM360 무선 터치패드 키보드,"41,600","41,600","41,600"
13037375,앱코 WKM40 무선 키보드 마우스 세트,"베이지_21,900","베이지_21,900","베이지_21,900"
13037483,앱코 WKM50 펜홀더형 무선 키보드 마우스 세트,"핑크_21,900|네이비_21,900","핑크_21,900|네이비_21,900","핑크_21,900|네이비_21,900"
13037591,앱코 WKM60 무선 키보드 마우스 세트,"블랙_21,100","블랙_21,100","블랙_21,100"
12278561,앱코 WKM620 TKL 멀티 컬러 육각키캡 무선 미니 키보드 마우스 세트,"옐로우_28,000|피치_9,900|핑크_9,900","옐로우_28,000|피치_9,900|핑크_9,900","옐로우_28,000|피치_9,900|핑크_9,900"
12257396,앱코 WKM650 멀티 컬러 육각키캡 무선 키보드 마우스 세트,"핑크_10,900|스카이 블루_10,900|카키_11,310","핑크_10,900|스카이 블루_10,900|카키_11,310","핑크_10,900|스카이 블루_10,900|카키_11,310"
17990549,앱코 WKM800 무선 키보드 마우스 세트,"21,500","21,500","21,500"
13860356,앱코 WKM900 무소음 무선 키보드 마우스 세트,"블랙_21,780","블랙_21,780","블랙_21,780"
31427648,앱코 검은사막 AN01 게이밍 기계식,"23,010","23,010","23,010"
31383731,앱코 디아블로 II: 레저렉션 체리,"51,360","51,360","51,360"
31374929,앱코 디아블로 II: 레저렉션 체리 텐키리스,"55,640","55,640","55,640"
5682280,앱코 레트로 써클 컬러 키캡 104키,"블랙_39,000|화이트, 실버_31,570","블랙_39,000|화이트, 실버_31,570","블랙_39,000|화이트, 실버_31,570"
4291186,앱코 레트로 써클 키캡,"68키_31,000|87키_35,000|104키_41,000","68키_31,000|87키_35,000|104키_41,000","68키_31,000|87키_35,000|104키_34,850"
13493210,앱코 앱코 ASM01 스위트몬스터 스페셜에디션 무선 터치패드 키보드,"9,900","9,900","9,900"
3768039,앱코 초콜릿 KM80 무선 Combo,"골드_32,400|블랙_32,400|핑크_18,000","골드_32,400|블랙_32,400|핑크_18,000","골드_32,400|블랙_32,400|핑크_18,000"
1882131,에이데이타코리아 DDZONE DK-201 PS2,"키스킨포함_4,210|키스킨미포함_4,290",0,0
31390901,엠스톤글로벌 GV10 수제윤활 그린크레용 MA,"코랄V2축, 38g_가격비교예정|갈축, 35g_가격비교예정|갈축, 45g_151,000|밀키V2축, 38g_164,000|밀키V2축, 45g_164,000||||||||||||||","코랄V2축, 38g_가격비교예정|갈축, 35g_가격비교예정|갈축, 45g_151,000|밀키V2축, 38g_164,000|밀키V2축, 45g_164,000||||||||||||||","코랄V2축, 38g_가격비교예정|갈축, 35g_가격비교예정|갈축, 45g_151,000|밀키V2축, 38g_164,000|밀키V2축, 45g_164,000||||||||||||||"
31511534,엠스톤글로벌 GV10 수제윤활 블루블랙,"코랄V2축, 38g_가격비교예정|갈축, 35g_가격비교예정|갈축, 45g_가격비교예정|밀키V2축, 38g_가격비교예정|밀키V2축, 45g_가격비교예정||||||||||||||","코랄V2축, 38g_가격비교예정|갈축, 35g_가격비교예정|갈축, 45g_가격비교예정|밀키V2축, 38g_가격비교예정|밀키V2축, 45g_가격비교예정||||||||||||||","코랄V2축, 38g_가격비교예정|갈축, 35g_가격비교예정|갈축, 45g_가격비교예정|밀키V2축, 38g_가격비교예정|밀키V2축, 45g_가격비교예정||||||||||||||"
31679933,엠스톤글로벌 GV10 수제윤활 크레용 MA,0,"코랄V2축, 38g_가격비교예정|갈축, 35g_가격비교예정|갈축, 45g_가격비교예정|밀키V2축, 38g_가격비교예정|밀키V2축, 45g_가격비교예정||||||||||||||","코랄V2축, 38g_가격비교예정|갈축, 35g_가격비교예정|갈축, 45g_가격비교예정|밀키V2축, 38g_가격비교예정|밀키V2축, 45g_가격비교예정||||||||||||||"
28416050,엠스톤글로벌 GV10 수제윤활 퍼플러MA,"코랄V2축, 38g_166,440|코랄V2축, 45g_일시품절|저소음 코랄축, 45g_164,000|밀키V2축, 38g_164,000|밀키V2축, 45g_164,000||||||||","코랄V2축, 38g_166,440|코랄V2축, 45g_일시품절|저소음 코랄축, 45g_164,000|밀키V2축, 38g_164,000|밀키V2축, 45g_164,000||||||||","코랄V2축, 38g_166,440|코랄V2축, 45g_일시품절|저소음 코랄축, 45g_164,000|밀키V2축, 38g_164,000|밀키V2축, 45g_164,000||||||||"
31391369,엠스톤글로벌 GV8 수제윤활 그린크레용 MA,"코랄V2축, 38g_가격비교예정|갈축, 35g_가격비교예정|갈축, 45g_149,000|밀키V2축, 38g_159,000|밀키V2축, 45g_159,000||||||||||||||","코랄V2축, 38g_가격비교예정|갈축, 35g_가격비교예정|갈축, 45g_149,000|밀키V2축, 38g_159,000|밀키V2축, 45g_159,000||||||||||||||","코랄V2축, 38g_가격비교예정|갈축, 35g_가격비교예정|갈축, 45g_149,000|밀키V2축, 38g_159,000|밀키V2축, 45g_159,000||||||||||||||"
31489649,엠스톤글로벌 GV8 수제윤활 블루블랙,"코랄V2축, 38g_가격비교예정|갈축, 35g_가격비교예정|갈축, 45g_가격비교예정|밀키V2축, 38g_가격비교예정|밀키V2축, 45g_가격비교예정||||||||||||||","코랄V2축, 38g_가격비교예정|갈축, 35g_가격비교예정|갈축, 45g_가격비교예정|밀키V2축, 38g_가격비교예정|밀키V2축, 45g_가격비교예정||||||||||||||","코랄V2축, 38g_가격비교예정|갈축, 35g_가격비교예정|갈축, 45g_가격비교예정|밀키V2축, 38g_가격비교예정|밀키V2축, 45g_가격비교예정||||||||||||||"
31679768,엠스톤글로벌 GV8 수제윤활 크레용 MA,0,"밀키V2축, 38g_가격비교예정|갈축, 35g_가격비교예정|갈축, 45g_가격비교예정|밀키V2축, 45g_가격비교예정|밀키V2축, 55g_가격비교예정||||||||||||||","밀키V2축, 38g_가격비교예정|갈축, 35g_가격비교예정|갈축, 45g_가격비교예정|밀키V2축, 45g_가격비교예정|밀키V2축, 55g_가격비교예정||||||||||||||"
28402931,엠스톤글로벌 GV8 수제윤활 퍼플러MA,0,0,"코랄V2축, 38g_159,000|코랄V2축, 45g_159,000|저소음 코랄축, 45g_159,000|밀키V2축, 38g_159,000|밀키V2축, 45g_159,000||||||||"
28551305,엠스톤글로벌 수제윤활 그루브스톤 특주축 55ea,0,0,"밀키V2, 38g_49,000|밀키V2, 45g_49,000|밀키V2, 55g_49,000|저소음 밀키, 38g_49,000|저소음 밀키, 45g_49,000|||||||"
30009926,엠스톤글로벌 양방향리무버,"3,000","3,000",0
11464899,웨이코스 씽크웨이 CROAD BK620 턴 블루투스 유무선 기계식 키보드,"청축_72,270|갈축_69,500|적축_69,480","청축_72,270|갈축_69,500|적축_69,480","청축_72,270|갈축_69,500|적축_69,480"
5867148,웨이코스 씽크웨이 CROAD C704 체리미엄 PBT LED 기계식 키보드,"적축_115,000","적축_115,000","적축_115,000"
6398866,웨이코스 씽크웨이 CROAD K10 LED 기계식 숫자 키패드,"청축_19,390|갈축_19,390|적축_19,390","청축_19,390|갈축_19,390|적축_19,390","청축_19,390|갈축_19,390|적축_19,390"
10002555,웨이코스 씽크웨이 CROAD K20 매크로 숫자 키패드,"청축_27,500|갈축_27,500|적축_27,500","청축_27,500|갈축_27,500|적축_27,500","청축_27,500|갈축_27,500|적축_27,500"
6953971,웨이코스 씽크웨이 CROAD X36 키보드 손목 보호 받침대 (텐키리스용),"29,800","29,800","29,800"
28824962,웨이코스 씽크웨이 토체티 301 유무선 기계식 프로포즈 핑크,0,0,"넌클릭_99,900|리니어_99,000"
9568836,웨이코스 씽크웨이 토체티 D&T 콜라보 체리 키보드,"파스텔블루, 갈축_146,600|다크그레이, 저소음 흑축_207,000|베이지, 갈축_146,700|베이지, 은축_151,700|베이지, 저소음 적축_205,590|||||||||","파스텔블루, 갈축_146,600|다크그레이, 저소음 흑축_일시품절|베이지, 갈축_146,700|베이지, 은축_151,700|베이지, 저소음 적축_205,590|||||||||","파스텔블루, 갈축_146,600|다크그레이, 저소음 흑축_111,690|베이지, 갈축_146,700|베이지, 은축_151,700|베이지, 저소음 적축_205,590|||||||||"
