Id,Name,2023-11-01 10:51:41,2023-11-02 10:40:19,2023-11-03 10:44:03
28392785,8bitdo Retro 유무선 기계식,"해외구매_77,190","해외구매_77,550","해외구매_64,500"
28394927,AIGO A100 유무선 기계식,"해외구매_21,500","해외구매_21,500","해외구매_21,500"
21592418,AJAZZ AK871 무선 기계식,"해외구매_22,579","해외구매_22,579","해외구매_22,579"
28578356,AKKO MOD 007PC 기계식,"해외구매_114,390",0,0
21463238,AKKO MOD007 기계식,"해외구매_46,900",0,0
29480837,ANYZEN AMK-350 키보드 마우스 세트,"22,360","22,360","22,360"
29686637,ANYZEN AMK-450 키보드 마우스 세트,0,0,가격비교예정
29687042,ANYZEN AMK-450 키보드 마우스 세트 With Pad,0,0,가격비교예정
29343362,ANYZEN K250,"21,290","21,290","21,290"
29489273,ANYZEN K250 With Pad,"23,420","23,420","23,420"
5363737,APPLE Magic Keyboard with Numeric Keypad (MQ052KH/A),"정품_132,050","정품_131,650","정품_131,650"
15020783,APPLE Magic Keyboard 한글 (MK2C3KH/A),"180,950",0,0
28557293,ASUS ROG AZOTH WHITE PBT 유무선 영문,"적축_399,000|갈축_가격비교예정|청축_가격비교예정","적축_399,000|갈축_가격비교예정|청축_가격비교예정","적축_398,990|갈축_가격비교예정|청축_가격비교예정"
18728846,ASUS ROG AZOTH 유무선 기계식 영문,"갈축_398,510|적축_399,000|청축_399,000","갈축_398,510|적축_399,000|청축_399,000","갈축_398,510|적축_398,990|청축_399,000"
19827977,ASUS ROG AZOTH 유무선 기계식 한글,"갈축_399,000|적축_399,000|청축_399,000","갈축_399,000|적축_399,000|청축_399,000","갈축_387,000|적축_399,000|청축_399,000"
16559405,ASUS ROG CLAYMORE II RX PBT,"청축_391,400","청축_391,400","청축_391,400"
14408222,ASUS ROG CLAYMORE II RX 영문,"청축_329,000|적축_329,000","청축_329,000|적축_329,000","청축_329,000|적축_329,000"
18519221,ASUS ROG FALCHION ACE 기계식,"적축_199,000|갈축_199,000","적축_199,000|갈축_199,000","적축_199,000|갈축_199,000"
15369422,ASUS ROG FALCHION NX,"청축_185,000|적축_229,000|해외구매_236,710","청축_185,000|적축_229,000|해외구매_236,710","청축_185,000|적축_229,000|해외구매_236,710"
12768116,ASUS ROG FALCHION 영문,"청축_229,000|적축_229,000","청축_229,000|적축_229,000","청축_229,000|적축_229,000"
13417076,ASUS ROG PBT KEYCAP SET,"27,000","27,000","27,000"
17017928,ASUS ROG RX PBT 이중사출 키캡 세트,"32,400","32,400","32,400"
7273855,ASUS ROG STRIX FLARE,"청축_348,400|은축_일시품절","청축_348,400|은축_일시품절",0
6081923,ASUS ROG STRIX FLARE,0,0,"청축_348,400|은축_일시품절"
16988408,ASUS ROG STRIX FLARE II NX,"갈축_279,000|적축_279,000","갈축_279,000|적축_279,000","갈축_279,000|적축_279,000"
16930400,ASUS ROG STRIX FLARE II NX ANIMATE PBT 영문,"청축_329,000|갈축_329,000|적축_329,000","청축_329,000|갈축_329,000|적축_329,000","청축_329,000|갈축_329,000|적축_329,000"
17730146,ASUS ROG STRIX FLARE II NX ANIMATE PBT 한글,"청축_329,000|갈축_329,000|적축_329,000","청축_329,000|갈축_329,000|적축_329,000","청축_329,000|갈축_329,000|적축_329,000"
8216992,ASUS ROG STRIX FLARE PINK,"청축_224,000|적축_일시품절","청축_224,000|적축_일시품절","청축_224,000|적축_일시품절"
28121846,ASUS ROG STRIX SCOPE II 96 유무선 기계식,0,0,"SNOW_259,000"
28888703,ASUS ROG STRIX SCOPE II RX,"청축_209,000|적축_가격비교예정","청축_209,000|적축_가격비교예정","청축_209,000|적축_가격비교예정"
28888754,ASUS ROG STRIX SCOPE II RX 영문,청축_가격비교예정|적축_가격비교예정,청축_가격비교예정|적축_가격비교예정,청축_가격비교예정|적축_가격비교예정
17832590,ASUS ROG STRIX SCOPE NX,0,0,"청축_189,000|적축_189,000"
15354248,ASUS ROG STRIX SCOPE NX TKL,"청축_일시품절|갈축_179,000|적축_179,000","청축_일시품절|갈축_179,000|적축_179,000","청축_일시품절|갈축_179,000|적축_179,000"
14963858,ASUS ROG STRIX SCOPE NX TKL Moonlight White,"청축_151,000|갈축_150,000|적축_189,000","청축_139,860|갈축_150,000|적축_189,000","청축_139,860|갈축_150,000|적축_189,000"
16749149,ASUS ROG STRIX SCOPE NX WIRELESS DELUXE,"청축_229,000|갈축_229,000|적축_229,000","청축_229,000|갈축_229,000|적축_229,000","청축_229,000|갈축_229,000|적축_229,000"
11078613,ASUS ROG STRIX SCOPE PBT 영문,"청축_164,000|갈축_164,000|적축_164,000","청축_164,000|갈축_164,000|적축_164,000","청축_164,000|갈축_164,000|적축_164,000"
13486184,ASUS ROG STRIX SCOPE RX,"적축_184,000|청축_187,000","적축_184,000|청축_187,000","적축_184,000|청축_187,000"
15901865,ASUS ROG STRIX SCOPE RX PBT 영문,"청축_113,400|적축_189,000","청축_113,400|적축_189,000","청축_113,400|적축_189,000"
16750865,ASUS ROG STRIX SCOPE RX TKL WIRELESS DELUXE,"청축_249,000|적축_227,810","청축_249,000|적축_227,810","청축_249,000|적축_249,000"
10577751,ASUS ROG STRIX SCOPE TKL 영문,"청축_164,000|적축_470,110","청축_164,000|적축_470,110","청축_164,000|적축_470,110"
11070279,ASUS ROG STRIX SCOPE 영문,"청축_115,170|적축_174,000","청축_115,170|적축_174,000","청축_115,170|적축_174,000"
2885992,ASUS STRIX Tactic Pro,"청축_114,680","청축_114,680","청축_113,710"
3567106,ASUS STRIX Tactic Pro STCOM,청축_일시품절,"청축_78,000","청축_78,000"
25638749,AULA F87 유무선 기계식,"해외구매_34,110",0,0
18369920,Actto BTK-12 무선 키보드,"22,930","22,930","22,930"
5145416,Bless ZIO DT70 레인보우LED 기계식 게이밍 키보드,0,"청축_57,200|갈축_31,440",0
13937480,Britz BA-BK10 Plus,"61,590",0,0
6445016,CHERRY G80-3000,"화이트, 청축_128,640|블랙, 갈축_129,000|화이트, 갈축_123,920","화이트, 청축_128,640|블랙, 갈축_129,000|화이트, 갈축_123,910","화이트, 청축_128,640|블랙, 갈축_129,000|화이트, 갈축_123,910"
14420600,CHERRY G80-3000S RGB TKL,"블랙, 청축_115,320|블랙, 갈축_115,320|블랙, 적축_115,320|블랙, 흑축_124,000|블랙, 저소음 적축_99,160|||||","블랙, 청축_115,320|블랙, 갈축_115,320|블랙, 적축_115,320|블랙, 흑축_124,000|블랙, 저소음 적축_124,620|||||","블랙, 청축_115,320|블랙, 갈축_115,320|블랙, 적축_115,320|블랙, 흑축_124,000|블랙, 저소음 적축_124,620|||||"
14469221,CHERRY G80-3000S TKL,"블랙, 청축_99,000|블랙, 갈축_89,000|블랙, 적축_99,000|블랙, 저소음 적축_108,029|화이트, 청축_96,480||||","블랙, 청축_99,000|블랙, 갈축_89,000|블랙, 적축_99,000|블랙, 저소음 적축_108,029|화이트, 청축_96,480||||","블랙, 청축_99,000|블랙, 갈축_89,000|블랙, 적축_99,000|블랙, 저소음 적축_108,029|화이트, 청축_96,480||||"
6466885,CHERRY G80-3494,"블랙, 저소음 적축_129,000|화이트, 적축_128,640","블랙, 저소음 적축_129,000|화이트, 적축_128,640","블랙, 저소음 적축_129,000|화이트, 적축_128,640"
2868094,CHERRY G80-3800 + 키보드 받침대,"청축_87,450","청축_87,450","청축_87,450"
2120324,CHERRY G80-3800 기계식 키보드 전용 컬러 16종 키캡,"옐로우_8,500|오렌지_8,500|퍼플_8,500","옐로우_8,500|오렌지_8,500|퍼플_8,500","옐로우_8,500|오렌지_8,500|퍼플_8,500"
27665495,CHERRY MX 1.1 TKL RGB 기계식 화이트,"적축_82,770","적축_82,770","적축_82,770"
20314643,CHERRY MX 1.1 TKL 기계식 블랙,"청축_69,000|갈축_64,170|적축_64,170|저소음 적축_69,000","청축_69,000|갈축_64,170|적축_64,170|저소음 적축_69,000","청축_69,000|갈축_64,170|적축_64,170|저소음 적축_69,000"
20314661,CHERRY MX 1.1 TKL 기계식 화이트,"청축_69,000|갈축_64,170|적축_64,170|저소음 적축_69,000","청축_69,000|갈축_64,170|적축_64,170|저소음 적축_69,000","청축_69,000|갈축_64,170|적축_64,170|저소음 적축_69,000"
11494950,CHERRY MX BOARD 1.0 TKL RGB,"청축_203,100|적축_203,100","청축_203,100|적축_203,100","청축_203,100|적축_203,100"
14393852,CHERRY MX BOARD 10.0 Low Profile RGB,"블랙_234,000|실버_234,000","블랙_234,000|실버_234,000","블랙_234,000|실버_234,000"
13014152,CHERRY MX BOARD 2.0S,"블랙, 청축_81,620|블랙, 갈축_79,000|블랙, 적축_79,000|블랙, 저소음 적축_89,000|화이트, 청축_79,000|||","블랙, 청축_81,620|블랙, 갈축_79,000|블랙, 적축_79,000|블랙, 저소음 적축_89,000|화이트, 청축_79,000|||","블랙, 청축_81,620|블랙, 갈축_79,000|블랙, 적축_79,000|블랙, 저소음 적축_89,000|화이트, 청축_79,000|||"
14811248,CHERRY MX BOARD 2.0S RGB,"블랙, 청축_109,000|블랙, 갈축_109,000|블랙, 적축_255,870|화이트, 청축_109,000|화이트, 갈축_109,000||","블랙, 청축_109,000|블랙, 갈축_109,000|블랙, 적축_255,870|화이트, 청축_109,000|화이트, 갈축_109,000||","블랙, 청축_109,000|블랙, 갈축_109,000|블랙, 적축_255,870|화이트, 청축_109,000|화이트, 갈축_109,000||"
12285776,CHERRY MX BOARD 3.0S,"블랙, 청축_128,640|블랙, 갈축_128,400|블랙, 적축_122,670|블랙, 흑축_129,000|블랙, 저소음 적축_139,000|||||","블랙, 청축_128,640|블랙, 갈축_128,400|블랙, 적축_128,640|블랙, 흑축_129,000|블랙, 저소음 적축_139,000|||||","블랙, 청축_128,640|블랙, 갈축_128,400|블랙, 적축_128,640|블랙, 흑축_129,000|블랙, 저소음 적축_139,000|||||"
11356179,CHERRY MX BOARD 3.0S RGB,"블랙, 청축_159,000|블랙, 갈축_159,000|블랙, 적축_159,000|블랙, 흑축_159,000|블랙, 저소음 적축_169,000||||||||||","블랙, 청축_159,000|블랙, 갈축_159,000|블랙, 적축_159,000|블랙, 흑축_159,000|블랙, 저소음 적축_169,000||||||||||","블랙, 청축_159,000|블랙, 갈축_159,000|블랙, 적축_159,000|블랙, 흑축_159,000|블랙, 저소음 적축_169,000||||||||||"
17400206,CHERRY MX BOARD 3.0S TKL,"블랙, 청축_122,314|블랙, 갈축_122,314|블랙, 적축_122,314|블랙, 저소음 적축_132,480|핑크, 청축_122,314|||||||","블랙, 청축_122,314|블랙, 갈축_122,314|블랙, 적축_122,314|블랙, 저소음 적축_132,480|핑크, 청축_122,314|||||||","블랙, 청축_122,314|블랙, 갈축_122,314|블랙, 적축_122,314|블랙, 저소음 적축_132,480|핑크, 청축_122,314|||||||"
17652977,CHERRY MX BOARD 3.0S TKL RGB,"블랙, 청축_149,000|블랙, 갈축_149,000|블랙, 적축_149,000|블랙, 저소음 적축_149,000|핑크, 청축_149,000|||||||","블랙, 청축_149,000|블랙, 갈축_149,000|블랙, 적축_149,000|블랙, 저소음 적축_149,000|핑크, 청축_149,000|||||||","블랙, 청축_149,000|블랙, 갈축_149,000|블랙, 적축_149,000|블랙, 저소음 적축_149,000|핑크, 청축_149,000|||||||"
13955699,CHERRY MX RGB Switch,0,"1개, 청축_560|1개, 갈축_560|1개, 은축_720|1개, 저소음 흑축_810|1개, 적축_610||","1개, 청축_560|1개, 갈축_560|1개, 은축_720|1개, 저소음 흑축_810|1개, 적축_610||"
13955534,CHERRY MX Switch,0,0,"1개, 청축_580|1개, 갈축_580|1개, 은축_710|1개, 적축_580|1개, 흑축_580|"
27737228,CIDOO V65 PRO VIA 유무선 기계식,"169,000","169,000","169,000"
3586784,CORSAIR GAMING K70,"청축, 정품_204,000|갈축, 정품_175,000","청축, 정품_204,000|갈축, 정품_175,000","청축, 정품_204,000|갈축, 정품_175,000"
17932703,CORSAIR K100 AIR WIRELESS RGB Ultra Low Profile 게이밍 기계식 키보드,"400,450","400,450","400,450"
12402839,CORSAIR K100 RGB MX SPEED 영문,"은축_341,950","은축_341,950","은축_341,950"
12799214,CORSAIR K100 RGB MX SPEED 한글,"은축_342,000","은축_342,000","은축_342,000"
12402851,CORSAIR K100 RGB OPTICAL 영문,"리니어_341,450","리니어_341,450","리니어_341,450"
12799259,CORSAIR K100 RGB OPTICAL 한글,"336,940","336,940","336,940"
15572654,CORSAIR K100 RGB OPX 영문,"미드나잇 골드_382,000","미드나잇 골드_382,000","미드나잇 골드_382,000"
15050258,CORSAIR K57 + Harpoon 무선 게이밍 키보드 마우스 콤보,"212,000","210,600",0
10189578,CORSAIR K57 RGB WIRELESS,"정품_142,000",0,0
12618380,CORSAIR K60 PRO,"109,550","109,550","109,550"
12618515,CORSAIR K60 RGB PRO,"142,000","141,990","141,990"
12669857,CORSAIR K60 RGB PRO LP,"은축_189,000","은축_189,000","은축_189,000"
12829025,CORSAIR K60 RGB PRO SE,"정품_156,990","정품_156,990","정품_156,990"
5065159,CORSAIR K63,"적축_116,960","적축_116,960","적축_119,000"
6040268,CORSAIR K63 WIRELESS,"적축_168,000","적축_168,000","적축_168,000"
21566336,CORSAIR K65 PRO MINI OPX 게이밍,"168,840","168,840","168,840"
13660838,CORSAIR K65 RGB MINI,"블랙, 적축_128,200|블랙, 저소음 적축_128,640|화이트, 적축_129,000|화이트, 저소음 적축_129,000|해외구매_102,820","블랙, 적축_128,200|블랙, 저소음 적축_128,640|화이트, 적축_129,000|화이트, 저소음 적축_129,000|해외구매_102,820",0
13661003,CORSAIR K65 RGB MINI,0,0,"블랙, 적축_128,200|블랙, 저소음 적축_128,990|화이트, 적축_129,000|화이트, 저소음 적축_129,000|해외구매_102,820"
28601858,CORSAIR K65 RGB PLUS 유무선 게이밍 기계식,"192,510","192,510","198,990"
5217261,CORSAIR K68 방수/방진,"청축_142,000|적축_131,900","청축_142,000|적축_131,900","청축_142,000|적축_131,900"
4138936,CORSAIR K70 LUX,"청축_176,000|적축_181,000","청축_176,000|적축_181,000","청축_176,000|적축_181,000"
4417510,CORSAIR K70 LUX BLUE LED,적축_일시품절,적축_일시품절,적축_일시품절
4498013,CORSAIR K70 LUX RGB,"적축_288,000|갈축_288,000","적축_288,000|갈축_288,000","적축_288,000|갈축_288,000"
27546863,CORSAIR K70 MAX RGB MGX 게이밍 기계식,"마그네틱축_299,000","마그네틱축_299,000","마그네틱축_299,000"
4111501,CORSAIR K70 RAPIDFIRE,"은축_181,990","은축_181,990","은축_181,990"
28603439,CORSAIR K70 RGB CORE BLACK 게이밍 기계식,"127,880","127,880","127,880"
28605752,CORSAIR K70 RGB CORE WHITE SE 게이밍 기계식,"146,280","146,280","146,280"
6351641,CORSAIR K70 RGB MK.2,"청축_257,210|갈축_229,000|은축_401,000|적축_257,130|저소음 적축_287,890","청축_257,210|갈축_229,000|은축_401,000|적축_257,130|저소음 적축_287,890","청축_257,210|갈축_229,000|은축_401,000|적축_257,130|저소음 적축_287,890"
6569690,CORSAIR K70 RGB MK.2 LOW PROFILE,"적축_387,640","적축_387,640","적축_387,640"
6548195,CORSAIR K70 RGB MK.2 LOW PROFILE RAPIDFIRE,"은축_238,000","은축_238,000","은축_238,000"
16388009,CORSAIR K70 RGB PRO,"청축_227,930|갈축_228,000|적축_227,460|저소음 적축_228,000|스피드 은축_228,500","청축_227,930|갈축_229,000|적축_227,460|저소음 적축_228,500|스피드 은축_228,500","청축_227,930|갈축_229,000|적축_227,000|저소음 적축_228,500|스피드 은축_228,500"
17822123,CORSAIR K70 RGB PRO OPX 게이밍 기계식 키보드,"블랙_233,000|화이트_242,000","블랙_233,000|화이트_243,000","블랙_233,000|화이트_243,000"
13855607,CORSAIR K70 RGB TKL CHAMPION 한글,"적축_199,000|은축_198,000|저소음 적축_199,000","적축_199,000|은축_199,000|저소음 적축_199,000","적축_199,000|은축_199,000|저소음 적축_199,000"
16795421,CORSAIR K70 RGB TKL OPX 광적축 게이밍 기계식 키보드,"정품_199,000|해외구매_177,000","정품_199,000|해외구매_177,000","정품_199,000|해외구매_177,000"
17467130,CORSAIR K70 프로 미니 핫스왑 무선 게이밍 기계식 키보드,"적축_189,000|저소음 적축_189,000","적축_189,000|저소음 적축_189,000","적축_189,000|저소음 적축_189,000"
17825702,CORSAIR K70 프로 미니 핫스왑 화이트 무선 게이밍 기계식 키보드,0,"적축_183,890","적축_183,890"
7411843,CORSAIR K83 Wireless Entertainment Keyboard,"189,610","189,610","189,610"
5013599,CORSAIR K95 RGB PLATINUM,"은축_369,000","은축_369,000","은축_369,000"
5714453,CORSAIR PBT DOUBLE-SHOT KEYCAPS,"블랙_39,000|화이트_39,000","블랙_39,000|화이트_39,000","블랙_39,000|화이트_39,000"
6214631,CORSAIR STRAFE RGB MK.2 SILENT,"저소음 적축_219,000","저소음 적축_219,000","저소음 적축_219,000"
11815033,CORSAIR iCUE NEXUS,"141,810","141,810","141,810"
5047429,COUGAR VANTAR,"49,010","49,010","49,010"
14438276,COUGAR VANTAR AX,"Black_60,230|Silver_64,980|Pink_69,000","Black_60,230|Silver_64,980|Pink_69,000","Black_60,550|Silver_64,980|Pink_69,000"
6454535,COX 145Key 염료승화 PBT 한글 포인트 컬러 키캡,"오렌지_66,700|블루_66,700","오렌지_66,700|블루_66,700","오렌지_66,700|블루_66,700"
11640566,COX CA106 CNC 알루미늄 어고노믹 게이트론 기계식 키보드,"황축_377,400|갈축_240,480","황축_377,400|갈축_240,480","황축_377,400|갈축_240,480"
10677879,COX CA108BT 블루투스 유무선 알루미늄 PBT 이색사출,"레드, 황축_120,350|레드, 갈축_138,000|로즈골드, 갈축_138,000|로즈골드, 황축_141,360","레드, 황축_120,350|레드, 갈축_138,000|로즈골드, 갈축_138,000|로즈골드, 황축_141,360","레드, 황축_120,350|레드, 갈축_138,000|로즈골드, 갈축_138,000|로즈골드, 황축_141,360"
8004508,COX CARAVEL 게이트론 교체축 RGB 염료승화 PBT 리빙코랄,"녹축_58,300","녹축_58,300","녹축_58,300"
8004616,COX CARAVEL108 게이트론 교체축 RGB 염료승화 PBT 리빙코랄,"녹축_66,990","녹축_66,990","녹축_66,990"
19401857,COX CBF300 무선 큰글씨,"16,040","15,900","16,000"
13224044,COX CK01 Navy 교체축 사이드 RGB 게이밍 기계식 키보드,"청축_39,900|갈축_39,900|적축_39,900","청축_39,900|갈축_39,900|적축_39,900","청축_39,900|갈축_39,900|적축_39,900"
15185441,COX CK01 PBT SL 기계식 키보드,"저소음 백축_66,000","저소음 백축_66,000","저소음 백축_66,000"
18625514,COX CK01 PBT 마이애미 나이트 에디션 게이밍 기계식,"청축_45,750|갈축_45,750|적축_45,750","청축_45,750|갈축_45,750|적축_45,750","청축_50,000|갈축_50,000|적축_50,000"
11696714,COX CK01 PBT 이색사출 사이드 RGB 기계식 키보드,"청축_47,850|갈축_47,830|적축_47,710","청축_47,830|갈축_47,800|적축_47,670",0
11696723,COX CK01 PBT 이색사출 사이드 RGB 기계식 키보드,0,0,"청축_47,820|갈축_47,760|적축_47,590"
28862909,COX CK01 SAHARA HUANO 퀵스압 게이밍 기계식,"청축_42,000|갈축_42,000|적축_42,000","청축_42,000|갈축_42,000|적축_42,000","청축_42,000|갈축_42,000|적축_42,000"
28862948,COX CK01 SAHARA HUANO 퀵스압 게이밍 기계식,0,"청축_42,000|갈축_42,000|적축_42,000","청축_42,000|갈축_42,000|적축_42,000"
14440445,COX CK01 TKL,"청축_34,000|갈축_34,000|적축_34,000","청축_34,000|갈축_34,000|적축_34,000","청축_34,000|갈축_34,000|적축_34,000"
15185348,COX CK01 TKL PBT SL 기계식 키보드,"저소음 백축_56,750","저소음 백축_56,750","저소음 백축_56,750"
14393789,COX CK01 TKL PBT 기계식 키보드,"청축_43,940|갈축_43,860|적축_43,940","청축_43,940|갈축_43,820|적축_43,940",0
14393792,COX CK01 TKL PBT 기계식 키보드,0,0,"청축_43,940|갈축_43,800|적축_43,940"
11234124,COX CK01 교체축 사이드 RGB 게이밍 기계식 키보드,"블랙, 청축_39,900|블랙, 적축_49,270|화이트, 갈축_43,570|화이트, 적축_43,690|화이트, 청축_44,130","블랙, 청축_39,900|블랙, 적축_49,270|화이트, 갈축_43,550|화이트, 적축_43,690|화이트, 청축_44,110","블랙, 청축_39,900|블랙, 적축_49,270|화이트, 갈축_43,530|화이트, 적축_43,690|화이트, 청축_44,090"
19456175,COX CK01SL PBT 45GF,"64,490","64,480","64,350"
20439878,COX CK01SL TKL PBT 45GF 기계식,"60,320","60,300","60,240"
16180022,COX CK01V V광축 완전방수 사이드 RGB 게이밍 키보드,"블랙&틸_51,470","블랙&틸_51,470","블랙&틸_51,470"
11433837,COX CK104 RGB BAR 투톤 이중사출 게이트론 기계식,"블랙그레이, 청축_50,900|레드그레이, 청축_47,900|레드그레이, 황축_57,510","블랙그레이, 청축_50,900|레드그레이, 청축_47,900|레드그레이, 황축_57,510","블랙그레이, 청축_50,900|레드그레이, 청축_47,900|레드그레이, 황축_57,510"
12095825,COX CK108 BT 게이트론 블루투스 5.0 기계식 게이밍 키보드,"블랙, 청축_69,000|화이트, 청축_68,800","블랙, 청축_69,000|화이트, 청축_68,760","블랙, 청축_69,000|화이트, 청축_68,740"
8048776,COX CK108 레드/다크그레이 게이트론 LED 게이밍 기계식,"S1, 녹축_49,900|S1, 갈축_91,000|S1, 황축_49,900|S2, 갈축_49,900|S2, 녹축_49,900|","S1, 녹축_49,900|S1, 갈축_91,000|S1, 황축_49,900|S2, 갈축_49,900|S2, 녹축_49,900|","S1, 녹축_49,900|S1, 갈축_91,000|S1, 황축_49,900|S2, 갈축_49,900|S2, 녹축_49,900|"
8048416,COX CK108 블랙/다크그레이 게이트론 LED 게이밍 기계식,"녹축_82,130|갈축_73,900|저소음 갈축_99,000|저소음 황축_99,000|황축_73,900","녹축_73,900|갈축_73,900|저소음 갈축_99,000|저소음 황축_99,000|황축_73,900","녹축_73,900|갈축_73,900|저소음 갈축_99,000|저소음 황축_99,000|황축_73,900"
8070895,COX CK2000 V광축 SA 투톤키캡 완전방수 교체축 사이드 RGB 게이밍,"34,660","34,640","34,630"
28191863,COX CK20th Century 멤브레인,"16,500","16,500","16,500"
6404207,COX CK250 교체축 LED 기계식 게이밍 텐키리스,"블랙, 청축_36,380|블랙, 갈축_61,930|블랙, 적축_63,270|화이트, 갈축_53,890|화이트, 적축_59,170|","블랙, 청축_36,380|블랙, 갈축_65,320|블랙, 적축_63,270|화이트, 갈축_53,890|화이트, 적축_59,170|","블랙, 청축_36,380|블랙, 갈축_63,080|블랙, 적축_63,270|화이트, 갈축_53,890|화이트, 적축_59,170|"
6278440,COX CK420 교체축 레인보우 LED 게이밍 기계식 키보드,"블랙, 청축_34,860|블랙, 갈축_33,490|블랙, 적축_34,730|화이트, 갈축_34,720|화이트, 적축_34,860|","블랙, 청축_34,860|블랙, 갈축_33,470|블랙, 적축_34,710|화이트, 갈축_34,690|화이트, 적축_34,860|","블랙, 청축_34,860|블랙, 갈축_33,430|블랙, 적축_34,670|화이트, 갈축_34,630|화이트, 적축_34,860|"
7480660,COX CK450 교체축 사이드 RGB 기계식 게이밍,"화이트, 적축_53,950","화이트, 적축_53,950","화이트, 적축_53,950"
16889645,COX CK510 교체축 LED 게이밍 기계식 키보드,"청축_28,370|갈축_28,500|적축_26,070","청축_28,370|갈축_28,500|적축_26,070","청축_28,370|갈축_28,500|적축_28,370"
7973581,COX CK8000 V광축 완전방수 크리스탈 키캡 교체축 사이드 RGB 게이밍,클릭_일시품절,클릭_일시품절,클릭_일시품절
8414463,COX CK8100 V광축 완전방수 크리스탈 키캡 교체축 사이드 RGB 게이밍,"S1, 클릭_29,900|S2, 클릭_26,820","S1, 클릭_29,900|S2, 클릭_29,610","S1, 클릭_29,900|S2, 클릭_26,620"
12086609,COX CK87 BT 게이트론 블루투스 5.0 텐키리스 기계식 게이밍 키보드,"블랙, 청축_59,900|블랙, 갈축_59,900|블랙, 황축_59,900|화이트, 청축_59,900|화이트, 갈축_108,400|","블랙, 청축_59,900|블랙, 갈축_59,900|블랙, 황축_59,900|화이트, 청축_59,900|화이트, 갈축_108,400|","블랙, 청축_59,900|블랙, 갈축_59,900|블랙, 황축_59,900|화이트, 청축_59,900|화이트, 갈축_108,400|"
20438657,COX CK87 PBT SUNSHINE GD 기계식,"황축_90,290|갈축_90,200","황축_90,290|갈축_90,180","황축_90,290|갈축_90,120"
15376265,COX CK87 PBT 게이트론 기계식 키보드,"청축_82,500|갈축_82,500|황축_82,500","청축_82,500|갈축_82,500|황축_82,500","청축_82,500|갈축_82,500|황축_82,500"
17466563,COX CK87 SLIM LP PBT,"블랙, 청축_78,990|블랙, 갈축_79,000|블랙, 적축_79,000|화이트, 청축_79,000|화이트, 갈축_79,000|","블랙, 청축_78,990|블랙, 갈축_79,000|블랙, 적축_79,000|화이트, 청축_79,000|화이트, 갈축_79,000|","블랙, 청축_78,990|블랙, 갈축_79,000|블랙, 적축_79,000|화이트, 청축_79,000|화이트, 갈축_79,000|"
7938631,COX CK87 네이비 게이트론 LED 게이밍 기계식,"갈축_62,900|녹축_73,900|황축_73,900","갈축_62,880|녹축_73,900|황축_62,880","갈축_62,900|녹축_73,900|황축_62,900"
7939003,COX CK87 레드/그레이 게이트론 LED 게이밍 기계식,"S1, 갈축_일시품절|S1, 녹축_일시품절|S1, 황축_73,900|S2, 갈축_일시품절|S2, 녹축_일시품절|",0,0
7939045,COX CK87 레드/그레이 게이트론 LED 게이밍 기계식,0,"S1, 갈축_일시품절|S1, 녹축_일시품절|S1, 황축_73,900|S2, 갈축_일시품절|S2, 녹축_일시품절|","S1, 갈축_일시품절|S1, 녹축_일시품절|S1, 황축_73,900|S2, 갈축_일시품절|S2, 녹축_일시품절|"
7938520,COX CK87 블랙 게이트론 LED 게이밍 기계식,"갈축_62,900|녹축_73,890|황축_62,900|저소음 갈축_88,940|저소음 황축_88,950","갈축_62,880|녹축_62,880|황축_62,880|저소음 갈축_88,930|저소음 황축_78,000","갈축_62,900|녹축_62,900|황축_62,900|저소음 갈축_88,920|저소음 황축_78,000"
11063505,COX CK87 크림블루 게이트론 LED 게이밍 기계식,"청축_62,900|갈축_62,900|황축_73,900","청축_62,880|갈축_62,880|황축_62,880","청축_62,900|갈축_62,820|황축_62,900"
10339050,COX CK87 화이트 게이트론 LED 게이밍 기계식,"갈축_62,900|황축_62,900",0,0
10339101,COX CK87 화이트 게이트론 LED 게이밍 기계식,0,"갈축_62,880|황축_62,880","갈축_62,900|황축_62,900"
12025952,COX CK89 PBT 게이트론 기계식 누메릭 게이밍 키보드,"갈축_48,500|황축_48,500","갈축_48,500|황축_48,500","갈축_48,500|황축_48,500"
12419303,COX CKM01 멤브레인 키보드마우스 세트,"15,400","15,400","15,400"
10924074,COX CKM20 무선 키보드 마우스 콤보,"23,890","23,890","23,890"
