7052686,Ducky ONE 2 MINI RGB PBT 이중사출 한글,"갈축_129,000","갈축_129,000"
7053073,Ducky ONE 2 RGB SEAMLESS PBT 이중사출 한글,"갈축_179,000|은축_189,000|적축_179,000","갈축_179,000|은축_189,000|적축_179,000"
9723786,Ducky ONE 2 SEAMLESS BON VOYAGE PBT 이중사출 영문,"저소음 적축_160,550","저소음 적축_160,550"
14998202,Ducky ONE 2 SEAMLESS BON VOYAGE PBT 이중사출 한글,적축_일시품절|저소음적축_일시품절,적축_일시품절|저소음적축_일시품절
12586205,Ducky ONE 2 SEAMLESS TUXEDO PBT 이중사출 한글,"갈축_138,000|은축_148,000","갈축_138,000|은축_148,000"
12549566,Ducky ONE 2 SF RGB PURE WHITE PBT 이중사출 영문,"갈축_149,460|적축_150,090","갈축_149,460|적축_150,090"
7053244,Ducky ONE 2 TKL RGB SEAMLESS PBT 이중사출 한글,"갈축_179,000|은축_189,000|저소음 적축_189,000|적축_179,000","갈축_179,000|은축_189,000|저소음 적축_189,000|적축_179,000"
9723897,Ducky ONE 2 TKL SEAMLESS BON VOYAGE PBT 이중사출 영문,"저소음 적축_148,000","저소음 적축_148,000"
14998157,Ducky ONE 2 TKL SEAMLESS BON VOYAGE PBT 이중사출 한글,"갈축_138,000|적축_138,000|저소음적축_148,000","갈축_138,000|적축_138,000|저소음적축_148,000"
12586562,Ducky ONE 2 TKL SEAMLESS TUXEDO PBT 이중사출 한글,"갈축_138,000|적축_137,990|저소음 적축_148,000","갈축_138,000|적축_137,990|저소음 적축_148,000"
7291159,Ducky ONE 2 WHITE LED SEAMLESS PBT 이중사출 한글,"갈축_149,000|은축_158,000|적축_149,000","갈축_149,000|은축_158,000|적축_149,000"
16986809,Ducky ONE 3 MINI RGB DayBreak PBT 이중사출 한글,"갈축_169,000|적축_169,000|저소음 적축_179,000|스피드 은축_179,000|클리어축_179,000","갈축_169,000|적축_169,000|저소음 적축_179,000|스피드 은축_179,000|클리어축_179,000"
16987259,Ducky ONE 3 MINI RGB Yellow PBT 이중사출 한글,"갈축_169,000|적축_169,000|저소음 적축_179,000|스피드 은축_171,250|클리어축_179,000","갈축_169,000|적축_169,000|저소음 적축_179,000|스피드 은축_171,250|클리어축_179,000"
17019752,Ducky ONE 3 Matcha PBT 이중사출 한글,"적축_188,980|저소음 적축_197,890|스피드 은축_198,000","적축_188,890|저소음 적축_197,800|스피드 은축_198,000"
17019236,Ducky ONE 3 Night Pink PBT 이중사출 한글,"스피드 은축_188,100","스피드 은축_188,100"
16986329,Ducky ONE 3 RGB DayBreak PBT 이중사출 한글,"스피드 은축_228,000|클리어축_228,000","스피드 은축_228,000|클리어축_228,000"
16987001,Ducky ONE 3 RGB Yellow PBT 이중사출 한글,"스피드 은축_228,000|클리어축_228,000","스피드 은축_일시품절|클리어축_228,000"
16986725,Ducky ONE 3 SF RGB DayBreak PBT 이중사출 한글,"갈축_179,000|저소음 적축_189,000|스피드 은축_189,000|클리어축_189,000","갈축_179,000|저소음 적축_189,000|스피드 은축_189,000|클리어축_189,000"
16987139,Ducky ONE 3 SF RGB Yellow PBT 이중사출 한글,"적축_179,000|저소음 적축_189,000|클리어축_189,000",0
16987151,Ducky ONE 3 SF RGB Yellow PBT 이중사출 한글,0,"적축_179,000|저소음 적축_189,000|클리어축_189,000"
17019665,Ducky ONE 3 TKL Matcha PBT 이중사출 한글,"저소음 적축_187,470","저소음 적축_187,380"
17019443,Ducky ONE 3 TKL Night Pink PBT 이중사출 한글,"갈축_264,000|적축_264,000","갈축_264,000|적축_264,000"
16986506,Ducky ONE 3 TKL RGB DayBreak PBT 이중사출 한글,"적축_264,000|스피드 은축_218,000|클리어축_218,000","적축_264,000|스피드 은축_218,000|클리어축_218,000"
16987058,Ducky ONE 3 TKL RGB Yellow PBT 이중사출 한글,"갈축_264,000|클리어축_218,000","갈축_264,000|클리어축_218,000"
14979056,Ducky One 2 SEAMLESS ROSA PBT 이중사출 한글,"갈축_138,000|적축_138,000|은축_148,000","갈축_138,000|적축_138,000|은축_148,000"
14516426,EVGA Z15 RGB 게이밍 키보드 한글,"은축_119,600","은축_119,600"
14811578,EVGA Z20 RGB 광축 게이밍 키보드 한글,"클릭_111,290|리니어_111,230","클릭_111,290|리니어_111,230"
19744532,FL ESPORTS CMK87 유무선 기계식 마쉬멜로우,"리니어_189,000|택타일_189,000","리니어_189,000|택타일_189,000"
19744508,FL ESPORTS CMK87 유무선 기계식 아보카도,"리니어_189,000|택타일_189,000","리니어_189,000|택타일_189,000"
19520744,FL ESPORTS CMK99 유무선 기계식 모노크롬,"GOLD PINK V2_197,990","GOLD PINK V2_197,990"
19520765,FL ESPORTS CMK99 유무선 기계식 아이스 블루,"GOLD PINK V2_197,990","GOLD PINK V2_197,990"
19744904,FL ESPORTS FL750 CPM 유무선 기계식 메탈하트,"백축_119,000|황축_119,000","백축_119,000|황축_119,000"
19744943,FL ESPORTS FL750 SAM 유무선 기계식 폴라 나이트 블랙,"백축_119,000|황축_119,000","백축_119,000|황축_119,000"
19744121,FL ESPORTS FL980 V2 유무선 기계식 메탈하트,"Red V2_159,000|White V2_159,000","Red V2_159,000|White V2_159,000"
19744157,FL ESPORTS FL980 V2 유무선 기계식 블랙 올리비아,"Red V2_159,000|White V2_159,000","Red V2_159,000|White V2_159,000"
19744166,FL ESPORTS FL980 V2 유무선 기계식 씨솔트,"Red V2_159,000|White V2_159,000","Red V2_159,000|White V2_159,000"
19743719,FL ESPORTS MK750 유무선 베어본 기계식,"투명 블랙_89,000|불투명 블랙_89,000|불투명 화이트_89,000|투명 화이트_92,000","투명 블랙_89,000|불투명 블랙_89,000|불투명 화이트_89,000|투명 화이트_92,000"
3689711,G.SKILL GAMING RIPJAWS KM780 RGB,"정품, 갈축_672,000","정품, 갈축_672,000"
28366412,GDEVIL MK700W 무선 키보드 마우스 세트,"옐로우_32,200|민트_35,800|퍼플_35,800","옐로우_32,200|민트_35,800|퍼플_35,800"
15259547,GIGABYTE AORUS K1 RGB Fusion 게이밍 키보드,"적축, 영문_123,540","적축, 영문_123,450"
8913236,HEXGEARS GK760,"187,950","187,950"
10135905,HP GK400F LED,"청축_28,490|갈축_28,600|적축_27,830|흑축_28,490","청축_28,490|갈축_28,600|적축_27,830|흑축_28,490"
17259917,HyperX Alloy Origins 65,"적축_127,010|아쿠아축_123,330",0
10409004,HyperX Alloy Origins Core,"청축_92,470|아쿠아축_117,600|적축_92,470","청축_92,470|아쿠아축_117,600|적축_92,470"
16318028,Keychron C1 Retro 텐키리스 기계식 유선 키보드,"청축_86,700|갈축_73,080|적축_73,080",0
13825142,Keychron C1 텐키리스 LED,"청축_79,000|갈축_79,000|적축_80,100",0
13826387,Keychron C2 RGB,"청축_93,600|갈축_92,040|적축_94,000",0
16318211,Keychron C2 Retro 풀배열,0,"청축_80,100|갈축_89,000|적축_89,000"
28417448,Keychron K PRO 스위치 110Pcs,"은축_29,200|갈축_29,200|민트축_49,800|적축_28,990|청축_28,990|","은축_29,790|갈축_29,790|민트축_49,800|적축_28,990|청축_28,990|"
17686178,Keychron K10 알루미늄 RGB 핫스왑 기계식,"청축_149,000|갈축_143,100|저소음 적축_158,420|적축_109,710","청축_149,000|갈축_149,000|저소음 적축_179,000|적축_109,710"
14526971,Keychron K4 V2 RGB 다크그레이 알루미늄 핫스왑,"청축_159,000|갈축_149,000|적축_147,510",0
28397315,Keychron K6 PRO 커스텀 보강판,"폴리카보네이트_21,500|알루미늄_21,500|황동_47,030","폴리카보네이트_21,500|알루미늄_21,500|황동_47,030"
28397432,Keychron K8 PRO 커스텀 보강판,"23,490","23,490"
28153634,Keychron K8 PRO 화이트 유무선 기계식,"저소음 적축_168,210",0
20422766,Keychron K8 Retro 알루미늄 기계식 핫스왑,"청축_134,000|갈축_132,660|저소음 적축_144,000|적축_124,000","청축_134,000|갈축_131,320|저소음 적축_144,000|적축_124,000"
28397672,Keychron Q0 커스텀 보강판,"알루미늄_13,350|황동_25,810","알루미늄_14,990|황동_25,810"
28395722,Keychron Q1 커스텀 보강판,"48,990","48,990"
16629788,Keychron Q1 호두나무 원목 팜레스트,0,"28,990"
28395788,Keychron Q2 커스텀 보강판,"황동_48,060|알루미늄_27,840","황동_48,060|알루미늄_27,840"
28396355,Keychron Q3 노브 커스텀 보강판,"21,500","21,500"
28496498,Keychron Q60 레트로 기계식,"적축_309,000|갈축_275,010|청축_309,000","적축_309,000|갈축_308,990|청축_309,000"
28396628,Keychron Q8 커스텀 보강판,"알루미늄_21,500|FR4_21,500|폴리카보네이트_21,500|황동_48,060","알루미늄_21,500|FR4_21,500|폴리카보네이트_21,500|황동_48,060"
28396919,Keychron V1 커스텀 보강판,"알루미늄_21,500|폴리카보네이트_21,500|황동_48,900","알루미늄_21,500|폴리카보네이트_21,500|황동_48,050"
28396994,Keychron V2 커스텀 보강판,"폴리카보네이트_14,280|FR4_21,500","폴리카보네이트_13,350|FR4_21,500"
28397021,Keychron V3 노브 커스텀 보강판,"14,280","13,350"
28397078,Keychron V5 노브 커스텀 보강판,"폴리카보네이트_13,420|알루미늄_21,500","폴리카보네이트_13,420|알루미늄_21,500"
28397156,Keychron V6 노브 커스텀 보강판,"폴리카보네이트_14,340|알루미늄_21,500","폴리카보네이트_14,320|알루미늄_21,500"
28420022,Keychron 게이트론 Cap V2 스위치 35Pcs,"29,900","29,900"
28420580,Keychron 게이트론 G PRO 2.0 스위치 35Pcs,"29,890","29,890"
28419839,Keychron 게이트론 G PRO 3.0 스위치 110Pcs,"백축_57,370|은축_57,370|흑축_41,760","백축_57,350|은축_57,350|흑축_41,740"
28397423,Keychron 게이트론 G Pro 스위치 110pcs,"청축_31,000|갈축_31,000|적축_31,000","청축_31,000|갈축_31,000|적축_31,000"
28420076,Keychron 게이트론 Oil King 스위치 110Pcs,"96,790","96,790"
28420127,Keychron 게이트론 노스폴 2.0 스위치 110Pcs,"86,790","86,790"
28418528,Keychron 게이트론 로우프로파일 스위치 110Pcs,"갈축_36,780|적축_36,740|청축_35,620","갈축_36,760|적축_36,720|청축_35,620"
28415786,Keychron 게이트론 로우프로파일 스위치 35Pcs,"갈축_23,000","갈축_23,000"
28419674,Keychron 게이트론 스위치 테스터 35Pcs,"26,530","26,530"
28417262,Keychron 게이트론 팬텀 스위치 35Pcs,"청축_18,690|갈축_20,990","청축_18,690|갈축_20,990"
28415489,Keychron 로우프로파일 옵티컬 스위치 90Pcs,"적축_36,800|갈축_34,680|민트축_36,800|바나나축_35,390|백축_34,680||","적축_36,800|갈축_36,480|민트축_36,800|바나나축_36,290|백축_36,290||"
28416530,Keychron 카일 미드나잇 프로 스위치 110Pcs,"80,370","79,930"
28416266,Keychron 카일 박스 스위치 110Pcs,"갈축_44,330|네이비축_51,670|백축_46,780|제이드축_51,670","갈축_46,780|네이비축_51,650|백축_46,760|제이드축_51,650"
28415990,Keychron 카일 스위치 110Pcs,"청축_29,440|갈축_29,440|적축_29,440","청축_29,440|갈축_29,290|적축_29,440"
28416506,Keychron 카일 폴리아 스위치 110Pcs,"71,030","71,030"
20300327,Keydous NJ80-AP 유무선 베어본,"149,000","149,000"
20299505,Keydous NJ80-AP 유무선 핫스왑 풀윤활 기계식 차콜블랙,"Box RED V2_159,000|Blueberry Icecream Pro_169,000|Deep Sea Silent Islet_179,000|Deep Sea Silent Whale_179,000|Strawberry Icecream Pro_169,000","Box RED V2_159,000|Blueberry Icecream Pro_169,000|Deep Sea Silent Islet_179,000|Deep Sea Silent Whale_179,000|Strawberry Icecream Pro_169,000"
20267321,Keydous NJ80-AP 유무선 핫스왑 풀윤활 기계식 크림아이보리,"Box RED V2_159,000|Blueberry Icecream Pro_169,000|Deep Sea Silent Islet_178,990|Deep Sea Silent Whale_179,000|Strawberry Icecream Pro_168,990","Box RED V2_159,000|Blueberry Icecream Pro_169,000|Deep Sea Silent Islet_178,990|Deep Sea Silent Whale_179,000|Strawberry Icecream Pro_168,990"
28393730,Kinesis Freestyle2,"해외구매_161,400","해외구매_161,390"
20648642,LANGTU LT-104 유무선 기계식,"해외구매_22,630","해외구매_22,630"
19936787,LANGTU LT-84 유무선,"해외구매_44,460","해외구매_44,460"
19937138,LANGTU LT-84 유선,"해외구매_19,790","해외구매_19,790"
3755095,LG전자 MKS-1000Plus 세트 USB,"15,390","14,780"
27890627,MAXTILL GM-MK500S 무선 키보드 마우스 세트,"21,900","21,900"
20120111,MONSGEEK M1 기계식 해외구매,"블랙_55,500|레드_66,700|실버_55,500|퍼플_55,500|핑크_55,500","블랙_55,500|레드_66,700|실버_55,500|퍼플_55,500|핑크_55,500"
20438030,MONSGEEK M1W 유무선 기계식 해외구매,"블랙_70,218|퍼플_70,218|핑크_70,218",0
20438048,MONSGEEK M1W 유무선 기계식 해외구매,0,"블랙_70,218|퍼플_70,218|핑크_70,218"
20050778,MONSGEEK M3 기계식 해외구매,"블랙_62,510|실버_62,510|퍼플_66,690",0
20050763,MONSGEEK M3 기계식 해외구매,0,"블랙_62,510|실버_62,510|퍼플_66,690"
20119655,MONSGEEK M5 기계식 해외구매,"블랙_59,740|실버_66,900|퍼플_72,900","블랙_59,740|실버_66,900|퍼플_72,900"
20642354,MONSGEEK MG108B 유무선 기계식,"해외구매_27,900",0
17399453,MOUNTAIN EVEREST 60,"텍타일_214,200|리니어_218,160|리니어 스피드_214,200","텍타일_214,200|리니어_218,160|리니어 스피드_214,200"
13144194,MOUNTAIN EVEREST 60 넘버패드,"텍타일_75,300|리니어_75,300|리니어 스피드_75,300","텍타일_75,300|리니어_75,300|리니어 스피드_75,300"
17420348,MOUNTAIN EVEREST CORE,"블랙, 청축_249,090|블랙, 갈축_244,000|블랙, 적축_244,000|블랙, 저소음 적축_253,790","블랙, 청축_249,090|블랙, 갈축_244,000|블랙, 적축_244,000|블랙, 저소음 적축_253,790"
17643284,MOUNTAIN EVEREST MAX,"블랙, 청축_494,990|블랙, 갈축_494,990|블랙, 적축_439,700|블랙, 저소음 적축_494,990|그레이, 청축_492,470|||","블랙, 청축_494,990|블랙, 갈축_494,990|블랙, 적축_439,610|블랙, 저소음 적축_494,990|그레이, 청축_492,470|||"
17961863,MOUNTAIN PBT 이중사출 키캡 세트,"Aquamarine_A_57,290|Aquamarine_B_57,290|Black_50,890|Dolomite_A_57,290|Dolomite_B_57,300||||||","Aquamarine_A_57,290|Aquamarine_B_57,290|Black_50,890|Dolomite_A_57,290|Dolomite_B_57,300||||||"
13164513,MOUNTAIN 스위치,"리니어 스피드_73,200|리니어_73,200|텍타일_73,200","리니어 스피드_73,200|리니어_73,200|텍타일_73,200"
13846658,MSI GK20,일시품절,일시품절
9781407,MSI GK30,"42,790","42,790"
16349240,MSI GK71 소닉 게이밍 키보드,"적축_172,300|청축_134,810","적축_172,300|청축_134,810"
12073796,MSI WR01,"15,000","15,000"
16955183,MadCatz S.T.R.I.K.E 6,"78,930","78,930"
11757986,Microsoft Bluetooth Desktop,0,"정품_68,900"
13269491,Microsoft Designer Compact Keyboard,0,"매트 블랙_89,900|라이트 그레이_89,900"
2310940,Microsoft Sculpt Ergonomic Desktop,"정품_119,000","정품_119,000"
3657745,Microsoft Wireless Desktop 900,"정품_35,500|해외구매_71,600","정품_35,500|해외구매_71,600"
13269398,Microsoft 무선 넘버패드 블루투스,0,"매트 블랙_32,000|라이트 그레이_32,000"
28394567,Mistel MD600 ALPHA 유무선 기계식,일시품절,일시품절
16601618,NZXT FUNCTION,"Matte White_208,000","Matte White_208,000"
16614146,NZXT FUNCTION MINITKL,"Matte Black_89,000|Matte White_89,000","Matte Black_89,000|Matte White_89,000"
16614065,NZXT FUNCTION TENKEYLESS,"Matte Black_179,000|Matte White_일시품절","Matte Black_179,000|Matte White_일시품절"
6527098,QSENN ARES Q34 LED 게이밍 기계식 한손 키보드,"청축_22,390|갈축_22,900|적축_22,900",0
27545468,QSENN F68 유무선 기계식,0,"블랙_88,990|퍼플_88,990|핑크_88,990|화이트_88,990"
27545522,QSENN F98 유무선 기계식,"블랙_77,990|핑크_77,990|화이트_77,990","블랙_77,980|핑크_77,990|화이트_77,990"
15055466,QSENN K1000 무선키보드,"블랙, 키스킨 포함_9,460|화이트, 키스킨 포함_9,570|민트, 키스킨 포함_9,900|핑크, 키스킨 포함_9,900",0
18442208,QSENN KM6000 미니 키보드 마우스 세트,0,"9,570"
15270242,QSENN MK210 무선 키보드 마우스 세트,"블랙, 키스킨 포함_14,760|화이트, 키스킨 포함_14,760|핑크, 키스킨 포함_14,520|민트, 키스킨 포함_14,800|블랙, 키스킨 미포함_14,800|||","블랙, 키스킨 포함_14,760|화이트, 키스킨 포함_14,760|핑크, 키스킨 포함_14,520|민트, 키스킨 포함_14,800|블랙, 키스킨 미포함_14,800|||"
17856344,QSENN MK310 버티컬 Wireless Combo,0,"블랙_25,340|민트_25,300|핑크_25,300"
20166155,QSENN MK350 무선 키보드 마우스 세트,0,"블랙_20,390|민트_20,390|핑크_20,170|화이트_20,400"
17459915,QSENN MK450 무선 키보드 마우스 세트,"블랙_18,400|민트_18,400|핑크_18,400|화이트_18,400","블랙_18,400|민트_18,400|핑크_18,400|화이트_18,400"
6555974,QSENN PTS-GK1000 게이밍 한손 키보드,"13,900",0
18167000,QSENN SEM-DT 큰글씨,"10,580","10,580"
11996414,QSENN SEM-DT25TS LED 텐키리스,"19,900","19,900"
3274936,QSENN SEM-DT35 NEW PS2,"블랙_12,400|화이트_12,400","블랙_12,400|화이트_12,400"
3274953,QSENN SEM-DT35 NEW USB,"블랙_12,400|민트_11,880|핑크_11,770|화이트_12,400","블랙_12,400|민트_11,880|핑크_11,770|화이트_12,400"
19993331,QSENN SEM-DT35W 무선,"블랙_15,900|민트_15,900|핑크_15,900|화이트_15,900","블랙_15,900|민트_15,900|핑크_15,900|화이트_15,900"
11996540,QSENN SEM-DT45 NEW Plus,"PS/2_10,600|USB, 블랙_10,600|USB, 화이트_10,600","PS/2_10,600|USB, 블랙_10,600|USB, 화이트_10,600"
17040407,QSENN SEM-DT55T LED,"22,000","22,000"
18167246,QSENN SEM-KM 큰글씨 키보드 마우스 세트,"13,900","13,900"
9604023,RIZUM RK301 광축 완전방수 푸딩 키캡 게이밍 키보드,"블랙_28,600|화이트_28,600","블랙_28,600|화이트_28,600"
19301000,ROCCAT MAGMA Mini,"44,900","44,900"
12636446,ROCCAT VULCAN TKL PRO 한글,"적축_145,880",0
15391286,ROYCHE BT21 리틀버디 베이비 무선 블루투스 키보드,"타타_15,900|망_15,900|슈키_15,900|알제이_15,900|치미_15,900||",0
4112515,Razer BlackWidow Chroma 오버워치 에디션,"녹축_143,040","녹축_143,040"
7957945,Razer BlackWidow Lite Stealth US,"블랙, 오렌지축_129,000|머큐리, 오렌지축_139,000","블랙, 오렌지축_129,000|머큐리, 오렌지축_139,000"
14519831,Razer BlackWidow V3 KR,"녹축_148,270|황축_148,260","녹축_147,270|황축_147,260"
14458727,Razer BlackWidow V3 Mini HyperSpeed KR,"녹축_219,000|황축_219,000","녹축_219,000|황축_219,000"
13617902,Razer BlackWidow V3 Pro KR,"녹축_306,050|황축_310,000","녹축_306,050|황축_310,000"
12495716,Razer BlackWidow V3 Pro US,"녹축_310,000","녹축_310,000"
14244248,Razer BlackWidow V3 TKL KR,"녹축_139,000|황축_129,450","녹축_139,000|황축_129,450"
12495356,Razer BlackWidow V3 US,"녹축_190,990","녹축_190,990"
28124966,Razer BlackWidow V4 75% 기계식,"270,760","283,210"
28125020,Razer BlackWidow V4 75% 기계식 화이트,"283,210","283,210"
15169460,Razer Blackwidow V3 Mini HyperSpeed Phantom US,"녹축_262,150|황축_289,000","녹축_262,150|황축_289,000"
28497494,Razer Blackwidow V3 Roblox Edition,"정품_218,890|해외구매_149,300","정품_218,800|해외구매_149,300"
27569933,Razer Blackwidow V4 KR,"219,120","219,120"
27569942,Razer Blackwidow V4 Linear KR,"219,120","219,120"
19109549,Razer Blackwidow V4 Pro KR,"331,030","330,940"
19109573,Razer Blackwidow V4 Pro Linear KR,"정품_312,850|병행수입_426,890","정품_312,850|병행수입_426,890"
19109597,Razer Blackwidow V4 Pro Linear US,"349,000","349,000"
19109588,Razer Blackwidow V4 Pro US,"349,000","349,000"
17685794,Razer DeathStalker V2 Pro Linear KR,"309,990","309,990"
17685806,Razer DeathStalker V2 Pro Linear US,"310,000","310,000"
17839187,Razer DeathStalker V2 Pro TKL Linear KR,"295,270","295,270"
17839301,Razer DeathStalker V2 Pro TKL Linear US,"294,000","296,490"
18497024,Razer DeathStalker V2 Pro TKL Linear White US,"299,000","299,000"
18802031,Razer DeathStalker V2 Pro White US 유무선,"309,990","309,990"
18739907,Razer DeathStalker V2 US,"리니어_268,990","리니어_268,990"
14731214,Razer Ergonomic Wrist Rest,"TKL_29,000","TKL_29,000"
10357521,Razer Ergonomic Wrist Rest Pro,"49,000","49,000"
10357491,Razer Ergonomic Wrist Rest Standard,"28,000","28,000"
9772839,Razer Huntsman Elite US,"클릭_299,000|리니어_299,000","클릭_299,000|리니어_299,000"
12235631,Razer Huntsman Mini US,"블랙, 클릭_159,000|머큐리, 리니어_180,000|머큐리, 클릭_169,000|블랙, 리니어_146,500","블랙, 클릭_159,000|머큐리, 리니어_180,000|머큐리, 클릭_169,000|블랙, 리니어_146,500"
9668085,Razer Huntsman Tournament US,"154,000","154,000"
13569632,Razer Huntsman V2 Analog US,"369,000","369,000"
21625853,Razer Huntsman V2 Battlegrounds Edition,"리니어_329,000","리니어_329,000"
16058669,Razer Huntsman V2 KR,"리니어_269,000|퍼플축_259,000","리니어_269,000|퍼플축_259,000"
15680276,Razer Huntsman V2 TKL KR,"리니어_227,540","리니어_227,540"
15284648,Razer Huntsman V2 TKL US,"리니어_일시품절|퍼플축_199,000","리니어_일시품절|퍼플축_199,000"
15284531,Razer Huntsman V2 US,"리니어_269,000|퍼플축_251,670",0
15284444,Razer Huntsman V2 US,0,"리니어_269,000|퍼플축_258,710"
11538242,Razer ORNATA V2,"222,400","222,400"
17686100,Razer Ornata V3 KR,"104,640","104,640"
19970087,Razer Ornata V3 TKL KR,"102,550","103,990"
10357233,Razer PBT Keycap Upgrade Set,"블랙_42,000|그린_42,000|핑크_42,000|화이트_42,000","블랙_42,000|그린_42,000|핑크_42,000|화이트_42,000"
21625907,Razer PUBG Battlegrounds Edition 키보드 마우스 세트 + 헤드셋,"748,990","748,990"
15329453,Razer Phantom Keycap Set,"화이트_55,000","화이트_55,000"
12227084,Razer Pro Type,"199,000","199,000"
16716845,Razer Pro type Ultra KR,"218,990","218,990"
16316537,Razer Pro type Ultra US,"219,000","219,000"
10770513,Razer Tartarus Pro,"클래식 블랙_189,000|머큐리 화이트_187,470|해외구매_127,700","클래식 블랙_189,000|머큐리 화이트_186,470|해외구매_127,700"
17851829,Redragon K617 Fizz,"해외구매_22,970","해외구매_22,970"
12706109,TGIC TGC-K1500U 멤브레인 유선키보드,"3,890","3,890"
15318299,TGIC TGC-K7000M 유선 미니 키보드,"블랙_5,440","블랙_5,470"
18961166,TG삼보 TG-KM7100GS 무선 키보드 마우스 세트,0,"21,900"
28418198,Topre REALFORCE R3 BT 유무선 그레이 블루 한글,"474,990","474,990"
17444597,Topre REALFORCE R3 R3HB11,"해외구매_378,000",0
20082929,VARMILO MA108 V2 WARRIOR SOAR 무접점,"아이리스축_249,000|로즈축_249,000|바이올렛축_249,000|자스민축_249,000|핑크축_249,000","아이리스축_249,000|로즈축_249,000|바이올렛축_249,000|자스민축_249,000|핑크축_249,000"
13728860,VARMILO MA108M KOI PBT 염료승화 영문,"데이지축_208,990|로즈축_220,400|핑크축_209,000","데이지축_208,990|로즈축_220,400|핑크축_209,000"
13350848,VARMILO MA108M Lovebirds I PBT 염료승화 영문,"로즈축_233,400|핑크축_198,000","로즈축_233,400|핑크축_198,000"
13350923,VARMILO MA108M Lovebirds YOU PBT 염료승화 영문,"로즈축_197,990|핑크축_197,990","로즈축_197,990|핑크축_197,990"
13199999,VARMILO MA108M MOONLIGHT PBT 염료승화 영문,"핑크축_188,000","핑크축_188,000"
15126398,VARMILO MA108M SUMMIT R2 PBT 염료승화 영문,"핑크축_219,000","핑크축_219,000"
20082431,VARMILO MA87 V2 WARRIOR SOAR 무접점,"데이지축_229,000|로즈축_229,000|바이올렛축_229,000|아이리스축_229,000|자스민축_229,000|","데이지축_229,000|로즈축_229,000|바이올렛축_229,000|아이리스축_229,000|자스민축_229,000|"
13729001,VARMILO MA87M KOI PBT 염료승화 영문,"데이지축_198,000|로즈축_190,990|핑크축_198,000","데이지축_198,000|로즈축_190,990|핑크축_198,000"
13350356,VARMILO MA87M Lovebirds I PBT 염료승화 영문,"로즈축_389,000","로즈축_389,000"
13350203,VARMILO MA87M Lovebirds You PBT 염료승화 영문,"로즈축_306,500","로즈축_306,500"
13199318,VARMILO MA87M MOONLIGHT PBT 염료승화 영문,"핑크축_199,800|아이비축_177,990","핑크축_199,800|아이비축_177,990"
15126377,VARMILO MA87M SUMMIT R2 PBT 염료승화 영문,"핑크축_208,000","핑크축_208,000"
14160737,VARMILO MA87M 매화 컬렉션 PBT 염료승화 한글,로즈축_일시품절,로즈축_일시품절
18978827,VARMILO MINILO EUCALYPTUS 유무선 영문,"로즈축_169,000|바이올렛축_169,000|아이리스축_169,000|자스민축_169,000|핑크축_169,000","로즈축_169,000|바이올렛축_169,000|아이리스축_169,000|자스민축_169,000|핑크축_169,000"
18991469,VARMILO MINILO MENDOZAE 유무선 영문,"데이지축_169,000|로즈축_169,000|바이올렛축_169,000|아이리스축_169,000|자스민축_169,000|","데이지축_169,000|로즈축_169,000|바이올렛축_169,000|아이리스축_169,000|자스민축_169,000|"
12495089,VARMILO MIYA PRO KOI PBT 염료승화 영문,"갈축_179,000|적축_179,000","갈축_179,000|적축_179,000"
5829362,VARMILO MIYA PRO PBT 매화 컬렉션 염료승화 영문,"갈축_138,000","갈축_138,000"
13734128,VARMILO VA108M Lovebirds I PBT 염료승화 영문,"저소음 적축_239,000","저소음 적축_239,000"
13733990,VARMILO VA108M Lovebirds YOU PBT 염료승화 영문,"저소음 적축_239,000","저소음 적축_239,000"
14039546,VARMILO VA108M SUMMIT R2 PBT 염료승화 영문,"갈축_209,000|적축_208,990","갈축_209,000|적축_208,990"
17572766,VARMILO VA108M V2 Dreams on Board PBT 염료승화 한글,"갈축_일시품절|저소음 적축_219,000|적축_일시품절","갈축_일시품절|저소음 적축_219,000|적축_일시품절"
20259998,VARMILO VA108M V2 MOONLIGHT 한글,"갈축_198,000|저소음 적축_209,000|적축_198,000","갈축_198,000|저소음 적축_209,000|적축_198,000"
17632301,VARMILO VA108M V2 PANDA R2 PBT 염료승화 영문,"갈축_209,000|적축_209,000|저소음 적축_234,250",0
17632286,VARMILO VA108M V2 PANDA R2 PBT 염료승화 영문,0,"갈축_209,000|적축_209,000|저소음 적축_234,250"
