8035732,ASUS TUF B450-PRO GAMING STCOM,"171,000","171,000","171,000"
12409628,ASUS TUF B450-PRO GAMING 대원CTS,0,0,"151,800"
7741678,ASUS TUF B450M-PRO GAMING STCOM,"117,000","117,000","116,540"
12060134,ASUS TUF Gaming A520M-PLUS STCOM,"109,000","108,950",0
12067601,ASUS TUF Gaming A520M-PLUS 아이보라,"100,310","100,180","99,950"
12655739,ASUS TUF Gaming B450-PLUS II STCOM,"163,950",0,"163,950"
12676097,ASUS TUF Gaming B450-PLUS II 대원CTS,"110,000","110,000","126,000"
12646694,ASUS TUF Gaming B450-PLUS II 아이보라,0,"131,100","130,910"
12617759,ASUS TUF Gaming B450M-PLUS II 대원CTS,"106,520","105,360","104,210"
12629378,ASUS TUF Gaming B450M-PRO II STCOM,"133,950",0,0
11814517,ASUS TUF Gaming B450M-PRO S STCOM,"138,340","138,340","138,000"
11413119,ASUS TUF Gaming B460M-PLUS (WI-FI) STCOM,"158,950","158,950","158,800"
11370792,ASUS TUF Gaming B460M-PLUS STCOM,"134,250",0,0
12646568,ASUS TUF Gaming B460M-PRO 아이보라,0,"131,240","131,130"
12113681,ASUS TUF Gaming B550-PLUS (Wi-Fi) STCOM,"234,060",0,"234,060"
12140450,ASUS TUF Gaming B550-PLUS (Wi-Fi) 대원CTS,"186,000","186,000","186,000"
12086387,ASUS TUF Gaming B550-PLUS (Wi-Fi) 아이보라,"188,140","187,960","187,780"
11571272,ASUS TUF Gaming B550-PLUS STCOM,"194,000","194,000","194,000"
11574341,ASUS TUF Gaming B550-PLUS 대원CTS,"182,790","169,500","178,290"
11583224,ASUS TUF Gaming B550-PLUS 아이보라,"170,410","169,950","169,950"
13240724,ASUS TUF Gaming B550-PRO STCOM,"228,530","228,530","231,000"
13191455,ASUS TUF Gaming B550-PRO 대원CTS,0,"212,000","212,000"
13268105,ASUS TUF Gaming B550-PRO 아이보라,"204,790","204,560","201,020"
11571440,ASUS TUF Gaming B550M-PLUS (Wi-Fi) STCOM,"196,000","196,000","196,000"
11571368,ASUS TUF Gaming B550M-PLUS STCOM,"169,000","168,950","169,000"
11583245,ASUS TUF Gaming B550M-PLUS 아이보라,"168,100",0,"167,690"
13561976,ASUS TUF Gaming B560M-PLUS WIFI 인텍앤컴퍼니,"200,330","197,750","197,750"
13531097,ASUS TUF Gaming B560M-PLUS 인텍앤컴퍼니,"179,000","174,900","168,000"
11370177,ASUS TUF Gaming H470-PRO STCOM,0,"189,000","189,000"
13763201,ASUS TUF Gaming H570-PRO WIFI 인텍앤컴퍼니,"246,240","246,240","246,240"
13763021,ASUS TUF Gaming H570-PRO 인텍앤컴퍼니,0,"219,530","219,470"
8516985,ASUS TUF Gaming X570-PLUS STCOM,"291,330","291,330","291,330"
8542178,ASUS TUF Gaming X570-PLUS 대원CTS,"292,160","290,960","290,910"
8517531,ASUS TUF Gaming X570-PLUS 아이보라,"262,080","261,840","261,660"
12424514,ASUS TUF Gaming X570-PRO (Wi-Fi) 아이보라,"274,980","274,750","274,700"
11222736,ASUS TUF Gaming Z490-PLUS 코잇,"233,280","233,280","233,280"
13354835,ASUS TUF Gaming Z590-PLUS WIFI 인텍앤컴퍼니,"297,560","300,000","297,390"
13587644,ASUS TUF Gaming Z590-PLUS 인텍앤컴퍼니,"253,000","271,740","261,000"
6024684,ASUS TUF H370-PRO GAMING (Wi-Fi) 코잇,0,"169,000","169,000"
13613522,ASUS Tinker board 2,"135,950","135,950","135,950"
6731779,ASUS WS C246 PRO 아이보라,"340,500",0,"338,560"
5973277,ASUS WS C621E SAGE 아이보라,0,0,"825,850"
5857728,ASUS WS X299 PRO/SE STCOM,0,"598,180","598,180"
13902929,B450 (중고),"150,000","150,000","150,000"
6122300,BIOSTAR A320MH 이엠텍,"53,300","53,300","53,300"
12074945,BIOSTAR A520MH 이엠텍,"73,250","73,250",0
6706111,BIOSTAR B450MH 이엠텍,"77,320","75,840","75,740"
7138990,BIOSTAR B45M2 이엠텍,"64,900","64,900","64,900"
13212992,BIOSTAR B550M SILVER 이엠텍,"143,900","143,900","143,900"
12065594,BIOSTAR B550MH 이엠텍,"103,380","103,380","103,380"
7653622,BIOSTAR H310MHG 이엠텍,"74,100","74,100","74,100"
11405250,BIOSTAR H410MH 이엠텍,"77,800","79,000","80,000"
13822283,BIOSTAR H510MH/E 2.0 이엠텍,"87,000","87,000","87,000"
13822412,BIOSTAR H510MX/E 2.0 이엠텍,"90,000","90,000","90,000"
4946574,BIOSTAR RACING B350GT5 이엠텍,"96,250","96,180","95,950"
11399055,BIOSTAR RACING B460GTQ 이엠텍,0,0,"121,000"
11691983,BIOSTAR RACING B550GTQ 이엠텍,"158,000","158,000","158,000"
13645175,BIOSTAR RACING B560GTQ 이엠텍,"163,800","163,800","163,660"
4946644,BIOSTAR RACING X370GT5 이엠텍,"113,860","113,680","113,450"
9249009,BIOSTAR RACING X570GT 이엠텍,"163,000","163,000","163,000"
11233074,BIOSTAR RACING Z490GTA EVO 이엠텍,"216,780","216,780","216,780"
11333931,BIOSTAR RACING Z490GTA 이엠텍,0,"195,140","195,140"
11333949,BIOSTAR RACING Z490GTN 이엠텍,"195,140","195,140","195,140"
13662614,BIOSTAR RACING Z590GTA 이엠텍,0,"291,140","290,910"
5022334,BIOSTAR TB250 BTC 이엠텍,"220,000",0,"200,000"
14097128,BIOSTAR TB360-BTC PRO,일시품절,일시품절,일시품절
6622063,COLORFUL A320M-K PRO YV14 STCOM,"49,400","49,400","49,400"
13066529,COLORFUL BATTLE-AX A520M-M.2 PRO V14 STCOM,"73,440",0,0
10064217,COLORFUL BATTLE-AX B450M-G DELUXE V14 STCOM,0,"90,060","90,000"
11369613,COLORFUL BATTLE-AX Z490M-PLUS V20 STCOM,"152,000","152,000","152,000"
11877574,COLORFUL CVN B460M GAMING PRO V20 STCOM,"113,260","113,260","113,260"
12120113,COLORFUL CVN B550M GAMING PRO V14 STCOM,"147,130","147,130","147,130"
11369259,COLORFUL CVN Z490 GAMING PRO V20 STCOM,0,"181,000","181,000"
7129243,COLORFUL H310M-E PRO V20 STCOM,"56,400","56,400","55,000"
11877226,COLORFUL H410M-K PRO V20 STCOM,"78,500","78,500","78,500"
11369454,COLORFUL iGAME Z490 VULCAN X V20 STCOM,"246,000","246,000","238,250"
5474440,ECS DURATHON2 A320AM4-M3D 제이씨현,"48,740","48,650","48,630"
8156149,ECS DURATHON2 A320AM4-M3D 코잇,"51,390","51,300","51,190"
11097624,ECS DURATHON2 B450AM4-M 코잇,"104,060",0,0
12549941,ECS DURATHON2 B460H6-M22 코잇,"126,380",0,"126,380"
5466288,ECS DURATHON2 H110S-2P 코잇,"96,590","96,410","96,180"
6675772,ECS DURATHON2 H310CH5-M2 코잇,0,"60,940","60,930"
7320049,ECS H310CH5-TI2 코잇,"96,700",0,"96,290"
7566175,ECS H310CH5-TI2 코잇 (90W 어댑터),"101,250",0,"101,250"
12500273,ECS H410H6-TI2 코잇,"106,660","106,430","106,250"
12500279,ECS H410H6-TI2 코잇 (120W 어댑터),"137,720",0,"137,370"
12767324,GIGABYTE A320M-H 듀러블에디션 제이씨현 (벌크),0,"60,890","60,800"
6500307,GIGABYTE A320M-H 듀러블에디션 피씨디렉트,"62,640","62,640","62,600"
14147171,GIGABYTE A520 AORUS ELITE 피씨디렉트,"126,000","126,000","126,000"
12136250,GIGABYTE A520I AC 듀러블에디션 제이씨현,"179,950",0,"163,740"
12076919,GIGABYTE A520M AORUS ELITE 제이씨현,"106,650","106,650","105,850"
12083705,GIGABYTE A520M AORUS ELITE 피씨디렉트,"107,700",0,"107,690"
12083735,GIGABYTE A520M DS3H 듀러블에디션 피씨디렉트,"87,930","83,550","86,000"
12077126,GIGABYTE A520M H 듀러블에디션 제이씨현,"81,380","81,380","81,380"
12083807,GIGABYTE A520M H 듀러블에디션 피씨디렉트,"82,000",0,"81,540"
12077093,GIGABYTE A520M S2H 듀러블에디션 제이씨현,"81,900","81,900",0
12083765,GIGABYTE A520M S2H 듀러블에디션 피씨디렉트,"82,850","81,920","83,910"
6015737,GIGABYTE B360M DS3H 듀러블에디션 피씨디렉트,0,"238,360","238,360"
8183626,GIGABYTE B365 M AORUS ELITE 제이씨현,"127,410",0,"127,410"
7801285,GIGABYTE B365M DS3H 듀러블에디션 제이씨현,"79,680","79,680","79,980"
7892983,GIGABYTE B365M DS3H 듀러블에디션 피씨디렉트,"90,060",0,0
8663672,GIGABYTE B365M H 듀러블에디션 제이씨현,0,"81,470","81,470"
8562848,GIGABYTE B365M H 듀러블에디션 피씨디렉트,0,"87,080","87,080"
14147273,GIGABYTE B450 AORUS ELITE V2 제이씨현,일시품절,"119,700","119,700"
13512716,GIGABYTE B450 AORUS ELITE V2 피씨디렉트,"87,200","87,200","87,200"
6399970,GIGABYTE B450 AORUS ELITE 제이씨현,"115,860","115,810","115,800"
6445735,GIGABYTE B450 AORUS ELITE 피씨디렉트,"89,620","89,620","89,620"
6349562,GIGABYTE B450 AORUS PRO 제이씨현,0,"147,440","147,440"
6639577,GIGABYTE B450 AORUS PRO 피씨디렉트,"149,000","149,000","149,000"
7878274,GIGABYTE B450 GAMING X 게이밍에디션 제이씨현,"121,890","121,890","121,340"
10162080,GIGABYTE B450M AORUS ELITE 제이씨현,"80,000","80,000","80,000"
10140399,GIGABYTE B450M AORUS ELITE 피씨디렉트,"80,000","80,000","80,000"
13240664,GIGABYTE B450M DS3H V2 듀러블에디션 제이씨현,"90,300","90,300","88,000"
12450836,GIGABYTE B450M DS3H V2 듀러블에디션 피씨디렉트,"95,800","88,800","88,800"
6383091,GIGABYTE B450M DS3H 듀러블에디션 제이씨현,"80,600","80,490","80,400"
6544861,GIGABYTE B450M GAMING 게이밍에디션 제이씨현,"91,800","91,800","91,000"
11394771,GIGABYTE B460 AORUS PRO AC 제이씨현,"213,930","213,930","213,000"
11405688,GIGABYTE B460 AORUS PRO AC 피씨디렉트,0,"225,000","225,000"
11572877,GIGABYTE B460M AORUS ELITE 피씨디렉트,"125,290","125,290","123,900"
13240610,GIGABYTE B460M DS3H V2 듀러블에디션 제이씨현,"101,700","104,000","104,000"
13279442,GIGABYTE B460M DS3H V2 듀러블에디션 피씨디렉트,"100,000","100,000","100,000"
11405823,GIGABYTE B460M DS3H 듀러블에디션 피씨디렉트,0,"102,990","101,760"
11606894,GIGABYTE B550 AORUS ELITE 제이씨현,"179,000","179,000","176,290"
11574242,GIGABYTE B550 AORUS ELITE 피씨디렉트,"177,000","177,000","177,000"
11606864,GIGABYTE B550 AORUS MASTER 제이씨현,"434,000","434,000","434,000"
11574560,GIGABYTE B550 AORUS MASTER 피씨디렉트,"430,170","430,170","432,000"
13289030,GIGABYTE B550 AORUS PRO V2 제이씨현,0,"267,840","267,840"
12243425,GIGABYTE B550 AORUS PRO V2 피씨디렉트,"271,000","271,000","271,000"
12276464,GIGABYTE B550 GAMING X V2 게이밍에디션 피씨디렉트,"180,890","180,890","180,890"
11606903,GIGABYTE B550 GAMING X 게이밍에디션 제이씨현,"179,030","179,030","179,030"
11575262,GIGABYTE B550 GAMING X 게이밍에디션 피씨디렉트,0,"178,950","178,950"
13253213,GIGABYTE B550 VISION D-P 피씨디렉트,"389,000","389,000","389,000"
11751551,GIGABYTE B550I AORUS PRO AX 피씨디렉트,"268,800","268,800","268,800"
11684576,GIGABYTE B550M AORUS ELITE 제이씨현,0,"125,800",0
11751599,GIGABYTE B550M AORUS ELITE 피씨디렉트,"142,000",0,0
12755786,GIGABYTE B550M AORUS PRO-P 제이씨현,"127,450","128,030","128,030"
12276353,GIGABYTE B550M AORUS PRO-P 피씨디렉트,"107,640","102,000","99,990"
11684642,GIGABYTE B550M DS3H 듀러블에디션 제이씨현,"127,450","129,000","118,680"
11575373,GIGABYTE B550M DS3H 듀러블에디션 피씨디렉트,"114,480","106,100","106,100"
11684771,GIGABYTE B550M GAMING 게이밍에디션 제이씨현,"124,780","124,780","124,780"
11751674,GIGABYTE B550M GAMING 게이밍에디션 피씨디렉트,"113,400","113,400","113,400"
11685269,GIGABYTE B550M H 듀러블에디션 제이씨현,"118,000","118,000","118,000"
11771141,GIGABYTE B550M H 듀러블에디션 피씨디렉트,"108,000","108,000","108,000"
13528505,GIGABYTE B560 AORUS PRO AX 피씨디렉트,"243,600","243,600","243,600"
14332331,GIGABYTE B560 HD3 듀러블에디션 피씨디렉트,가격비교예정,가격비교예정,가격비교예정
13838093,GIGABYTE B560M AORUS ELITE 제이씨현,"169,000","169,000","169,000"
13922957,GIGABYTE B560M AORUS ELITE 피씨디렉트,"148,650","148,650","148,650"
13562420,GIGABYTE B560M AORUS PRO AX 제이씨현,"207,240",0,"207,240"
13486556,GIGABYTE B560M AORUS PRO AX 피씨디렉트,"188,800","188,800","188,800"
13562459,GIGABYTE B560M AORUS PRO 제이씨현,"181,200","181,200","181,200"
13504949,GIGABYTE B560M AORUS PRO 피씨디렉트,"166,970","166,910","166,800"
13845140,GIGABYTE B560M D2V 듀러블에디션 제이씨현,"98,940","98,990","98,810"
13681838,GIGABYTE B560M D2V 듀러블에디션 피씨디렉트,"95,600","95,600","95,600"
13858076,GIGABYTE B560M D3H 듀러블에디션 제이씨현,"135,000","135,000","135,000"
13643576,GIGABYTE B560M D3H 듀러블에디션 피씨디렉트,"136,000",0,"136,000"
13524110,GIGABYTE B560M DS3H 듀러블에디션 피씨디렉트,"114,460","112,250","115,550"
7634614,GIGABYTE C246-WU4 피씨디렉트,"305,950","305,950","305,950"
7659157,GIGABYTE C246M-WU4 피씨디렉트,0,"243,950","243,950"
7713430,GIGABYTE C621-SD8 피씨디렉트,"669,000","669,000","669,000"
7953976,GIGABYTE C621-SU8 피씨디렉트,"555,330","555,330","555,330"
10630311,GIGABYTE C621-WD12-IPMI 피씨디렉트,"849,000","849,000","849,000"
5760122,GIGABYTE GA-A320M-S2H 듀러블에디션 제이씨현,"69,660","69,660","62,600"
5997948,GIGABYTE GA-A320M-S2H 듀러블에디션 피씨디렉트,"62,750","64,210","64,210"
3535387,GIGABYTE GA-H110M-DS2V 듀러블에디션 피씨디렉트,"71,580","71,580","71,580"
4172985,GIGABYTE GA-H110M-HD2 듀러블에디션 피씨디렉트,"162,800",0,"162,800"
3535400,GIGABYTE GA-H110M-S2PV 듀러블에디션 피씨디렉트,"130,950",0,0
11988770,GIGABYTE GA-N3160N-D3V 듀러블에디션 피씨디렉트,0,"114,000","114,000"
8131558,GIGABYTE H310M A 2.0 듀러블에디션 제이씨현,"78,990","78,880","78,790"
8195818,GIGABYTE H310M A 2.0 듀러블에디션 피씨디렉트,"79,920",0,"79,920"
6582490,GIGABYTE H310M DS2V 2.0 듀러블에디션 제이씨현,"72,500",0,0
6464259,GIGABYTE H310M DS2V 2.0 듀러블에디션 피씨디렉트,"72,400",0,"72,400"
6022458,GIGABYTE H310M DS2V 듀러블에디션 제이씨현,0,"66,880","66,630"
6016476,GIGABYTE H310M DS2V 듀러블에디션 피씨디렉트,"68,760",0,"68,760"
8751266,GIGABYTE H310M H 2.0 듀러블에디션 피씨디렉트,"76,000","76,000","76,000"
6669445,GIGABYTE H310M S2H 2.0 듀러블에디션 제이씨현,"79,600","79,530","79,420"
6649963,GIGABYTE H310M S2H 2.0 듀러블에디션 피씨디렉트,"82,390","82,390","82,390"
7482430,GIGABYTE H310N 2.0 듀러블에디션 제이씨현,0,"172,670","172,670"
13426790,GIGABYTE H410M DS2V V2 듀러블에디션 제이씨현,"82,000","82,000","82,000"
13462727,GIGABYTE H410M DS2V V2 듀러블에디션 피씨디렉트,"79,000","79,000","79,000"
11396310,GIGABYTE H410M DS2V 듀러블에디션 제이씨현,"79,000","79,000","79,000"
11405880,GIGABYTE H410M DS2V 듀러블에디션 피씨디렉트,"79,000","79,000","79,000"
13426967,GIGABYTE H410M H V2 듀러블에디션 제이씨현,"79,000","79,000","79,000"
13498859,GIGABYTE H410M H V2 듀러블에디션 피씨디렉트,0,"82,500","82,500"
13426601,GIGABYTE H410M S2H V2 듀러블에디션 제이씨현,0,"88,000","88,000"
13462670,GIGABYTE H410M S2H V2 듀러블에디션 피씨디렉트,0,"84,640","84,640"
11405958,GIGABYTE H410M S2H 듀러블에디션 피씨디렉트,0,"83,850","83,850"
11393649,GIGABYTE H470 AORUS PRO AX 제이씨현,"208,640","208,460","208,230"
11405994,GIGABYTE H470 AORUS PRO AX 피씨디렉트,0,"245,000","245,000"
11406015,GIGABYTE H470 HD3 듀러블에디션 피씨디렉트,"169,000",0,"169,000"
11394462,GIGABYTE H470I AORUS PRO AX 제이씨현,"245,000","245,000","247,200"
11406057,GIGABYTE H470I AORUS PRO AX 피씨디렉트,"257,000",0,"257,000"
14327948,GIGABYTE H510M DS2V 듀러블에디션 (벌크),"94,000","94,000","94,000"
13804274,GIGABYTE H510M DS2V 듀러블에디션 제이씨현,"93,000","93,000","93,000"
13774823,GIGABYTE H510M DS2V 듀러블에디션 피씨디렉트,"93,000","93,000","93,000"
14327864,GIGABYTE H510M H 듀러블에디션 (벌크),"85,080","85,080","85,080"
13830011,GIGABYTE H510M H 듀러블에디션 제이씨현,"92,000","92,000","91,990"
13775150,GIGABYTE H510M H 듀러블에디션 피씨디렉트,"86,100","86,100","86,100"
13857962,GIGABYTE H510M S2H 듀러블에디션 제이씨현,"97,660","97,660","97,660"
13745243,GIGABYTE H510M S2H 듀러블에디션 피씨디렉트,0,"92,400","92,400"
10013538,GIGABYTE TRX40 AORUS MASTER 피씨디렉트,0,0,"720,000"
10013697,GIGABYTE TRX40 AORUS PRO WiFi 피씨디렉트,0,0,"570,000"
11857741,GIGABYTE W480 VISION D 피씨디렉트,0,"525,290","525,290"
11839705,GIGABYTE W480 VISION W 피씨디렉트,"409,000","406,580","406,580"
11839732,GIGABYTE W480M VISION W 피씨디렉트,0,"319,000","319,000"
14274146,GIGABYTE WRX80-SU8-IPMI 피씨디렉트,가격비교예정,가격비교예정,가격비교예정
7634722,GIGABYTE X299-WU8 피씨디렉트,0,0,"698,950"
9960828,GIGABYTE X299X AORUS XTREME WATERFORCE 피씨디렉트,"2,238,000","2,238,000","2,238,000"
9999069,GIGABYTE X299X DESIGNARE 10G 피씨디렉트,"878,990","878,990","878,990"
6716767,GIGABYTE X470 AORUS Gaming 7 WiFi 피씨디렉트,"340,000","340,000","340,000"
9473076,GIGABYTE X570 AORUS ELITE WiFi 피씨디렉트,"305,000","305,000","305,000"
8497905,GIGABYTE X570 AORUS ELITE 피씨디렉트,"270,350","270,290","270,060"
8515635,GIGABYTE X570 AORUS MASTER 제이씨현,"1,014,630",0,0
8498229,GIGABYTE X570 AORUS MASTER 피씨디렉트,"810,000","810,000","810,000"
8499117,GIGABYTE X570 AORUS PRO 피씨디렉트,"343,270","343,270","343,270"
8502411,GIGABYTE X570 AORUS XTREME 피씨디렉트,"926,920",0,0
8502699,GIGABYTE X570 GAMING X 게이밍에디션 피씨디렉트,"234,990","234,990","234,990"
8515863,GIGABYTE X570 I AORUS PRO WiFi 제이씨현,0,0,"339,000"
8502987,GIGABYTE X570 I AORUS PRO WiFi 피씨디렉트,"335,220","335,220","335,220"
6508404,GIGABYTE Z390 AORUS ELITE 제이씨현,0,"189,170","188,990"
6508756,GIGABYTE Z390 AORUS MASTER 피씨디렉트,"389,800","389,800","389,800"
6508759,GIGABYTE Z390 AORUS PRO 피씨디렉트,"331,300","331,300",0
6508764,GIGABYTE Z390 GAMING SLI 피씨디렉트,0,"235,000","235,000"
6508461,GIGABYTE Z390 M GAMING 게이밍에디션 제이씨현,"197,870","197,870","197,870"
6891424,GIGABYTE Z390 M 듀러블에디션 피씨디렉트,0,"186,000","186,000"
6508761,GIGABYTE Z390 UD 듀러블에디션 피씨디렉트,"184,990",0,0
11231664,GIGABYTE Z490 AORUS ELITE AC 제이씨현,"285,000","285,000","283,690"
11297253,GIGABYTE Z490 AORUS ELITE AC 피씨디렉트,0,"270,610","270,610"
11231685,GIGABYTE Z490 AORUS ELITE 제이씨현,0,0,"264,000"
11224539,GIGABYTE Z490 AORUS ELITE 피씨디렉트,"268,990",0,0
11231589,GIGABYTE Z490 AORUS MASTER 제이씨현,0,0,"457,000"
11224548,GIGABYTE Z490 AORUS MASTER 피씨디렉트,"448,000","448,000","448,000"
11231616,GIGABYTE Z490 AORUS PRO AX 제이씨현,"342,870","342,080","342,030"
11297184,GIGABYTE Z490 AORUS PRO AX 피씨디렉트,"324,440","324,440","324,440"
11231598,GIGABYTE Z490 AORUS ULTRA 제이씨현,"340,940","340,760","340,530"
11231772,GIGABYTE Z490 GAMING X 게이밍에디션 제이씨현,"236,530","236,530","236,430"
11225142,GIGABYTE Z490 GAMING X 게이밍에디션 피씨디렉트,"249,000","248,990","248,990"
11231784,GIGABYTE Z490 UD 듀러블에디션 제이씨현,0,"212,000","212,000"
11231718,GIGABYTE Z490 VISION D 제이씨현,"405,940",0,"405,940"
11238549,GIGABYTE Z490 VISION D 피씨디렉트,"495,000","495,000","495,000"
11231748,GIGABYTE Z490 VISION G 제이씨현,0,"274,950","270,990"
11225379,GIGABYTE Z490 VISION G 피씨디렉트,"289,000","289,000","289,000"
11231799,GIGABYTE Z490I AORUS ULTRA 제이씨현,"361,050","361,050","361,050"
11297427,GIGABYTE Z490I AORUS ULTRA 피씨디렉트,"320,000",0,"320,000"
11331702,GIGABYTE Z490M GAMING X 게이밍에디션 제이씨현,"221,450","221,450","221,030"
11232054,GIGABYTE Z490M GAMING X 게이밍에디션 피씨디렉트,"228,800","228,800","228,800"
11331840,GIGABYTE Z490M 듀러블에디션 제이씨현,"180,640","180,460","180,230"
11232027,GIGABYTE Z490M 듀러블에디션 피씨디렉트,"210,000","210,000","210,000"
13627262,GIGABYTE Z590 AORUS ELITE AX 제이씨현,"303,800","303,800","303,800"
13410428,GIGABYTE Z590 AORUS ELITE AX 피씨디렉트,"304,000","304,000","304,000"
13409234,GIGABYTE Z590 AORUS ELITE 피씨디렉트,"280,000","280,000","280,000"
13377359,GIGABYTE Z590 AORUS MASTER 제이씨현,"583,730","583,730","583,730"
13364366,GIGABYTE Z590 AORUS MASTER 피씨디렉트,"548,800","548,800","588,700"
13535570,GIGABYTE Z590 AORUS PRO AX 제이씨현,"359,140","359,140","354,260"
13424705,GIGABYTE Z590 AORUS PRO AX 피씨디렉트,"360,000","360,000","360,000"
13682129,GIGABYTE Z590 AORUS TACHYON 피씨디렉트,0,"731,900","731,900"
13537568,GIGABYTE Z590 AORUS ULTRA 제이씨현,"429,660","429,660","429,660"
13448285,GIGABYTE Z590 AORUS ULTRA 피씨디렉트,0,"432,110","432,110"
13683158,GIGABYTE Z590 AORUS XTREME 제이씨현,0,"1,100,000","1,100,000"
13760984,GIGABYTE Z590 AORUS XTREME 피씨디렉트,0,0,"1,093,100"
13627403,GIGABYTE Z590 GAMING X 게이밍에디션 제이씨현,"255,000","255,000","255,000"
13473218,GIGABYTE Z590 GAMING X 게이밍에디션 피씨디렉트,"255,940","255,940","255,940"
13627526,GIGABYTE Z590 UD 듀러블에디션 제이씨현,"234,360","234,360","232,550"
13473563,GIGABYTE Z590 UD 듀러블에디션 피씨디렉트,"236,360","236,360","236,360"
13708577,GIGABYTE Z590 VISION D 제이씨현,"476,320","476,320","469,110"
13763357,GIGABYTE Z590 VISION D 피씨디렉트,"469,000",0,"469,000"
13377386,GIGABYTE Z590 VISION G 제이씨현,"314,650","314,650","309,520"
13627157,GIGABYTE Z590I AORUS ULTRA 제이씨현,"382,800","382,800","383,260"
13424996,GIGABYTE Z590I AORUS ULTRA 피씨디렉트,"392,950",0,"392,950"
13547912,GIGABYTE Z590I VISION D 피씨디렉트,"429,000",0,0
13696718,GIGABYTE Z590M GAMING X 게이밍에디션 제이씨현,"243,040","243,040","243,040"
13829828,GIGABYTE Z590M GAMING X 게이밍에디션 피씨디렉트,"234,200","234,200","234,200"
13761467,GIGABYTE Z590M 듀러블에디션 제이씨현,"212,660",0,"212,660"
13805843,GIGABYTE Z590M 듀러블에디션 피씨디렉트,"206,680","206,680","206,680"
13949627,LKino MEGA128 트레이닝 보드 LA18,"66,960","66,850","66,760"
9302775,MSI A320M-A PRO,"61,000","61,000","60,980"
12281690,MSI A520M PRO,"77,130","74,890","82,470"
12403937,MSI A520M PRO-C DASH,"84,640","84,640","84,640"
12067598,MSI A520M-A PRO,"74,020","72,400","74,020"
6013975,MSI B360M 박격포,"96,570","96,570","96,570"
6333723,MSI B450 게이밍 프로 카본 AC,"455,000",0,0
6333832,MSI B450 게이밍 플러스,"129,000","129,000","129,000"
6334442,MSI B450M 박격포,0,0,"96,000"
11572061,MSI B460M PRO-VDH WiFi,"115,000","115,000","115,000"
11407332,MSI B460M-PRO,"102,950","102,950","102,950"
13803932,MSI B560M PRO,"116,600","116,600","116,600"
13804151,MSI B560M-A PRO,"106,000","106,000","106,000"
6681823,MSI H310M PRO-VD PLUS,"69,000","69,000","69,000"
11407134,MSI H410M PRO,"85,340","85,340","85,340"
11406948,MSI H410M-A PRO,"83,340","82,890","82,890"
13759994,MSI H510M PRO,"94,000","94,000","94,000"
13628021,MSI H510M-A PRO,"90,720","90,720","90,720"
8938550,MSI MAG B450M 박격포 맥스,"93,900","89,150","92,340"
11407599,MSI MAG B460 토마호크,0,0,"167,000"
12304409,MSI MAG B460 토피도,"138,490","138,490","138,490"
11407725,MSI MAG B460M 바주카,"120,440","120,440","120,440"
11397129,MSI MAG B460M 박격포,"127,250","129,000","131,110"
11408037,MSI MAG B460M 박격포 WiFi,"142,950","142,800","142,800"
11577782,MSI MAG B550 토마호크,"208,600","208,550","208,500"
11578097,MSI MAG B550M 박격포,"186,740","175,450","178,750"
11578325,MSI MAG B550M 박격포 WiFi,"186,900","185,900","185,900"
12889655,MSI MAG B550M 박격포 WiFi + 코어리퀴드 240R,"313,000",0,"313,000"
13696388,MSI MAG B560 토마호크 WIFI,"226,570","226,570","226,570"
13803419,MSI MAG B560 토피도,"216,780","216,730","216,780"
13803641,MSI MAG B560M 바주카,"179,000","179,000","179,000"
13760447,MSI MAG B560M 박격포,"196,500","196,440","196,380"
13844039,MSI MAG B560M 박격포 WIFI,"204,630","204,510","204,280"
11223516,MSI MAG Z490 토마호크,"199,000","199,000",0
13669925,MSI MAG Z590 토마호크 WIFI,"308,780","308,730","308,780"
13697252,MSI MAG Z590 토피도,"295,090","295,040","295,090"
12904922,MSI MEG B550 유니파이,"377,640","383,170","383,170"
12897401,MSI MEG B550 유니파이 + 코어리퀴드 360R,0,0,"524,160"
13060886,MSI MEG B550 유니파이-X,"399,220","399,220","399,220"
8519025,MSI MEG X570 갓라이크,"1,790,350","1,790,350","1,790,350"
9831717,MSI MEG X570 유니파이,"853,630",0,"853,630"
11319420,MSI MEG Z490 유니파이,"330,280","330,280","330,280"
13867739,MSI MEG Z590 갓라이크,"1,075,610","1,075,610","1,075,610"
13669397,MSI MEG Z590 에이스,"658,500","658,500","658,500"
14105573,MSI MEG Z590 유니파이,가격비교예정,가격비교예정,가격비교예정
13724183,MSI MEG Z590I 유니파이,"372,400","372,400","372,400"
11193693,MSI MPG B450 게이밍 프로 카본 맥스 WiFi,0,"254,330","254,330"
9204126,MSI MPG B450 게이밍 플러스 맥스,"160,770","160,770","160,770"
11591798,MSI MPG B550 게이밍 엣지 WiFi,"284,990","284,990","259,350"
11578637,MSI MPG B550 게이밍 카본 WiFi,"275,370","275,370","275,370"
11591501,MSI MPG B550 게이밍 플러스,0,"193,250","193,300"
11592377,MSI MPG B550I 게이밍 엣지 WiFi,"248,300",0,"249,000"
13355741,MSI MPG B550I 게이밍 엣지 맥스 WIFI,"246,150","246,100","246,150"
9500100,MSI MPG X470 게이밍 플러스 맥스,"105,000","105,000","105,000"
8520741,MSI MPG X570 게이밍 엣지 WiFi,"477,840","477,840","477,840"
8520999,MSI MPG X570 게이밍 플러스,"252,449","252,449","252,449"
6508252,MSI MPG Z390 게이밍 엣지 AC,"477,850",0,"477,850"
11223594,MSI MPG Z490 게이밍 엣지 WiFi,"249,000","227,000","199,000"
12952814,MSI MPG Z490 게이밍 엣지 WiFi + 코어리퀴드 360R,0,"369,360","359,100"
11223636,MSI MPG Z490 게이밍 플러스,"222,660","193,000","188,500"
13804826,MSI MPG Z590 게이밍 엣지 WiFi,"390,000","390,000","390,000"
13388384,MSI MPG Z590 게이밍 카본 WIFI,"435,500","435,500","435,500"
13449158,MSI MPG Z590 게이밍 포스,"428,190","428,140","428,190"
6062200,MSI X470 게이밍 플러스,"470,000",0,"470,000"
11223681,MSI Z490-A PRO,"189,000",0,"189,000"
14200919,NVIDIA Jetson Xavier NX Developer Kit (해외구매),"541,920","565,030","565,030"
13889813,아두이노 16채널 12V 릴레이 모듈,"9,600","9,600","9,600"
14147057,아두이노 1채널 3.3V 릴레이 모듈,"4,890","4,890","4,890"
13949195,아두이노 MAX485 TTL to RS485 컨버터 모듈,400,400,400
13949078,아두이노 MP1584EN DC-DC 스텝다운,780,780,780
13889939,아두이노 Pro Micro 보드,"11,000","11,000","11,000"
