13587644,ASUS TUF Gaming Z590-PLUS 인텍앤컴퍼니,"298,200","298,200"
6024680,ASUS TUF H370-PRO GAMING 코잇,"145,790","148,930"
6511779,ASUS TUF Z390-PLUS GAMING STCOM,0,"313,250"
13613522,ASUS Tinker board 2,가격비교예정,가격비교예정
13695704,ASUS Tinker board 2S,"172,000","172,000"
9428169,ASUS Tinker board S,"128,990","128,990"
5973277,ASUS WS C621E SAGE 아이보라,"832,180","832,000"
5857695,ASUS WS X299 PRO STCOM,"556,000","556,000"
5857728,ASUS WS X299 PRO/SE STCOM,"556,000","556,000"
5857774,ASUS WS X299 SAGE STCOM,"1,531,670",0
5896041,ASUS WS X299 SAGE 아이보라,"770,000","770,000"
3257884,ASUS Z10PA-D8 STCOM,"526,000","526,000"
3056913,ASUS Z10PE-D16 WS 아이보라,"738,000","738,000"
5864802,ASUS Z11PA-U12 아이보라,"603,330",0
5864888,ASUS Z11PA-U12/10G-2S 아이보라,"663,600","663,600"
13606571,Arduino 아두이노 우노 R3 초보 키트,"29,700","29,700"
6898861,B250 ATX (중고),"67,480","99,000"
6122300,BIOSTAR A320MH 이엠텍,"53,300","53,300"
12074945,BIOSTAR A520MH 이엠텍,"73,000","73,000"
8680376,BIOSTAR B365MHC 이엠텍,"75,000","75,000"
6706111,BIOSTAR B450MH 이엠텍,"75,900","73,900"
7138990,BIOSTAR B45M2 이엠텍,"64,900","64,900"
13212992,BIOSTAR B550M SILVER 이엠텍,"142,400","142,400"
12065594,BIOSTAR B550MH 이엠텍,"104,500","104,500"
7653622,BIOSTAR H310MHG 이엠텍,"74,100","74,100"
8778968,BIOSTAR H310MHP 이엠텍,"80,600","80,600"
11405250,BIOSTAR H410MH 이엠텍,"77,900","77,900"
4946574,BIOSTAR RACING B350GT5 이엠텍,"96,610","96,610"
9553977,BIOSTAR RACING B450GT3 이엠텍,"91,990","92,050"
11399055,BIOSTAR RACING B460GTQ 이엠텍,"119,270","121,000"
13645175,BIOSTAR RACING B560GTQ,"184,800","184,800"
4946644,BIOSTAR RACING X370GT5 이엠텍,"117,840","117,840"
11233074,BIOSTAR RACING Z490GTA EVO 이엠텍,"215,070","215,070"
11333931,BIOSTAR RACING Z490GTA 이엠텍,"198,720","198,720"
11333949,BIOSTAR RACING Z490GTN 이엠텍,"193,200","193,200"
13662614,BIOSTAR RACING Z590GTA 이엠텍,"295,960","295,960"
5324924,BIOSTAR TB250 BTC+ 이엠텍,0,일시품절
13644830,BIOSTAR Z590 VALKYRIE,가격비교예정,가격비교예정
6622063,COLORFUL A320M-K PRO YV14 STCOM,0,"49,400"
8407983,COLORFUL BATTLE-AX B365M-PLUS V20 STCOM,"87,000","83,740"
10064217,COLORFUL BATTLE-AX B450M-G DELUXE V14 STCOM,"90,060","90,060"
11877349,COLORFUL BATTLE-AX B460M-D V20 STCOM,"95,360","95,360"
11369613,COLORFUL BATTLE-AX Z490M-PLUS V20 STCOM,"150,680","152,000"
11877574,COLORFUL CVN B460M GAMING PRO V20 STCOM,"113,600","113,600"
12120113,COLORFUL CVN B550M GAMING PRO V14 STCOM,"145,100","145,100"
11369259,COLORFUL CVN Z490 GAMING PRO V20 STCOM,"181,000","181,000"
7129243,COLORFUL H310M-E PRO V20 STCOM,"57,720","57,720"
11877226,COLORFUL H410M-K PRO V20 STCOM,"78,270","78,800"
5382791,COLORFUL H81A-BTC,일시품절,일시품절
11369454,COLORFUL iGAME Z490 VULCAN X V20 STCOM,"246,000","246,000"
10368939,ECS DURATHON2 B365H5-M16 코잇,"82,600","82,600"
5466288,ECS DURATHON2 H110S-2P 코잇,"97,130","94,000"
6675772,ECS DURATHON2 H310CH5-M2 코잇,"61,500","61,500"
6026930,ECS DURATHON2 H310H5-M2 코잇,"61,480","61,480"
12192059,ECS DURATHON2 H410H6-M7 V2.0 코잇,"188,150","187,960"
12500273,ECS H410H6-TI2 코잇,"108,930","108,750"
12767324,GIGABYTE A320M-H 듀러블에디션 제이씨현 (벌크),"57,690","57,690"
12211325,GIGABYTE A520 AORUS ELITE 제이씨현,"122,000","125,500"
12083669,GIGABYTE A520I AC 듀러블에디션 피씨디렉트,"136,130","136,130"
12076919,GIGABYTE A520M AORUS ELITE 제이씨현,"107,000","106,690"
12083705,GIGABYTE A520M AORUS ELITE 피씨디렉트,"108,640","109,000"
12077012,GIGABYTE A520M DS3H 듀러블에디션 제이씨현,"87,000","87,000"
12083735,GIGABYTE A520M DS3H 듀러블에디션 피씨디렉트,"88,920","87,900"
12077126,GIGABYTE A520M H 듀러블에디션 제이씨현,"81,380","81,380"
12083807,GIGABYTE A520M H 듀러블에디션 피씨디렉트,"78,540","81,990"
12083765,GIGABYTE A520M S2H 듀러블에디션 피씨디렉트,"82,600","82,600"
6015737,GIGABYTE B360M DS3H 듀러블에디션 피씨디렉트,0,"238,360"
8183626,GIGABYTE B365 M AORUS ELITE 제이씨현,"115,200","115,200"
8316501,GIGABYTE B365M D3H 듀러블에디션 제이씨현,"157,090","157,090"
7801285,GIGABYTE B365M DS3H 듀러블에디션 제이씨현,"85,800","85,800"
8663672,GIGABYTE B365M H 듀러블에디션 제이씨현,"87,800","87,800"
8562848,GIGABYTE B365M H 듀러블에디션 피씨디렉트,"85,000","84,080"
13512716,GIGABYTE B450 AORUS ELITE V2 피씨디렉트,"118,700","118,700"
6399970,GIGABYTE B450 AORUS ELITE 제이씨현,"109,580","109,580"
6349562,GIGABYTE B450 AORUS PRO 제이씨현,"155,400","155,220"
6639577,GIGABYTE B450 AORUS PRO 피씨디렉트,"144,900","141,780"
7878274,GIGABYTE B450 GAMING X 게이밍에디션 제이씨현,"119,000","119,000"
10162080,GIGABYTE B450M AORUS ELITE 제이씨현,"104,500","104,500"
13240664,GIGABYTE B450M DS3H V2 듀러블에디션 제이씨현,"90,890","90,890"
12450836,GIGABYTE B450M DS3H V2 듀러블에디션 피씨디렉트,"91,840","92,830"
6383091,GIGABYTE B450M DS3H 듀러블에디션 제이씨현,"92,100","92,100"
6449535,GIGABYTE B450M DS3H 듀러블에디션 피씨디렉트,"88,000","88,000"
6544861,GIGABYTE B450M GAMING 게이밍에디션 제이씨현,"92,000","92,000"
11394771,GIGABYTE B460 AORUS PRO AC 제이씨현,"213,930","213,930"
11405688,GIGABYTE B460 AORUS PRO AC 피씨디렉트,"225,000","225,000"
11405718,GIGABYTE B460 HD3 듀러블에디션 피씨디렉트,"135,580","134,100"
11783365,GIGABYTE B460M AORUS ELITE 제이씨현,0,"125,000"
11572877,GIGABYTE B460M AORUS ELITE 피씨디렉트,"124,990","123,650"
11395074,GIGABYTE B460M AORUS PRO 제이씨현,0,"128,100"
11405739,GIGABYTE B460M AORUS PRO 피씨디렉트,"131,410","128,590"
11405757,GIGABYTE B460M D2V 듀러블에디션 피씨디렉트,"110,250","110,250"
13240610,GIGABYTE B460M DS3H V2 듀러블에디션 제이씨현,"103,820","104,000"
13279442,GIGABYTE B460M DS3H V2 듀러블에디션 피씨디렉트,"98,490","97,750"
11395467,GIGABYTE B460M DS3H 듀러블에디션 제이씨현,"102,000","102,000"
11405823,GIGABYTE B460M DS3H 듀러블에디션 피씨디렉트,"96,000",0
11685608,GIGABYTE B460M POWER 듀러블에디션 피씨디렉트,"94,000","94,000"
11606894,GIGABYTE B550 AORUS ELITE 제이씨현,"185,000","185,000"
11574242,GIGABYTE B550 AORUS ELITE 피씨디렉트,0,"169,100"
11606864,GIGABYTE B550 AORUS MASTER 제이씨현,0,"434,000"
11574560,GIGABYTE B550 AORUS MASTER 피씨디렉트,"405,390","405,390"
12243425,GIGABYTE B550 AORUS PRO V2 피씨디렉트,"270,500","270,500"
11606882,GIGABYTE B550 AORUS PRO 제이씨현,"258,000","258,000"
12276464,GIGABYTE B550 GAMING X V2 게이밍에디션 피씨디렉트,"179,550","179,550"
11606903,GIGABYTE B550 GAMING X 게이밍에디션 제이씨현,"181,200","181,200"
11575262,GIGABYTE B550 GAMING X 게이밍에디션 피씨디렉트,"166,130","166,130"
11920246,GIGABYTE B550 VISION D 피씨디렉트,"486,300",0
13222670,GIGABYTE B550 VISION D-P 제이씨현,"389,520","389,520"
13253213,GIGABYTE B550 VISION D-P 피씨디렉트,"389,000","389,000"
11685446,GIGABYTE B550I AORUS PRO AX 제이씨현,"265,830","265,830"
11751551,GIGABYTE B550I AORUS PRO AX 피씨디렉트,"263,100","268,800"
11751599,GIGABYTE B550M AORUS ELITE 피씨디렉트,0,"138,550"
11607056,GIGABYTE B550M AORUS PRO 제이씨현,"189,990","189,990"
12755786,GIGABYTE B550M AORUS PRO-P 제이씨현,"128,000","105,000"
12276353,GIGABYTE B550M AORUS PRO-P 피씨디렉트,"133,100","138,200"
11684642,GIGABYTE B550M DS3H 듀러블에디션 제이씨현,"128,460","128,460"
11684771,GIGABYTE B550M GAMING 게이밍에디션 제이씨현,"126,950","126,950"
11751674,GIGABYTE B550M GAMING 게이밍에디션 피씨디렉트,0,"116,680"
11685269,GIGABYTE B550M H 듀러블에디션 제이씨현,"119,350","119,350"
11771141,GIGABYTE B550M H 듀러블에디션 피씨디렉트,"117,370","116,100"
13528505,GIGABYTE B560 AORUS PRO AX 피씨디렉트,"243,600","243,600"
13640129,GIGABYTE B560M AORUS PRO + i5-11400 (로켓레이크S),"449,470","449,470"
13562420,GIGABYTE B560M AORUS PRO AX 제이씨현,"219,000","219,000"
13486556,GIGABYTE B560M AORUS PRO AX 피씨디렉트,"206,700","206,700"
13562459,GIGABYTE B560M AORUS PRO 제이씨현,"192,780","192,780"
13504949,GIGABYTE B560M AORUS PRO 피씨디렉트,"189,000","189,000"
13681838,GIGABYTE B560M D2V 듀러블에디션 피씨디렉트,"109,000","107,100"
13643576,GIGABYTE B560M D3H 듀러블에디션 피씨디렉트,"136,500","136,500"
13627625,GIGABYTE B560M DS3H 듀러블에디션 제이씨현,"128,960","128,960"
13524110,GIGABYTE B560M DS3H 듀러블에디션 피씨디렉트,"134,000","134,000"
7811044,GIGABYTE C246-WU4 제이씨현,"324,570","324,570"
7634614,GIGABYTE C246-WU4 피씨디렉트,"293,120","293,120"
7659157,GIGABYTE C246M-WU4 피씨디렉트,"226,460","226,460"
7713430,GIGABYTE C621-SD8 피씨디렉트,"633,790","633,790"
7953976,GIGABYTE C621-SU8 피씨디렉트,"553,050","553,050"
7921588,GIGABYTE C621-WD12 피씨디렉트,"804,600","804,600"
4950478,GIGABYTE GA-AB350-Gaming 3 게이밍에디션 제이씨현,"128,780","128,780"
5242396,GIGABYTE GA-H110-D3A BTC 듀러블에디션 제이씨현,"179,950","179,950"
3495489,GIGABYTE GA-H110M-A 듀러블에디션 제이씨현,"80,000","80,000"
3519243,GIGABYTE GA-H110M-DS2V 듀러블에디션 제이씨현,0,"120,000"
4172985,GIGABYTE GA-H110M-HD2 듀러블에디션 피씨디렉트,"151,400","151,400"
3513104,GIGABYTE GA-Z170N-WiFi 듀러블에디션 제이씨현,"358,870","358,870"
8131558,GIGABYTE H310M A 2.0 듀러블에디션 제이씨현,"76,550","76,530"
8195818,GIGABYTE H310M A 2.0 듀러블에디션 피씨디렉트,"76,960","74,660"
6016103,GIGABYTE H310M A 듀러블에디션 피씨디렉트,"82,000","82,000"
6582490,GIGABYTE H310M DS2V 2.0 듀러블에디션 제이씨현,"68,000",0
6464259,GIGABYTE H310M DS2V 2.0 듀러블에디션 피씨디렉트,"71,520","70,760"
6022458,GIGABYTE H310M DS2V 듀러블에디션 제이씨현,"66,250",0
8751266,GIGABYTE H310M H 2.0 듀러블에디션 피씨디렉트,"73,500","72,220"
6669445,GIGABYTE H310M S2H 2.0 듀러블에디션 제이씨현,"82,820","82,800"
6649963,GIGABYTE H310M S2H 2.0 듀러블에디션 피씨디렉트,"80,500","79,140"
13426790,GIGABYTE H410M DS2V V2 듀러블에디션 제이씨현,"83,000","83,000"
13462727,GIGABYTE H410M DS2V V2 듀러블에디션 피씨디렉트,"80,000","80,000"
11396310,GIGABYTE H410M DS2V 듀러블에디션 제이씨현,"82,800","82,800"
11405880,GIGABYTE H410M DS2V 듀러블에디션 피씨디렉트,"100,000","88,100"
13426967,GIGABYTE H410M H V2 듀러블에디션 제이씨현,"83,150","84,500"
13498859,GIGABYTE H410M H V2 듀러블에디션 피씨디렉트,"82,180","82,180"
11396190,GIGABYTE H410M H 듀러블에디션 제이씨현,"85,000","85,000"
11405913,GIGABYTE H410M H 듀러블에디션 피씨디렉트,"104,950",0
13462670,GIGABYTE H410M S2H V2 듀러블에디션 피씨디렉트,"93,890","94,000"
11395866,GIGABYTE H410M S2H 듀러블에디션 제이씨현,"97,000","97,000"
11405958,GIGABYTE H410M S2H 듀러블에디션 피씨디렉트,"96,000","96,000"
11393649,GIGABYTE H470 AORUS PRO AX 제이씨현,"236,000","236,000"
11405994,GIGABYTE H470 AORUS PRO AX 피씨디렉트,"239,840","239,840"
11394462,GIGABYTE H470I AORUS PRO AX 제이씨현,"269,000","269,000"
11394168,GIGABYTE H470M DS3H 듀러블에디션 제이씨현,"148,000","148,000"
11406087,GIGABYTE H470M DS3H 듀러블에디션 피씨디렉트,"149,000","149,000"
13774823,GIGABYTE H510M DS2V 듀러블에디션 피씨디렉트,0,"93,500"
13775150,GIGABYTE H510M H 듀러블에디션 피씨디렉트,0,가격비교예정
13745243,GIGABYTE H510M S2H 듀러블에디션 피씨디렉트,"96,600","96,600"
9473190,GIGABYTE J4005N D2P 듀러블에디션 제이씨현,"120,320","120,320"
10039422,GIGABYTE TRX40 DESIGNARE 제이씨현,일시품절,일시품절
10114683,GIGABYTE TRX40 DESIGNARE 피씨디렉트,일시품절,일시품절
11839705,GIGABYTE W480 VISION W 피씨디렉트,"391,780","391,780"
11839732,GIGABYTE W480M VISION W 피씨디렉트,"298,850","298,850"
7474405,GIGABYTE X299-WU8 제이씨현,"1,392,630",0
7634722,GIGABYTE X299-WU8 피씨디렉트,"864,060","1,392,630"
10019427,GIGABYTE X299X AORUS MASTER 피씨디렉트,0,"581,330"
9960828,GIGABYTE X299X AORUS XTREME WATERFORCE 피씨디렉트,"2,190,880","2,190,880"
9999069,GIGABYTE X299X DESIGNARE 10G 피씨디렉트,"865,520","856,400"
6716767,GIGABYTE X470 AORUS Gaming 7 WiFi 피씨디렉트,"340,000","340,000"
9473076,GIGABYTE X570 AORUS ELITE WiFi 피씨디렉트,"302,400","302,400"
8515581,GIGABYTE X570 AORUS ELITE 제이씨현,"274,000","274,000"
8497905,GIGABYTE X570 AORUS ELITE 피씨디렉트,"253,130","253,130"
8515635,GIGABYTE X570 AORUS MASTER 제이씨현,"522,640","522,640"
9421983,GIGABYTE X570 AORUS PRO WiFi 피씨디렉트,"353,600","353,600"
8515653,GIGABYTE X570 AORUS PRO 제이씨현,"393,210","393,210"
8499117,GIGABYTE X570 AORUS PRO 피씨디렉트,"323,410","323,410"
8515707,GIGABYTE X570 AORUS ULTRA 제이씨현,"835,800","835,800"
8502411,GIGABYTE X570 AORUS XTREME 피씨디렉트,"895,640","895,640"
8515827,GIGABYTE X570 GAMING X 게이밍에디션 제이씨현,"241,000","241,000"
8502699,GIGABYTE X570 GAMING X 게이밍에디션 피씨디렉트,"223,600","219,830"
8502987,GIGABYTE X570 I AORUS PRO WiFi 피씨디렉트,"339,100","339,100"
9216033,GIGABYTE X570 UD 듀러블에디션 제이씨현,"196,660","200,730"
6508404,GIGABYTE Z390 AORUS ELITE 제이씨현,"195,910","195,730"
6508758,GIGABYTE Z390 AORUS ELITE 피씨디렉트,"204,700","204,700"
6508764,GIGABYTE Z390 GAMING SLI 피씨디렉트,"222,530","222,530"
6508422,GIGABYTE Z390 GAMING X 게이밍에디션 제이씨현,"206,000","206,000"
6508461,GIGABYTE Z390 M GAMING 게이밍에디션 제이씨현,"194,000","194,000"
11231664,GIGABYTE Z490 AORUS ELITE AC 제이씨현,"274,000","274,000"
11297253,GIGABYTE Z490 AORUS ELITE AC 피씨디렉트,"282,450","282,450"
11231685,GIGABYTE Z490 AORUS ELITE 제이씨현,"256,060","256,060"
11224539,GIGABYTE Z490 AORUS ELITE 피씨디렉트,"252,010","252,010"
11224548,GIGABYTE Z490 AORUS MASTER 피씨디렉트,"425,370","425,370"
11231616,GIGABYTE Z490 AORUS PRO AX 제이씨현,"357,850","357,850"
11297184,GIGABYTE Z490 AORUS PRO AX 피씨디렉트,"309,560","309,560"
11231598,GIGABYTE Z490 AORUS ULTRA 제이씨현,"417,100","417,100"
11297130,GIGABYTE Z490 AORUS ULTRA 피씨디렉트,"430,000","430,000"
11297598,GIGABYTE Z490 AORUS XTREME WATERFORCE 피씨디렉트,"1,470,480","1,470,480"
11231772,GIGABYTE Z490 GAMING X 게이밍에디션 제이씨현,"236,530","236,530"
11225142,GIGABYTE Z490 GAMING X 게이밍에디션 피씨디렉트,"243,000","242,100"
11231949,GIGABYTE Z490 UD AC 듀러블에디션 피씨디렉트,"231,930","227,000"
11231784,GIGABYTE Z490 UD 듀러블에디션 제이씨현,"211,830","211,830"
11231919,GIGABYTE Z490 UD 듀러블에디션 피씨디렉트,0,"215,000"
11231718,GIGABYTE Z490 VISION D 제이씨현,"476,230","476,230"
11238549,GIGABYTE Z490 VISION D 피씨디렉트,"458,530","458,530"
11231748,GIGABYTE Z490 VISION G 제이씨현,"285,090","284,620"
11225379,GIGABYTE Z490 VISION G 피씨디렉트,"270,750","270,750"
11231799,GIGABYTE Z490I AORUS ULTRA 제이씨현,"375,180","375,180"
11331702,GIGABYTE Z490M GAMING X 게이밍에디션 제이씨현,"222,000","222,000"
11232054,GIGABYTE Z490M GAMING X 게이밍에디션 피씨디렉트,"214,540","214,540"
11331840,GIGABYTE Z490M 듀러블에디션 제이씨현,"209,680","209,680"
11232027,GIGABYTE Z490M 듀러블에디션 피씨디렉트,"201,000","201,000"
13627262,GIGABYTE Z590 AORUS ELITE AX 제이씨현,"317,910","317,910"
13410428,GIGABYTE Z590 AORUS ELITE AX 피씨디렉트,0,"311,850"
13409318,GIGABYTE Z590 AORUS ELITE 제이씨현,"297,290","297,290"
13409234,GIGABYTE Z590 AORUS ELITE 피씨디렉트,"292,900",0
13377359,GIGABYTE Z590 AORUS MASTER 제이씨현,"597,840","597,840"
13364366,GIGABYTE Z590 AORUS MASTER 피씨디렉트,"594,650","594,750"
13535570,GIGABYTE Z590 AORUS PRO AX 제이씨현,"359,100","359,100"
13424705,GIGABYTE Z590 AORUS PRO AX 피씨디렉트,"377,000","377,000"
13682129,GIGABYTE Z590 AORUS TACHYON 피씨디렉트,가격비교예정,가격비교예정
13537568,GIGABYTE Z590 AORUS ULTRA 제이씨현,"428,400","428,400"
13448285,GIGABYTE Z590 AORUS ULTRA 피씨디렉트,"448,300","448,300"
13683158,GIGABYTE Z590 AORUS XTREME 제이씨현,가격비교예정,가격비교예정
13760984,GIGABYTE Z590 AORUS XTREME 피씨디렉트,가격비교예정,"1,093,100"
13627403,GIGABYTE Z590 GAMING X 게이밍에디션 제이씨현,"256,200","256,200"
13627526,GIGABYTE Z590 UD 듀러블에디션 제이씨현,"244,000","244,000"
13473563,GIGABYTE Z590 UD 듀러블에디션 피씨디렉트,"248,990","248,940"
13708577,GIGABYTE Z590 VISION D 제이씨현,"478,000","478,000"
13763357,GIGABYTE Z590 VISION D 피씨디렉트,"474,150","458,900"
13640066,GIGABYTE Z590 VISION G + i7-11700K (로켓레이크S),"875,780","875,780"
13377386,GIGABYTE Z590 VISION G 제이씨현,"315,120","315,120"
13627157,GIGABYTE Z590I AORUS ULTRA 제이씨현,"388,860","388,720"
13424996,GIGABYTE Z590I AORUS ULTRA 피씨디렉트,"419,000",0
13761077,GIGABYTE Z590I VISION D 제이씨현,가격비교예정,"428,120"
13547912,GIGABYTE Z590I VISION D 피씨디렉트,일시품절,일시품절
13696718,GIGABYTE Z590M GAMING X 게이밍에디션 제이씨현,가격비교예정,가격비교예정
13761467,GIGABYTE Z590M 듀러블에디션 제이씨현,가격비교예정,가격비교예정
6231487,MSI A320M PRO-M2,"72,630",0
9302775,MSI A320M-A PRO,"59,220","59,220"
9480036,MSI A320M-A PRO 맥스,0,"78,850"
12281690,MSI A520M PRO,"81,190","82,290"
12403937,MSI A520M PRO-C DASH,"84,240","84,240"
12067598,MSI A520M-A PRO,"77,000","77,000"
6013975,MSI B360M 박격포,"81,380","81,380"
6333832,MSI B450 게이밍 플러스,"129,000","129,000"
6334179,MSI B450M 바주카 플러스,"115,000","115,000"
9480156,MSI B450M-A PRO 맥스,"95,950","95,950"
11572061,MSI B460M PRO-VDH WiFi,"115,000","115,000"
7025836,MSI H310M PRO-VDH PLUS,"93,990","93,990"
11407134,MSI H410M PRO,"88,000","85,340"
11406948,MSI H410M-A PRO,"87,360","87,360"
13759994,MSI H510M PRO,가격비교예정,가격비교예정
13628021,MSI H510M-A PRO,"88,990","91,000"
9203967,MSI MAG B450 토마호크 맥스,"160,990",0
8938550,MSI MAG B450M 박격포 맥스,"95,000","94,470"
11407599,MSI MAG B460 토마호크,"167,000","167,000"
12952802,MSI MAG B460 토마호크 + 코어리퀴드 240R,"279,000","279,000"
11407725,MSI MAG B460M 바주카,"179,990","179,990"
11397129,MSI MAG B460M 박격포,"136,980","139,000"
11408037,MSI MAG B460M 박격포 WiFi,"153,940","153,850"
11578097,MSI MAG B550M 박격포,"184,930","185,000"
11578325,MSI MAG B550M 박격포 WiFi,"188,640","189,000"
12889655,MSI MAG B550M 박격포 WiFi + 코어리퀴드 240R,"316,500","316,500"
13696388,MSI MAG B560 토마호크 WIFI,"224,700","224,700"
13760447,MSI MAG B560M 박격포,가격비교예정,가격비교예정
13669925,MSI MAG Z590 토마호크 WIFI,"303,500","303,500"
13697252,MSI MAG Z590 토피도,"299,000","299,000"
12897401,MSI MEG B550 유니파이 + 코어리퀴드 360R,0,"525,000"
8519025,MSI MEG X570 갓라이크,"1,790,350","1,790,350"
9831717,MSI MEG X570 유니파이,"853,630","853,630"
6508240,MSI MEG Z390 갓라이크,"1,044,610","1,044,610"
11319420,MSI MEG Z490 유니파이,"408,000","374,000"
11319750,MSI MEG Z490I 유니파이,"408,880","408,950"
13669397,MSI MEG Z590 에이스,"659,400","659,400"
13724183,MSI MEG Z590I 유니파이,"375,000","375,000"
11591798,MSI MPG B550 게이밍 엣지 WiFi,"225,110","225,570"
11578637,MSI MPG B550 게이밍 카본 WiFi,"274,650","274,650"
11591501,MSI MPG B550 게이밍 플러스,"194,000","194,000"
11592377,MSI MPG B550I 게이밍 엣지 WiFi,"248,950","248,950"
9500100,MSI MPG X470 게이밍 플러스 맥스,"104,000","104,000"
8520741,MSI MPG X570 게이밍 엣지 WiFi,"477,840","477,840"
12672557,MSI MPG X570 게이밍 엣지 WiFi + 코어리퀴드 360R,0,"507,440"
8520477,MSI MPG X570 게이밍 프로 카본 WiFi,"423,000","423,000"
8520999,MSI MPG X570 게이밍 플러스,"255,078",0
11223594,MSI MPG Z490 게이밍 엣지 WiFi,"255,000","255,000"
12952262,MSI MPG Z490 게이밍 엣지 WiFi (해외구매),"264,900","264,900"
12952814,MSI MPG Z490 게이밍 엣지 WiFi + 코어리퀴드 360R,"390,000","390,000"
11223636,MSI MPG Z490 게이밍 플러스,"221,750","224,500"
11223663,MSI MPG Z490M 게이밍 엣지 WiFi,"241,070",0
12952226,MSI MPG Z490M 게이밍 엣지 WiFi (해외구매),"250,500","250,500"
13449158,MSI MPG Z590 게이밍 포스,"432,400","432,400"
4947831,MSI X370 XPOWER 게이밍 티타늄,0,"399,000"
5560377,MSI X399 SLI PLUS,"549,120","549,120"
8524905,MSI X570-A PRO,"278,220",0
6524017,MSI Z390-A PRO,"209,220",0
13564229,MSI Z590-A PRO,"222,600","222,600"
10002684,MSI 크리에이터 TRX40,"1,195,770","1,195,770"
13571723,NE555P 타이머IC,80,80
13570775,Raspberry Pi 라즈베리 파이 400 키보드 일체형 PC 세트 (해외구매),"117,600","117,600"
13607285,삼성전자 H61S1 (중고),"19,800","19,800"
