Id,Name,2021-06-01 11:54:29,2021-06-02 11:56:53,2021-06-03 11:32:07
14043278,AFOX IH61-MA5-V2 에즈윈,"66,200","66,200","66,200"
14043425,AFOX IH81-MA5-V2 에즈윈,"66,200","66,200","66,200"
7096525,ASRock A320M-DVS R4.0 디앤디컴,"61,870","61,870",0
7449106,ASRock A320M-DVS R4.0 디앤디컴 (벌크),"57,800","57,690","57,600"
7622335,ASRock A320M-DVS R4.0 에즈윈,"62,500","62,500","62,500"
6978235,ASRock A320M-HDV R4.0 디앤디컴,"66,190","66,190","66,190"
7476658,ASRock A320M-HDV R4.0 디앤디컴 (벌크),0,"61,740",0
6948952,ASRock A320M-HDV R4.0 에즈윈,"66,700","66,700","66,410"
10311162,ASRock A320M-HDVP 에즈윈 (벌크),"66,340","66,340","66,340"
12074723,ASRock A520M PRO4 디앤디컴,"105,250","105,250","105,250"
12092663,ASRock A520M-HDV 디앤디컴,"75,150",0,0
12222293,ASRock A520M-HDVP 디앤디컴,0,0,"81,380"
12086510,ASRock A520M-HVS 디앤디컴,"74,110","74,760","74,330"
12130319,ASRock A520M-HVS 에즈윈,0,"77,000","77,000"
12080207,ASRock A520M-ITX/ac 에즈윈,"145,000",0,"144,990"
1357994,ASRock A780GM-LE (중고),"40,000",0,"40,000"
7114357,ASRock B365 Phantom Gaming 4 디앤디컴,0,"144,000","144,000"
9265920,ASRock B365M PRO4-F 디앤디컴,"94,670","94,670","94,670"
9636918,ASRock B365M PRO4-F 에즈윈,"98,950",0,"98,950"
7411384,ASRock B365M Phantom Gaming 4 에즈윈,0,0,"125,500"
7939498,ASRock B365M-HDV 디앤디컴,"79,750","79,750","79,750"
7952827,ASRock B365M-HDV 디앤디컴 (벌크),"85,480",0,"85,280"
8010253,ASRock B365M-HDV 에즈윈,"83,470",0,"82,820"
6494014,ASRock B450 PRO4 디앤디컴,"127,000","127,000","127,000"
7015291,ASRock B450 스틸레전드 디앤디컴,"250,000","250,000",0
7337842,ASRock B450 스틸레전드 에즈윈,0,0,"150,480"
13363490,ASRock B450M PRO4 R2.0 디앤디컴,0,"101,520","101,520"
13598726,ASRock B450M PRO4 R2.0 에즈윈,"103,000","103,000","103,000"
6348963,ASRock B450M PRO4 디앤디컴,"91,910","91,680","91,500"
6352473,ASRock B450M PRO4 에즈윈,"99,000","99,000","99,000"
13363601,ASRock B450M PRO4-F R2.0 디앤디컴,"93,860","93,860","93,860"
7170754,ASRock B450M 스틸레전드 에즈윈,0,"109,590","109,000"
6978166,ASRock B450M-HDV R4.0 디앤디컴,"83,010","83,010","83,000"
7424164,ASRock B450M-HDV R4.0 디앤디컴 (벌크),"79,050","78,940","78,850"
6891964,ASRock B450M-HDV R4.0 에즈윈,"82,500","82,500",0
11399547,ASRock B460 PRO4 디앤디컴,"144,670",0,"144,670"
11399676,ASRock B460 Phantom Gaming 4 디앤디컴,"122,000",0,"122,000"
11674511,ASRock B460 스틸레전드 디앤디컴,"166,550","166,550","166,550"
11399754,ASRock B460M PRO4 디앤디컴,"110,000",0,"109,950"
11407626,ASRock B460M PRO4 에즈윈,"117,000",0,0
11517701,ASRock B460M 스틸레전드 디앤디컴,"129,120","126,950","125,430"
11399841,ASRock B460M-ITX/ac 디앤디컴,"137,570","137,390","137,160"
11758070,ASRock B550 EXTREME4 디앤디컴,"247,250","247,250","247,250"
11571482,ASRock B550 PG Velocita 에즈윈,"307,600","307,600","307,600"
11708183,ASRock B550 PRO4 디앤디컴,"171,980","171,980",0
11580941,ASRock B550 PRO4 에즈윈,"172,800","172,800","172,800"
11764859,ASRock B550 Phantom Gaming 4 디앤디컴,"145,670","145,670",0
11571746,ASRock B550 Phantom Gaming 4 에즈윈,"147,440","147,960",0
11572088,ASRock B550 Phantom Gaming-ITX/ax 에즈윈,"267,960","266,970","266,740"
13148999,ASRock B550 Taichi Razer Edition 에즈윈,"470,000","470,000","470,000"
11675459,ASRock B550 Taichi 디앤디컴,"417,430","417,430","417,430"
11572808,ASRock B550 Taichi 에즈윈,"395,280","395,280","395,280"
11636093,ASRock B550 스틸레전드 디앤디컴,"238,700","238,700","238,700"
11572490,ASRock B550 스틸레전드 에즈윈,"241,000","241,000","241,000"
11649263,ASRock B550M PRO4 디앤디컴,"132,150","132,150","132,150"
11572991,ASRock B550M PRO4 에즈윈,"137,700","137,700","137,700"
12487823,ASRock B550M Phantom Gaming 4 디앤디컴,"121,420","121,420","121,420"
12464213,ASRock B550M Phantom Gaming 4 에즈윈,"123,690","123,690","123,690"
11636132,ASRock B550M 스틸레전드 디앤디컴,"173,000","173,000","173,000"
11580755,ASRock B550M 스틸레전드 에즈윈,"177,660","177,660","177,660"
12797720,ASRock B550M-HDV 디앤디컴,"111,760","111,760","111,760"
11573573,ASRock B550M-HDV 에즈윈,"113,400","113,400","113,400"
12022880,ASRock B550M-ITX/ac 디앤디컴,"186,080","186,080","186,080"
12256262,ASRock B550M-ITX/ac 에즈윈,0,"182,520","182,520"
13512974,ASRock B560 PRO4 디앤디컴,"151,900","151,900","151,900"
13289012,ASRock B560 PRO4 에즈윈,"153,530","153,530",0
13523723,ASRock B560 스틸레전드 디앤디컴,0,"185,000","185,000"
13353035,ASRock B560 스틸레전드 에즈윈,0,"210,000","210,000"
13418717,ASRock B560M PRO4 디앤디컴,"135,630","135,630","135,630"
13289171,ASRock B560M PRO4 에즈윈,"137,500","137,190","137,310"
13601942,ASRock B560M 스틸레전드 디앤디컴,0,"169,270","169,270"
13425908,ASRock B560M 스틸레전드 에즈윈,"168,990","168,930","168,870"
13523756,ASRock B560M-HDV 디앤디컴,0,"101,450","101,450"
13948124,ASRock B560M-HDV 디앤디컴 (벌크),"98,020","98,020","100,140"
13368608,ASRock B560M-HDV 에즈윈,"102,000","102,000","102,000"
13744889,ASRock B560M-ITX/ac 디앤디컴,"162,950","162,950",0
6017987,ASRock FATAL1TY H370 Performance 디앤디컴,"148,000",0,0
6385410,ASRock H310CM-DVS 디앤디컴,"67,270","67,270","67,270"
6395778,ASRock H310CM-DVS 디앤디컴 (벌크),"61,570","61,460","61,370"
6421625,ASRock H310CM-DVS 에즈윈,0,"71,600","71,600"
6421658,ASRock H310CM-DVS 에즈윈 (벌크),0,"63,770","63,770"
6891775,ASRock H310CM-HDV Plus 에즈윈,0,"73,000",0
6864472,ASRock H310CM-HDV 에즈윈 (벌크),"75,000",0,"75,000"
6503460,ASRock H310CM-HDV/M.2 디앤디컴,"81,380",0,"81,280"
6435538,ASRock H310CM-HDV/M.2 에즈윈,"78,000","78,000","78,000"
6421764,ASRock H310CM-HDVP2 에즈윈 (벌크),"83,000","82,900","82,900"
12905678,ASRock H370M-HDV 에즈윈,"73,090","73,060","73,040"
13117481,ASRock H410M-HDV R2.0 에즈윈,"82,620","82,620",0
11407683,ASRock H410M-HDV 에즈윈,0,0,"83,000"
11708204,ASRock H410M-HDVP 디앤디컴,"85,000","85,000","85,000"
13149347,ASRock H410M-HDVP2 에즈윈 (벌크),"79,660","79,570","79,460"
13117499,ASRock H410M-HVS R2.0 에즈윈,"84,250",0,"84,250"
11407704,ASRock H410M-HVS 에즈윈,"94,140",0,0
11399394,ASRock H470 Phantom Gaming 4 디앤디컴,"350,000","350,000","350,000"
11399340,ASRock H470 스틸레전드 디앤디컴,"197,540","197,540","197,540"
11399469,ASRock H470M PRO4 디앤디컴,"140,680",0,"140,580"
13379969,ASRock H470M-HDV 디앤디컴,0,"81,920","81,920"
13380026,ASRock H470M-HDV 디앤디컴 (벌크),0,0,"80,410"
13243124,ASRock H470M-HDV 에즈윈,"84,240","84,240","84,240"
13243136,ASRock H470M-HDV 에즈윈 (벌크),"78,580",0,"78,380"
13501820,ASRock H470M-HDV/M.2 디앤디컴,"86,700","86,700","86,700"
14220305,ASRock H470M-HDV/M.2 디앤디컴 (벌크),가격비교예정,가격비교예정,가격비교예정
13301561,ASRock H470M-HDV/M.2 에즈윈,"88,980","88,980","88,980"
13337210,ASRock H470M-HVS 디앤디컴,0,"80,840","80,840"
13337225,ASRock H470M-HVS 디앤디컴 (벌크),"75,920",0,"74,590"
13301417,ASRock H470M-HVS 에즈윈,"80,000","80,000","80,000"
13301432,ASRock H470M-HVS 에즈윈 (벌크),"76,160","76,070","76,050"
11399493,ASRock H470M-ITX/ac 디앤디컴,"181,200","181,200","181,200"
13948277,ASRock H510M-HDV 디앤디컴 (벌크),"88,890","87,100","87,100"
13584227,ASRock H510M-HDV 에즈윈,"90,000","90,000","90,000"
13584266,ASRock H510M-HDV 에즈윈 (벌크),"85,370",0,"85,260"
14091545,ASRock H510M-HDV/M.2 디앤디컴 (벌크),"92,060","92,790","92,880"
13653038,ASRock H510M-HDV/M.2 에즈윈,0,"95,000","95,000"
13948355,ASRock H510M-HVS 디앤디컴 (벌크),"84,190","83,560","83,550"
13652690,ASRock H510M-HVS 에즈윈,"88,800","88,800","88,800"
13652981,ASRock H510M-HVS 에즈윈 (벌크),"82,630","82,520","82,430"
13744781,ASRock H510M-ITX/ac 디앤디컴,"137,030","137,030","137,030"
13830548,ASRock H570 Phantom Gaming 4 디앤디컴,"164,150","164,150","164,150"
13865837,ASRock H570 스틸레전드 에즈윈,"177,060","177,060","177,060"
14273075,ASRock H570M PRO4 디앤디컴,"147,960","147,960","147,960"
13670681,ASRock H570M PRO4 에즈윈,0,0,"152,000"
13745069,ASRock H570M-ITX/ac 디앤디컴,"190,300","190,300","190,300"
14268878,ASRock IMB-1215 (해외구매),"406,720","406,610","406,430"
14268593,ASRock IMB-1711,"400,470","400,350","400,240"
5911580,ASRock J4105-ITX 에즈윈,"130,000","130,000","130,000"
12940859,ASRock J4125B-ITX 에즈윈,"124,200","124,200","124,200"
10174962,ASRock TRX40 CREATOR 에즈윈,"688,900","688,900","688,900"
7887742,ASRock X370M-HDV R4.0 에즈윈,"68,970","68,860","68,770"
8506491,ASRock X570 PRO4 에즈윈,0,"241,000","241,000"
8508369,ASRock X570 Phantom Gaming 4 디앤디컴,"216,780","216,780","216,780"
8747690,ASRock X570 Phantom Gaming 4 에즈윈,"219,280","219,280","219,280"
13149158,ASRock X570 Taichi Razer Edition 에즈윈,"514,620","520,000","520,000"
8508585,ASRock X570 Taichi 디앤디컴,"487,780","477,180","498,390"
8507295,ASRock X570 Taichi 에즈윈,"434,000","434,000","434,000"
8507643,ASRock X570 스틸레전드 에즈윈,"298,000","298,000","298,000"
8507937,ASRock X570M PRO4 에즈윈,"260,400","260,400","260,400"
6508755,ASRock Z390 EXTREME4 디앤디컴,"234,000",0,"234,000"
6508754,ASRock Z390 EXTREME4 에즈윈,"228,940","228,940","228,940"
11329152,ASRock Z490 EXTREME4 디앤디컴,"253,980","253,980","253,980"
11337192,ASRock Z490 EXTREME4 에즈윈,"255,000","255,000","255,000"
11328411,ASRock Z490 PG Velocita 디앤디컴,"300,640","300,410","300,350"
11321532,ASRock Z490 PG Velocita 에즈윈,"324,000","324,000","324,000"
11327856,ASRock Z490 PRO4 디앤디컴,"193,940","193,760","193,530"
11329587,ASRock Z490 Phantom Gaming 4 디앤디컴,"171,550","171,370","171,200"
11329749,ASRock Z490 Phantom Gaming 4/2.5G 디앤디컴,"188,800",0,"188,800"
11398728,ASRock Z490 Phantom Gaming-ITX/TB3 디앤디컴,"371,420","371,420","371,420"
11337861,ASRock Z490 Phantom Gaming-ITX/TB3 에즈윈,"373,390","373,390","373,390"
11329311,ASRock Z490 Taichi 디앤디컴,"430,000","430,000","430,000"
11337381,ASRock Z490 Taichi 에즈윈,"442,500","442,500","442,500"
11328783,ASRock Z490 스틸레전드 디앤디컴,"225,540","225,360","225,180"
11328141,ASRock Z490M PRO4 디앤디컴,"193,760","193,760","193,760"
11327562,ASRock Z490M-ITX/ac 디앤디컴,"202,370",0,0
11337465,ASRock Z490M-ITX/ac 에즈윈,0,0,"228,000"
13562528,ASRock Z590 EXTREME 디앤디컴,"281,390",0,0
13484777,ASRock Z590 EXTREME 에즈윈,"274,000","274,000","274,000"
14348456,ASRock Z590 OC Formula 에즈윈,0,가격비교예정,가격비교예정
13512842,ASRock Z590 PRO4 디앤디컴,"224,060",0,0
13485029,ASRock Z590 PRO4 에즈윈,"228,500","228,500","228,500"
13830350,ASRock Z590 Phantom Gaming 4 디앤디컴,"202,880","202,880","202,880"
13486046,ASRock Z590 Phantom Gaming 4 에즈윈,"207,240","207,240","207,240"
14063930,ASRock Z590 Phantom Gaming-ITX/TB4 디앤디컴,"415,560","415,560","415,560"
13422545,ASRock Z590 Taichi 에즈윈,"606,520",0,"606,520"
13418894,ASRock Z590 스틸레전드 디앤디컴,"243,050","246,000","246,000"
13472993,ASRock Z590 스틸레전드 에즈윈,"260,350","260,300","260,350"
13501733,ASRock Z590M PRO4 디앤디컴,0,"219,720","219,720"
13408382,ASRock Z590M PRO4 에즈윈,0,0,"221,680"
13830266,ASRock Z590M Phantom Gaming 4 디앤디컴,"190,300","190,300","190,300"
13486274,ASRock Z590M Phantom Gaming 4 에즈윈,0,"192,220","192,220"
13736231,ASRock Z590M-ITX/ax 디앤디컴,"253,240","253,240","253,240"
6051885,ASUS EX A320M-GAMING STCOM,"73,980","74,000","74,000"
7452148,ASUS EX A320M-GAMING 대원CTS,"71,470","69,680","69,630"
6154344,ASUS EX A320M-GAMING 아이보라,"67,650","67,460","67,350"
11408886,ASUS EX B460M-V5 인텍앤컴퍼니,"95,000","95,000","95,000"
13949414,ASUS EX B560M-V5 STCOM,0,"123,050","123,050"
13949459,ASUS EX B560M-V5 아이보라,"111,470","111,290","111,110"
14111102,ASUS EX B560M-V5 인텍앤컴퍼니,"135,000","135,000","135,000"
14063303,ASUS EX B560M-V5 코잇,"119,350","119,350","119,350"
3603620,ASUS H110M-K 아이보라,"76,020","75,960","75,850"
2494395,ASUS H81M-K STCOM,"73,000","73,000",0
3875191,ASUS P10S WS STCOM,"302,000",0,"302,000"
3949562,ASUS P10S-M WS STCOM,"287,000","287,000",0
3226637,ASUS P9D-MH/10G-DUAL STCOM,0,"524,950","524,950"
7452181,ASUS PRIME A320M-K 대원CTS,"69,000","69,000","69,000"
5122402,ASUS PRIME A320M-K 아이보라,"66,640","66,550","66,440"
8101588,ASUS PRIME A320M-K/CSM STCOM,"73,840","73,840","73,840"
12060239,ASUS PRIME A520M-A STCOM,"108,500","108,500","108,500"
12069533,ASUS PRIME A520M-A 대원CTS,"93,420","93,420","93,420"
12067604,ASUS PRIME A520M-A 아이보라,0,"95,870","95,870"
12060812,ASUS PRIME A520M-A/CSM STCOM,"118,270","118,270","118,270"
12060446,ASUS PRIME A520M-E STCOM,"104,170","104,170","104,170"
12069548,ASUS PRIME A520M-E 대원CTS,0,0,"88,460"
12060293,ASUS PRIME A520M-K STCOM,"86,800","89,000","89,000"
12069566,ASUS PRIME A520M-K 대원CTS,"82,610","85,470","85,360"
12067610,ASUS PRIME A520M-K 아이보라,"80,640","80,460","80,350"
12060863,ASUS PRIME A520M-K/CSM STCOM,"106,000","106,000","106,000"
8190274,ASUS PRIME B365-PLUS 코잇,"232,780",0,0
7108366,ASUS PRIME B365M-A 코잇,"95,490","95,490","95,490"
7439677,ASUS PRIME B365M-K 인텍앤컴퍼니,"92,560",0,"92,420"
6352292,ASUS PRIME B450-PLUS STCOM,"132,000","132,000","132,000"
12629255,ASUS PRIME B450M-A II STCOM,0,"133,950","133,000"
12626231,ASUS PRIME B450M-A II 대원CTS,0,"122,100","121,920"
7452226,ASUS PRIME B450M-A 대원CTS,"94,340","93,970","93,970"
12689660,ASUS PRIME B450M-K II STCOM,0,"118,700","118,700"
12626198,ASUS PRIME B450M-K II 대원CTS,0,"111,380","111,330"
6352391,ASUS PRIME B450M-K STCOM,0,0,"207,400"
11370495,ASUS PRIME B460-PLUS STCOM,0,0,"170,990"
11334177,ASUS PRIME B460-PLUS 코잇,"172,000","172,000",0
11396745,ASUS PRIME B460M-A 코잇,"101,700","101,400","101,700"
11370840,ASUS PRIME B460M-K STCOM,"110,950",0,"110,950"
11397810,ASUS PRIME B460M-K 아이보라,"98,790","99,770","100,070"
11333751,ASUS PRIME B460M-K 코잇,"106,330","106,330","106,000"
11656259,ASUS PRIME B550M-A (Wi-Fi) 대원CTS,"151,000","151,000","151,000"
11570618,ASUS PRIME B550M-A STCOM,0,0,"146,710"
11574458,ASUS PRIME B550M-A 대원CTS,"127,890","123,850","125,760"
11570354,ASUS PRIME B550M-K STCOM,"125,270","125,270","125,270"
11574545,ASUS PRIME B550M-K 대원CTS,"122,200","121,040","120,810"
11583095,ASUS PRIME B550M-K 아이보라,"113,130","112,800","112,800"
11656073,ASUS PRIME B550M-K/CSM STCOM,0,"143,320","143,320"
13451951,ASUS PRIME B560-PLUS STCOM,"173,300","173,300","173,300"
13656224,ASUS PRIME B560-PLUS 아이보라,"167,810","167,580","167,400"
13423211,ASUS PRIME B560-PLUS 코잇,"180,670","180,670","180,670"
13506266,ASUS PRIME B560M-A 코잇,"138,880","138,880","138,880"
13709738,ASUS PRIME B560M-K STCOM,0,0,"124,000"
13656140,ASUS PRIME B560M-K/CSM 아이보라,"120,140","120,140","120,250"
13761692,ASUS PRIME B560M-K/CSM 인텍앤컴퍼니,"134,090",0,"134,090"
6370926,ASUS PRIME H310M-A R2.0 아이보라,"65,120","65,010","64,920"
6632107,ASUS PRIME H310M-A R2.0 인텍앤컴퍼니,"66,000","65,890","65,800"
6721984,ASUS PRIME H310M-A R2.0 코잇,0,"67,830","67,740"
6494926,ASUS PRIME H310M-K R2.0 인텍앤컴퍼니,"68,170","68,170","68,170"
6021582,ASUS PRIME H370-A 아이보라,"142,200",0,"142,200"
11334711,ASUS PRIME H410M-A 코잇,"93,000","93,000","93,000"
11408766,ASUS PRIME H410M-E 인텍앤컴퍼니,0,"82,850","82,850"
11370858,ASUS PRIME H410M-K STCOM,"77,000","77,000","75,000"
11397861,ASUS PRIME H410M-K 아이보라,"71,900","71,900","71,900"
11408364,ASUS PRIME H410M-K 인텍앤컴퍼니,0,"75,950","75,000"
11334720,ASUS PRIME H410M-K 코잇,"83,000","83,500","83,500"
11396484,ASUS PRIME H470M-PLUS STCOM,"165,890","165,890","165,890"
11396916,ASUS PRIME H470M-PLUS 코잇,"150,000","150,000","150,000"
13423994,ASUS PRIME H510M-A WIFI 코잇,0,"118,270","118,270"
14063252,ASUS PRIME H510M-A/CSM 코잇,"300,000","300,000","300,000"
14109998,ASUS PRIME H510M-D STCOM,"100,910","100,910","100,910"
13935689,ASUS PRIME H510M-D/CSM STCOM,"106,100","106,100","106,100"
13924958,ASUS PRIME H510M-E STCOM,"103,000","103,000","103,000"
13656296,ASUS PRIME H510M-E 아이보라,"90,750","90,570","90,340"
13762082,ASUS PRIME H510M-E 인텍앤컴퍼니,0,"97,000","97,000"
13927079,ASUS PRIME H510M-E/CSM STCOM,"107,100","107,100","107,100"
14005334,ASUS PRIME H510M-K 인텍앤컴퍼니,"89,420","89,190","89,010"
13423445,ASUS PRIME H570-PLUS 코잇,"184,460","184,460","184,460"
13451855,ASUS PRIME H570M-PLUS STCOM,"178,500","178,500","178,500"
12481682,ASUS PRIME TRX40-PRO S STCOM,"759,000","759,000","759,000"
12626147,ASUS PRIME TRX40-PRO S 대원CTS,0,"706,700","706,700"
12433307,ASUS PRIME TRX40-PRO S 아이보라,0,"696,410","685,710"
9511734,ASUS PRIME X299-A II 코잇,0,"534,950","535,000"
6060034,ASUS PRIME X470-PRO STCOM,0,"432,030","432,030"
8511729,ASUS PRIME X570-P/CSM STCOM,"246,000","246,000","246,000"
8514897,ASUS PRIME X570-P/CSM 아이보라,0,"210,940","210,760"
8511207,ASUS PRIME X570-PRO/CSM STCOM,0,0,"329,000"
8542220,ASUS PRIME X570-PRO/CSM 대원CTS,"312,000",0,0
8514777,ASUS PRIME X570-PRO/CSM 아이보라,"290,980","290,800","290,620"
6511733,ASUS PRIME Z390-A STCOM,"298,000",0,0
11224146,ASUS PRIME Z490-A 인텍앤컴퍼니,0,0,"338,920"
11222532,ASUS PRIME Z490-A 코잇,"298,000","298,000","298,000"
11223801,ASUS PRIME Z490-P 아이보라,"210,060",0,0
11224182,ASUS PRIME Z490M-PLUS 인텍앤컴퍼니,"195,630","198,000","195,630"
13448774,ASUS PRIME Z590-A 코잇,"350,460","350,460","350,460"
13369766,ASUS PRIME Z590-P STCOM,"275,590","275,590","275,590"
13911266,ASUS PRIME Z590-P WIFI 아이보라,"267,670","267,490","267,320"
13352234,ASUS PRIME Z590-P 아이보라,"238,810","238,480","238,540"
13358777,ASUS PRIME Z590-P 인텍앤컴퍼니,"259,980",0,"259,570"
13422950,ASUS PRIME Z590-P 코잇,0,"259,320","259,320"
13352363,ASUS PRIME Z590M-PLUS 아이보라,"213,500","213,230","213,000"
13358816,ASUS PRIME Z590M-PLUS 인텍앤컴퍼니,"224,950","222,350","227,770"
13422977,ASUS PRIME Z590M-PLUS 코잇,0,"230,020","230,020"
13923911,ASUS PRO WS WRX80E-SAGE SE WIFI 아이보라,"1,376,620","1,376,440","1,376,210"
8890244,ASUS PRO WS X570-ACE STCOM,0,"445,000","445,000"
8518257,ASUS PRO WS X570-ACE 아이보라,"438,070","437,950","437,900"
13656371,ASUS Pro B560M-C/CSM 아이보라,"130,730",0,"130,500"
12371279,ASUS Pro H410T/CSM 아이보라,"127,900",0,"127,900"
13656899,ASUS Pro H510M-C/CSM 아이보라,"99,470","99,240","99,060"
13924289,ASUS ProArt B550-CREATOR STCOM,"365,000","365,000","365,000"
14076707,ASUS ProArt B550-CREATOR 아이보라,"356,120","355,900","355,720"
12701975,ASUS ROG CROSSHAIR VIII DARK HERO STCOM,"580,880","580,880","607,000"
12698210,ASUS ROG CROSSHAIR VIII DARK HERO 대원CTS,"530,000","530,000","530,000"
12719003,ASUS ROG CROSSHAIR VIII DARK HERO 아이보라,0,0,"589,840"
8513403,ASUS ROG CROSSHAIR VIII FORMULA STCOM,"784,440","784,440","784,440"
8515059,ASUS ROG CROSSHAIR VIII FORMULA 아이보라,"697,580","697,350","697,170"
8514591,ASUS ROG CROSSHAIR VIII HERO (Wi-Fi) STCOM,"596,000",0,"596,000"
8515179,ASUS ROG CROSSHAIR VIII HERO (Wi-Fi) 아이보라,0,"569,980","569,800"
12689573,ASUS ROG CROSSHAIR VIII IMPACT STCOM,"513,000","513,000","513,000"
9739197,ASUS ROG CROSSHAIR VIII IMPACT 아이보라,"480,420","480,210","480,020"
11210139,ASUS ROG MAXIMUS XII FORMULA STCOM,"667,980","667,980","667,980"
11232516,ASUS ROG MAXIMUS XII FORMULA 인텍앤컴퍼니,"635,210",0,"635,210"
11222715,ASUS ROG MAXIMUS XII FORMULA 코잇,0,"645,580","645,580"
11224269,ASUS ROG MAXIMUS XII HERO (Wi-Fi) 인텍앤컴퍼니,"459,000","459,000","459,000"
13875599,ASUS ROG MAXIMUS XIII APEX 인텍앤컴퍼니,"675,000","675,000","659,950"
13933280,ASUS ROG MAXIMUS XIII EXTREME GLACIAL STCOM,"2,004,000","2,003,950","2,003,950"
13928168,ASUS ROG MAXIMUS XIII EXTREME GLACIAL 아이보라,"1,850,970","1,790,990","1,723,340"
13947872,ASUS ROG MAXIMUS XIII EXTREME GLACIAL 인텍앤컴퍼니,"1,892,000","1,892,000","1,892,000"
13980314,ASUS ROG MAXIMUS XIII EXTREME GLACIAL 코잇,"1,948,000","1,948,000","1,948,000"
13911173,ASUS ROG MAXIMUS XIII EXTREME 아이보라,"1,029,850","1,029,620","1,029,440"
14111216,ASUS ROG MAXIMUS XIII EXTREME 인텍앤컴퍼니,"1,135,080",0,"1,135,080"
13774883,ASUS ROG MAXIMUS XIII EXTREME 코잇,"1,106,700","1,106,700","1,106,700"
13351433,ASUS ROG MAXIMUS XIII HERO 아이보라,"531,640","531,460","531,230"
13354628,ASUS ROG MAXIMUS XIII HERO 인텍앤컴퍼니,"613,230","564,000","564,560"
13422713,ASUS ROG MAXIMUS XIII HERO 코잇,0,"616,800","616,800"
14146568,ASUS ROG RAMPAGE VI EXTREME ENCORE (해외구매),"1,046,900","1,046,900","1,046,900"
13909592,ASUS ROG RAMPAGE VI EXTREME ENCORE STCOM,"1,092,000","1,092,000","1,092,000"
12629147,ASUS ROG STRIX B450-F GAMING II STCOM,"194,700","194,700","194,700"
12617309,ASUS ROG STRIX B450-F GAMING II 대원CTS,"185,900","185,900","185,900"
6351887,ASUS ROG STRIX B450-F GAMING STCOM,"199,650","199,650","199,650"
12409535,ASUS ROG STRIX B450-F GAMING 대원CTS,"181,620","181,490","181,260"
6407504,ASUS ROG STRIX B450-I GAMING STCOM,"229,000","229,000","229,000"
11370333,ASUS ROG STRIX B460-I GAMING STCOM,0,"207,980","207,980"
11396877,ASUS ROG STRIX B460-I GAMING 코잇,0,0,"207,000"
12048893,ASUS ROG STRIX B550-A GAMING STCOM,"236,130","236,020","235,960"
11934316,ASUS ROG STRIX B550-A GAMING 대원CTS,"228,980","228,980","228,980"
11920711,ASUS ROG STRIX B550-A GAMING 아이보라,"212,960",0,"212,400"
11725601,ASUS ROG STRIX B550-I GAMING STCOM,"279,000","278,950","279,000"
12130349,ASUS ROG STRIX B550-I GAMING 대원CTS,"272,100","272,100","272,100"
11824639,ASUS ROG STRIX B550-I GAMING 아이보라,0,"256,110","255,830"
12702185,ASUS ROG STRIX B550-XE GAMING WiFi STCOM,"405,000","405,000","405,000"
12719033,ASUS ROG STRIX B550-XE GAMING WiFi 아이보라,"359,360","359,180","358,950"
13924805,ASUS ROG STRIX B560-A GAMING WIFI STCOM,"279,000","279,000","279,000"
13934306,ASUS ROG STRIX B560-A GAMING WIFI 아이보라,"235,030","331,080","331,030"
14111060,ASUS ROG STRIX B560-A GAMING WIFI 인텍앤컴퍼니,"259,000","259,000","259,000"
13933445,ASUS ROG STRIX B560-A GAMING WIFI 코잇,"247,380","244,700","244,700"
14219717,ASUS ROG STRIX B560-E GAMING WIFI 아이보라,"306,410","306,290","306,120"
13924343,ASUS ROG STRIX B560-F GAMING WIFI STCOM,"269,000","269,000","269,000"
14191463,ASUS ROG STRIX B560-F GAMING WIFI 아이보라,"273,030","272,910","272,740"
14177450,ASUS ROG STRIX B560-F GAMING WIFI 인텍앤컴퍼니,"244,700","244,700","244,700"
13658867,ASUS ROG STRIX B560-F GAMING WIFI 코잇,"284,270",0,"284,270"
13598225,ASUS ROG STRIX B560-G GAMING WIFI STCOM,"224,700","228,940","228,940"
13597925,ASUS ROG STRIX B560-I GAMING WIFI STCOM,"248,000","248,000","248,000"
13696994,ASUS ROG STRIX B560-I GAMING WIFI 아이보라,"238,870","238,870","229,710"
13948001,ASUS ROG STRIX B560-I GAMING WIFI 인텍앤컴퍼니,"225,930","225,700","225,520"
13933502,ASUS ROG STRIX B560-I GAMING WIFI 코잇,"231,000","231,000","231,000"
12689624,ASUS ROG STRIX TRX40-XE GAMING STCOM,"835,000",0,"835,000"
12681329,ASUS ROG STRIX TRX40-XE GAMING 아이보라,"781,870","781,640","781,460"
9877746,ASUS ROG STRIX X299-E GAMING II 아이보라,"651,600",0,"644,600"
8517171,ASUS ROG STRIX X570-E GAMING STCOM,"496,000","496,000",0
8517573,ASUS ROG STRIX X570-E GAMING 아이보라,0,"455,140","454,960"
8542250,ASUS ROG STRIX X570-F GAMING 대원CTS,"397,900","397,900","397,900"
8517627,ASUS ROG STRIX X570-F GAMING 아이보라,"385,180","385,060","385,000"
11210097,ASUS ROG STRIX Z490-E GAMING STCOM,"520,000",0,"520,000"
13324397,ASUS ROG STRIX Z490-E GAMING 인텍앤컴퍼니,"272,700","270,000","270,000"
11222730,ASUS ROG STRIX Z490-E GAMING 코잇,"377,000",0,"382,520"
11210103,ASUS ROG STRIX Z490-F GAMING STCOM,"346,000","345,950","346,000"
11223846,ASUS ROG STRIX Z490-F GAMING 아이보라,"395,000",0,"395,000"
11232270,ASUS ROG STRIX Z490-F GAMING 인텍앤컴퍼니,"348,560","348,380","348,150"
11222727,ASUS ROG STRIX Z490-F GAMING 코잇,"344,700","344,700","334,800"
13324577,ASUS ROG STRIX Z490-G GAMING (Wi-Fi) 인텍앤컴퍼니,0,"213,000","213,000"
11232387,ASUS ROG STRIX Z490-H GAMING 인텍앤컴퍼니,0,"285,750","285,690"
11210115,ASUS ROG STRIX Z490-I GAMING STCOM,"388,780","388,780","388,780"
11222694,ASUS ROG STRIX Z490-I GAMING 코잇,"378,670","378,670","378,670"
13281752,ASUS ROG STRIX Z590-A GAMING WiFi STCOM,"428,000","428,000","428,000"
13363700,ASUS ROG STRIX Z590-E GAMING WIFI STCOM,0,0,"480,060"
13422746,ASUS ROG STRIX Z590-E GAMING WIFI 코잇,"460,170","460,170","460,170"
13408079,ASUS ROG STRIX Z590-F GAMING WIFI STCOM,"457,870","457,870","457,870"
13351769,ASUS ROG STRIX Z590-F GAMING WIFI 아이보라,"393,020","392,790","392,610"
13355441,ASUS ROG STRIX Z590-F GAMING WIFI 인텍앤컴퍼니,0,"401,650","401,650"
13422776,ASUS ROG STRIX Z590-F GAMING WIFI 코잇,0,"416,850","416,850"
13363298,ASUS ROG STRIX Z590-I GAMING WIFI 아이보라,"427,130","426,950","426,720"
13358747,ASUS ROG STRIX Z590-I GAMING WIFI 인텍앤컴퍼니,"436,320","436,320","436,320"
13422815,ASUS ROG STRIX Z590-I GAMING WIFI 코잇,0,"439,430","439,430"
7128832,ASUS ROG ZENITH EXTREME ALPHA STCOM,"783,720",0,"782,590"
11068470,ASUS ROG ZENITH II EXTREME ALPHA STCOM,0,"1,158,000","1,157,950"
9999324,ASUS ROG ZENITH II EXTREME STCOM,"2,371,030",0,"2,371,030"
8395641,ASUS TUF B365M-PLUS GAMING 인텍앤컴퍼니,0,"95,020","101,000"
8190613,ASUS TUF B365M-PLUS GAMING 코잇,"104,500","104,500","104,500"
6352178,ASUS TUF B450-PLUS GAMING STCOM,"147,560","147,560","147,560"
12409673,ASUS TUF B450-PLUS GAMING 대원CTS,"128,100","128,100","128,100"
