Id,Name,2021-04-01 09:21:02,2021-04-02 09:26:52
7096525,ASRock A320M-DVS R4.0 디앤디컴,"62,910","62,800"
7622335,ASRock A320M-DVS R4.0 에즈윈,"62,500","62,500"
6978235,ASRock A320M-HDV R4.0 디앤디컴,0,"66,620"
7476658,ASRock A320M-HDV R4.0 디앤디컴 (벌크),0,"62,020"
6948952,ASRock A320M-HDV R4.0 에즈윈,"66,700","66,700"
10864752,ASRock A320M-HDVP 디앤디컴,"68,900","68,800"
10311162,ASRock A320M-HDVP 에즈윈 (벌크),"66,670","66,670"
12074723,ASRock A520M PRO4 디앤디컴,"113,000","113,000"
12130286,ASRock A520M-HDV 에즈윈,"80,000","80,000"
12222293,ASRock A520M-HDVP 디앤디컴,"82,360","82,360"
12236990,ASRock A520M-HDVP 에즈윈,"83,800","83,800"
12086510,ASRock A520M-HVS 디앤디컴,"74,150","75,000"
12130319,ASRock A520M-HVS 에즈윈,"75,300",0
7420189,ASRock B365 PRO4 에즈윈,"130,000",0
7114357,ASRock B365 Phantom Gaming 4 디앤디컴,"143,320","143,320"
7114534,ASRock B365M PRO4 디앤디컴,0,"95,960"
9265920,ASRock B365M PRO4-F 디앤디컴,"90,800","90,800"
9636918,ASRock B365M PRO4-F 에즈윈,"97,550","97,550"
7391893,ASRock B365M Phantom Gaming 4 디앤디컴,"123,280","124,730"
7411384,ASRock B365M Phantom Gaming 4 에즈윈,"110,630","110,630"
7939498,ASRock B365M-HDV 디앤디컴,"85,900","85,900"
8010253,ASRock B365M-HDV 에즈윈,"79,310","79,220"
6494014,ASRock B450 PRO4 디앤디컴,"123,000","123,000"
7015291,ASRock B450 스틸레전드 디앤디컴,"126,840","126,800"
7337842,ASRock B450 스틸레전드 에즈윈,"132,700","132,700"
13363490,ASRock B450M PRO4 R2.0 디앤디컴,"99,700","99,700"
13598726,ASRock B450M PRO4 R2.0 에즈윈,"99,800","99,800"
6348963,ASRock B450M PRO4 디앤디컴,"94,800","94,800"
13363601,ASRock B450M PRO4-F R2.0 디앤디컴,"95,100","95,100"
9769749,ASRock B450M PRO4-F 디앤디컴,"91,000","91,000"
7097008,ASRock B450M 스틸레전드 디앤디컴,"108,500","108,460"
7170754,ASRock B450M 스틸레전드 에즈윈,"109,590","109,590"
6978166,ASRock B450M-HDV R4.0 디앤디컴,"83,440","83,440"
7424164,ASRock B450M-HDV R4.0 디앤디컴 (벌크),"78,820","78,720"
6891964,ASRock B450M-HDV R4.0 에즈윈,"82,500","82,500"
11399547,ASRock B460 PRO4 디앤디컴,"134,000","134,000"
11399676,ASRock B460 Phantom Gaming 4 디앤디컴,"119,000","119,000"
11674511,ASRock B460 스틸레전드 디앤디컴,"166,670","166,670"
11399754,ASRock B460M PRO4 디앤디컴,"115,000",0
11517701,ASRock B460M 스틸레전드 디앤디컴,"125,290",0
11399841,ASRock B460M-ITX/ac 디앤디컴,"145,500","145,300"
11758070,ASRock B550 EXTREME4 디앤디컴,"262,440","262,440"
11571071,ASRock B550 EXTREME4 에즈윈,"263,000","263,000"
11571482,ASRock B550 PG Velocita 에즈윈,"307,600","307,600"
11708183,ASRock B550 PRO4 디앤디컴,"175,670","175,670"
11580941,ASRock B550 PRO4 에즈윈,"178,490","178,490"
11764859,ASRock B550 Phantom Gaming 4 디앤디컴,"159,840","159,840"
11571746,ASRock B550 Phantom Gaming 4 에즈윈,"160,000","160,000"
11932180,ASRock B550 Phantom Gaming-ITX/ax 디앤디컴,"271,690","271,690"
11572088,ASRock B550 Phantom Gaming-ITX/ax 에즈윈,"281,000","281,000"
13148999,ASRock B550 Taichi Razer Edition 에즈윈,"470,000","470,000"
11675459,ASRock B550 Taichi 디앤디컴,"419,900","419,900"
11572808,ASRock B550 Taichi 에즈윈,"422,800","422,800"
11636093,ASRock B550 스틸레전드 디앤디컴,"242,350","231,340"
11572490,ASRock B550 스틸레전드 에즈윈,"235,330","235,330"
11649263,ASRock B550M PRO4 디앤디컴,"140,890","140,890"
11572991,ASRock B550M PRO4 에즈윈,"143,000","143,000"
12487823,ASRock B550M Phantom Gaming 4 디앤디컴,"124,670","124,670"
12464213,ASRock B550M Phantom Gaming 4 에즈윈,"125,000","125,000"
11580755,ASRock B550M 스틸레전드 에즈윈,"187,500","187,500"
12797720,ASRock B550M-HDV 디앤디컴,"114,470","115,450"
11573573,ASRock B550M-HDV 에즈윈,"118,300","118,300"
12022880,ASRock B550M-ITX/ac 디앤디컴,"187,440","187,600"
12256262,ASRock B550M-ITX/ac 에즈윈,"194,220","194,220"
13512974,ASRock B560 PRO4 디앤디컴,"154,000","152,990"
13289012,ASRock B560 PRO4 에즈윈,"172,800","172,800"
13418717,ASRock B560M PRO4 디앤디컴,"136,500","137,000"
13289171,ASRock B560M PRO4 에즈윈,"136,710","136,710"
13601942,ASRock B560M 스틸레전드 디앤디컴,"168,070","168,070"
13425908,ASRock B560M 스틸레전드 에즈윈,"169,000","169,000"
13523756,ASRock B560M-HDV 디앤디컴,"99,750","101,800"
13744889,ASRock B560M-ITX/ac 디앤디컴,"163,080","163,730"
11183211,ASRock FATAL1TY B450 Gaming-ITX/ac 디앤디컴,"164,000","163,800"
4812804,ASRock FATAL1TY H270 Performance 디앤디컴,"190,000","190,000"
4812931,ASRock H270M PRO4 디앤디컴,"190,000","190,000"
6385410,ASRock H310CM-DVS 디앤디컴,"65,500","65,500"
6395778,ASRock H310CM-DVS 디앤디컴 (벌크),"62,000","61,980"
6421625,ASRock H310CM-DVS 에즈윈,"71,600","71,600"
6421658,ASRock H310CM-DVS 에즈윈 (벌크),"64,480","63,770"
6891775,ASRock H310CM-HDV Plus 에즈윈,"71,880","71,910"
7424026,ASRock H310CM-HDV 디앤디컴 (벌크),"73,600","73,600"
6503460,ASRock H310CM-HDV/M.2 디앤디컴,"83,600","83,600"
6435538,ASRock H310CM-HDV/M.2 에즈윈,"78,000","76,440"
6421764,ASRock H310CM-HDVP2 에즈윈 (벌크),"82,810","82,900"
12905678,ASRock H370M-HDV 에즈윈,"71,240","71,240"
13117481,ASRock H410M-HDV R2.0 에즈윈,0,"80,320"
11407683,ASRock H410M-HDV 에즈윈,"80,990","81,000"
11407860,ASRock H410M-HDV/M.2 에즈윈,"91,300","91,300"
13117499,ASRock H410M-HVS R2.0 에즈윈,"77,900","77,900"
13117505,ASRock H410M-HVS R2.0 에즈윈 (벌크),"98,000","98,000"
11399934,ASRock H410M-HVS 디앤디컴,"82,000","82,000"
11407704,ASRock H410M-HVS 에즈윈,"79,000","79,000"
11531255,ASRock H410M-ITX/ac 디앤디컴,"128,950","128,950"
11399394,ASRock H470 Phantom Gaming 4 디앤디컴,"136,870","136,750"
11399340,ASRock H470 스틸레전드 디앤디컴,"199,000","198,800"
11399469,ASRock H470M PRO4 디앤디컴,"143,200","143,010"
11407749,ASRock H470M PRO4 에즈윈,"144,090","144,090"
13243124,ASRock H470M-HDV 에즈윈,"82,000","82,000"
13501820,ASRock H470M-HDV/M.2 디앤디컴,"92,000","91,800"
13301417,ASRock H470M-HVS 에즈윈,"80,000","80,000"
11399493,ASRock H470M-ITX/ac 디앤디컴,"181,820","181,820"
13643204,ASRock H510M-HDV 디앤디컴,"91,000","91,000"
13584227,ASRock H510M-HDV 에즈윈,"90,000","90,000"
13584266,ASRock H510M-HDV 에즈윈 (벌크),"87,150","87,150"
13644035,ASRock H510M-HDV/M.2 디앤디컴,"95,380","95,380"
13653038,ASRock H510M-HDV/M.2 에즈윈,"96,000","96,000"
13644221,ASRock H510M-HVS 디앤디컴,"88,870","88,800"
13652690,ASRock H510M-HVS 에즈윈,"88,980","88,980"
13652981,ASRock H510M-HVS 에즈윈 (벌크),"85,000","85,000"
13744781,ASRock H510M-ITX/ac 디앤디컴,"138,780","138,780"
13602143,ASRock H570 스틸레전드 디앤디컴,"194,670","198,450"
13670681,ASRock H570M PRO4 에즈윈,"140,700","145,390"
13745069,ASRock H570M-ITX/ac 디앤디컴,"192,240","192,300"
5911580,ASRock J4105-ITX 에즈윈,"124,500","124,500"
12940763,ASRock J4125-ITX 에즈윈,"133,920","134,540"
12940859,ASRock J4125B-ITX 에즈윈,"123,500","123,500"
10174962,ASRock TRX40 CREATOR 에즈윈,"685,500","688,900"
10551033,ASRock TRX40 Taichi 디앤디컴,"741,970","741,970"
10174755,ASRock TRX40 Taichi 에즈윈,"776,020","779,950"
6487245,ASRock X370M PRO4 에즈윈,"94,000",0
7887742,ASRock X370M-HDV R4.0 에즈윈,"69,400","67,840"
8508051,ASRock X570 EXTREME4 디앤디컴,"257,510","257,380"
8506491,ASRock X570 PRO4 에즈윈,"241,000","241,000"
8508369,ASRock X570 Phantom Gaming 4 디앤디컴,"215,430","215,430"
8747690,ASRock X570 Phantom Gaming 4 에즈윈,"218,810","219,150"
8506191,ASRock X570 Phantom Gaming X 에즈윈,"499,000","499,000"
13149158,ASRock X570 Taichi Razer Edition 에즈윈,일시품절,일시품절
8508585,ASRock X570 Taichi 디앤디컴,"433,800","433,800"
8507295,ASRock X570 Taichi 에즈윈,"434,000","434,000"
8507643,ASRock X570 스틸레전드 에즈윈,"298,000","298,000"
8507937,ASRock X570M PRO4 에즈윈,"260,400","260,400"
5542284,ASRock Z370 PRO4 디앤디컴,"289,500","289,500"
6508755,ASRock Z390 EXTREME4 디앤디컴,"227,850","227,850"
11329152,ASRock Z490 EXTREME4 디앤디컴,"253,760","254,870"
11337192,ASRock Z490 EXTREME4 에즈윈,"255,000","255,000"
11328411,ASRock Z490 PG Velocita 디앤디컴,"311,230","311,050"
11321532,ASRock Z490 PG Velocita 에즈윈,"324,000","324,000"
11327856,ASRock Z490 PRO4 디앤디컴,"199,440","199,380"
11337267,ASRock Z490 PRO4 에즈윈,"206,450","206,450"
11329587,ASRock Z490 Phantom Gaming 4 디앤디컴,"178,000","177,800"
11337225,ASRock Z490 Phantom Gaming 4 에즈윈,"185,000","190,000"
11329749,ASRock Z490 Phantom Gaming 4/2.5G 디앤디컴,"186,080","186,080"
11398728,ASRock Z490 Phantom Gaming-ITX/TB3 디앤디컴,"374,760","376,600"
11337861,ASRock Z490 Phantom Gaming-ITX/TB3 에즈윈,"373,660","375,300"
11329311,ASRock Z490 Taichi 디앤디컴,"440,000","440,000"
11337381,ASRock Z490 Taichi 에즈윈,"442,500","442,500"
11328783,ASRock Z490 스틸레전드 디앤디컴,"244,090","244,090"
11337324,ASRock Z490 스틸레전드 에즈윈,"249,000","259,990"
11327562,ASRock Z490M-ITX/ac 디앤디컴,"209,010","208,830"
13562528,ASRock Z590 EXTREME 디앤디컴,"282,150","283,080"
13484777,ASRock Z590 EXTREME 에즈윈,"274,000",0
13512842,ASRock Z590 PRO4 디앤디컴,"227,750","227,750"
13485029,ASRock Z590 PRO4 에즈윈,"221,550","228,940"
13486046,ASRock Z590 Phantom Gaming 4 에즈윈,"201,600","208,330"
13422614,ASRock Z590 Taichi 디앤디컴,"583,800","583,800"
13422545,ASRock Z590 Taichi 에즈윈,"587,000","606,520"
13418894,ASRock Z590 스틸레전드 디앤디컴,"262,470","262,470"
13472993,ASRock Z590 스틸레전드 에즈윈,0,"263,660"
13501733,ASRock Z590M PRO4 디앤디컴,"219,780","219,780"
13408382,ASRock Z590M PRO4 에즈윈,"215,770","221,900"
13486274,ASRock Z590M Phantom Gaming 4 에즈윈,"187,950","183,840"
13736231,ASRock Z590M-ITX/ax 디앤디컴,"255,890","257,040"
13570487,ASUS EMB-H61A (중고),"31,500","31,500"
6051885,ASUS EX A320M-GAMING STCOM,"83,000",0
7452148,ASUS EX A320M-GAMING 대원CTS,"69,900","69,900"
6154344,ASUS EX A320M-GAMING 아이보라,"75,920","75,830"
11408886,ASUS EX B460M-V5 인텍앤컴퍼니,"100,000","99,000"
3548546,ASUS H110M-K STCOM,"159,320","159,320"
2494395,ASUS H81M-K STCOM,0,"69,510"
3587819,ASUS MAXIMUS VIII HERO/ALPHA 아이보라,0,"745,500"
3867920,ASUS P10S WS 아이보라,"287,900","287,860"
3949562,ASUS P10S-M WS STCOM,"287,000","287,000"
6914917,ASUS P11C-C/4L STCOM,"348,000","348,000"
6675862,ASUS P11C-C/4L 아이보라,"317,200","317,020"
6914983,ASUS P11C-X STCOM,"243,760","243,760"
3226637,ASUS P9D-MH/10G-DUAL STCOM,"523,980","523,920"
8654186,ASUS PRIME A320I-K STCOM,"118,000","118,000"
7452181,ASUS PRIME A320M-K 대원CTS,"69,000","69,000"
5122402,ASUS PRIME A320M-K 아이보라,"67,680","69,090"
8101588,ASUS PRIME A320M-K/CSM STCOM,"82,400","82,400"
12060239,ASUS PRIME A520M-A STCOM,"109,590","109,590"
12069533,ASUS PRIME A520M-A 대원CTS,"102,610",0
12067604,ASUS PRIME A520M-A 아이보라,"100,240","100,110"
12060812,ASUS PRIME A520M-A/CSM STCOM,"119,350","119,350"
12060446,ASUS PRIME A520M-E STCOM,"104,880","104,880"
12069548,ASUS PRIME A520M-E 대원CTS,"98,060","97,880"
12060293,ASUS PRIME A520M-K STCOM,"98,000","98,000"
12069566,ASUS PRIME A520M-K 대원CTS,"92,900","92,900"
12067610,ASUS PRIME A520M-K 아이보라,"88,910","88,780"
12060863,ASUS PRIME A520M-K/CSM STCOM,"102,960","102,960"
7108366,ASUS PRIME B365M-A 코잇,"98,740","98,740"
7439677,ASUS PRIME B365M-K 인텍앤컴퍼니,"93,000","93,000"
7108423,ASUS PRIME B365M-K 코잇,"96,000","96,000"
8025628,ASUS PRIME B365M-K/CSM STCOM,"104,500","104,500"
6352292,ASUS PRIME B450-PLUS STCOM,"134,000","134,000"
12629255,ASUS PRIME B450M-A II STCOM,"131,070","133,950"
12626231,ASUS PRIME B450M-A II 대원CTS,"123,510","123,510"
7452226,ASUS PRIME B450M-A 대원CTS,"94,940","93,890"
6343577,ASUS PRIME B450M-A 아이보라,0,"100,000"
8160142,ASUS PRIME B450M-A/CSM 아이보라,일시품절,일시품절
12689660,ASUS PRIME B450M-K II STCOM,"118,000","118,000"
12626198,ASUS PRIME B450M-K II 대원CTS,"112,860","114,000"
12447932,ASUS PRIME B450M-K II 아이보라,"112,500","112,500"
11370495,ASUS PRIME B460-PLUS STCOM,"169,100",0
11334177,ASUS PRIME B460-PLUS 코잇,"171,080","172,000"
12026672,ASUS PRIME B460I-PLUS 아이보라,"134,790","134,610"
12083309,ASUS PRIME B460I-PLUS 코잇,"146,480","146,480"
11396745,ASUS PRIME B460M-A 코잇,"119,000","119,000"
11370840,ASUS PRIME B460M-K STCOM,"108,560","108,560"
11397810,ASUS PRIME B460M-K 아이보라,"101,230","100,490"
11408334,ASUS PRIME B460M-K 인텍앤컴퍼니,"96,990","99,340"
11333751,ASUS PRIME B460M-K 코잇,"104,000","107,000"
11570735,ASUS PRIME B550M-A (Wi-Fi) STCOM,"204,000","204,000"
11656259,ASUS PRIME B550M-A (Wi-Fi) 대원CTS,0,"151,800"
11570618,ASUS PRIME B550M-A STCOM,"155,150",0
11574458,ASUS PRIME B550M-A 대원CTS,"131,000","131,000"
11570354,ASUS PRIME B550M-K STCOM,"128,140","129,520"
11574545,ASUS PRIME B550M-K 대원CTS,"118,840","117,960"
11583095,ASUS PRIME B550M-K 아이보라,"117,650","122,800"
11656073,ASUS PRIME B550M-K/CSM STCOM,"141,830","143,320"
13656224,ASUS PRIME B560-PLUS 아이보라,일시품절,일시품절
13628297,ASUS PRIME B560-PLUS 인텍앤컴퍼니,가격비교예정,가격비교예정
13423211,ASUS PRIME B560-PLUS 코잇,"173,880","172,520"
13506266,ASUS PRIME B560M-A 코잇,"149,000","149,000"
13709120,ASUS PRIME B560M-A/CSM 코잇,가격비교예정,가격비교예정
13709738,ASUS PRIME B560M-K STCOM,"133,400","133,400"
13656140,ASUS PRIME B560M-K/CSM 아이보라,"133,360","133,360"
13761692,ASUS PRIME B560M-K/CSM 인텍앤컴퍼니,가격비교예정,가격비교예정
13708883,ASUS PRIME B560M-K/CSM 코잇,가격비교예정,가격비교예정
6346757,ASUS PRIME H310M-A R2.0 STCOM,"72,500","72,500"
6370926,ASUS PRIME H310M-A R2.0 아이보라,"70,300","70,300"
6721984,ASUS PRIME H310M-A R2.0 코잇,"73,000","73,000"
6494926,ASUS PRIME H310M-K R2.0 인텍앤컴퍼니,"68,000","68,000"
12026699,ASUS PRIME H410I-PLUS 아이보라,"118,800","118,680"
11371335,ASUS PRIME H410M-D STCOM,0,"94,000"
11408766,ASUS PRIME H410M-E 인텍앤컴퍼니,"85,210","84,800"
11370858,ASUS PRIME H410M-K STCOM,0,"83,150"
11397861,ASUS PRIME H410M-K 아이보라,"81,700","80,780"
11408364,ASUS PRIME H410M-K 인텍앤컴퍼니,"82,190","82,500"
11334720,ASUS PRIME H410M-K 코잇,"82,000","85,900"
11370024,ASUS PRIME H470-PLUS STCOM,"184,990","185,000"
11396484,ASUS PRIME H470M-PLUS STCOM,"160,160","160,160"
11396916,ASUS PRIME H470M-PLUS 코잇,"150,000","150,000"
13656296,ASUS PRIME H510M-E 아이보라,"112,400","112,400"
13762082,ASUS PRIME H510M-E 인텍앤컴퍼니,가격비교예정,가격비교예정
13451855,ASUS PRIME H570M-PLUS STCOM,"178,500","178,500"
12481682,ASUS PRIME TRX40-PRO S STCOM,"755,000","755,000"
12626147,ASUS PRIME TRX40-PRO S 대원CTS,"696,730","696,550"
12433307,ASUS PRIME TRX40-PRO S 아이보라,"690,650","690,470"
9731643,ASUS PRIME X299 Edition 30 STCOM,"1,885,170","1,885,170"
9647316,ASUS PRIME X299-A II STCOM,"516,000","516,000"
9713286,ASUS PRIME X299-A II 인텍앤컴퍼니,"499,850","499,730"
9511734,ASUS PRIME X299-A II 코잇,"521,500",0
5456968,ASUS PRIME X399-A STCOM,"937,780",0
8511729,ASUS PRIME X570-P/CSM STCOM,"246,000","246,000"
8542142,ASUS PRIME X570-P/CSM 대원CTS,"224,700","224,700"
8514897,ASUS PRIME X570-P/CSM 아이보라,"215,290","215,110"
8514777,ASUS PRIME X570-PRO/CSM 아이보라,"291,580",0
6508656,ASUS PRIME Z390-P 아이보라,0,"148,610"
11210127,ASUS PRIME Z490-A STCOM,"289,890","289,890"
11273754,ASUS PRIME Z490-A 아이보라,"282,850",0
11222532,ASUS PRIME Z490-A 코잇,"295,120","295,120"
11223801,ASUS PRIME Z490-P 아이보라,"210,000","210,000"
11232246,ASUS PRIME Z490-P 인텍앤컴퍼니,"198,000","198,000"
11222577,ASUS PRIME Z490-P 코잇,0,"237,000"
11224182,ASUS PRIME Z490M-PLUS 인텍앤컴퍼니,"189,620","189,580"
13649681,ASUS PRIME Z590-A + i9-11900 (로켓레이크S),일시품절,일시품절
13369766,ASUS PRIME Z590-P STCOM,"273,500","273,500"
13642916,ASUS PRIME Z590-P WIFI STCOM,가격비교예정,가격비교예정
13657736,ASUS PRIME Z590-P WIFI 코잇,가격비교예정,가격비교예정
13352234,ASUS PRIME Z590-P 아이보라,"247,950","247,950"
13658519,ASUS PRIME Z590-V 코잇,가격비교예정,가격비교예정
13368221,ASUS PRIME Z590M-PLUS STCOM,"257,000","256,950"
13352363,ASUS PRIME Z590M-PLUS 아이보라,"229,590","229,590"
13358816,ASUS PRIME Z590M-PLUS 인텍앤컴퍼니,0,"234,000"
11397942,ASUS PRO WS W480-ACE 아이보라,"354,880","354,760"
13562387,ASUS PRO WS WRX80E-SAGE SE WIFI 대원CTS,"1,329,000",일시품절
8890244,ASUS PRO WS X570-ACE STCOM,"445,000","445,000"
8518257,ASUS PRO WS X570-ACE 아이보라,"410,930","410,750"
13656371,ASUS Pro B560M-C/CSM 아이보라,"146,800","146,800"
12371279,ASUS Pro H410T/CSM 아이보라,"127,420","127,420"
13656899,ASUS Pro H510M-C/CSM 아이보라,"117,400","117,400"
13708934,ASUS Pro H510M-C/CSM 코잇,가격비교예정,가격비교예정
13746323,ASUS ProArt B550-CREATOR 대원CTS,가격비교예정,가격비교예정
11345160,ASUS ProArt Z490-CREATOR 10G STCOM,"404,000","403,990"
11232495,ASUS ProArt Z490-CREATOR 10G 인텍앤컴퍼니,"354,640","354,640"
11222634,ASUS ProArt Z490-CREATOR 10G 코잇,"376,340","376,340"
6060171,ASUS ROG CROSSHAIR VII HERO STCOM,"706,470","706,470"
12701975,ASUS ROG CROSSHAIR VIII DARK HERO STCOM,일시품절,0
12698210,ASUS ROG CROSSHAIR VIII DARK HERO 대원CTS,"529,000","529,000"
12719003,ASUS ROG CROSSHAIR VIII DARK HERO 아이보라,"537,420","533,800"
8515059,ASUS ROG CROSSHAIR VIII FORMULA 아이보라,"766,650","758,700"
9739197,ASUS ROG CROSSHAIR VIII IMPACT 아이보라,"494,470","494,290"
5548383,ASUS ROG MAXIMUS X HERO 인텍앤컴퍼니,"523,000",0
6511865,ASUS ROG MAXIMUS XI FORMULA STCOM,"1,165,760","1,165,760"
11242554,ASUS ROG MAXIMUS XII APEX 코잇,0,"552,000"
11274450,ASUS ROG MAXIMUS XII EXTREME 아이보라,"900,000","900,000"
11210139,ASUS ROG MAXIMUS XII FORMULA STCOM,"676,000","676,000"
11274915,ASUS ROG MAXIMUS XII FORMULA 아이보라,"596,670","596,430"
11222715,ASUS ROG MAXIMUS XII FORMULA 코잇,"645,580","645,580"
11210148,ASUS ROG MAXIMUS XII HERO (Wi-Fi) STCOM,0,"498,000"
11224269,ASUS ROG MAXIMUS XII HERO (Wi-Fi) 인텍앤컴퍼니,"492,000","492,000"
13774883,ASUS ROG MAXIMUS XIII EXTREME 코잇,0,가격비교예정
13368140,ASUS ROG MAXIMUS XIII HERO STCOM,"666,800","666,800"
13351433,ASUS ROG MAXIMUS XIII HERO 아이보라,"636,500","636,500"
13354628,ASUS ROG MAXIMUS XIII HERO 인텍앤컴퍼니,"657,130",0
9929931,ASUS ROG RAMPAGE VI EXTREME ENCORE 아이보라,"1,015,780","1,015,720"
9999753,ASUS ROG RAMPAGE VI EXTREME ENCORE 코잇,"2,000,000","2,000,000"
12629147,ASUS ROG STRIX B450-F GAMING II STCOM,"202,000","202,000"
12617309,ASUS ROG STRIX B450-F GAMING II 대원CTS,"200,150","200,150"
6351887,ASUS ROG STRIX B450-F GAMING STCOM,"201,820","194,190"
12409535,ASUS ROG STRIX B450-F GAMING 대원CTS,"179,900","179,900"
6407504,ASUS ROG STRIX B450-I GAMING STCOM,"229,000","229,000"
11224011,ASUS ROG STRIX B450-I GAMING 대원CTS,"207,000","207,000"
11370333,ASUS ROG STRIX B460-I GAMING STCOM,"251,150",0
11398038,ASUS ROG STRIX B460-I GAMING 아이보라,"198,400","198,320"
11396877,ASUS ROG STRIX B460-I GAMING 코잇,"224,460","224,460"
12048893,ASUS ROG STRIX B550-A GAMING STCOM,0,"239,000"
11934316,ASUS ROG STRIX B550-A GAMING 대원CTS,"217,000","219,000"
11920711,ASUS ROG STRIX B550-A GAMING 아이보라,"214,780","214,600"
11725601,ASUS ROG STRIX B550-I GAMING STCOM,"276,020","276,020"
12130349,ASUS ROG STRIX B550-I GAMING 대원CTS,0,"266,400"
11824639,ASUS ROG STRIX B550-I GAMING 아이보라,"257,880","257,700"
12702185,ASUS ROG STRIX B550-XE GAMING WiFi STCOM,"405,000",0
13658867,ASUS ROG STRIX B560-F GAMING WIFI 코잇,"285,000","284,270"
13598225,ASUS ROG STRIX B560-G GAMING WIFI STCOM,"259,900","259,900"
13597925,ASUS ROG STRIX B560-I GAMING WIFI STCOM,"242,600","242,600"
13696994,ASUS ROG STRIX B560-I GAMING WIFI 아이보라,"238,300","245,290"
6023687,ASUS ROG STRIX H370-F GAMING STCOM,"231,000","231,000"
11369967,ASUS ROG STRIX H470-I GAMING STCOM,0,"271,990"
9877746,ASUS ROG STRIX X299-E GAMING II 아이보라,"640,770","640,590"
8517171,ASUS ROG STRIX X570-E GAMING STCOM,"495,990","496,000"
8517573,ASUS ROG STRIX X570-E GAMING 아이보라,"460,110","459,930"
8517447,ASUS ROG STRIX X570-F GAMING STCOM,"418,000","418,000"
8542250,ASUS ROG STRIX X570-F GAMING 대원CTS,"394,940","393,960"
8517627,ASUS ROG STRIX X570-F GAMING 아이보라,"383,910","386,230"
9591549,ASUS ROG STRIX X570-I GAMING 아이보라,"389,520","389,340"
6632176,ASUS ROG STRIX Z390-F GAMING 인텍앤컴퍼니,"276,460","276,280"
7140739,ASUS ROG STRIX Z390-I GAMING 인텍앤컴퍼니,"563,600","563,600"
11210109,ASUS ROG STRIX Z490-A GAMING STCOM,"289,000","289,000"
11210097,ASUS ROG STRIX Z490-E GAMING STCOM,0,"443,510"
11275848,ASUS ROG STRIX Z490-E GAMING 아이보라,"458,100","458,100"
11222730,ASUS ROG STRIX Z490-E GAMING 코잇,"406,880","406,880"
11210103,ASUS ROG STRIX Z490-F GAMING STCOM,"342,400","342,400"
11232270,ASUS ROG STRIX Z490-F GAMING 인텍앤컴퍼니,"346,900","346,900"
11222727,ASUS ROG STRIX Z490-F GAMING 코잇,"342,000","342,000"
11276139,ASUS ROG STRIX Z490-G GAMING (Wi-Fi) 아이보라,"278,000","278,000"
13324577,ASUS ROG STRIX Z490-G GAMING (Wi-Fi) 인텍앤컴퍼니,"222,100","206,560"
11298006,ASUS ROG STRIX Z490-G GAMING 아이보라,"278,000","278,000"
11232402,ASUS ROG STRIX Z490-G GAMING 인텍앤컴퍼니,"342,890","342,890"
11232387,ASUS ROG STRIX Z490-H GAMING 인텍앤컴퍼니,"285,110","284,980"
11210115,ASUS ROG STRIX Z490-I GAMING STCOM,"407,000","407,000"
11222694,ASUS ROG STRIX Z490-I GAMING 코잇,"370,000","377,360"
13649687,ASUS ROG STRIX Z590-E GAMING WIFI + i9-11900K (로켓레이크S),일시품절,일시품절
13363700,ASUS ROG STRIX Z590-E GAMING WIFI STCOM,"512,860","508,630"
13351916,ASUS ROG STRIX Z590-E GAMING WIFI 아이보라,"467,000","467,000"
13355396,ASUS ROG STRIX Z590-E GAMING WIFI 인텍앤컴퍼니,"491,400","491,400"
13422746,ASUS ROG STRIX Z590-E GAMING WIFI 코잇,"486,000","488,250"
13649684,ASUS ROG STRIX Z590-F GAMING WIFI + i9-11900K (로켓레이크S),일시품절,일시품절
13408079,ASUS ROG STRIX Z590-F GAMING WIFI STCOM,"445,000","445,000"
13351769,ASUS ROG STRIX Z590-F GAMING WIFI 아이보라,"406,700",0
13355441,ASUS ROG STRIX Z590-F GAMING WIFI 인텍앤컴퍼니,"427,400","427,400"
13422776,ASUS ROG STRIX Z590-F GAMING WIFI 코잇,"423,150","423,150"
13363298,ASUS ROG STRIX Z590-I GAMING WIFI 아이보라,"520,880",0
13358747,ASUS ROG STRIX Z590-I GAMING WIFI 인텍앤컴퍼니,"480,000",0
7128832,ASUS ROG ZENITH EXTREME ALPHA STCOM,"851,730","851,730"
11068470,ASUS ROG ZENITH II EXTREME ALPHA STCOM,"1,157,950","1,157,950"
10006572,ASUS ROG ZENITH II EXTREME 대원CTS,"1,174,680","1,174,680"
8037055,ASUS TUF B365M-PLUS GAMING STCOM,"118,150","118,150"
8190613,ASUS TUF B365M-PLUS GAMING 코잇,"104,500","104,500"
6352178,ASUS TUF B450-PLUS GAMING STCOM,"147,560","147,560"
12409673,ASUS TUF B450-PLUS GAMING 대원CTS,"132,500","132,500"
8035732,ASUS TUF B450-PRO GAMING STCOM,"171,000","168,130"
12409628,ASUS TUF B450-PRO GAMING 대원CTS,"150,360","150,180"
10526130,ASUS TUF B450M-PLUS GAMING 대원CTS,0,"100,300"
7741678,ASUS TUF B450M-PRO GAMING STCOM,"117,000","117,000"
9989817,ASUS TUF B450M-PRO GAMING 대원CTS,"129,000","129,000"
12069485,ASUS TUF Gaming A520M-PLUS 대원CTS,"116,080","116,550"
12067601,ASUS TUF Gaming A520M-PLUS 아이보라,"121,000","121,000"
12676097,ASUS TUF Gaming B450-PLUS II 대원CTS,"151,680","151,500"
12617759,ASUS TUF Gaming B450M-PLUS II 대원CTS,0,"125,900"
12629378,ASUS TUF Gaming B450M-PRO II STCOM,"134,000",0
11814517,ASUS TUF Gaming B450M-PRO S STCOM,"139,500","139,500"
11370480,ASUS TUF Gaming B460-PLUS STCOM,"174,000","174,000"
11334696,ASUS TUF Gaming B460-PLUS 코잇,"172,000","172,000"
11370648,ASUS TUF Gaming B460-PRO (WI-FI) STCOM,"190,400","190,400"
11396796,ASUS TUF Gaming B460-PRO (WI-FI) 코잇,"196,000","196,000"
11370792,ASUS TUF Gaming B460M-PLUS STCOM,"134,650","134,750"
12646568,ASUS TUF Gaming B460M-PRO 아이보라,"138,350","138,160"
12113681,ASUS TUF Gaming B550-PLUS (Wi-Fi) STCOM,"215,310","215,900"
12140450,ASUS TUF Gaming B550-PLUS (Wi-Fi) 대원CTS,"207,760","207,760"
12086387,ASUS TUF Gaming B550-PLUS (Wi-Fi) 아이보라,0,"200,000"
11574341,ASUS TUF Gaming B550-PLUS 대원CTS,"182,000","182,000"
11583224,ASUS TUF Gaming B550-PLUS 아이보라,"179,650","181,730"
13240724,ASUS TUF Gaming B550-PRO STCOM,"230,000","230,000"
13191455,ASUS TUF Gaming B550-PRO 대원CTS,"210,080",0
13268105,ASUS TUF Gaming B550-PRO 아이보라,0,"208,000"
13561976,ASUS TUF Gaming B560M-PLUS WIFI 인텍앤컴퍼니,"214,200","214,200"
13531097,ASUS TUF Gaming B560M-PLUS 인텍앤컴퍼니,"194,000","194,000"
11370177,ASUS TUF Gaming H470-PRO STCOM,"189,000",0
13763201,ASUS TUF Gaming H570-PRO WIFI 인텍앤컴퍼니,가격비교예정,가격비교예정
13763021,ASUS TUF Gaming H570-PRO 인텍앤컴퍼니,가격비교예정,가격비교예정
8516985,ASUS TUF Gaming X570-PLUS STCOM,"294,000","294,000"
8542178,ASUS TUF Gaming X570-PLUS 대원CTS,"288,000","288,000"
8517531,ASUS TUF Gaming X570-PLUS 아이보라,"270,060","269,880"
12481742,ASUS TUF Gaming X570-PRO (Wi-Fi) STCOM,"305,000","305,000"
12617363,ASUS TUF Gaming X570-PRO (Wi-Fi) 대원CTS,"294,250","294,250"
12424514,ASUS TUF Gaming X570-PRO (Wi-Fi) 아이보라,"280,200","280,010"
11222739,ASUS TUF Gaming Z490-PLUS (Wi-Fi) 코잇,"285,360","285,360"
11222736,ASUS TUF Gaming Z490-PLUS 코잇,"251,720","251,720"
13354835,ASUS TUF Gaming Z590-PLUS WIFI 인텍앤컴퍼니,"312,000","312,000"
