Id,Name,2022-02-01 10:10:05
11830057,ADATA FALCON M.2 NVMe,"2TB_197원/1GB_394,500|1TB_121,160|512GB_138원/1GB_70,710|256GB_187원/1GB_47,990"
15593504,ADATA PROSPECTOR 950 해외구매,"1TB_929원/1GB_928,720"
11830438,ADATA SWORDFISH M.2 NVMe,"2TB_176원/1GB_351,640|1TB_118,330|500GB_127원/1GB_63,610|250GB_160원/1GB_39,960"
7768462,ADATA Ultimate SU630,"960GB_140원/1GB_134,670|480GB_53,360|240GB_174원/1GB_41,840"
6478323,ADATA Ultimate SU650,"960GB_127원/1GB_122,390|480GB_57,490|256GB_152원/1GB_38,840|240GB_133원/1GB_31,880|120GB_186원/1GB_22,290"
9869412,ADATA Ultimate SU650 M.2 SATA,"480GB_63,980|240GB_179원/1GB_43,000|120GB_267원/1GB_32,000"
6429787,ADATA Ultimate SU655,"480GB_58,170|240GB_148원/1GB_35,500|120GB_284원/1GB_34,080"
7658227,ADATA Ultimate SU750,"1TB_142원/1GB_141,980|512GB_64,180|256GB_161원/1GB_41,210"
6476438,ADATA Ultimate SU800,"2TB_133원/1GB_266,600|1TB_119,000|512GB_139원/1GB_71,000|256GB_178원/1GB_45,500|128GB_317원/1GB_40,590"
6476459,ADATA Ultimate SU800 M.2 SATA,"1TB_143,440|512GB_145원/1GB_74,380|256GB_180원/1GB_46,060|128GB_273원/1GB_34,990"
6476489,ADATA Ultimate SU900,"1TB_300,000|512GB_330원/1GB_169,000|256GB_551원/1GB_141,000"
6476585,ADATA XPG GAMMIX S11 M.2 NVMe,"960GB_일시품절|480GB_일시품절|240GB_100,050"
7176094,ADATA XPG GAMMIX S11 PRO M.2 NVMe,"1TB_135,730|512GB_159원/1GB_81,600|256GB_190원/1GB_48,580"
7175707,ADATA XPG GAMMIX S5 M.2 NVMe,"1TB_138,880|512GB_150원/1GB_76,580|256GB_186원/1GB_47,500"
15562250,ADATA XPG GAMMIX S70 BLADE M.2 NVMe,"1TB_214원/1GB_214,400"
15562385,ADATA XPG GAMMIX S70 BLADE M.2 NVMe 해외구매,"2TB_291원/1GB_581,180|1TB_196,610"
13369613,ADATA XPG GAMMIX S70 M.2 NVMe,"2TB_403,630|1TB_220원/1GB_219,860"
13503713,ADATA XPG SPECTRIX S20G M.2 NVMe,"1TB_137,270|500GB_200원/1GB_99,990"
9245688,ADATA XPG SPECTRIX S40G M.2 NVMe,"1TB_144,790|512GB_155원/1GB_79,190|256GB_187원/1GB_47,970"
7175431,ADATA XPG SX6000 Lite M.2 NVMe,"1TB_123,090|512GB_132원/1GB_67,480|256GB_157원/1GB_40,270|128GB_352원/1GB_45,000"
6476516,ADATA XPG SX6000 M.2 NVMe,"1TB_348,000|256GB_367원/1GB_93,990|128GB_434원/1GB_55,500"
6515511,ADATA XPG SX6000 Pro M.2 NVMe,"2TB_201원/1GB_401,090|1TB_121,650|512GB_135원/1GB_68,990|256GB_155원/1GB_39,580"
11127390,ADATA XPG SX8100 M.2 NVMe,"1TB_132,630|512GB_151원/1GB_77,500|256GB_218원/1GB_55,900"
6476551,ADATA XPG SX8200 M.2 NVMe,"240GB_374원/1GB_89,700"
6856051,ADATA XPG SX8200 Pro M.2 NVMe,"2TB_137원/1GB_273,000|1TB_139원/1GB_139,000|512GB_67,770|256GB_201원/1GB_51,570"
5941038,ADATA XPG SX9000 Extreme Pack,"512GB_645원/1GB_330,440"
5681778,ADATA XPG SX9000 M.2 NVMe,512GB_일시품절
6476983,ADATA XPG SX950U,"960GB_일시품절|240GB_66,700|120GB_345원/1GB_41,400"
5937154,AFOX AFSN8T3BN,"240GB_325원/1GB_78,000"
15295952,AFOX MS200-500GN M.2 SATA,"500GB_111원/1GB_55,600"
7513840,AFOX Original SE,"480GB_109원/1GB_52,200"
14759402,ASUS HYPER M.2 x16 Gen 4 CARD 대원CTS,"SSD미포함_68,200"
12809624,ASUS HYPER M.2 x16 Gen 4 CARD 아이보라,"SSD미포함_76,800"
8134585,Apacer PANTHER AS340,"960GB_226원/1GB_217,410|480GB_63,940"
10374708,BIOSTAR M700 M.2 NVMe,"1TB_121,730|512GB_144원/1GB_73,870|256GB_180원/1GB_46,000"
4832561,BIOSTAR S100 Series,"240GB_36,800|120GB_208원/1GB_24,900"
10029384,BIOSTAR S120,"1TB_115,260|512GB_138원/1GB_70,600|256GB_146원/1GB_37,400|128GB_200원/1GB_25,570"
15583340,COLORFUL CN600 M.2 NVMe 디앤디컴,"512GB_60,670|256GB_136원/1GB_34,900"
15583520,COLORFUL CN600 M.2 NVMe 디앤디컴,"512GB_60,670|256GB_136원/1GB_34,900"
11304261,COLORFUL CN600 M.2 NVMe 아이보라,"1TB_136,950|512GB_140원/1GB_71,480|256GB_176원/1GB_45,180"
6538856,COLORFUL CN600S M.2 NVMe,"480GB_225원/1GB_108,000"
5902367,COLORFUL SL300 ONYX Q,"160GB_487원/1GB_77,850"
15591008,COLORFUL SL300 디앤디컴,"128GB_21,150|120GB_175원/1GB_20,980"
11303028,COLORFUL SL300 아이보라,"160GB_195원/1GB_31,180|128GB_20,650|120GB_170원/1GB_20,450"
11303892,COLORFUL SL500 DDR 아이보라,"1TB_143원/1GB_143,120"
5706990,COLORFUL SL500 ONYX ST,"480GB_341원/1GB_163,630|240GB_79,980"
15585548,COLORFUL SL500 디앤디컴,"512GB_56,000|480GB_120원/1GB_57,770|256GB_131원/1GB_33,430|240GB_129원/1GB_30,970"
11303766,COLORFUL SL500 아이보라,"2TB_207,500|1.92TB_111원/1GB_212,950|1TB_108원/1GB_107,540|512GB_113원/1GB_58,050|480GB_119원/1GB_56,950|360GB_130원/1GB_46,840|256GB_138원/1GB_35,410|240GB_134원/1GB_32,180"
6227269,CORSAIR Force Series MP300 M.2 NVMe,"960GB_일시품절|480GB_221,250|240GB_일시품절"
4792282,CORSAIR Force Series MP500 M.2 NVMe,"480GB_370,300|240GB_일시품절"
6632611,CORSAIR Force Series MP510 M.2 NVMe,"960GB_179,820|240GB_263원/1GB_63,130"
8462625,CORSAIR Force Series MP600 M.2 NVMe,"2TB_231원/1GB_461,850|1TB_207,910|500GB_438원/1GB_219,000"
13266914,CORSAIR HYDRO X SERIES MP600 PRO HXE M.2 NVMe,"2TB_287원/1GB_574,960"
15238799,CORSAIR HYDRO X SERIES MP600 PRO XT HXE M.2 NVMe,"4TB_382원/1GB_1,527,960|2TB_603,545"
12497453,CORSAIR MP400 M.2 NVMe,"8TB_244원/1GB_1,955,780|4TB_209원/1GB_837,990|2TB_354,750|1TB_177원/1GB_176,800"
16283714,CORSAIR MP400 R2 M.2 NVMe,4TB_가격비교예정|1TB_가격비교예정|2TB_가격비교예정
13266551,CORSAIR MP600 CORE M.2 NVMe,"4TB_226원/1GB_904,470|2TB_218원/1GB_436,700|1TB_182,150"
13266344,CORSAIR MP600 PRO M.2 NVMe,"2TB_561,600|1TB_321원/1GB_321,070"
15239015,CORSAIR MP600 PRO XT M.2 NVMe,"4TB_379원/1GB_1,517,046|2TB_293원/1GB_586,082|1TB_276,125"
15793496,EMTEC X150 해외구매,"960GB_123,400|480GB_135원/1GB_64,600|240GB_159원/1GB_38,200|120GB_281원/1GB_33,750"
15526235,EMTEC X160 해외구매,"128GB_3,389원/1GB_433,750"
15794270,EMTEC X250 M.2 SATA 해외구매,"1TB_196원/1GB_196,320|512GB_78,140|256GB_223원/1GB_57,000"
8433711,ESSENCORE KLEVV CRAS C700 M.2 NVMe,"480GB_315원/1GB_150,980"
11316081,ESSENCORE KLEVV CRAS C700 RGB M.2 NVMe,"960GB_138,800|480GB_177원/1GB_85,000|240GB_225원/1GB_54,000"
10927932,ESSENCORE KLEVV CRAS C710 M.2 NVMe,"1TB_125,000|512GB_135원/1GB_69,000|256GB_156원/1GB_39,900"
14685212,ESSENCORE KLEVV CRAS C710 M.2 NVMe 해외구매,"1TB_211원/1GB_211,210|512GB_75,350|256GB_271원/1GB_69,370"
15626990,ESSENCORE KLEVV CRAS C720 M.2 NVMe,"2TB_147원/1GB_294,500|1TB_143,600|512GB_148원/1GB_75,800|256GB_196원/1GB_50,200"
15627146,ESSENCORE KLEVV CRAS C720 M.2 NVMe,"2TB_147원/1GB_294,500|1TB_143,600|512GB_148원/1GB_75,800|256GB_196원/1GB_50,200"
15696317,ESSENCORE KLEVV CRAS C720 M.2 NVMe 해외구매,"512GB_263원/1GB_134,570"
15034367,ESSENCORE KLEVV CRAS C920 M.2 NVMe,"2TB_393,000|1TB_199원/1GB_199,000"
15058181,ESSENCORE KLEVV CRAS C920 M.2 NVMe 해외구매,"2TB_일시품절|1TB_338,800"
8417127,ESSENCORE KLEVV NEO N400,"480GB_59,000|240GB_142원/1GB_33,980|120GB_257원/1GB_30,870"
9931185,ESSENCORE KLEVV NEO N400 벌크,"480GB_57,200|240GB_135원/1GB_32,330|120GB_207원/1GB_24,840"
6402210,ESSENCORE KLEVV NEO N500,"480GB_67,840|240GB_675원/1GB_162,000"
8433213,ESSENCORE KLEVV NEO N510 PLUS,"480GB_122,160|240GB_326원/1GB_78,220|120GB_477원/1GB_57,220"
5006951,ESSENCORE KLEVV NEO N600,"240GB_108,050|120GB_550원/1GB_65,950"
5205493,ESSENCORE KLEVV NEO N600 M.2 SATA,"120GB_1,044원/1GB_125,320"
11211603,ESSENCORE KLEVV NEO N610,"1TB_130,000|512GB_141원/1GB_71,980|256GB_168원/1GB_43,000"
13465676,GIGABYTE AORUS 7000s M.2 NVMe,"2TB_423,950|1TB_219원/1GB_218,940"
12188150,GIGABYTE AORUS Gen4 M.2 NVMe,"2TB_151원/1GB_301,490|1TB_145,000|500GB_198원/1GB_98,850"
7609567,GIGABYTE AORUS RGB M.2 NVMe,"512GB_153,700|256GB_714원/1GB_182,910"
8440743,GIGABYTE AORUS SSD M.2 NVMe,"2TB_322,100|1TB_164원/1GB_163,540|500GB_225원/1GB_112,320"
9626676,GIGABYTE GP-GSM2NE3 M.2 NVMe,"1TB_118,540|512GB_129원/1GB_66,300|256GB_145원/1GB_37,110|128GB_242원/1GB_30,980"
6527622,GIGABYTE GP-GSM2NE8 M.2 NVMe,"256GB_191원/1GB_49,000"
14360795,GIGABYTE M30 M.2 NVMe,"1TB_140,230|512GB_156원/1GB_80,060"
6461742,GIGABYTE SSD,"1TB_106,910|480GB_116원/1GB_55,800|240GB_130원/1GB_31,120|120GB_177원/1GB_21,260"
16106009,GIGABYTE SSD M.2 NVMe,"1TB_138,030|500GB_152원/1GB_75,970"
6340998,GIGABYTE UD PRO 제이씨현,"512GB_286원/1GB_146,300|256GB_66,620"
9396207,GLOWAY VAL M.2 NVMe,"960GB_120,000|480GB_126원/1GB_60,500|240GB_190원/1GB_45,480"
5837322,GeIL ZENITH R3 Gen2,"480GB_129,000|240GB_291원/1GB_69,900"
9330975,HP EX900 M.2 NVMe,"1TB_128,690|500GB_140원/1GB_70,200|250GB_184원/1GB_46,110|120GB_390원/1GB_46,800"
12636320,HP EX900 PRO M.2 NVMe 히트싱크,"1TB_134,900|512GB_156원/1GB_79,700|256GB_202원/1GB_51,700"
15579344,HP EX900 PRO M.2 NVMe 히트싱크 해외구매,"1TB_132,200|512GB_158원/1GB_80,800|256GB_230원/1GB_58,800"
9331509,HP EX950 M.2 NVMe,"2TB_170원/1GB_340,840|1TB_166,200|512GB_173원/1GB_88,680"
6257681,HP S600,"240GB_37,660|120GB_230원/1GB_27,630"
15447458,HP S600 해외구매,"240GB_59,130|120GB_399원/1GB_47,920"
5483004,HP S700,"1TB_125,140|500GB_135원/1GB_67,500|250GB_177원/1GB_44,230|120GB_248원/1GB_29,800"
15437306,HP S700 M.2 SATA 해외구매,"120GB_508원/1GB_60,900"
5590806,HP S700 PRO,"1TB_183원/1GB_182,990|512GB_84,320|256GB_220원/1GB_56,350|128GB_276원/1GB_35,320"
5863915,HP S700 PRO M.2 SATA,"512GB_79,960|256GB_213원/1GB_54,500|128GB_287원/1GB_36,700"
15436331,HP S700 PRO M.2 SATA 해외구매,"256GB_903원/1GB_231,110|128GB_90,900"
12636665,HP S750,"1TB_125,500|512GB_142원/1GB_72,680|256GB_183원/1GB_46,800"
12636875,HP S750 M.2 SATA,"512GB_69,890|256GB_184원/1GB_47,100"
15580994,HP S750 해외구매,"1TB_136,600|512GB_160원/1GB_82,030"
11866912,ICY DOCK M.2 to SATA 변환 컨버터 (MB703M2P-B),"SSD미포함_19,300"
11284659,J&A LEVEN JM600 M.2 SATA,"2TB_245,000|1TB_123원/1GB_123,120|512GB_138원/1GB_70,900|256GB_160원/1GB_40,900|128GB_203원/1GB_26,000"
11844220,J&A LEVEN JMS600 mSATA,"512GB_172원/1GB_88,000|256GB_42,000|128GB_227원/1GB_29,000|64GB_359원/1GB_23,000"
11284401,J&A LEVEN JP600 M.2 NVMe,"1TB_118,900|512GB_127원/1GB_65,000|256GB_152원/1GB_38,900|128GB_234원/1GB_29,900"
12426863,J&A LEVEN JPR600 GAMING M.2 NVMe,"1TB_일시품절|512GB_76,870"
11013789,J&A LEVEN JS300,"240GB_32,900|120GB_192원/1GB_23,000"
15563771,J&A LEVEN JS300 PRO,"240GB_34,900|120GB_204원/1GB_24,500"
15563792,J&A LEVEN JS300 PRO,"240GB_34,900|120GB_204원/1GB_24,500"
11113806,J&A LEVEN JS600,"2TB_105원/1GB_209,990|1TB_103,500|512GB_119원/1GB_60,900|256GB_139원/1GB_35,500|128GB_191원/1GB_24,500"
12013793,J&A LEVEN JS600 PRO,"1TB_111,000|512GB_147원/1GB_75,330|256GB_141원/1GB_36,000|128GB_199원/1GB_25,500"
3062458,KINGMAX 3.5 듀얼 브라켓,720
1925749,KINGMAX 3.5 브라켓,490
6246418,KingDian S390,"512GB_56,560|256GB_131원/1GB_33,600|128GB_165원/1GB_21,120"
11148030,Lexar NM100 M.2 SATA,"512GB_91,160|256GB_187원/1GB_47,900|128GB_217원/1GB_27,800"
9237306,Lexar NM610 M.2 NVMe,"1TB_172원/1GB_172,240|500GB_85,530|250GB_218원/1GB_54,400"
10902219,Lexar NM700 M.2 NVMe,"1TB_143,600|512GB_165원/1GB_84,670|256GB_297원/1GB_76,060"
7162801,Lexar NS100,"512GB_69,000|256GB_159원/1GB_40,800|128GB_218원/1GB_27,920"
15202664,Lite-On CL1-8D128 M.2 NVMe 벌크,"128GB_188원/1GB_24,090"
15525386,M.2 to 2.5 컨버터 해외구매,"SSD미포함_19,200"
15115958,MBF MBF-U3SATA-BK USB 3.0 to SATA3 컨버터,"6,200"
15725393,MG BX3510 하드보관함,"26,500"
15725492,MG BX3826 하드보관함,"26,500"
2289404,NCTOP MIRASOL 2.5 슬롯형 SSD GUIDE,"1,460"
15880709,NEXI NX1246 M.2 NVMe to PCIe 확장 카드,"SSD미포함_7,170"
15880778,NEXI NX1247 M.2 NVMe to PCIe 확장 카드,"SSD미포함_4,980"
4645937,ORICO 2.5 변환 SSD 가이드 (1125SS),"10,000"
5574981,ORICO 20UTS SATA3 to USB 3.0 컨버터,"11,700"
1769014,ORICO PHI-35 HDD보관함,"3,400"
1759667,ORICO PHP-35 HDD보관함,"3,350"
1659778,ORICO PHX-35 하드 보호케이스,"5,500"
15200732,OWC ShuttleOne M.2 NVMe to U.2 컨버터,"SSD미포함_69,510"
7610623,PATRIOT BURST,"480GB_60,500|240GB_175원/1GB_42,000"
12826391,PATRIOT P300 M.2 NVMe,"1TB_129,000|512GB_134원/1GB_68,500|256GB_143원/1GB_36,500"
7962823,PATRIOT SCORCH M.2 NVMe,"256GB_422원/1GB_108,050"
9987471,PATRIOT VIPER VP4100 M.2 NVMe,"2TB_315원/1GB_629,000|1TB_258,000"
8448207,PATRIOT VIPER VPN100 M.2 NVMe,"2TB_358원/1GB_715,650|1TB_189,000|512GB_193원/1GB_99,000|256GB_273원/1GB_70,000"
10336053,PATRIOT VIPER VPR100 RGB M.2 NVMe,"256GB_415원/1GB_106,300"
14267903,PNY CS1030 Gen3 M.2 NVMe 마이크로닉스,"1TB_124원/1GB_124,470"
13137512,PNY CS1030 Gen3 M.2 NVMe 제이씨현,"1TB_129,000|512GB_133원/1GB_68,000|256GB_148원/1GB_38,000"
15820454,PNY CS1030 Gen3 M.2 NVMe 해외구매,"250GB_216원/1GB_53,950|500GB_84,350"
14268290,PNY CS1031 Gen3 M.2 NVMe 마이크로닉스,"256GB_160원/1GB_40,930"
13137749,PNY CS1031 Gen3 M.2 NVMe 제이씨현,"512GB_159원/1GB_81,480|256GB_37,800"
6848275,PNY CS2040 M.2 SATA,"1TB_140,320|512GB_303원/1GB_155,080|256GB_398원/1GB_101,920|128GB_285원/1GB_36,420"
6848578,PNY CS2060 M.2 NVMe,"512GB_157,450|256GB_418원/1GB_107,070"
15654095,PNY CS2130 M.2 NVMe 해외구매,"4TB_224원/1GB_896,900|2TB_275,900|1TB_166원/1GB_165,830|500GB_197원/1GB_98,450"
15711329,PNY CS2140 Gen4 M.2 NVMe 마이크로닉스,"1TB_147,800|500GB_159원/1GB_79,700"
15436727,PNY CS2140 Gen4 M.2 NVMe 제이씨현,"1TB_149,800|500GB_161원/1GB_80,560"
15436760,PNY CS2140 Gen4 M.2 NVMe 제이씨현,"1TB_149,800|500GB_161원/1GB_80,560"
6848131,PNY CS900 마이크로닉스,"960GB_107,310|500GB_128원/1GB_64,200|480GB_132원/1GB_63,410|240GB_140원/1GB_33,610|120GB_177원/1GB_21,270"
13023767,PNY CS900 제이씨현,"960GB_109,940|500GB_142원/1GB_70,880|480GB_118원/1GB_56,490|240GB_131원/1GB_31,400|120GB_168원/1GB_20,190"
11391825,PNY XLR8 CS2311,"250GB_272원/1GB_68,000"
14845808,PNY XLR8 CS3030 Gen3 M.2 NVMe 제이씨현,"4TB_225원/1GB_900,200|2TB_300,000|1TB_183원/1GB_182,640|500GB_185원/1GB_92,380|250GB_208원/1GB_51,950"
8018338,PNY XLR8 CS3030 M.2 NVMe,"1TB_156원/1GB_156,240|2TB_293,400|500GB_169원/1GB_84,500|250GB_203원/1GB_50,700"
10943163,PNY XLR8 CS3030 M.2 NVMe 히트싱크,"500GB_82,920|250GB_266원/1GB_66,430"
14268569,PNY XLR8 CS3040 Gen4 M.2 NVMe 마이크로닉스,"2TB_324,090|1TB_227원/1GB_226,930|500GB_238원/1GB_118,800"
13137998,PNY XLR8 CS3040 Gen4 M.2 NVMe 제이씨현,"2TB_300,320|1TB_230원/1GB_229,880|500GB_218원/1GB_108,990"
16267094,PNY XLR8 CS3140 Gen4 M.2 NVMe,"2TB_417,100|1TB_266원/1GB_266,200"
15775862,Plextor M10P M.2 NVMe,"2TB_424,980|1TB_214원/1GB_214,450|512GB_215원/1GB_110,000"
15775916,Plextor M10P M.2 NVMe,"2TB_424,980|1TB_214원/1GB_214,450|512GB_215원/1GB_110,000"
16292087,SK하이닉스 BC511 M.2 NVMe 2230 벌크,"256GB_112원/1GB_28,650"
14959721,SK하이닉스 BC711 M.2 NVMe 2230 해외구매,"128GB_198원/1GB_25,280"
14958056,SK하이닉스 BC711 M.2 NVMe 벌크,"256GB_138원/1GB_35,410"
15946682,SK하이닉스 BC711 M.2 NVMe 병행수입,"1TB_163,500|512GB_170원/1GB_87,000|256GB_209원/1GB_53,500"
13161353,SK하이닉스 Gold P31 M.2 NVMe,"2TB_186원/1GB_372,100|1TB_176,500|500GB_192원/1GB_96,000"
13077407,SK하이닉스 Gold P31 M.2 NVMe 해외구매,"1TB_158,150|2TB_167원/1GB_333,060|500GB_180원/1GB_90,230"
13168247,SK하이닉스 Gold S31,"1TB_128,000|500GB_135원/1GB_67,500|250GB_248원/1GB_62,000"
10315152,SK하이닉스 Gold S31 해외구매,"1TB_114,080|500GB_137원/1GB_68,680|250GB_259원/1GB_64,700"
11197458,SK하이닉스 PC601 M.2 NVMe 벌크,"1TB_149원/1GB_148,950|512GB_158원/1GB_80,900|256GB_33,240"
15405176,SSSTC CVB-CD128,"128GB_352원/1GB_45,000"
5713326,STCOM ALPHA SSD,"240GB_449원/1GB_107,740|120GB_46,000"
10991439,STCOM STORM SSD,"1TB_131원/1GB_130,570|480GB_59,200|240GB_132원/1GB_31,700"
3206498,Sandisk SSD PLUS,"2TB_330원/1GB_659,410|1TB_131원/1GB_131,390|960GB_106,180|480GB_144원/1GB_69,050|240GB_163원/1GB_39,220|120GB_343원/1GB_41,210"
12961841,Sandisk ULTRA M.2 NVMe,"2TB_224,850|1TB_113원/1GB_113,270|500GB_137원/1GB_68,470|250GB_204원/1GB_50,950"
5391601,Sandisk Ultra 3D,"2TB_111원/1GB_222,490|1TB_104,040|500GB_151원/1GB_75,590|250GB_193원/1GB_48,170"
8442537,Seagate Maxtor Z1 SSD,"960GB_95,330|480GB_142원/1GB_68,000|240GB_243원/1GB_58,430"
6556997,Seagate NYTRO 1351,"3.84TB_326원/1GB_1,250,000|1.92TB_610,000|960GB_354원/1GB_340,000|480GB_524원/1GB_251,750|240GB_625원/1GB_150,000"
6922819,Seagate NYTRO 5000 U.2 NVMe,"1.92TB_1,125원/1GB_2,159,650|1.6TB_683원/1GB_1,093,450|960GB_541,000|800GB_714원/1GB_570,940"
9990909,Seagate 바라쿠다 120 SSD,"2TB_일시품절|1TB_127,500|500GB_181원/1GB_90,390|250GB_206원/1GB_51,490"
9996615,Seagate 바라쿠다 510 M.2 NVMe,"1TB_179원/1GB_179,000|512GB_238원/1GB_121,990|500GB_77,000|256GB_262원/1GB_67,000|250GB_260원/1GB_65,000"
12233744,Seagate 바라쿠다 Q1 SSD,"960GB_129,000|480GB_144원/1GB_69,000|240GB_165원/1GB_39,500"
12668246,Seagate 바라쿠다 Q5 M.2 NVMe,"2TB_145원/1GB_289,000|1TB_139,000|500GB_158원/1GB_79,000"
14742761,Seagate 바라쿠다 Q5 M.2 NVMe 해외구매,"2TB_196원/1GB_391,030|1TB_183원/1GB_182,730|500GB_78,860"
6349416,Seagate 바라쿠다 SSD,"2TB_433,200|1TB_313원/1GB_312,590|500GB_360원/1GB_180,210|250GB_일시품절"
7859884,Seagate 아이언울프 110 SSD,"3.84TB_343원/1GB_1,315,780|1.92TB_645,000|960GB_374원/1GB_359,000|480GB_406원/1GB_195,000|240GB_579원/1GB_139,000"
12232799,Seagate 아이언울프 125 SSD,"4TB_945,000|2TB_240원/1GB_479,000|1TB_259원/1GB_259,000|500GB_278원/1GB_139,000|250GB_340원/1GB_85,000"
10869891,Seagate 아이언울프 510 M.2 NVMe,"1.92TB_579,000|960GB_311원/1GB_299,000|480GB_331원/1GB_159,000|240GB_413원/1GB_99,000"
15756047,Seagate 아이언울프 525 M.2 NVMe,"2TB_599,000|1TB_315원/1GB_315,000|500GB_330원/1GB_165,000"
15756104,Seagate 아이언울프 525 M.2 NVMe,"2TB_599,000|1TB_315원/1GB_315,000|500GB_330원/1GB_165,000"
12233471,Seagate 아이언울프 프로 125 SSD,"3.84TB_1,230,000|1.92TB_338원/1GB_649,000|960GB_370원/1GB_355,000|480GB_406원/1GB_195,000|240GB_521원/1GB_125,000"
11401443,Seagate 파이어쿠다 120 SSD,"4TB_213원/1GB_850,000|2TB_213원/1GB_425,000|1TB_122,900|500GB_169원/1GB_84,590"
8046469,Seagate 파이어쿠다 510 M.2 NVMe,"2TB_205원/1GB_409,000|1TB_175,000|500GB_178원/1GB_89,000|250GB_276원/1GB_69,000"
9991767,Seagate 파이어쿠다 520 M.2 NVMe,"2TB_223원/1GB_445,000|1TB_199,000|500GB_238원/1GB_119,000"
14668568,Seagate 파이어쿠다 520 사이버펑크 2077 리미티드 에디션 M.2 NVMe,"1TB_552원/1GB_551,560"
14803520,Seagate 파이어쿠다 530 M.2 NVMe,"4TB_298원/1GB_1,190,000|2TB_495,000|1TB_259원/1GB_259,000|500GB_350원/1GB_175,000"
15093515,Seagate 파이어쿠다 530 M.2 NVMe 해외구매,"4TB_일시품절|2TB_332원/1GB_663,830|1TB_320,290|500GB_354원/1GB_176,830"
14958794,Seagate 파이어쿠다 530 히트싱크 M.2 NVMe,"4TB_310원/1GB_1,240,000|2TB_525,000|1TB_289원/1GB_289,000|500GB_410원/1GB_205,000"
14958833,Seagate 파이어쿠다 530 히트싱크 M.2 NVMe,"4TB_310원/1GB_1,240,000|2TB_525,000|1TB_289원/1GB_289,000|500GB_410원/1GB_205,000"
15450896,Seagate 파이어쿠다 530 히트싱크 M.2 NVMe 해외구매,"500GB_456원/1GB_227,990"
2492532,SilverStone 5.25형 가이드 (SDP10B),"10,600"
15734789,SilverStone 5.25형 가이드 (SDP10B) 해외구매,"33,730"
15863327,SilverStone SDP08-E SSD 가이드 STCOM,"12,840"
2299216,SilverStone SDP08-LITE 듀얼 SSD 가이드,일시품절
15863087,SilverStone SDP08-LITE 듀얼 SSD 가이드 STCOM,"7,490"
12866717,SilverStone SST-EXB02 2.5인치 SAS 확장 카드 슬롯,"하드미포함_35,640"
15734888,SilverStone SST-EXB02 2.5인치 SAS 확장 카드 슬롯 해외구매,"하드미포함_82,150"
12867116,SilverStone SST-FS301 5.25 to 3.5인치 SAS/SATA 베이,"하드미포함_45,000"
11616860,Synology SNV3400 M.2 NVMe,"800GB_392,000|400GB_504원/1GB_201,700"
15484898,Synology SNV3400 M.2 NVMe 해외구매,"800GB_438,780|400GB_563원/1GB_225,300"
15486839,Synology SNV3500 M.2 NVMe 22110 해외구매,"800GB_373,900|400GB_664원/1GB_265,450"
12714437,TeamGroup CX1,"960GB_98,520|480GB_132원/1GB_63,140|240GB_151원/1GB_36,180"
12714620,TeamGroup CX2,"2TB_220,750|1TB_112원/1GB_112,040|512GB_120원/1GB_61,510|256GB_146원/1GB_37,420"
15578513,TeamGroup CX2 해외구매,"2TB_374,900|1TB_190원/1GB_190,270|512GB_193원/1GB_98,700"
15625598,TeamGroup EX2 해외구매,"2TB_131원/1GB_262,300|1TB_129,600|512GB_193원/1GB_98,800"
9282297,TeamGroup GX1,"240GB_238원/1GB_57,200"
11901727,TeamGroup GX1 SMI,"960GB_99,000|480GB_52,000|240GB_50,070|120GB_20,000"
9282591,TeamGroup GX2,"1TB_129원/1GB_129,400|512GB_56,000|256GB_125원/1GB_32,000|128GB_201원/1GB_25,700"
13459769,TeamGroup GX2 SMI,"1TB_99,900|256GB_156원/1GB_40,000|128GB_160원/1GB_20,500"
14400263,TeamGroup MP33 M.2 NVMe,"1TB_114,270|512GB_130원/1GB_66,320|256GB_152원/1GB_38,950"
15624587,TeamGroup MP33 PRO M.2 NVMe 해외구매,"2TB_132원/1GB_264,300|1TB_126,300|512GB_135원/1GB_69,000"
8539724,TeamGroup MP34 M.2 NVMe,"1TB_130,000|512GB_137원/1GB_70,000|256GB_186원/1GB_47,500"
7911922,TeamGroup MS30 M.2 SATA,"1TB_105,000|512GB_109원/1GB_56,000|256GB_129원/1GB_33,000"
14424020,TeamGroup T-Force CARDEA Ceramic C440 M.2 NVMe,"2TB_165원/1GB_329,900|1TB_145,000"
14475914,TeamGroup T-Force CARDEA ZERO Z330 M.2 NVMe,"2TB_120원/1GB_239,800|1TB_113,000|512GB_일시품절"
14409281,TeamGroup T-Force CARDEA ZERO Z440 M.2 NVMe,"2TB_324,900|1TB_175원/1GB_174,900"
10132215,TeamGroup T-Force DELTA MAX,"1TB_150,050|500GB_206원/1GB_102,800|250GB_296원/1GB_74,000"
6769621,TeamGroup T-Force DELTA R RGB,"1TB_152,290|500GB_221원/1GB_110,480|250GB_312원/1GB_78,000"
6256530,TeamGroup T-Force DELTA RGB,"1TB_154,000|500GB_199원/1GB_99,640|250GB_244원/1GB_61,000"
13274630,TeamGroup T-Force VULCAN G,"1TB_108,340|512GB_120원/1GB_61,210"
15577229,Union Memory AM620 M.2 NVMe 2242 벌크,"128GB_137원/1GB_17,500"
6163280,Western Digital WD BLACK 3D M.2 NVMe,"1TB_395원/1GB_394,800|500GB_448원/1GB_224,100|250GB_92,000"
4904343,Western Digital WD BLACK M.2 NVMe,"256GB_558원/1GB_142,760"
7395145,Western Digital WD BLACK SN750 M.2 NVMe,"4TB_323원/1GB_1,290,000|2TB_205원/1GB_409,000|1TB_181,200|500GB_182원/1GB_91,000|250GB_278원/1GB_69,500"
14428172,Western Digital WD BLACK SN750 SE M.2 NVMe,"1TB_176,430|500GB_182원/1GB_91,000|250GB_278원/1GB_69,500"
7891657,Western Digital WD BLACK SN750 히트싱크 M.2 NVMe,"2TB_351원/1GB_702,050|1TB_209,000|500GB_246원/1GB_123,040"
12660173,Western Digital WD BLACK SN850 M.2 NVMe,"2TB_219원/1GB_438,600|1TB_218,190|500GB_242원/1GB_121,000"
15450851,Western Digital WD BLACK SN850 M.2 NVMe Call of Duty 에디션 해외구매,"1TB_435원/1GB_435,300"
14597480,Western Digital WD BLACK SN850 M.2 NVMe 해외구매,"2TB_277원/1GB_553,620|1TB_243원/1GB_243,400|500GB_118,820"
13847258,Western Digital WD BLACK SN850 히트싱크 M.2 NVMe,"2TB_499,180|1TB_271원/1GB_271,070|500GB_358원/1GB_179,000"
15995546,Western Digital WD BLACK SN850 히트싱크 M.2 NVMe for 플레이스테이션5,"2TB_248원/1GB_495,450|1TB_244,000|500GB_318원/1GB_159,000"
15995762,Western Digital WD BLACK SN850 히트싱크 M.2 NVMe for 플레이스테이션5,"2TB_248원/1GB_495,450|1TB_244,000|500GB_318원/1GB_159,000"
14597159,Western Digital WD BLACK SN850 히트싱크 M.2 NVMe 해외구매,"1TB_344,900|500GB_449원/1GB_224,600"
10120452,Western Digital WD BLUE SN550 M.2 NVMe,"2TB_150원/1GB_299,000|1TB_125,640|500GB_137원/1GB_68,540|250GB_204원/1GB_51,000"
10888989,Western Digital WD BLUE SN550 M.2 NVMe 해외구매,"2TB_230원/1GB_459,400|1TB_133,950|500GB_148원/1GB_74,000|250GB_213원/1GB_53,280"
6078361,Western Digital WD Blue 3D M.2 SATA,"2TB_144원/1GB_287,820|1TB_139,000|500GB_143원/1GB_71,510|250GB_200원/1GB_49,920"
5678148,Western Digital WD Blue 3D M.2 SATA 해외구매,"2TB_157원/1GB_313,700|1TB_139,830|500GB_182원/1GB_90,900|250GB_326원/1GB_81,400"
5579649,Western Digital WD Blue 3D SSD,"4TB_151원/1GB_603,700|2TB_138원/1GB_276,460|1TB_129,900|500GB_138원/1GB_68,800|250GB_191원/1GB_47,800"
5678044,Western Digital WD Blue 3D SSD 해외구매,"4TB_179원/1GB_717,000|2TB_146원/1GB_291,920|1TB_124,500|500GB_166원/1GB_83,240|250GB_272원/1GB_67,890"
4800706,Western Digital WD Blue M.2 SATA,"1TB_139,000|500GB_144원/1GB_72,230|250GB_206원/1GB_51,500"
7521730,Western Digital WD Blue SN500 M.2 NVMe,"500GB_930원/1GB_465,000|250GB_200,000"
15796520,Western Digital WD Blue SN570 M.2 NVMe,"1TB_144,000|500GB_168원/1GB_84,000|250GB_228원/1GB_57,000"
4595348,Western Digital WD Blue SSD,"1TB_133,000|500GB_150원/1GB_75,000|250GB_198원/1GB_49,500"
4800828,Western Digital WD GREEN M.2 SATA,"480GB_72,000|240GB_194원/1GB_46,440|120GB_348원/1GB_41,780"
4593708,Western Digital WD GREEN SSD,"1TB_129,000|480GB_144원/1GB_69,000|240GB_180원/1GB_43,140|120GB_317원/1GB_38,000"
14314655,Western Digital WD Green SN350 M.2 NVMe,"1TB_122,700|960GB_129원/1GB_123,930|480GB_134원/1GB_64,500|240GB_173원/1GB_41,500"
9891273,Western Digital WD RED SA500 SSD,"1TB_250원/1GB_250,000|500GB_124,450"
13230500,Western Digital WD SN530 M.2 NVMe,"1TB_183,330|256GB_187원/1GB_47,800"
16291796,Western Digital WD SN530 M.2 NVMe 2242 벌크,"256GB_112원/1GB_28,590"
14968946,Western Digital WD SN530 M.2 NVMe 벌크,"256GB_119원/1GB_30,510"
13230152,Western Digital WD SN730 M.2 NVMe,"1TB_178,700|512GB_190원/1GB_97,100"
13725707,YMTC ZHITAI PC005 M.2 NVMe,"1TB_144원/1GB_143,670|512GB_73,370|256GB_159원/1GB_40,680"
13725794,YMTC ZHITAI SC001,"1TB_105,800|512GB_113원/1GB_57,940|256GB_136원/1GB_34,900"
3546574,강원전자 I-NC10K 다용도 알루미늄 하드디스크 보관함,"38,750"
4311656,강원전자 NETmate NMU-ST370 SATA3 to Type C 변환 컨버터,"13,990"
3641708,강원전자 NETmate SATA 컨버터 (NM-NGB1),"SSD미포함_9,320"
8535602,강원전자 NETmate USB 3.0 to SATA3 컨버터 (NM-KP01C),"17,420"
2479410,강원전자 NETmate ineo USB3.0 to SATA3 컨버터(I-NA316U2 Plus),"12,450"
2621608,강원전자 ineo I-NC25 알루미늄 하드디스크 보관함,"2.5 16Bay_36,940"
5923379,갤럭시 GALAX GAMER Heat Sink M.2 NVMe,"240GB_304원/1GB_73,000"
